{"2010":1,"2016":1,"Department":"Сторожинецький районний суд Чернівецької області","Region":"Чернівецька область","Position":"Голова Сторожинецького районного суду Чернівецької області","Name":"Казюк Олександр Олексійович","Link":"http://court.gov.ua/lustration/edd3e044b739471fa7440107f7ef6149.pdf","Note":"","AdditionalNote":"","field8":"","field9":"","field10":"","Кількість справ":"","Оскаржені":"","Кількість скарг":0,"Кількість дисциплінарних стягнень":"","Клейма":3,"Фото":"http://picua.org/img/2016-09/26/byj4wydsqkty8qs5su06b6cte.jpg","Як живе":"","Декларація доброчесності судді подано у 2016 році (вперше)":"","Декларація родинних зв’язків судді подано у 2016 році":"","key":"kazyuk_oleksandr_oleksiyovich","allDeclarations":[{"provider":"declarations.com.ua","document":{"intro":{"declaration_year":"2014"},"source":"VULYK","vehicle":{"35":[{"brand_hidden":false,"sum_rent_comment":"","sum_comment":"","brand":"Mitsubishi Lancer","brand_info_unclear":false,"sum_rent_unclear":false,"brand_info":"1.4 куб. см.","year":"2011","sum_comment_unclear":false,"sum_rent":"","sum":""}],"40":[{"brand_hidden":false,"sum_rent_comment":"","sum_comment":"","brand":"Mitsubishi Lancer","brand_info_unclear":false,"sum_rent":"","year":"2011","sum":"","brand_info":"1.4 куб. см.","brand_info_hidden":false,"year_unclear":false},{"brand":"Renault Kangoo","sum_rent_comment":"","sum_comment":"","sum":"","brand_info_unclear":false,"brand_info":"1.5 куб. см.","year":"2004","sum_rent":""}]},"income":{"5":{"family_unclear":false,"family":"71301","value":"242827","comment":"","family_comment":"","value_unclear":false},"6":{"family":"46083","value":"242747","family_comment":"","comment":""},"7":{"source_name_hidden":false,"family":"","source_name":"ТУДСА в Чернівецькій області. Управління пенсійного фонду в Сторожинецькому районі. Комарівська сільска рада. Сторожинецький районний тер. центр соц. обслуговування. ПАТ 'Чернівціобленерго' Сторожинецький РЕМ центр по нарахуванню пенсій","value":"","family_hidden":false,"source_name_unclear":false,"value_hidden":false,"family_comment":"","comment":""},"8":{"family":"","value":"","comment":"","value_hidden":false,"family_comment":"","family_hidden":false},"9":{"family":"","comment_hidden":false,"value":"80","comment":"","value_hidden":false,"family_comment":"","family_hidden":false},"10":{"family":"","value":"","family_comment":"","comment":""},"11":{"family":"","value":"","comment":"","value_hidden":false,"family_comment":"","family_hidden":false},"12":{"family":"","value_hidden":false,"value":"","family_comment":"","comment":""},"13":{"family":"","value_hidden":false,"value":"","family_comment":"","comment":""},"14":{"family":"","value_hidden":false,"value":"","family_comment":"","comment":""},"15":{"family":"25218","value_hidden":false,"value":"","family_comment":"","comment":""},"16":{"family":"","value_hidden":false,"value":"","family_comment":"","comment":""},"17":{"family":"","value_hidden":false,"value":"","family_comment":"","comment":""},"18":{"family":"","value_hidden":false,"value":"","family_comment":"","comment":""},"19":{"family":"","value_hidden":false,"value":"","family_comment":"","comment":""},"20":{"family_unclear":false,"family":"","value":"","comment":"","family_comment_unclear":false,"comment_unclear":false,"family_comment":"","value_unclear":false}},"estate":{"23":[{"costs_rent_comment":"","region":"","costs_rent":"","space":"900","address_hidden":true,"space_units_unclear":false,"space_unclear":false,"address":"","space_comment":"","space_hidden":false,"region_hidden":true,"costs":"","costs_comment":"","space_units":"м²"},{"region":"","costs_rent_comment":"","costs_rent_unclear":false,"costs_rent":"","space":"833","address_hidden":false,"space_units_unclear":false,"costs_comment":"","space_comment":"","region_hidden":false,"address_unclear":false,"costs":"","address":"","space_units":"м²"},{"costs_rent_comment":"","region":"","costs_rent":"","space":"","address_hidden":false,"address":"","space_comment":"","region_hidden":false,"address_unclear":false,"region_unclear":false,"costs":"","costs_comment":"","space_units":""},{"space_comment":"","costs_rent_comment":"","region_hidden":false,"costs_rent":"","region":"","space":"","address_hidden":false,"space_units":"","costs":"","address":"","costs_comment":""},{"space_comment":"","costs_rent_comment":"","costs_rent":"","region":"","space":"","space_units":"","costs":"","address":"","costs_comment":""}],"24":[{"costs_rent_comment":"","region":"","costs_rent":"","space":"215","address_hidden":true,"space_hidden":false,"address":"","space_comment":"","space_unclear":false,"region_hidden":true,"costs":"","costs_comment":"","space_units":"м²"}],"25":[{"costs_hidden":false,"costs_rent_comment":"","region":"","costs_rent":"","space":"46.1","address_hidden":true,"space_unclear":false,"address":"","space_comment":"","space_hidden":false,"region_hidden":true,"costs":"","costs_comment":"","space_units":"м²"}],"29":[{"costs_rent_comment":"","costs_rent":"","region":"","space":"2500","address_hidden":true,"space_units_unclear":false,"space_hidden":false,"costs_property":"","space_comment":"","costs_property_comment":"","space_unclear":false,"region_hidden":true,"region_unclear":false,"address":"","space_units":"м²"},{"costs_rent_comment":"","region":"","costs_rent":"","space":"800","address_hidden":true,"costs_property":"","space_comment":"","costs_property_comment":"","space_unclear":false,"region_hidden":false,"region_unclear":false,"address":"","space_units":"м²"}],"31":[{"costs_rent_comment":"","region":"","costs_rent":"","space":"46.1","address_hidden":true,"space_unclear":false,"costs_property":"","space_comment":"","costs_property_comment":"","space_comment_unclear":false,"region_hidden":true,"address":"","space_units":"м²"},{"costs_rent_comment":"","region":"","costs_rent":"","costs_property_comment":"","address_hidden":false,"costs_property":"","space_comment":"","space":"28","space_comment_unclear":false,"region_hidden":false,"address":"","space_units":"м²"},{"space_comment":"","costs_property_comment":"","costs_rent_comment":"","costs_rent":"","space":"35.6","costs_property":"","address":"","space_units":"м²"}]},"liabilities":{"54":{"sum_foreign_comment":"","sum_hidden":false,"sum_foreign":"","sum":"","sum_comment":""},"55":{"sum_foreign_comment":"","sum_comment":"","sum_foreign":"","sum":""},"56":{"sum_foreign_comment":"","sum_comment":"","sum_foreign":"","sum":"14800"},"57":{"sum_foreign_comment":"","sum_comment":"","sum_foreign":"","sum":"","sum_foreign_hidden":false,"sum_comment_hidden":false,"sum_hidden":false},"58":{"sum_foreign_comment":"","sum_comment":"","sum_foreign":"","sum":"","sum_foreign_hidden":false,"sum_comment_hidden":false,"sum_hidden":false},"59":{"sum_foreign_comment":"","sum_comment":"","sum_foreign":"","sum":"32700","sum_unclear":false},"60":{"sum_foreign_comment":"","sum_comment":"","sum_foreign":"","sum":""},"61":{"sum_foreign_comment":"","sum_comment":"","sum_foreign":"","sum":""},"62":{"sum_foreign_comment":"","sum_comment":"","sum_foreign":"","sum":"7423","sum_unclear":false},"63":{"sum_foreign_comment":"","sum_comment":"","sum_foreign":"","sum":""},"64":{"sum_foreign_comment":"","sum_comment":"","sum_foreign":"","sum":""}},"general":{"full_name":"Казюк Олександр Олексійович","full_name_suggest":{"output":"Казюк Олександр Олексійович","input":["Казюк Олександр Олексійович","Олександр Олексійович Казюк","Олександр Казюк"]},"family_raw":"","last_name":"Казюк","patronymic":"Олексійович","last_name_unclear":false,"family":[{"inn":"","relations_other":"","name_unclear":false,"relations":"Подружжя","inn_hidden":true,"name_hidden":true,"family_name":"Казюк Н. В","relations_hidden":false},{"inn":"","relations_other":"","name_unclear":false,"relations":"Дитина","inn_hidden":false,"name_hidden":false,"family_name":"Казюк О. О"},{"inn":"","relations_other":"","name_unclear":false,"relations":"Дитина","inn_hidden":false,"name_hidden":false,"family_name":"Українець О. О"}],"name":"Олександр","post":{"post":"голова сторожинецького районного суду","candidate":"","region_hidden":false,"region":"Чернівецька область","post_hidden":false,"office":"Загальний місцевий суд","post_unclear":false,"office_hidden":false},"inn":"","inn_hidden":true,"addresses":[{"place_address":"","place_district":"","place_city":"","place_address_hidden":true,"place_city_type_hidden":true,"place":"","place_district_hidden":true,"place_city_type":"","place_city_hidden":true,"place_hidden":true}]},"id":"vulyk_33_196","declaration":{"date":"2015-03-06T00:00:00","notfull":"","additional_info_text":"","url":"http://static.declarations.com.ua/declarations/chosen_ones/mega_batch/kaziuk_oleksandr_oleksiiovych.pdf","additional_info":"","notfull_lostpages":""},"ft_src":"32700\n7423\n14800\nголова сторожинецького районного суду\nЧернівецька область\nЗагальний місцевий суд\nОлександр\nКазюк Н. В\nПодружжя\nКазюк О. О\nДитина\nУкраїнець О. О\nДитина\nОлексійович\nКазюк\nКазюк Олександр Олексійович\nКазюк Олександр Олексійович\nОлександр Олексійович Казюк\nОлександр Казюк\nКазюк Олександр Олексійович\nMitsubishi Lancer\n1.4 куб. см.\n2011\n1.4 куб. см.\nMitsubishi Lancer\n2011\n1.5 куб. см.\n2004\nRenault Kangoo\n1000\n2600\n1000\n2014\n1.4 куб. см.\n2011\nMitsubishi Lancer\n1.4 куб. см.\n2011\nMitsubishi Lancer\n1.5 куб. см.\nRenault Kangoo\n2004\n1000\n2600\n1000\n900\n833\n2500\n800\n215\n46.1\n28\n35.6\n46.1\nКазюк Олександр Олексійович\nОлександр Олексійович Казюк\nОлександр Казюк\nКазюк Олександр Олексійович\nКазюк Олександр Олексійович\nПодружжя\nКазюк Н. В\nДитина\nКазюк О. О\nДитина\nУкраїнець О. О\nОлександр\nОлексійович\nЗагальний місцевий суд\nголова сторожинецького районного суду\nЧернівецька область\nКазюк\n32700\n14800\n7423\nТУДСА в Чернівецькій області. Управління пенсійного фонду в Сторожинецькому районі. Комарівська сільска рада. Сторожинецький районний тер. центр соц. обслуговування. ПАТ 'Чернівціобленерго' Сторожинецький РЕМ центр по нарахуванню пенсій\n242747\n46083\n25218\n242827\n71301\n80\n2014\n14800\n7423\n32700\n46.1\n28\n35.6\n2500\n800\n215\n900\n833\n46.1\nКазюк Н. В\nПодружжя\nКазюк О. О\nДитина\nУкраїнець О. О\nДитина\nОлександр\nОлексійович\nКазюк\nКазюк Олександр Олексійович\nОлександр Олексійович Казюк\nОлександр Казюк\nКазюк Олександр Олексійович\nЧернівецька область\nголова сторожинецького районного суду\nЗагальний місцевий суд\nКазюк Олександр Олексійович\n46083\n242747\n25218\nТУДСА в Чернівецькій області. Управління пенсійного фонду в Сторожинецькому районі. Комарівська сільска рада. Сторожинецький районний тер. центр соц. обслуговування. ПАТ 'Чернівціобленерго' Сторожинецький РЕМ центр по нарахуванню пенсій\n71301\n242827\n80\n2011\n1.4 куб. см.\nMitsubishi Lancer\nMitsubishi Lancer\n1.4 куб. см.\n2011\n2004\n1.5 куб. см.\nRenault Kangoo\n25218\n242827\n71301\nТУДСА в Чернівецькій області. Управління пенсійного фонду в Сторожинецькому районі. Комарівська сільска рада. Сторожинецький районний тер. центр соц. обслуговування. ПАТ 'Чернівціобленерго' Сторожинецький РЕМ центр по нарахуванню пенсій\n80\n46083\n242747\n46.1\n28\n35.6\n900\n833\n215\n46.1\n2500\n800\n1000\n1000\n2600\n2014","banks":{"45":[{"sum_foreign_comment":"","sum_comment":"","sum_foreign":"","sum":"1000","sum_comment_hidden":false,"sum_foreign_units":"UAH","sum_units":"UAH","sum_hidden":false},{"sum_foreign_comment":"","sum_comment":"","sum_foreign":"","sum":"","sum_foreign_units":"","sum_units":""},{"sum_foreign_comment":"","sum_comment":"","sum_foreign":"","sum":"","sum_foreign_units":"","sum_units":""}],"46":[{"sum_foreign_comment":"","sum_comment":"","sum_foreign":"","sum":"1000","sum_comment_hidden":false,"sum_foreign_units":"UAH","sum_units":"UAH"}],"47":[{"sum_foreign":"","sum_foreign_comment":"","sum_comment":"","sum":"","sum_foreign_units":"UAH","sum_comment_unclear":false,"sum_units":"UAH"}],"48":[{"sum_foreign_comment":"","sum_comment":"","sum_foreign":"","sum":"","sum_foreign_units":"UAH","sum_units":"UAH"}],"49":[{"sum_foreign_comment":"","sum_comment":"","sum_foreign":"","sum":"","sum_foreign_units":"UAH","sum_units":"UAH"}],"50":[{"sum_foreign_comment":"","sum_comment":"","sum_foreign":"","sum":"","sum_foreign_units":"UAH","sum_units":"UAH"}],"51":[{"sum_foreign_comment":"","sum_comment":"","sum_foreign":"","sum":"2600","sum_comment_hidden":false,"sum_foreign_units":"UAH","sum_units":"UAH","sum_hidden":false},{"sum_foreign_comment":"","sum_comment":"","sum_foreign":"","sum":"","sum_foreign_units":"","sum_units":""},{"sum_foreign_comment":"","sum_comment":"","sum_foreign":"","sum":""}],"52":[{"sum_foreign_comment":"","sum_comment":"","sum_foreign":"","sum":"","sum_comment_hidden":false,"sum_foreign_units":"UAH","sum_units":"UAH"}],"53":[{"sum_foreign":"","sum_foreign_comment":"","sum_comment":"","sum":"","sum_foreign_units":"UAH","sum_comment_unclear":false,"sum_units":"UAH"}]}}}],"declarations":[{"intro":{"declaration_year":"2014"},"source":"VULYK","vehicle":{"35":[{"brand_hidden":false,"sum_rent_comment":"","sum_comment":"","brand":"Mitsubishi Lancer","brand_info_unclear":false,"sum_rent_unclear":false,"brand_info":"1.4 куб. см.","year":"2011","sum_comment_unclear":false,"sum_rent":"","sum":""}],"40":[{"brand_hidden":false,"sum_rent_comment":"","sum_comment":"","brand":"Mitsubishi Lancer","brand_info_unclear":false,"sum_rent":"","year":"2011","sum":"","brand_info":"1.4 куб. см.","brand_info_hidden":false,"year_unclear":false},{"brand":"Renault Kangoo","sum_rent_comment":"","sum_comment":"","sum":"","brand_info_unclear":false,"brand_info":"1.5 куб. см.","year":"2004","sum_rent":""}]},"income":{"5":{"family_unclear":false,"family":"71301","value":"242827","comment":"","family_comment":"","value_unclear":false},"6":{"family":"46083","value":"242747","family_comment":"","comment":""},"7":{"source_name_hidden":false,"family":"","source_name":"ТУДСА в Чернівецькій області. Управління пенсійного фонду в Сторожинецькому районі. Комарівська сільска рада. Сторожинецький районний тер. центр соц. обслуговування. ПАТ 'Чернівціобленерго' Сторожинецький РЕМ центр по нарахуванню пенсій","value":"","family_hidden":false,"source_name_unclear":false,"value_hidden":false,"family_comment":"","comment":""},"8":{"family":"","value":"","comment":"","value_hidden":false,"family_comment":"","family_hidden":false},"9":{"family":"","comment_hidden":false,"value":"80","comment":"","value_hidden":false,"family_comment":"","family_hidden":false},"10":{"family":"","value":"","family_comment":"","comment":""},"11":{"family":"","value":"","comment":"","value_hidden":false,"family_comment":"","family_hidden":false},"12":{"family":"","value_hidden":false,"value":"","family_comment":"","comment":""},"13":{"family":"","value_hidden":false,"value":"","family_comment":"","comment":""},"14":{"family":"","value_hidden":false,"value":"","family_comment":"","comment":""},"15":{"family":"25218","value_hidden":false,"value":"","family_comment":"","comment":""},"16":{"family":"","value_hidden":false,"value":"","family_comment":"","comment":""},"17":{"family":"","value_hidden":false,"value":"","family_comment":"","comment":""},"18":{"family":"","value_hidden":false,"value":"","family_comment":"","comment":""},"19":{"family":"","value_hidden":false,"value":"","family_comment":"","comment":""},"20":{"family_unclear":false,"family":"","value":"","comment":"","family_comment_unclear":false,"comment_unclear":false,"family_comment":"","value_unclear":false}},"estate":{"23":[{"costs_rent_comment":"","region":"","costs_rent":"","space":"900","address_hidden":true,"space_units_unclear":false,"space_unclear":false,"address":"","space_comment":"","space_hidden":false,"region_hidden":true,"costs":"","costs_comment":"","space_units":"м²"},{"region":"","costs_rent_comment":"","costs_rent_unclear":false,"costs_rent":"","space":"833","address_hidden":false,"space_units_unclear":false,"costs_comment":"","space_comment":"","region_hidden":false,"address_unclear":false,"costs":"","address":"","space_units":"м²"},{"costs_rent_comment":"","region":"","costs_rent":"","space":"","address_hidden":false,"address":"","space_comment":"","region_hidden":false,"address_unclear":false,"region_unclear":false,"costs":"","costs_comment":"","space_units":""},{"space_comment":"","costs_rent_comment":"","region_hidden":false,"costs_rent":"","region":"","space":"","address_hidden":false,"space_units":"","costs":"","address":"","costs_comment":""},{"space_comment":"","costs_rent_comment":"","costs_rent":"","region":"","space":"","space_units":"","costs":"","address":"","costs_comment":""}],"24":[{"costs_rent_comment":"","region":"","costs_rent":"","space":"215","address_hidden":true,"space_hidden":false,"address":"","space_comment":"","space_unclear":false,"region_hidden":true,"costs":"","costs_comment":"","space_units":"м²"}],"25":[{"costs_hidden":false,"costs_rent_comment":"","region":"","costs_rent":"","space":"46.1","address_hidden":true,"space_unclear":false,"address":"","space_comment":"","space_hidden":false,"region_hidden":true,"costs":"","costs_comment":"","space_units":"м²"}],"29":[{"costs_rent_comment":"","costs_rent":"","region":"","space":"2500","address_hidden":true,"space_units_unclear":false,"space_hidden":false,"costs_property":"","space_comment":"","costs_property_comment":"","space_unclear":false,"region_hidden":true,"region_unclear":false,"address":"","space_units":"м²"},{"costs_rent_comment":"","region":"","costs_rent":"","space":"800","address_hidden":true,"costs_property":"","space_comment":"","costs_property_comment":"","space_unclear":false,"region_hidden":false,"region_unclear":false,"address":"","space_units":"м²"}],"31":[{"costs_rent_comment":"","region":"","costs_rent":"","space":"46.1","address_hidden":true,"space_unclear":false,"costs_property":"","space_comment":"","costs_property_comment":"","space_comment_unclear":false,"region_hidden":true,"address":"","space_units":"м²"},{"costs_rent_comment":"","region":"","costs_rent":"","costs_property_comment":"","address_hidden":false,"costs_property":"","space_comment":"","space":"28","space_comment_unclear":false,"region_hidden":false,"address":"","space_units":"м²"},{"space_comment":"","costs_property_comment":"","costs_rent_comment":"","costs_rent":"","space":"35.6","costs_property":"","address":"","space_units":"м²"}]},"liabilities":{"54":{"sum_foreign_comment":"","sum_hidden":false,"sum_foreign":"","sum":"","sum_comment":""},"55":{"sum_foreign_comment":"","sum_comment":"","sum_foreign":"","sum":""},"56":{"sum_foreign_comment":"","sum_comment":"","sum_foreign":"","sum":"14800"},"57":{"sum_foreign_comment":"","sum_comment":"","sum_foreign":"","sum":"","sum_foreign_hidden":false,"sum_comment_hidden":false,"sum_hidden":false},"58":{"sum_foreign_comment":"","sum_comment":"","sum_foreign":"","sum":"","sum_foreign_hidden":false,"sum_comment_hidden":false,"sum_hidden":false},"59":{"sum_foreign_comment":"","sum_comment":"","sum_foreign":"","sum":"32700","sum_unclear":false},"60":{"sum_foreign_comment":"","sum_comment":"","sum_foreign":"","sum":""},"61":{"sum_foreign_comment":"","sum_comment":"","sum_foreign":"","sum":""},"62":{"sum_foreign_comment":"","sum_comment":"","sum_foreign":"","sum":"7423","sum_unclear":false},"63":{"sum_foreign_comment":"","sum_comment":"","sum_foreign":"","sum":""},"64":{"sum_foreign_comment":"","sum_comment":"","sum_foreign":"","sum":""}},"general":{"full_name":"Казюк Олександр Олексійович","full_name_suggest":{"output":"Казюк Олександр Олексійович","input":["Казюк Олександр Олексійович","Олександр Олексійович Казюк","Олександр Казюк"]},"family_raw":"","last_name":"Казюк","patronymic":"Олексійович","last_name_unclear":false,"family":[{"inn":"","relations_other":"","name_unclear":false,"relations":"Подружжя","inn_hidden":true,"name_hidden":true,"family_name":"Казюк Н. В","relations_hidden":false},{"inn":"","relations_other":"","name_unclear":false,"relations":"Дитина","inn_hidden":false,"name_hidden":false,"family_name":"Казюк О. О"},{"inn":"","relations_other":"","name_unclear":false,"relations":"Дитина","inn_hidden":false,"name_hidden":false,"family_name":"Українець О. О"}],"name":"Олександр","post":{"post":"голова сторожинецького районного суду","candidate":"","region_hidden":false,"region":"Чернівецька область","post_hidden":false,"office":"Загальний місцевий суд","post_unclear":false,"office_hidden":false},"inn":"","inn_hidden":true,"addresses":[{"place_address":"","place_district":"","place_city":"","place_address_hidden":true,"place_city_type_hidden":true,"place":"","place_district_hidden":true,"place_city_type":"","place_city_hidden":true,"place_hidden":true}]},"id":"vulyk_33_196","declaration":{"date":"2015-03-06T00:00:00","notfull":"","additional_info_text":"","url":"http://static.declarations.com.ua/declarations/chosen_ones/mega_batch/kaziuk_oleksandr_oleksiiovych.pdf","additional_info":"","notfull_lostpages":""},"ft_src":"32700\n7423\n14800\nголова сторожинецького районного суду\nЧернівецька область\nЗагальний місцевий суд\nОлександр\nКазюк Н. В\nПодружжя\nКазюк О. О\nДитина\nУкраїнець О. О\nДитина\nОлексійович\nКазюк\nКазюк Олександр Олексійович\nКазюк Олександр Олексійович\nОлександр Олексійович Казюк\nОлександр Казюк\nКазюк Олександр Олексійович\nMitsubishi Lancer\n1.4 куб. см.\n2011\n1.4 куб. см.\nMitsubishi Lancer\n2011\n1.5 куб. см.\n2004\nRenault Kangoo\n1000\n2600\n1000\n2014\n1.4 куб. см.\n2011\nMitsubishi Lancer\n1.4 куб. см.\n2011\nMitsubishi Lancer\n1.5 куб. см.\nRenault Kangoo\n2004\n1000\n2600\n1000\n900\n833\n2500\n800\n215\n46.1\n28\n35.6\n46.1\nКазюк Олександр Олексійович\nОлександр Олексійович Казюк\nОлександр Казюк\nКазюк Олександр Олексійович\nКазюк Олександр Олексійович\nПодружжя\nКазюк Н. В\nДитина\nКазюк О. О\nДитина\nУкраїнець О. О\nОлександр\nОлексійович\nЗагальний місцевий суд\nголова сторожинецького районного суду\nЧернівецька область\nКазюк\n32700\n14800\n7423\nТУДСА в Чернівецькій області. Управління пенсійного фонду в Сторожинецькому районі. Комарівська сільска рада. Сторожинецький районний тер. центр соц. обслуговування. ПАТ 'Чернівціобленерго' Сторожинецький РЕМ центр по нарахуванню пенсій\n242747\n46083\n25218\n242827\n71301\n80\n2014\n14800\n7423\n32700\n46.1\n28\n35.6\n2500\n800\n215\n900\n833\n46.1\nКазюк Н. В\nПодружжя\nКазюк О. О\nДитина\nУкраїнець О. О\nДитина\nОлександр\nОлексійович\nКазюк\nКазюк Олександр Олексійович\nОлександр Олексійович Казюк\nОлександр Казюк\nКазюк Олександр Олексійович\nЧернівецька область\nголова сторожинецького районного суду\nЗагальний місцевий суд\nКазюк Олександр Олексійович\n46083\n242747\n25218\nТУДСА в Чернівецькій області. Управління пенсійного фонду в Сторожинецькому районі. Комарівська сільска рада. Сторожинецький районний тер. центр соц. обслуговування. ПАТ 'Чернівціобленерго' Сторожинецький РЕМ центр по нарахуванню пенсій\n71301\n242827\n80\n2011\n1.4 куб. см.\nMitsubishi Lancer\nMitsubishi Lancer\n1.4 куб. см.\n2011\n2004\n1.5 куб. см.\nRenault Kangoo\n25218\n242827\n71301\nТУДСА в Чернівецькій області. Управління пенсійного фонду в Сторожинецькому районі. Комарівська сільска рада. Сторожинецький районний тер. центр соц. обслуговування. ПАТ 'Чернівціобленерго' Сторожинецький РЕМ центр по нарахуванню пенсій\n80\n46083\n242747\n46.1\n28\n35.6\n900\n833\n215\n46.1\n2500\n800\n1000\n1000\n2600\n2014","banks":{"45":[{"sum_foreign_comment":"","sum_comment":"","sum_foreign":"","sum":"1000","sum_comment_hidden":false,"sum_foreign_units":"UAH","sum_units":"UAH","sum_hidden":false},{"sum_foreign_comment":"","sum_comment":"","sum_foreign":"","sum":"","sum_foreign_units":"","sum_units":""},{"sum_foreign_comment":"","sum_comment":"","sum_foreign":"","sum":"","sum_foreign_units":"","sum_units":""}],"46":[{"sum_foreign_comment":"","sum_comment":"","sum_foreign":"","sum":"1000","sum_comment_hidden":false,"sum_foreign_units":"UAH","sum_units":"UAH"}],"47":[{"sum_foreign":"","sum_foreign_comment":"","sum_comment":"","sum":"","sum_foreign_units":"UAH","sum_comment_unclear":false,"sum_units":"UAH"}],"48":[{"sum_foreign_comment":"","sum_comment":"","sum_foreign":"","sum":"","sum_foreign_units":"UAH","sum_units":"UAH"}],"49":[{"sum_foreign_comment":"","sum_comment":"","sum_foreign":"","sum":"","sum_foreign_units":"UAH","sum_units":"UAH"}],"50":[{"sum_foreign_comment":"","sum_comment":"","sum_foreign":"","sum":"","sum_foreign_units":"UAH","sum_units":"UAH"}],"51":[{"sum_foreign_comment":"","sum_comment":"","sum_foreign":"","sum":"2600","sum_comment_hidden":false,"sum_foreign_units":"UAH","sum_units":"UAH","sum_hidden":false},{"sum_foreign_comment":"","sum_comment":"","sum_foreign":"","sum":"","sum_foreign_units":"","sum_units":""},{"sum_foreign_comment":"","sum_comment":"","sum_foreign":"","sum":""}],"52":[{"sum_foreign_comment":"","sum_comment":"","sum_foreign":"","sum":"","sum_comment_hidden":false,"sum_foreign_units":"UAH","sum_units":"UAH"}],"53":[{"sum_foreign":"","sum_foreign_comment":"","sum_comment":"","sum":"","sum_foreign_units":"UAH","sum_comment_unclear":false,"sum_units":"UAH"}]}}],"declarationsLength":1,"analytics":[{"y":2014,"b":1000,"i":242827,"c":1,"k":46.1,"ka":1,"h":215,"ha":1,"l":1733,"la":5,"fi":71301,"ff":109.7,"ffa":3,"fl":3300,"fla":2}]}