{"intro":{"declaration_year":"2013","isnotdeclaration":"FALSE"},"general":{"full_name":"Сушко Людмила Петрівна","full_name_suggest":{"output":"Сушко Людмила Петрівна","input":["Сушко Людмила Петрівна","Людмила Петрівна Сушко","Людмила Сушко"]},"family_raw":"Син Перевуенчев Ю. О.","post_raw":"Суддя Апеляційного суду Київської області","last_name":"Сушко","patronymic":"Петрівна","name_unclear":false,"last_name_unclear":false,"last_name_hidden":false,"patronymic_unclear":false,"patronymic_hidden":false,"name":"Людмила","post":{"office":"Загальний апеляційний суд","post":"Суддя","region":"Київська область"},"inn":"","addresses_raw_hidden":true,"addresses_raw":"приховано","name_hidden":false},"vehicle":{"35":[{"brand_hidden":false,"sum_rent_comment":"","sum_comment":"","brand":"Nissan,Note","brand_info":"","year":"2011","sum":"","sum_rent":""}]},"income":{"5":{"family":"0","value":"284563,59","family_comment":"","comment":""},"6":{"family":"0","value":"225093,59","family_comment":"","comment":""},"7":{"family":"0","source_name":"0","value":"0","comment":"","family_comment":""},"8":{"family":"0","value":"0","family_comment":"","comment":""},"9":{"family":"0","value":"0","family_comment":"","comment":""},"10":{"family":"0","value":"11470","family_comment":"","comment":""},"11":{"family":"0","value":"0","family_comment":"","comment":""},"12":{"family":"0","value":"0","family_comment":"","comment":""},"13":{"family":"0","value":"48000","family_comment":"","comment":""},"14":{"family":"0","value":"0","family_comment":"","comment":""},"15":{"family":"0","value":"0","family_comment":"","comment":""},"16":{"family":"0","value":"0","family_comment":"","comment":""},"17":{"family":"0","value":"0","family_comment":"","comment":""},"18":{"family":"0","value":"0","family_comment":"","comment":""},"19":{"family":"0","value":"0","family_comment":"","comment":""},"20":{"family":"0","value":"0","family_comment":"","comment":""},"21":[{"cur":"0","country":"0","uah_equal":"0","country_comment":""},{"cur":"0","country":"0","uah_equal":"0","country_comment":""},{"cur":"0","country":"0","uah_equal":"0","country_comment":""},{"cur":"0","country":"0","uah_equal":"0","country_comment":""},{"cur":"0","country":"0","uah_equal":"0","country_comment":""}],"22":[{"cur":"0","country":"0","uah_equal":"0","country_comment":""},{"cur":"0","country":"0","uah_equal":"0","country_comment":""},{"cur":"0","country":"0","uah_equal":"0","country_comment":""},{"cur":"0","country":"0","uah_equal":"0","country_comment":""},{"cur":"0","country":"0","uah_equal":"0","country_comment":""}]},"estate":{"23":[{"space_comment":"","costs_rent_comment":"","region":"","costs_rent":"","space":"1500","location_raw":"приховано","address":"","costs":"","costs_comment":"","space_units":""},{"space_comment":"","costs_rent_comment":"","region":"","costs_rent":"","space":"","location_raw":"","address":"","costs":"","costs_comment":"","space_units":""},{"space_comment":"","costs_rent_comment":"","region":"","costs_rent":"","space":"","location_raw":"","address":"","costs":"","costs_comment":"","space_units":""}],"24":[{"space_comment":"","costs_rent_comment":"","region":"","costs_rent":"","space":"","location_raw":"приховано","address":"","costs":"","costs_comment":"","space_units":""}],"25":[{"space_comment":"","costs_rent_comment":"","region":"","costs_rent":"","space":"164","location_raw":"приховано","address":"","costs":"","costs_comment":"","space_units":""}],"27":[{"space_comment":"","costs_rent_comment":"","region":"","costs_rent":"","space":"18","location_raw":"приховано","address":"","costs":"","costs_comment":"","space_units":""}]},"liabilities":{"54":{"sum_foreign_comment":"","sum_comment":"","sum_foreign":"","sum":""},"55":{"sum_foreign_comment":"","sum_comment":"","sum_foreign":"","sum":"","sum_foreign_units":"","sum_units":""},"56":{"sum_foreign_comment":"","sum_comment":"","sum_foreign":"","sum":""},"57":{"sum_foreign_comment":"","sum_comment":"","sum_foreign":"","sum":""},"58":{"sum_foreign_comment":"","sum_comment":"","sum_foreign":"","sum":""},"59":{"sum_foreign_comment":"","sum_comment":"","sum_foreign":"","sum":""},"60":{"sum_foreign_comment":"","sum_comment":"","sum_foreign":"","sum":""},"61":{"sum_foreign_comment":"","sum_comment":"","sum_foreign":"","sum":"","sum_foreign_units":"","sum_units":""},"62":{"sum_foreign_comment":"","sum_comment":"","sum_foreign":"","sum":""},"63":{"sum_units":"","sum_foreign_comment":"","sum_comment":"","sum":"","sum_foreign":""},"64":{"sum_units":"","sum_foreign_comment":"","sum_comment":"","sum":"","sum_foreign":""}},"id":"1127","declaration":{"needs_scancopy_check":false,"notfull":"FALSE","additional_info_text":"п. 3. Посада;Суддя Апеляційного суду Київської області - нема впевненості, що вірно розпізнана назва ’Київської’ області);;п. 4. Члени сім’ї декларанта;син Перевуенчев Ю. О. - (нема впевненості, що вірно розпізнане Прізвище сина);;п. 24. Житлові будинки і. Сума витрат на оренду;В колонці ’Сума витрат (грн) на оренду чи на інше право користування’ замість вартості нерозбірливо внесене якесь слово;;п. 45. Сума коштів на рахунках у банках усього;в колонці ’Усього’ вказано: ;Приват банк - 2917.43 грн,;Укрсиббанк - 8000 грн;Замість суми 10917.43","url":"http://static.declarations.com.ua/declarations/sudy/apeliatsiini_sudy_oblastei__m.kyieva/kyivska/sushko.pdf","additional_info":"TRUE","notfull_lostpages":""},"ft_src":"FALSE\nп. 3. Посада;Суддя Апеляційного суду Київської області - нема впевненості, що вірно розпізнана назва ’Київської’ області);;п. 4. Члени сім’ї декларанта;син Перевуенчев Ю. О. - (нема впевненості, що вірно розпізнане Прізвище сина);;п. 24. Житлові будинки і. Сума витрат на оренду;В колонці ’Сума витрат (грн) на оренду чи на інше право користування’ замість вартості нерозбірливо внесене якесь слово;;п. 45. Сума коштів на рахунках у банках усього;в колонці ’Усього’ вказано: ;Приват банк - 2917.43 грн,;Укрсиббанк - 8000 грн;Замість суми 10917.43\nTRUE\n11470\n284563,59\n225093,59\n48000\nNissan,Note\n2011\nNissan,Note\n2011\n1500\n18\n164\n10917,43\nTRUE\nп. 3. Посада;Суддя Апеляційного суду Київської області - нема впевненості, що вірно розпізнана назва ’Київської’ області);;п. 4. Члени сім’ї декларанта;син Перевуенчев Ю. О. - (нема впевненості, що вірно розпізнане Прізвище сина);;п. 24. Житлові будинки і. Сума витрат на оренду;В колонці ’Сума витрат (грн) на оренду чи на інше право користування’ замість вартості нерозбірливо внесене якесь слово;;п. 45. Сума коштів на рахунках у банках усього;в колонці ’Усього’ вказано: ;Приват банк - 2917.43 грн,;Укрсиббанк - 8000 грн;Замість суми 10917.43\nFALSE\nFALSE\n2013\n225093,59\n48000\n11470\n284563,59\nNissan,Note\n2011\nп. 3. Посада;Суддя Апеляційного суду Київської області - нема впевненості, що вірно розпізнана назва ’Київської’ області);;п. 4. Члени сім’ї декларанта;син Перевуенчев Ю. О. - (нема впевненості, що вірно розпізнане Прізвище сина);;п. 24. Житлові будинки і. Сума витрат на оренду;В колонці ’Сума витрат (грн) на оренду чи на інше право користування’ замість вартості нерозбірливо внесене якесь слово;;п. 45. Сума коштів на рахунках у банках усього;в колонці ’Усього’ вказано: ;Приват банк - 2917.43 грн,;Укрсиббанк - 8000 грн;Замість суми 10917.43\nFALSE\nTRUE\n1500\n18\n164\nСуддя Апеляційного суду Київської області\nСин Перевуенчев Ю. О.\nСушко\nСушко Людмила Петрівна\nЛюдмила Петрівна Сушко\nЛюдмила Сушко\nСушко Людмила Петрівна\nЛюдмила\nСушко Людмила Петрівна\nЗагальний апеляційний суд\nСуддя\nКиївська область\nПетрівна\n225093,59\n48000\n284563,59\n11470\n10917,43\n2013\nFALSE\nСушко\nПетрівна\nСин Перевуенчев Ю. О.\nСушко Людмила Петрівна\nЛюдмила Петрівна Сушко\nЛюдмила Сушко\nСушко Людмила Петрівна\nЛюдмила\nСуддя Апеляційного суду Київської області\nСуддя\nКиївська область\nЗагальний апеляційний суд\nСушко Людмила Петрівна\n164\n1500\n18\nСуддя\nКиївська область\nЗагальний апеляційний суд\nСуддя Апеляційного суду Київської області\nЛюдмила\nПетрівна\nСин Перевуенчев Ю. О.\nСушко\nСушко Людмила Петрівна\nСушко Людмила Петрівна\nЛюдмила Петрівна Сушко\nЛюдмила Сушко\nСушко Людмила Петрівна\n10917,43\nFALSE\n2013","banks":{"45":[{"sum_foreign_comment":"","sum_comment":"","sum_foreign":"","sum":"10917,43","sum_foreign_units":"","sum_units":"UAH"},{"sum_foreign_comment":"","sum_comment":"","sum_foreign":"","sum":"","sum_foreign_units":"","sum_units":"USD"},{"sum_foreign_comment":"","sum_comment":"","sum_foreign":"","sum":"","sum_foreign_units":"","sum_units":"EUR"}],"46":[{"sum_foreign_comment":"","sum_comment":"","sum_foreign":"","sum":"","sum_foreign_units":"","sum_units":"UAH"},{"sum_foreign_comment":"","sum_comment":"","sum_foreign":"","sum":"","sum_foreign_units":"","sum_units":"USD"},{"sum_foreign_comment":"","sum_comment":"","sum_foreign":"","sum":"","sum_foreign_units":"","sum_units":"EUR"}],"47":[{"sum_foreign_comment":"","sum_comment":"","sum_foreign":"","sum":"","sum_foreign_units":"","sum_units":""}],"48":[{"sum_foreign_comment":"","sum_comment":"","sum_foreign":"","sum":"","sum_foreign_units":"","sum_units":""}],"49":[{"sum_foreign_comment":"","sum_comment":"","sum_foreign":"","sum":"","sum_foreign_units":"","sum_units":""}],"50":[{"sum_foreign_comment":"","sum_comment":"","sum_foreign":"","sum":"","sum_foreign_units":"","sum_units":""}],"51":[{"sum_foreign_comment":"","sum_comment":"","sum_foreign":"","sum":"","sum_foreign_units":"","sum_units":"UAH"},{"sum_foreign_comment":"","sum_comment":"","sum_foreign":"","sum":"","sum_foreign_units":"","sum_units":"USD"},{"sum_foreign_comment":"","sum_comment":"","sum_foreign":"","sum":"","sum_foreign_units":"","sum_units":"EUR"}],"52":[{"sum_foreign_comment":"","sum_comment":"","sum_foreign":"","sum":"","sum_foreign_units":"","sum_units":""}],"53":[{"sum_foreign_comment":"","sum_comment":"","sum_foreign":"","sum":"","sum_foreign_units":"","sum_units":""}]}}