{"intro":{"declaration_year":"2013","isnotdeclaration":"FALSE"},"general":{"full_name":"Грідіна Наталія Вікторівна","full_name_suggest":{"output":"Грідіна Наталія Вікторівна","input":["Грідіна Наталія Вікторівна","Наталія Вікторівна Грідіна","Наталія Грідіна"]},"family_raw":"","post_raw":"Суддя апеляційного суду Одеської області","last_name":"Грідіна","patronymic":"Вікторівна","name_unclear":false,"last_name_unclear":false,"last_name_hidden":false,"patronymic_unclear":false,"patronymic_hidden":false,"name":"Наталія","post":{"office":"Загальний апеляційний суд","post":"Суддя","region":"Одеська область"},"inn":"","addresses_raw_hidden":true,"addresses_raw":"приховано","name_hidden":false},"estate":{"23":[{"space_comment":"","costs_rent_comment":"","region":"","costs_rent":"","space":"3000","location_raw":"приховано","address":"","costs":"110000","costs_comment":"","space_units":""},{"space_comment":"","costs_rent_comment":"","region":"","costs_rent":"","space":"","location_raw":"","address":"","costs":"","costs_comment":"","space_units":""},{"space_comment":"","costs_rent_comment":"","region":"","costs_rent":"","space":"","location_raw":"","address":"","costs":"","costs_comment":"","space_units":""}]},"income":{"5":{"family":"0","value":"236564","family_comment":"","comment":""},"6":{"family":"0","value":"225147","family_comment":"","comment":""},"7":{"family":"0","source_name":"НУ ’Одеська юридична академія’;Національна школа суддів України","value":"11417","comment":"","family_comment":""},"8":{"family":"0","value":"0","family_comment":"","comment":""},"9":{"family":"0","value":"0","family_comment":"","comment":""},"10":{"family":"0","value":"0","family_comment":"","comment":""},"11":{"family":"0","value":"0","family_comment":"","comment":""},"12":{"family":"0","value":"0","family_comment":"","comment":""},"13":{"family":"0","value":"0","family_comment":"","comment":""},"14":{"family":"0","value":"0","family_comment":"","comment":""},"15":{"family":"0","value":"0","family_comment":"","comment":""},"16":{"family":"0","value":"0","family_comment":"","comment":""},"17":{"family":"0","value":"0","family_comment":"","comment":""},"18":{"family":"0","value":"0","family_comment":"","comment":""},"19":{"family":"0","value":"0","family_comment":"","comment":""},"20":{"family":"0","value":"0","family_comment":"","comment":""},"21":[{"cur":"0","country":"0","uah_equal":"0","country_comment":""},{"cur":"0","country":"0","uah_equal":"0","country_comment":""},{"cur":"0","country":"0","uah_equal":"0","country_comment":""},{"cur":"0","country":"0","uah_equal":"0","country_comment":""},{"cur":"0","country":"0","uah_equal":"0","country_comment":""}],"22":[{"cur":"0","country":"0","uah_equal":"0","country_comment":""},{"cur":"0","country":"0","uah_equal":"0","country_comment":""},{"cur":"0","country":"0","uah_equal":"0","country_comment":""},{"cur":"0","country":"0","uah_equal":"0","country_comment":""},{"cur":"0","country":"0","uah_equal":"0","country_comment":""}]},"liabilities":{"54":{"sum_foreign_comment":"","sum_comment":"","sum_foreign":"","sum":""},"55":{"sum_foreign_comment":"","sum_comment":"","sum_foreign":"","sum":"","sum_foreign_units":"","sum_units":""},"56":{"sum_foreign_comment":"","sum_comment":"","sum_foreign":"","sum":""},"57":{"sum_foreign_comment":"","sum_comment":"","sum_foreign":"","sum":""},"58":{"sum_foreign_comment":"","sum_comment":"","sum_foreign":"","sum":""},"59":{"sum_foreign_comment":"","sum_comment":"","sum_foreign":"","sum":""},"60":{"sum_foreign_comment":"","sum_comment":"","sum_foreign":"","sum":""},"61":{"sum_foreign_comment":"","sum_comment":"","sum_foreign":"","sum":"","sum_foreign_units":"","sum_units":""},"62":{"sum_foreign_comment":"","sum_comment":"","sum_foreign":"","sum":""},"63":{"sum_units":"","sum_foreign_comment":"","sum_comment":"","sum":"","sum_foreign":""},"64":{"sum_units":"","sum_foreign_comment":"","sum_comment":"","sum":"","sum_foreign":""}},"id":"1501","declaration":{"needs_scancopy_check":false,"notfull":"FALSE","additional_info_text":"Розділ 2. Відомості про доходи.;Пункт 7. Дохід від викладацької, наукової і творчої діяльності, медичної практики, інструкторської та суддівської практики із спорту.;В декларації записано 2 рядки. Перший в розшифровку доданий.;Другий - Національна школа(?) суддів України, Сума одержаного доходу декларанта - 3661","url":"http://static.declarations.com.ua/declarations/sudy/apeliatsiini_sudy_oblastei__m.kyieva/odeska/gridina_dec.pdf","additional_info":"TRUE","notfull_lostpages":""},"banks":{"45":[{"sum_foreign_comment":"","sum_comment":"","sum_foreign":"","sum":"","sum_foreign_units":"","sum_units":"UAH"},{"sum_foreign_comment":"","sum_comment":"","sum_foreign":"","sum":"","sum_foreign_units":"","sum_units":"USD"},{"sum_foreign_comment":"","sum_comment":"","sum_foreign":"","sum":"","sum_foreign_units":"","sum_units":"EUR"}],"46":[{"sum_foreign_comment":"","sum_comment":"","sum_foreign":"","sum":"","sum_foreign_units":"","sum_units":"UAH"},{"sum_foreign_comment":"","sum_comment":"","sum_foreign":"","sum":"","sum_foreign_units":"","sum_units":"USD"},{"sum_foreign_comment":"","sum_comment":"","sum_foreign":"","sum":"","sum_foreign_units":"","sum_units":"EUR"}],"47":[{"sum_foreign_comment":"","sum_comment":"","sum_foreign":"","sum":"","sum_foreign_units":"","sum_units":""}],"48":[{"sum_foreign_comment":"","sum_comment":"","sum_foreign":"","sum":"","sum_foreign_units":"","sum_units":""}],"49":[{"sum_foreign_comment":"","sum_comment":"","sum_foreign":"","sum":"","sum_foreign_units":"","sum_units":""}],"50":[{"sum_foreign_comment":"","sum_comment":"","sum_foreign":"","sum":"","sum_foreign_units":"","sum_units":""}],"51":[{"sum_foreign_comment":"","sum_comment":"","sum_foreign":"","sum":"","sum_foreign_units":"","sum_units":"UAH"},{"sum_foreign_comment":"","sum_comment":"","sum_foreign":"","sum":"","sum_foreign_units":"","sum_units":"USD"},{"sum_foreign_comment":"","sum_comment":"","sum_foreign":"","sum":"","sum_foreign_units":"","sum_units":"EUR"}],"52":[{"sum_foreign_comment":"","sum_comment":"","sum_foreign":"","sum":"","sum_foreign_units":"","sum_units":""}],"53":[{"sum_foreign_comment":"","sum_comment":"","sum_foreign":"","sum":"","sum_foreign_units":"","sum_units":""}]},"ft_src":"FALSE\nРозділ 2. Відомості про доходи.;Пункт 7. Дохід від викладацької, наукової і творчої діяльності, медичної практики, інструкторської та суддівської практики із спорту.;В декларації записано 2 рядки. Перший в розшифровку доданий.;Другий - Національна школа(?) суддів України, Сума одержаного доходу декларанта - 3661\nTRUE\nНУ ’Одеська юридична академія’;Національна школа суддів України\n11417\n236564\n225147\n110000\n3000\nTRUE\nРозділ 2. Відомості про доходи.;Пункт 7. Дохід від викладацької, наукової і творчої діяльності, медичної практики, інструкторської та суддівської практики із спорту.;В декларації записано 2 рядки. Перший в розшифровку доданий.;Другий - Національна школа(?) суддів України, Сума одержаного доходу декларанта - 3661\nFALSE\nFALSE\n2013\n225147\n11417\nНУ ’Одеська юридична академія’;Національна школа суддів України\n236564\nРозділ 2. Відомості про доходи.;Пункт 7. Дохід від викладацької, наукової і творчої діяльності, медичної практики, інструкторської та суддівської практики із спорту.;В декларації записано 2 рядки. Перший в розшифровку доданий.;Другий - Національна школа(?) суддів України, Сума одержаного доходу декларанта - 3661\nFALSE\nTRUE\n110000\n3000\nСуддя апеляційного суду Одеської області\nГрідіна\nГрідіна Наталія Вікторівна\nНаталія Вікторівна Грідіна\nНаталія Грідіна\nГрідіна Наталія Вікторівна\nНаталія\nГрідіна Наталія Вікторівна\nЗагальний апеляційний суд\nСуддя\nОдеська область\nВікторівна\nНУ ’Одеська юридична академія’;Національна школа суддів України\n11417\n225147\n236564\n2013\nFALSE\nГрідіна\nВікторівна\nГрідіна Наталія Вікторівна\nНаталія Вікторівна Грідіна\nНаталія Грідіна\nГрідіна Наталія Вікторівна\nНаталія\nСуддя апеляційного суду Одеської області\nСуддя\nОдеська область\nЗагальний апеляційний суд\nГрідіна Наталія Вікторівна\n110000\n3000\nСуддя\nОдеська область\nЗагальний апеляційний суд\nСуддя апеляційного суду Одеської області\nНаталія\nВікторівна\nГрідіна\nГрідіна Наталія Вікторівна\nГрідіна Наталія Вікторівна\nНаталія Вікторівна Грідіна\nНаталія Грідіна\nГрідіна Наталія Вікторівна\nFALSE\n2013"}