{"intro":{"declaration_year":"2013","isnotdeclaration":"FALSE"},"general":{"full_name":"Шевченко Володимир Альбертович","full_name_suggest":{"output":"Шевченко Володимир Альбертович","input":["Шевченко Володимир Альбертович","Володимир Альбертович Шевченко","Володимир Шевченко"]},"family_raw":"Дружина, Шелегеда О.І., приховано, приховано;","post_raw":"Суддя, секретар судової палати у цивільних справах Апеляційного суду Сумської області","last_name":"Шевченко","patronymic":"Альбертович","name_unclear":false,"last_name_unclear":false,"last_name_hidden":false,"patronymic_unclear":false,"patronymic_hidden":false,"name":"Володимир","post":{"office":"Загальний апеляційний суд","post":"Суддя","region":"Сумська область"},"inn":"","addresses_raw_hidden":true,"addresses_raw":"приховано","name_hidden":false},"vehicle":{"35":[{"brand_hidden":false,"sum_rent_comment":"","sum_comment":"","brand":"Toyota","brand_info":"","year":"2011","sum":"","sum_rent":""}],"40":[{"brand_hidden":false,"sum_rent_comment":"","sum_comment":"","brand":"Mitsubishi","brand_info":"","year":"2008","sum":"","sum_rent":""},{"brand_hidden":false,"sum_rent_comment":"","sum_comment":"","brand":"ВАЗ","brand_info":"","year":"2008","sum":"","sum_rent":""}]},"income":{"5":{"family":"1330292","value":"244407","family_comment":"","comment":""},"6":{"family":"300272","value":"231790","family_comment":"","comment":""},"7":{"family":"0","source_name":"0","value":"0","comment":"","family_comment":""},"8":{"family":"0","value":"0","family_comment":"","comment":""},"9":{"family":"271918","value":"0","family_comment":"","comment":""},"10":{"family":"0","value":"0","family_comment":"","comment":""},"11":{"family":"0","value":"0","family_comment":"","comment":""},"12":{"family":"0","value":"0","family_comment":"","comment":""},"13":{"family":"0","value":"0","family_comment":"","comment":""},"14":{"family":"0","value":"0","family_comment":"","comment":""},"15":{"family":"0","value":"0","family_comment":"","comment":""},"16":{"family":"0","value":"0","family_comment":"","comment":""},"17":{"family":"0","value":"0","family_comment":"","comment":""},"18":{"family":"757952","value":"0","family_comment":"","comment":""},"19":{"family":"0","value":"0","family_comment":"","comment":""},"20":{"family":"0","value":"12617","family_comment":"","comment":""},"21":[{"cur":"0","country":"0","uah_equal":"0","country_comment":""},{"cur":"0","country":"0","uah_equal":"0","country_comment":""},{"cur":"0","country":"0","uah_equal":"0","country_comment":""},{"cur":"0","country":"0","uah_equal":"0","country_comment":""},{"cur":"0","country":"0","uah_equal":"0","country_comment":""}],"22":[{"cur":"0","country":"0","uah_equal":"0","country_comment":""},{"cur":"0","country":"0","uah_equal":"0","country_comment":""},{"cur":"0","country":"0","uah_equal":"0","country_comment":""},{"cur":"0","country":"0","uah_equal":"0","country_comment":""},{"cur":"0","country":"0","uah_equal":"0","country_comment":""}]},"estate":{"23":[{"space_comment":"","costs_rent_comment":"","region":"","costs_rent":"","space":"1119","location_raw":"приховано","address":"","costs":"","costs_comment":"","space_units":""},{"space_comment":"","costs_rent_comment":"","region":"","costs_rent":"","space":"1868","location_raw":"приховано","address":"","costs":"","costs_comment":"","space_units":""},{"space_comment":"","costs_rent_comment":"","region":"","costs_rent":"","space":"","location_raw":"","address":"","costs":"","costs_comment":"","space_units":""}],"24":[{"space_comment":"","costs_rent_comment":"","region":"","costs_rent":"","space":"","location_raw":"приховано","address":"","costs":"","costs_comment":"","space_units":""}],"27":[{"space_comment":"","costs_rent_comment":"","region":"","costs_rent":"","space":"35,9","location_raw":"приховано","address":"","costs":"","costs_comment":"","space_units":""}],"29":[{"space_comment":"","space":"601","costs_rent_comment":"","region":"","costs_rent":"","costs_property_comment":"","address":"","space_units":"","location_raw":"приховано","costs_property":""},{"space_comment":"","space":"460","costs_rent_comment":"","region":"","costs_rent":"","costs_property_comment":"","address":"","space_units":"","location_raw":"приховано","costs_property":""},{"space_comment":"","space":"20000","costs_rent_comment":"","region":"","costs_rent":"","costs_property_comment":"","address":"","space_units":"","location_raw":"приховано","costs_property":""}],"30":[{"space_comment":"","space":"","costs_rent_comment":"","region":"","costs_rent":"","costs_property_comment":"","address":"","space_units":"","location_raw":"приховано","costs_property":""}],"31":[{"space_comment":"","space":"73,9","costs_rent_comment":"","region":"","costs_rent":"","costs_property_comment":"","address":"","space_units":"","location_raw":"приховано","costs_property":""}]},"liabilities":{"54":{"sum_foreign_comment":"","sum_comment":"","sum_foreign":"","sum":""},"55":{"sum_foreign_comment":"","sum_comment":"","sum_foreign":"","sum":"","sum_foreign_units":"","sum_units":""},"56":{"sum_foreign_comment":"","sum_comment":"","sum_foreign":"","sum":""},"57":{"sum_foreign_comment":"","sum_comment":"","sum_foreign":"","sum":""},"58":{"sum_foreign_comment":"","sum_comment":"","sum_foreign":"","sum":""},"59":{"sum_foreign_comment":"","sum_comment":"","sum_foreign":"","sum":""},"60":{"sum_foreign_comment":"","sum_comment":"","sum_foreign":"","sum":""},"61":{"sum_foreign_comment":"","sum_comment":"","sum_foreign":"","sum":"","sum_foreign_units":"","sum_units":""},"62":{"sum_foreign_comment":"","sum_comment":"","sum_foreign":"","sum":""},"63":{"sum_units":"","sum_foreign_comment":"","sum_comment":"","sum":"","sum_foreign":""},"64":{"sum_units":"","sum_foreign_comment":"","sum_comment":"","sum":"","sum_foreign":""}},"id":"1584","declaration":{"needs_scancopy_check":false,"notfull":"FALSE","additional_info_text":"Стр. 5;Майно, що перебуває у власності, в оренді чи на іншому праві користування членів сім’ї декларанта;29. Земельні ділянки 20 000;Стр. 8;51. Сума коштів на рахунках у банках та інших фінансових установах 346962","url":"http://static.declarations.com.ua/declarations/sudy/apeliatsiini_sudy_oblastei__m.kyieva/sumska/shevchenko.pdf","additional_info":"TRUE","notfull_lostpages":""},"ft_src":"FALSE\nСтр. 5;Майно, що перебуває у власності, в оренді чи на іншому праві користування членів сім’ї декларанта;29. Земельні ділянки 20 000;Стр. 8;51. Сума коштів на рахунках у банках та інших фінансових установах 346962\nTRUE\n757952\n12617\n1330292\n244407\n271918\n300272\n231790\nToyota\n2011\nMitsubishi\n2008\nВАЗ\n2008\nToyota\n2011\nMitsubishi\n2008\nВАЗ\n2008\n35,9\n601\n460\n20000\n1119\n1868\n73,9\n146900\n10\n151\nTRUE\nСтр. 5;Майно, що перебуває у власності, в оренді чи на іншому праві користування членів сім’ї декларанта;29. Земельні ділянки 20 000;Стр. 8;51. Сума коштів на рахунках у банках та інших фінансових установах 346962\nFALSE\nFALSE\n2013\n300272\n231790\n757952\n1330292\n244407\n271918\n12617\nToyota\n2011\nMitsubishi\n2008\nВАЗ\n2008\nСтр. 5;Майно, що перебуває у власності, в оренді чи на іншому праві користування членів сім’ї декларанта;29. Земельні ділянки 20 000;Стр. 8;51. Сума коштів на рахунках у банках та інших фінансових установах 346962\nFALSE\nTRUE\n35,9\n1119\n1868\n601\n460\n20000\n73,9\nСуддя, секретар судової палати у цивільних справах Апеляційного суду Сумської області\nДружина, Шелегеда О.І., приховано, приховано;\nШевченко\nШевченко Володимир Альбертович\nВолодимир Альбертович Шевченко\nВолодимир Шевченко\nШевченко Володимир Альбертович\nВолодимир\nШевченко Володимир Альбертович\nЗагальний апеляційний суд\nСуддя\nСумська область\nАльбертович\n231790\n300272\n757952\n12617\n244407\n1330292\n271918\n146900\n10\n151\n2013\nFALSE\nШевченко\nАльбертович\nДружина, Шелегеда О.І., приховано, приховано;\nШевченко Володимир Альбертович\nВолодимир Альбертович Шевченко\nВолодимир Шевченко\nШевченко Володимир Альбертович\nВолодимир\nСуддя, секретар судової палати у цивільних справах Апеляційного суду Сумської області\nСуддя\nСумська область\nЗагальний апеляційний суд\nШевченко Володимир Альбертович\n73,9\n1119\n1868\n35,9\n601\n460\n20000\nСуддя\nСумська область\nЗагальний апеляційний суд\nСуддя, секретар судової палати у цивільних справах Апеляційного суду Сумської області\nВолодимир\nАльбертович\nДружина, Шелегеда О.І., приховано, приховано;\nШевченко\nШевченко Володимир Альбертович\nШевченко Володимир Альбертович\nВолодимир Альбертович Шевченко\nВолодимир Шевченко\nШевченко Володимир Альбертович\n10\n146900\n151\nFALSE\n2013","banks":{"45":[{"sum_foreign_comment":"","sum_comment":"","sum_foreign":"","sum":"","sum_foreign_units":"","sum_units":"UAH"},{"sum_foreign_comment":"","sum_comment":"","sum_foreign":"","sum":"","sum_foreign_units":"","sum_units":"USD"},{"sum_foreign_comment":"","sum_comment":"","sum_foreign":"","sum":"","sum_foreign_units":"","sum_units":"EUR"}],"46":[{"sum_foreign_comment":"","sum_comment":"","sum_foreign":"","sum":"","sum_foreign_units":"","sum_units":"UAH"},{"sum_foreign_comment":"","sum_comment":"","sum_foreign":"","sum":"","sum_foreign_units":"","sum_units":"USD"},{"sum_foreign_comment":"","sum_comment":"","sum_foreign":"","sum":"","sum_foreign_units":"","sum_units":"EUR"}],"47":[{"sum_foreign_comment":"","sum_comment":"","sum_foreign":"","sum":"","sum_foreign_units":"","sum_units":""}],"48":[{"sum_foreign_comment":"","sum_comment":"","sum_foreign":"","sum":"","sum_foreign_units":"","sum_units":""}],"49":[{"sum_foreign_comment":"","sum_comment":"","sum_foreign":"","sum":"","sum_foreign_units":"","sum_units":""}],"50":[{"sum_foreign_comment":"","sum_comment":"","sum_foreign":"","sum":"","sum_foreign_units":"","sum_units":""}],"51":[{"sum_foreign_comment":"","sum_comment":"","sum_foreign":"","sum":"146900","sum_foreign_units":"","sum_units":"UAH"},{"sum_foreign_comment":"","sum_comment":"","sum_foreign":"","sum":"","sum_foreign_units":"","sum_units":"USD"},{"sum_foreign_comment":"","sum_comment":"","sum_foreign":"","sum":"","sum_foreign_units":"","sum_units":"EUR"}],"52":[{"sum_foreign_comment":"","sum_comment":"","sum_foreign":"","sum":"10","sum_foreign_units":"","sum_units":""}],"53":[{"sum_foreign_comment":"","sum_comment":"","sum_foreign":"","sum":"151","sum_foreign_units":"","sum_units":""}]}}