{"income":{"5":{"family_comment":"","value":"213973","family":"26172","comment":""},"6":{"family_comment":"","value":"193690","family":"26172","comment":""},"7":{"family_comment":"","value":"0","source_name":"0","family":"0","comment":""},"8":{"family_comment":"","value":"0","family":"0","comment":""},"9":{"family_comment":"","value":"2359","family":"0","comment":""},"10":{"family_comment":"","value":"11470","family":"0","comment":""},"11":{"family_comment":"","value":"0","family":"0","comment":""},"12":{"family_comment":"","value":"0","family":"0","comment":""},"13":{"family_comment":"","value":"0","family":"0","comment":""},"14":{"family_comment":"","value":"0","family":"0","comment":""},"15":{"family_comment":"","value":"6454","family":"0","comment":""},"16":{"family_comment":"","value":"0","family":"0","comment":""},"17":{"family_comment":"","value":"0","family":"0","comment":""},"18":{"family_comment":"","value":"0","family":"0","comment":""},"19":{"family_comment":"","value":"0","family":"0","comment":""},"20":{"family_comment":"","value":"0","family":"0","comment":""},"21":[{"cur":"0","country":"0","uah_equal":"0","country_comment":""},{"cur":"0","country":"0","uah_equal":"0","country_comment":""},{"cur":"0","country":"0","uah_equal":"0","country_comment":""},{"cur":"0","country":"0","uah_equal":"0","country_comment":""},{"cur":"0","country":"0","uah_equal":"0","country_comment":""}],"22":[{"cur":"0","country":"0","uah_equal":"0","country_comment":""},{"cur":"0","country":"0","uah_equal":"0","country_comment":""},{"cur":"0","country":"0","uah_equal":"0","country_comment":""},{"cur":"0","country":"0","uah_equal":"0","country_comment":""},{"cur":"0","country":"0","uah_equal":"0","country_comment":""}]},"vehicle":{"35":[{"brand_info":"","sum_rent_comment":"","brand":"Toyota,Corolla","sum_comment":"","year":"2012","brand_hidden":false,"sum":"","sum_rent":""}]},"id":"177","banks":{"45":[{"sum_foreign_comment":"","sum_units":"UAH","sum_comment":"","sum_foreign_units":"","sum":"36640","sum_foreign":""},{"sum_foreign_comment":"","sum_units":"USD","sum_comment":"","sum_foreign_units":"","sum":"","sum_foreign":""},{"sum_foreign_comment":"","sum_units":"EUR","sum_comment":"","sum_foreign_units":"","sum":"","sum_foreign":""}],"46":[{"sum_foreign_comment":"","sum_units":"UAH","sum_comment":"","sum_foreign_units":"","sum":"30993","sum_foreign":""},{"sum_foreign_comment":"","sum_units":"USD","sum_comment":"","sum_foreign_units":"","sum":"","sum_foreign":""},{"sum_foreign_comment":"","sum_units":"EUR","sum_comment":"","sum_foreign_units":"","sum":"","sum_foreign":""}],"47":[{"sum_foreign_comment":"","sum_units":"","sum_comment":"","sum_foreign_units":"","sum":"","sum_foreign":""}],"48":[{"sum_foreign_comment":"","sum_units":"","sum_comment":"","sum_foreign_units":"","sum":"","sum_foreign":""}],"49":[{"sum_foreign_comment":"","sum_units":"","sum_comment":"","sum_foreign_units":"","sum":"","sum_foreign":""}],"50":[{"sum_foreign_comment":"","sum_units":"","sum_comment":"","sum_foreign_units":"","sum":"","sum_foreign":""}],"51":[{"sum_foreign_comment":"","sum_units":"UAH","sum_comment":"","sum_foreign_units":"","sum":"","sum_foreign":""},{"sum_foreign_comment":"","sum_units":"USD","sum_comment":"","sum_foreign_units":"","sum":"","sum_foreign":""},{"sum_foreign_comment":"","sum_units":"EUR","sum_comment":"","sum_foreign_units":"","sum":"","sum_foreign":""}],"52":[{"sum_foreign_comment":"","sum_units":"","sum_comment":"","sum_foreign_units":"","sum":"","sum_foreign":""}],"53":[{"sum_foreign_comment":"","sum_units":"","sum_comment":"","sum_foreign_units":"","sum":"","sum_foreign":""}]},"declaration":{"needs_scancopy_check":false,"additional_info_text":"в этих пунктах я вносила только цифры, а доп.информация (в каких банках) написала здесь ниже.;Була інформація по пунктам;;45. Сума коштів на рахунках у банках усього; 9961 ПАТ РАЙФАЙЗЕН БАНК АВАЛЬ;26679  ПАТ БАНК КРЕДИТ ДНІПРО;;46. вкладених у звітному році Усього;7993   ПАТ РАЙФАЙЗЕН БАНК АВАЛЬ;23000  ПАТ БАНК КРЕДИТ ДНІПРО;;54. Добровільне страхування Усього;9218 Дніпропетровська філія СК «АХА»;;57. Погашення основної суми позики. Усього. ;50000 ПАТ КредіАгріколь, філія у Дніпропетровській обл;","notfull_lostpages":"","notfull":"FALSE","additional_info":"TRUE","url":"http://static.declarations.com.ua/declarations/sudy/hospodarski_mistsevi_sudy/dnipropetrovska_oblast/evsegneeva.pdf"},"liabilities":{"54":{"sum_foreign_comment":"","sum":"9218","sum_comment":"","sum_foreign":""},"55":{"sum_foreign_comment":"","sum_units":"","sum_comment":"","sum_foreign_units":"","sum":"","sum_foreign":""},"56":{"sum_foreign_comment":"","sum":"12269","sum_comment":"","sum_foreign":""},"57":{"sum_foreign_comment":"","sum":"50000","sum_comment":"","sum_foreign":""},"58":{"sum_foreign_comment":"","sum":"","sum_comment":"","sum_foreign":""},"59":{"sum_foreign_comment":"","sum":"","sum_comment":"","sum_foreign":""},"60":{"sum_foreign_comment":"","sum":"","sum_comment":"","sum_foreign":""},"61":{"sum_foreign_comment":"","sum_units":"","sum_comment":"","sum_foreign_units":"","sum":"","sum_foreign":""},"62":{"sum_foreign_comment":"","sum":"","sum_comment":"","sum_foreign":""},"63":{"sum_foreign_comment":"","sum_units":"","sum_comment":"","sum":"","sum_foreign":""},"64":{"sum_foreign_comment":"","sum_units":"","sum_comment":"","sum":"","sum_foreign":""}},"estate":{"23":[{"costs_rent":"","location_raw":"","region":"","costs":"","costs_rent_comment":"","costs_comment":"","space_comment":"","space_units":"","space":"","address":""},{"costs_rent":"","location_raw":"","region":"","costs":"","costs_rent_comment":"","costs_comment":"","space_comment":"","space_units":"","space":"","address":""},{"costs_rent":"","location_raw":"","region":"","costs":"","costs_rent_comment":"","costs_comment":"","space_comment":"","space_units":"","space":"","address":""}],"25":[{"costs_rent":"","location_raw":"приховано","region":"","costs":"","costs_rent_comment":"","costs_comment":"","space_comment":"","space_units":"","space":"162,8","address":""}]},"general":{"name_hidden":false,"name":"Надія","patronymic_unclear":false,"last_name_hidden":false,"addresses_raw":"приховано","post_raw":"Суддя господарського суду Дніпропетровської області","patronymic":"Михайлівна","inn":"","family_raw":"Донька, Євстигнеєва Т.О.","last_name":"Євстигнеєва","post":{"office":"Господарський місцевий суд","region":"Дніпропетровська область","post":"Суддя"},"addresses_raw_hidden":true,"last_name_unclear":false,"full_name":"Євстигнеєва Надія Михайлівна","patronymic_hidden":false,"full_name_suggest":{"output":"Євстигнеєва Надія Михайлівна","input":["Євстигнеєва Надія Михайлівна","Надія Михайлівна Євстигнеєва","Надія Євстигнеєва"]},"name_unclear":false},"ft_src":"50000\n9218\n12269\nFALSE\nв этих пунктах я вносила только цифры, а доп.информация (в каких банках) написала здесь ниже.;Була інформація по пунктам;;45. Сума коштів на рахунках у банках усього; 9961 ПАТ РАЙФАЙЗЕН БАНК АВАЛЬ;26679  ПАТ БАНК КРЕДИТ ДНІПРО;;46. вкладених у звітному році Усього;7993   ПАТ РАЙФАЙЗЕН БАНК АВАЛЬ;23000  ПАТ БАНК КРЕДИТ ДНІПРО;;54. Добровільне страхування Усього;9218 Дніпропетровська філія СК «АХА»;;57. Погашення основної суми позики. Усього. ;50000 ПАТ КредіАгріколь, філія у Дніпропетровській обл;\nTRUE\n6454\n11470\n26172\n213973\n2359\n26172\n193690\nToyota,Corolla\n2012\nToyota,Corolla\n2012\n162,8\n30993\n36640\nTRUE\nв этих пунктах я вносила только цифры, а доп.информация (в каких банках) написала здесь ниже.;Була інформація по пунктам;;45. Сума коштів на рахунках у банках усього; 9961 ПАТ РАЙФАЙЗЕН БАНК АВАЛЬ;26679  ПАТ БАНК КРЕДИТ ДНІПРО;;46. вкладених у звітному році Усього;7993   ПАТ РАЙФАЙЗЕН БАНК АВАЛЬ;23000  ПАТ БАНК КРЕДИТ ДНІПРО;;54. Добровільне страхування Усього;9218 Дніпропетровська філія СК «АХА»;;57. Погашення основної суми позики. Усього. ;50000 ПАТ КредіАгріколь, філія у Дніпропетровській обл;\nFALSE\nFALSE\n2013\n26172\n193690\n6454\n11470\n26172\n213973\n2359\nToyota,Corolla\n2012\nв этих пунктах я вносила только цифры, а доп.информация (в каких банках) написала здесь ниже.;Була інформація по пунктам;;45. Сума коштів на рахунках у банках усього; 9961 ПАТ РАЙФАЙЗЕН БАНК АВАЛЬ;26679  ПАТ БАНК КРЕДИТ ДНІПРО;;46. вкладених у звітному році Усього;7993   ПАТ РАЙФАЙЗЕН БАНК АВАЛЬ;23000  ПАТ БАНК КРЕДИТ ДНІПРО;;54. Добровільне страхування Усього;9218 Дніпропетровська філія СК «АХА»;;57. Погашення основної суми позики. Усього. ;50000 ПАТ КредіАгріколь, філія у Дніпропетровській обл;\nFALSE\nTRUE\n162,8\nСуддя господарського суду Дніпропетровської області\nДонька, Євстигнеєва Т.О.\nЄвстигнеєва\nЄвстигнеєва Надія Михайлівна\nНадія Михайлівна Євстигнеєва\nНадія Євстигнеєва\nЄвстигнеєва Надія Михайлівна\nНадія\nЄвстигнеєва Надія Михайлівна\nГосподарський місцевий суд\nСуддя\nДніпропетровська область\nМихайлівна\n50000\n12269\n9218\n193690\n26172\n6454\n213973\n26172\n11470\n2359\n36640\n30993\n2013\nFALSE\n50000\n12269\n9218\nЄвстигнеєва\nМихайлівна\nДонька, Євстигнеєва Т.О.\nЄвстигнеєва Надія Михайлівна\nНадія Михайлівна Євстигнеєва\nНадія Євстигнеєва\nЄвстигнеєва Надія Михайлівна\nНадія\nСуддя господарського суду Дніпропетровської області\nСуддя\nДніпропетровська область\nГосподарський місцевий суд\nЄвстигнеєва Надія Михайлівна\n162,8\nСуддя\nДніпропетровська область\nГосподарський місцевий суд\nСуддя господарського суду Дніпропетровської області\nНадія\nМихайлівна\nДонька, Євстигнеєва Т.О.\nЄвстигнеєва\nЄвстигнеєва Надія Михайлівна\nЄвстигнеєва Надія Михайлівна\nНадія Михайлівна Євстигнеєва\nНадія Євстигнеєва\nЄвстигнеєва Надія Михайлівна\n30993\n36640\nFALSE\n2013","intro":{"declaration_year":"2013","isnotdeclaration":"FALSE"}}