{"intro":{"declaration_year":"2013","isnotdeclaration":"FALSE"},"general":{"full_name":"Зозуля Дмитро Петрович","full_name_suggest":{"output":"Зозуля Дмитро Петрович","input":["Зозуля Дмитро Петрович","Дмитро Петрович Зозуля","Дмитро Зозуля"]},"family_raw":"Дружина - Зозуля Тетяна Вікторівна (дата, дані не вказано),;Син - Зозуля Петро Дмитрович (дата, дані не вказано),;Донька - Зозуля Софія Дмитрівна  (дата, дані не вказано),;Мати дружини - Куковинець(прізвище написано нерозбірливо) Людмила Петрівна  (дата, дані не вказано).","post_raw":"Суддя Рівненського окружного адміністративного суду","last_name":"Зозуля","patronymic":"Петрович","name_unclear":false,"last_name_unclear":false,"last_name_hidden":false,"patronymic_unclear":false,"patronymic_hidden":false,"name":"Дмитро","post":{"office":"Адміністративний місцевий суд","post":"Суддя","region":"Рівненська область"},"inn":"","addresses_raw_hidden":true,"addresses_raw":"","name_hidden":false},"vehicle":{"35":[{"brand_hidden":false,"sum_rent_comment":"","sum_comment":"","brand":"Volkswagen,Passat","brand_info":"","year":"2013","sum":"","sum_rent":"111374"},{"brand_hidden":false,"sum_rent_comment":"","sum_comment":"","brand":"Daewoo,Lanos","brand_info":"","year":"2010","sum":"","sum_rent":""}]},"income":{"5":{"family":"49915","value":"256522","family_comment":"","comment":""},"6":{"family":"118","value":"181944","family_comment":"","comment":""},"7":{"family":"0","source_name":"0","value":"0","comment":"","family_comment":""},"8":{"family":"0","value":"0","family_comment":"","comment":""},"9":{"family":"0","value":"0","family_comment":"","comment":""},"10":{"family":"0","value":"0","family_comment":"","comment":""},"11":{"family":"48","value":"48","family_comment":"","comment":""},"12":{"family":"0","value":"0","family_comment":"","comment":""},"13":{"family":"0","value":"0","family_comment":"","comment":""},"14":{"family":"0","value":"0","family_comment":"","comment":""},"15":{"family":"0","value":"0","family_comment":"","comment":""},"16":{"family":"0","value":"54050","family_comment":"","comment":""},"17":{"family":"0","value":"0","family_comment":"","comment":""},"18":{"family":"0","value":"0","family_comment":"","comment":""},"19":{"family":"0","value":"0","family_comment":"","comment":""},"20":{"family":"49749","value":"20480","family_comment":"","comment":""},"21":[{"cur":"0","country":"0","uah_equal":"0","country_comment":""},{"cur":"0","country":"0","uah_equal":"0","country_comment":""},{"cur":"0","country":"0","uah_equal":"0","country_comment":""},{"cur":"0","country":"0","uah_equal":"0","country_comment":""},{"cur":"0","country":"0","uah_equal":"0","country_comment":""}],"22":[{"cur":"0","country":"0","uah_equal":"0","country_comment":""},{"cur":"0","country":"0","uah_equal":"0","country_comment":""},{"cur":"0","country":"0","uah_equal":"0","country_comment":""},{"cur":"0","country":"0","uah_equal":"0","country_comment":""},{"cur":"0","country":"0","uah_equal":"0","country_comment":""}]},"estate":{"23":[{"space_comment":"","costs_rent_comment":"","region":"","costs_rent":"","space":"","location_raw":"","address":"","costs":"","costs_comment":"","space_units":""},{"space_comment":"","costs_rent_comment":"","region":"","costs_rent":"","space":"","location_raw":"","address":"","costs":"","costs_comment":"","space_units":""},{"space_comment":"","costs_rent_comment":"","region":"","costs_rent":"","space":"","location_raw":"","address":"","costs":"","costs_comment":"","space_units":""}],"29":[{"space_comment":"","space":"769","costs_rent_comment":"","region":"","costs_rent":"","costs_property_comment":"","address":"","space_units":"","location_raw":"","costs_property":""},{"space_comment":"","space":"538","costs_rent_comment":"","region":"","costs_rent":"","costs_property_comment":"","address":"","space_units":"","location_raw":"","costs_property":""},{"space_comment":"","space":"500","costs_rent_comment":"","region":"","costs_rent":"","costs_property_comment":"","address":"","space_units":"","location_raw":"","costs_property":""}],"30":[{"space_comment":"","space":"94,6","costs_rent_comment":"","region":"","costs_rent":"","costs_property_comment":"","address":"","space_units":"","location_raw":"","costs_property":""},{"space_comment":"","space":"38,5","costs_rent_comment":"","region":"","costs_rent":"","costs_property_comment":"","address":"","space_units":"","location_raw":"","costs_property":""}],"34":[{"space_comment":"","space":"72","costs_rent_comment":"","region":"","costs_rent":"","costs_property_comment":"","address":"","space_units":"","location_raw":"","costs_property":""}]},"liabilities":{"54":{"sum_foreign_comment":"","sum_comment":"","sum_foreign":"","sum":""},"55":{"sum_foreign_comment":"","sum_comment":"","sum_foreign":"","sum":"","sum_foreign_units":"","sum_units":""},"56":{"sum_foreign_comment":"","sum_comment":"","sum_foreign":"","sum":""},"57":{"sum_foreign_comment":"","sum_comment":"","sum_foreign":"","sum":""},"58":{"sum_foreign_comment":"","sum_comment":"","sum_foreign":"","sum":""},"59":{"sum_foreign_comment":"","sum_comment":"","sum_foreign":"","sum":""},"60":{"sum_foreign_comment":"","sum_comment":"","sum_foreign":"","sum":""},"61":{"sum_foreign_comment":"","sum_comment":"","sum_foreign":"","sum":"","sum_foreign_units":"","sum_units":""},"62":{"sum_foreign_comment":"","sum_comment":"","sum_foreign":"","sum":""},"63":{"sum_units":"грн","sum_foreign_comment":"","sum_comment":"","sum":"3260","sum_foreign":""},"64":{"sum_units":"грн","sum_foreign_comment":"","sum_comment":"","sum":"693","sum_foreign":""}},"id":"2225","declaration":{"needs_scancopy_check":false,"notfull":"FALSE","additional_info_text":"","url":"http://static.declarations.com.ua/declarations/sudy/mistsevi_sudy/okruzhni_administratyvni_sudy/rivnenska/zozulya_dec.pdf","additional_info":"FALSE","notfull_lostpages":""},"ft_src":"693\n3260\nFALSE\nFALSE\n48\n48\n49749\n20480\n54050\n49915\n256522\n118\n181944\n111374\nVolkswagen,Passat\n2013\nDaewoo,Lanos\n2010\nVolkswagen,Passat\n2013\n111374\nDaewoo,Lanos\n2010\n769\n538\n500\n94,6\n38,5\n72\n5081\nFALSE\nFALSE\nFALSE\n2013\n118\n181944\n48\n48\n49915\n256522\n54050\n49749\n20480\nVolkswagen,Passat\n2013\n111374\nDaewoo,Lanos\n2010\nFALSE\nFALSE\n769\n538\n500\n94,6\n38,5\n72\nСуддя Рівненського окружного адміністративного суду\nДружина - Зозуля Тетяна Вікторівна (дата, дані не вказано),;Син - Зозуля Петро Дмитрович (дата, дані не вказано),;Донька - Зозуля Софія Дмитрівна  (дата, дані не вказано),;Мати дружини - Куковинець(прізвище написано нерозбірливо) Людмила Петрівна  (дата, дані не вказано).\nЗозуля\nЗозуля Дмитро Петрович\nДмитро Петрович Зозуля\nДмитро Зозуля\nЗозуля Дмитро Петрович\nДмитро\nЗозуля Дмитро Петрович\nАдміністративний місцевий суд\nСуддя\nРівненська область\nПетрович\n3260\n693\n181944\n118\n20480\n49749\n256522\n49915\n54050\n48\n48\n5081\n2013\nFALSE\n693\n3260\nЗозуля\nПетрович\nДружина - Зозуля Тетяна Вікторівна (дата, дані не вказано),;Син - Зозуля Петро Дмитрович (дата, дані не вказано),;Донька - Зозуля Софія Дмитрівна  (дата, дані не вказано),;Мати дружини - Куковинець(прізвище написано нерозбірливо) Людмила Петрівна  (дата, дані не вказано).\nЗозуля Дмитро Петрович\nДмитро Петрович Зозуля\nДмитро Зозуля\nЗозуля Дмитро Петрович\nДмитро\nСуддя Рівненського окружного адміністративного суду\nСуддя\nРівненська область\nАдміністративний місцевий суд\nЗозуля Дмитро Петрович\n94,6\n38,5\n72\n769\n538\n500\nСуддя\nРівненська область\nАдміністративний місцевий суд\nСуддя Рівненського окружного адміністративного суду\nДмитро\nПетрович\nДружина - Зозуля Тетяна Вікторівна (дата, дані не вказано),;Син - Зозуля Петро Дмитрович (дата, дані не вказано),;Донька - Зозуля Софія Дмитрівна  (дата, дані не вказано),;Мати дружини - Куковинець(прізвище написано нерозбірливо) Людмила Петрівна  (дата, дані не вказано).\nЗозуля\nЗозуля Дмитро Петрович\nЗозуля Дмитро Петрович\nДмитро Петрович Зозуля\nДмитро Зозуля\nЗозуля Дмитро Петрович\n5081\nFALSE\n2013","banks":{"45":[{"sum_foreign_comment":"","sum_comment":"","sum_foreign":"","sum":"","sum_foreign_units":"","sum_units":"UAH"},{"sum_foreign_comment":"","sum_comment":"","sum_foreign":"","sum":"","sum_foreign_units":"","sum_units":"USD"},{"sum_foreign_comment":"","sum_comment":"","sum_foreign":"","sum":"","sum_foreign_units":"","sum_units":"EUR"}],"46":[{"sum_foreign_comment":"","sum_comment":"","sum_foreign":"","sum":"","sum_foreign_units":"","sum_units":"UAH"},{"sum_foreign_comment":"","sum_comment":"","sum_foreign":"","sum":"","sum_foreign_units":"","sum_units":"USD"},{"sum_foreign_comment":"","sum_comment":"","sum_foreign":"","sum":"","sum_foreign_units":"","sum_units":"EUR"}],"47":[{"sum_foreign_comment":"","sum_comment":"","sum_foreign":"","sum":"","sum_foreign_units":"","sum_units":""}],"48":[{"sum_foreign_comment":"","sum_comment":"","sum_foreign":"","sum":"","sum_foreign_units":"","sum_units":""}],"49":[{"sum_foreign_comment":"","sum_comment":"","sum_foreign":"","sum":"","sum_foreign_units":"","sum_units":""}],"50":[{"sum_foreign_comment":"","sum_comment":"","sum_foreign":"","sum":"","sum_foreign_units":"","sum_units":""}],"51":[{"sum_foreign_comment":"","sum_comment":"","sum_foreign":"","sum":"5081","sum_foreign_units":"","sum_units":"UAH"},{"sum_foreign_comment":"","sum_comment":"","sum_foreign":"","sum":"","sum_foreign_units":"","sum_units":"USD"},{"sum_foreign_comment":"","sum_comment":"","sum_foreign":"","sum":"","sum_foreign_units":"","sum_units":"EUR"}],"52":[{"sum_foreign_comment":"","sum_comment":"","sum_foreign":"","sum":"","sum_foreign_units":"","sum_units":""}],"53":[{"sum_foreign_comment":"","sum_comment":"","sum_foreign":"","sum":"","sum_foreign_units":"","sum_units":""}]}}