{"income":{"5":{"family_comment":"","value":"566388","value_unclear":false,"family":"14042","comment":""},"6":{"family_comment":"","value":"331066","value_unclear":false,"family":"","comment":""},"7":{"source_name_unclear":false,"value":"","family_hidden":false,"value_hidden":false,"family_comment":"","source_name":"","family":"","comment":"","source_name_hidden":false},"8":{"value":"","family_hidden":false,"value_hidden":false,"family_comment":"","family":"","comment":""},"9":{"value":"18065","value_unclear":false,"value_hidden":false,"family_comment":"","comment_unclear":false,"comment":"","family":"555"},"10":{"value":"13764","family_hidden":false,"value_hidden":false,"family_comment":"","family":"","comment":""},"11":{"value":"","family_hidden":false,"value_hidden":false,"family_comment":"","family":"","comment":""},"12":{"value":"","family_hidden":false,"value_hidden":false,"family_comment":"","family":"","comment":""},"13":{"value":"","family_hidden":false,"value_hidden":false,"family_comment":"","family":"","comment":""},"14":{"value":"","family_hidden":false,"value_hidden":false,"family_comment":"","family":"","comment":""},"15":{"value":"5020","family_hidden":false,"value_hidden":false,"family_comment":"","family":"","comment":""},"16":{"value":"145000","family_hidden":false,"value_hidden":false,"family_comment":"","family":"","comment":""},"17":{"value":"","family_hidden":false,"value_hidden":false,"family_comment":"","family":"","comment":""},"18":{"value":"","comment_unclear":false,"family_hidden":false,"value_hidden":false,"family_comment":"","family":"","comment":""},"19":{"value":"","family_hidden":false,"value_hidden":false,"family_comment":"","family":"","comment":""},"20":{"value":"53473","value_unclear":false,"family_hidden":false,"value_hidden":false,"family_comment":"пенсія за віком","comment_unclear":false,"comment":"пенсія за віком","family":"13487"}},"id":"23","banks":{"45":[{"sum_units":"UAH","sum_foreign":"","sum_hidden":false,"sum":"113730","sum_units_hidden":false,"sum_foreign_comment":"","sum_foreign_hidden":false,"sum_comment":"","sum_foreign_units":"UAH","sum_units_unclear":false,"sum_comment_hidden":false,"sum_unclear":false}],"51":[{"sum_units":"UAH","sum_hidden":false,"sum":"13276","sum_units_hidden":false,"sum_foreign_comment":"","sum_foreign_hidden":false,"sum_comment":"","sum_comment_unclear":false,"sum_foreign_units":"UAH","sum_foreign":"","sum_comment_hidden":false,"sum_unclear":false}]},"declaration":{"additional_info_text":"","notfull":"1","additional_info":"","notfull_lostpages":"Декларація не повна. на 2-х сторінках вибірково наведені дані по декількох пунктах, що містять певну інформацію. пункти (2) (7-8) (11-14) (17-19) (26-28) (30) (32-44) (47-60) (53-60) (63) відсутні. немає відомостей щодо року декларування і дати складання декларації","url":"http://static.declarations.com.ua/declarations/chosen_ones/judges_batch/159_hohol_tamara_hryhorivna.pdf"},"liabilities":{"54":{"sum_foreign_comment":"","sum_foreign_hidden":false,"sum_comment":"","sum_hidden":false,"sum_foreign_comment_unclear":false,"sum_comment_hidden":false,"sum":"","sum_foreign":""},"55":{"sum_foreign_comment":"","sum":"","sum_hidden":false,"sum_comment":"","sum_foreign":""},"56":{"sum_foreign_comment":"","sum":"","sum_comment":"","sum_foreign":""},"57":{"sum_foreign_comment":"","sum_foreign_hidden":false,"sum_comment":"","sum_hidden":false,"sum_comment_hidden":false,"sum":"","sum_foreign":""},"58":{"sum_foreign_comment":"","sum":"","sum_comment":"","sum_hidden":false,"sum_comment_hidden":false,"sum_foreign":""},"59":{"sum_foreign_comment":"","sum_foreign_hidden":false,"sum_comment":"","sum_hidden":false,"sum":"","sum_foreign":""},"60":{"sum_foreign_comment":"","sum":"","sum_comment":"","sum_comment_unclear":false,"sum_hidden":false,"sum_comment_hidden":false,"sum_foreign":""},"61":{"sum_foreign_comment":"","sum":"","sum_hidden":false,"sum_comment":"","sum_foreign":""},"62":{"sum_foreign_comment":"","sum_foreign_hidden":false,"sum_comment":"","sum_comment_hidden":false,"sum_unclear":false,"sum":"4141","sum_foreign":""},"63":{"sum_foreign_comment":"","sum_foreign_hidden":false,"sum_comment":"","sum_hidden":false,"sum_comment_hidden":false,"sum":"","sum_foreign":""},"64":{"sum_foreign_comment":"","sum":"","sum_comment":"","sum_hidden":false,"sum_comment_hidden":false,"sum_foreign":""}},"ft_src":"4141\n1\nДекларація не повна. на 2-х сторінках вибірково наведені дані по декількох пунктах, що містять певну інформацію. пункти (2) (7-8) (11-14) (17-19) (26-28) (30) (32-44) (47-60) (53-60) (63) відсутні. немає відомостей щодо року декларування і дати складання декларації\nсуддя вищого господарського суду україни\nЗагальнодержавний регіон\nВищий господарський суд\nТамара\nГоголь М. В\nПодружжя\nГригорівна\nГоголь Тамара Григорівна\nТамара Григорівна Гоголь\nТамара Гоголь\nГоголь Тамара Григорівна\nГоголь Тамара Григорівна\nГоголь\n1/2\n98\n1200\n80\n916\n2250\n80\n13276\n113730\nДекларація не повна. на 2-х сторінках вибірково наведені дані по декількох пунктах, що містять певну інформацію. пункти (2) (7-8) (11-14) (17-19) (26-28) (30) (32-44) (47-60) (53-60) (63) відсутні. немає відомостей щодо року декларування і дати складання декларації\n1\n2013\n1\nДекларація не повна. на 2-х сторінках вибірково наведені дані по декількох пунктах, що містять певну інформацію. пункти (2) (7-8) (11-14) (17-19) (26-28) (30) (32-44) (47-60) (53-60) (63) відсутні. немає відомостей щодо року декларування і дати складання декларації\n2013\nГоголь Тамара Григорівна\nТамара Григорівна Гоголь\nТамара Гоголь\nГоголь Тамара Григорівна\nГоголь Тамара Григорівна\nПодружжя\nГоголь М. В\nТамара\nГригорівна\nсуддя вищого господарського суду україни\nВищий господарський суд\nЗагальнодержавний регіон\nГоголь\n4141\n331066\n53473\nпенсія за віком\nпенсія за віком\n13487\n5020\n566388\n14042\n145000\n18065\n555\n13764\n916\n2250\n1200\n80\n1/2\n98\n80\n113730\n13276\n4141\n331066\n5020\n555\n18065\n13764\n14042\n566388\n145000\nпенсія за віком\nпенсія за віком\n13487\n53473\nПодружжя\nГоголь М. В\nГригорівна\nГоголь\nТамара\nГоголь Тамара Григорівна\nТамара Григорівна Гоголь\nТамара Гоголь\nГоголь Тамара Григорівна\nЗагальнодержавний регіон\nВищий господарський суд\nсуддя вищого господарського суду україни\nГоголь Тамара Григорівна\n5020\n18065\n555\n13764\nпенсія за віком\n53473\n13487\nпенсія за віком\n14042\n566388\n145000\n331066\n1/2\n98\n916\n2250\n80\n80\n1200\n113730\n13276\n2013","general":{"inn":"","name":"Тамара","inn_unclear":false,"family":[{"inn":"","relations":"Подружжя","inn_unclear":false,"relations_hidden":false,"inn_hidden":true,"relations_other":"","name_hidden":true,"family_name":"Гоголь М. В","name_unclear":false}],"inn_hidden":true,"family_raw":"","last_name":"Гоголь","post":{"post":"суддя вищого господарського суду україни","region":"Загальнодержавний регіон","candidate":"","office_hidden":false,"post_hidden":false,"office":"Вищий господарський суд","region_hidden":false},"full_name_suggest":{"output":"Гоголь Тамара Григорівна","input":["Гоголь Тамара Григорівна","Тамара Григорівна Гоголь","Тамара Гоголь"]},"full_name":"Гоголь Тамара Григорівна","patronymic":"Григорівна","last_name_unclear":false,"name_unclear":false},"source":"VULYK","estate":{"23":[{"region_unclear":false,"space_unclear":false,"costs":"","costs_comment":"","costs_hidden":false,"address_hidden":true,"region_hidden":true,"space_comment":"","space_hidden":false,"space_units_unclear":false,"address":"","costs_comment_unclear":false,"region":"","address_unclear":false,"space":"916","costs_rent_hidden":false,"costs_rent_comment_hidden":false,"space_units":"м²","costs_comment_hidden":false,"costs_rent":"","costs_rent_comment":""},{"space_unclear":false,"costs":"","costs_comment":"","costs_hidden":false,"address_hidden":false,"region_hidden":false,"space_comment":"","space":"2250","address":"","region":"","costs_rent_comment":"","costs_rent_hidden":false,"space_units":"м²","costs_rent":""}],"24":[{"space_unclear":false,"costs":"","costs_comment":"","costs_hidden":false,"address_hidden":true,"region_hidden":true,"space_comment":"","space_hidden":false,"space":"80","address":"","region":"","costs_rent_comment":"","costs_rent_hidden":false,"costs_rent_comment_hidden":false,"space_units":"м²","costs_comment_hidden":false,"costs_rent":""}],"25":[{"region_unclear":false,"space_unclear":false,"costs":"","costs_comment":"","costs_hidden":false,"address_hidden":true,"region_hidden":true,"space_comment":"","space":"80","address":"","costs_rent_comment_unclear":false,"region":"","costs_rent_comment":"","costs_rent_hidden":false,"space_comment_unclear":false,"costs_rent_comment_hidden":false,"space_units":"м²","costs_comment_hidden":false,"costs_rent":"","costs_unclear":false}],"29":[{"space_unclear":false,"costs_property_hidden":false,"address_hidden":true,"region_hidden":true,"space_comment":"","space_hidden":false,"space":"1200","address":"","region":"","costs_property":"","costs_rent_comment":"","costs_rent_hidden":false,"space_comment_hidden":false,"space_units":"м²","costs_property_comment":"","costs_rent":""}],"31":[{"region_unclear":false,"space_unclear":false,"costs_property_hidden":false,"address_hidden":true,"region_hidden":true,"space_comment":"1/2","space_units_hidden":false,"space_hidden":false,"space":"98","address":"","region":"","costs_property":"","costs_rent_comment":"","space_comment_unclear":false,"space_units":"м²","costs_property_comment":"","costs_rent":""}]},"intro":{"declaration_year":"2013","isnotdeclaration":"","declaration_year_unclear":false,"declaration_year_hidden":false}}