{"income":{"5":{"family_comment":"","value":"539862,65","family":"933433","comment":""},"6":{"family_comment":"","value":"214209,56","family":"0","comment":""},"7":{"family_comment":"","value":"0","source_name":"0","family":"0","comment":""},"8":{"family_comment":"","value":"0","family":"0","comment":""},"9":{"family_comment":"","value":"0","family":"0","comment":""},"10":{"family_comment":"","value":"0","family":"0","comment":""},"11":{"family_comment":"","value":"0","family":"0","comment":""},"12":{"family_comment":"","value":"0","family":"0","comment":""},"13":{"family_comment":"","value":"0","family":"0","comment":""},"14":{"family_comment":"","value":"0","family":"0","comment":""},"15":{"family_comment":"","value":"0","family":"0","comment":""},"16":{"family_comment":"","value":"216000","family":"0","comment":""},"17":{"family_comment":"","value":"0","family":"0","comment":""},"18":{"family_comment":"","value":"0","family":"0","comment":""},"19":{"family_comment":"","value":"0","family":"0","comment":""},"20":{"family_comment":"","value":"109653,09","family":"0","comment":""},"21":[{"cur":"0","country":"0","uah_equal":"0","country_comment":""},{"cur":"0","country":"0","uah_equal":"0","country_comment":""},{"cur":"0","country":"0","uah_equal":"0","country_comment":""},{"cur":"0","country":"0","uah_equal":"0","country_comment":""},{"cur":"0","country":"0","uah_equal":"0","country_comment":""}],"22":[{"cur":"0","country":"0","uah_equal":"0","country_comment":""},{"cur":"0","country":"0","uah_equal":"0","country_comment":""},{"cur":"0","country":"0","uah_equal":"0","country_comment":""},{"cur":"0","country":"0","uah_equal":"0","country_comment":""},{"cur":"0","country":"0","uah_equal":"0","country_comment":""}]},"vehicle":{"35":[{"brand_info":"","sum_rent_comment":"","brand":"Volkswagen,Touareg","sum_comment":"","year":"2007","brand_hidden":false,"sum":"256000","sum_rent":""}],"41":[{"brand_info":"","sum_rent_comment":"","brand":"ГАЗ,3309","sum_comment":"","year":"2006","brand_hidden":false,"sum":"","sum_rent":""}]},"id":"2603","banks":{"45":[{"sum_foreign_comment":"","sum_units":"UAH","sum_comment":"","sum_foreign_units":"","sum":"","sum_foreign":""},{"sum_foreign_comment":"","sum_units":"USD","sum_comment":"","sum_foreign_units":"","sum":"","sum_foreign":""},{"sum_foreign_comment":"","sum_units":"EUR","sum_comment":"","sum_foreign_units":"","sum":"","sum_foreign":""}],"46":[{"sum_foreign_comment":"","sum_units":"UAH","sum_comment":"","sum_foreign_units":"","sum":"","sum_foreign":""},{"sum_foreign_comment":"","sum_units":"USD","sum_comment":"","sum_foreign_units":"","sum":"","sum_foreign":""},{"sum_foreign_comment":"","sum_units":"EUR","sum_comment":"","sum_foreign_units":"","sum":"","sum_foreign":""}],"47":[{"sum_foreign_comment":"","sum_units":"","sum_comment":"","sum_foreign_units":"","sum":"","sum_foreign":""}],"48":[{"sum_foreign_comment":"","sum_units":"","sum_comment":"","sum_foreign_units":"","sum":"","sum_foreign":""}],"49":[{"sum_foreign_comment":"","sum_units":"","sum_comment":"","sum_foreign_units":"","sum":"","sum_foreign":""}],"50":[{"sum_foreign_comment":"","sum_units":"","sum_comment":"","sum_foreign_units":"","sum":"","sum_foreign":""}],"51":[{"sum_foreign_comment":"","sum_units":"UAH","sum_comment":"","sum_foreign_units":"","sum":"539,48","sum_foreign":""},{"sum_foreign_comment":"","sum_units":"USD","sum_comment":"","sum_foreign_units":"","sum":"","sum_foreign":""},{"sum_foreign_comment":"","sum_units":"EUR","sum_comment":"","sum_foreign_units":"","sum":"","sum_foreign":""}],"52":[{"sum_foreign_comment":"","sum_units":"","sum_comment":"","sum_foreign_units":"","sum":"","sum_foreign":""}],"53":[{"sum_foreign_comment":"","sum_units":"","sum_comment":"","sum_foreign_units":"","sum":"","sum_foreign":""}]},"declaration":{"needs_scancopy_check":false,"additional_info_text":"Сторінка №5;Пункт 29. Земельні ділянки.;Вказані лише площі без місцязнаходження та сум витрат. В декларації зазначено 8 (вісім) земельних ділянок. В анкету вніс лише 3 (три) найбільших. Повний список ділянок, які зазначено в декларації:;і) 0.1000га;;2) 0.1714га;;3) 0.8655га;;4) 0.800га;;5) 0.1583га;;6) 0.110га;;7) 0.0450га;;8) 8.3899га","notfull_lostpages":"","notfull":"FALSE","additional_info":"TRUE","url":"http://static.declarations.com.ua/declarations/sudy/mistsevi_sudy/okruzhni_administratyvni_sudy/khersonska/d_gomelchuk.pdf"},"liabilities":{"54":{"sum_foreign_comment":"","sum":"","sum_comment":"","sum_foreign":""},"55":{"sum_foreign_comment":"","sum_units":"грн","sum_comment":"","sum_foreign_units":"","sum":"3878","sum_foreign":""},"56":{"sum_foreign_comment":"","sum":"20000","sum_comment":"","sum_foreign":""},"57":{"sum_foreign_comment":"","sum":"","sum_comment":"","sum_foreign":""},"58":{"sum_foreign_comment":"","sum":"","sum_comment":"","sum_foreign":""},"59":{"sum_foreign_comment":"","sum":"","sum_comment":"","sum_foreign":""},"60":{"sum_foreign_comment":"","sum":"","sum_comment":"","sum_foreign":""},"61":{"sum_foreign_comment":"","sum_units":"","sum_comment":"","sum_foreign_units":"","sum":"","sum_foreign":""},"62":{"sum_foreign_comment":"","sum":"","sum_comment":"","sum_foreign":""},"63":{"sum_foreign_comment":"","sum_units":"","sum_comment":"","sum":"","sum_foreign":""},"64":{"sum_foreign_comment":"","sum_units":"","sum_comment":"","sum":"","sum_foreign":""}},"estate":{"23":[{"costs_rent":"","location_raw":"","region":"","costs":"","costs_rent_comment":"","costs_comment":"","space_comment":"","space_units":"","space":"","address":""},{"costs_rent":"","location_raw":"","region":"","costs":"","costs_rent_comment":"","costs_comment":"","space_comment":"","space_units":"","space":"","address":""},{"costs_rent":"","location_raw":"","region":"","costs":"","costs_rent_comment":"","costs_comment":"","space_comment":"","space_units":"","space":"","address":""}]},"general":{"name_hidden":false,"name":"Сергій","patronymic_unclear":false,"last_name_hidden":false,"addresses_raw":"приховано","post_raw":"Суддя","patronymic":"Васильович","inn":"","family_raw":"Дружина Гомельчук О.І.","last_name":"Гомельчук","post":{"office":"Адміністративний місцевий суд","region":"Херсонська область","post":"Суддя"},"addresses_raw_hidden":true,"last_name_unclear":false,"full_name":"Гомельчук Сергій Васильович","patronymic_hidden":false,"full_name_suggest":{"output":"Гомельчук Сергій Васильович","input":["Гомельчук Сергій Васильович","Сергій Васильович Гомельчук","Сергій Гомельчук"]},"name_unclear":false},"ft_src":"3878\n20000\nFALSE\nСторінка №5;Пункт 29. Земельні ділянки.;Вказані лише площі без місцязнаходження та сум витрат. В декларації зазначено 8 (вісім) земельних ділянок. В анкету вніс лише 3 (три) найбільших. Повний список ділянок, які зазначено в декларації:;і) 0.1000га;;2) 0.1714га;;3) 0.8655га;;4) 0.800га;;5) 0.1583га;;6) 0.110га;;7) 0.0450га;;8) 8.3899га\nTRUE\n109653,09\n216000\n933433\n539862,65\n214209,56\nГАЗ,3309\n2006\nVolkswagen,Touareg\n256000\n2007\nГАЗ,3309\n2006\nVolkswagen,Touareg\n256000\n2007\n539,48\nTRUE\nСторінка №5;Пункт 29. Земельні ділянки.;Вказані лише площі без місцязнаходження та сум витрат. В декларації зазначено 8 (вісім) земельних ділянок. В анкету вніс лише 3 (три) найбільших. Повний список ділянок, які зазначено в декларації:;і) 0.1000га;;2) 0.1714га;;3) 0.8655га;;4) 0.800га;;5) 0.1583га;;6) 0.110га;;7) 0.0450га;;8) 8.3899га\nFALSE\nFALSE\n2013\n214209,56\n933433\n539862,65\n216000\n109653,09\n256000\nVolkswagen,Touareg\n2007\nГАЗ,3309\n2006\nСторінка №5;Пункт 29. Земельні ділянки.;Вказані лише площі без місцязнаходження та сум витрат. В декларації зазначено 8 (вісім) земельних ділянок. В анкету вніс лише 3 (три) найбільших. Повний список ділянок, які зазначено в декларації:;і) 0.1000га;;2) 0.1714га;;3) 0.8655га;;4) 0.800га;;5) 0.1583га;;6) 0.110га;;7) 0.0450га;;8) 8.3899га\nFALSE\nTRUE\nСуддя\nДружина Гомельчук О.І.\nГомельчук\nГомельчук Сергій Васильович\nСергій Васильович Гомельчук\nСергій Гомельчук\nГомельчук Сергій Васильович\nСергій\nГомельчук Сергій Васильович\nАдміністративний місцевий суд\nСуддя\nХерсонська область\nВасильович\n3878\n20000\n214209,56\n109653,09\n539862,65\n933433\n216000\n539,48\n2013\nFALSE\n20000\n3878\nГомельчук\nВасильович\nДружина Гомельчук О.І.\nГомельчук Сергій Васильович\nСергій Васильович Гомельчук\nСергій Гомельчук\nГомельчук Сергій Васильович\nСергій\nСуддя\nСуддя\nХерсонська область\nАдміністративний місцевий суд\nГомельчук Сергій Васильович\nСуддя\nХерсонська область\nАдміністративний місцевий суд\nСуддя\nСергій\nВасильович\nДружина Гомельчук О.І.\nГомельчук\nГомельчук Сергій Васильович\nГомельчук Сергій Васильович\nСергій Васильович Гомельчук\nСергій Гомельчук\nГомельчук Сергій Васильович\n539,48\nFALSE\n2013","intro":{"declaration_year":"2013","isnotdeclaration":"FALSE"}}