{"ft_src":"Renault,Symbol\n2003\nVolkswagen,Passat\n2005\n600\n1200\n39\n75,33\n13\n5\n14898\n13319\n16069\n10\n18676\nFALSE\nFALSE\nFALSE\n2013\n63740\n184705\n63740\n184777\n72\nRenault,Symbol\n2003\nVolkswagen,Passat\n2005\nFALSE\nFALSE\n600\n1200\n39\n75,33\n13\nСуддя господарського суду Запорізької області\nБатько - Горохов Сергій Олександрович, реєстраційний номер облікової картки платника податків/серія та номер паспорта - приховано;;мати - Горохова Ганна Йосипівна, реєстраційний номер облікової картки платника податків/серія та номер паспорта - приховано;;брат - Горохов Олександр Сергійович, реєстраційний номер облікової картки платника податків/серія та номер паспорта - приховано;;\nГорохов\nГорохов Ігор Сергійович\nІгор Сергійович Горохов\nІгор Горохов\nГорохов Ігор Сергійович\nІгор\nГорохов Ігор Сергійович\nГосподарський місцевий суд\nСуддя\nЗапорізька область\nСергійович\n24051\n1738\n60\n184705\n63740\n72\n184777\n63740\n16069\n13319\n10\n18676\n5\n14898\n2013\nFALSE\n1738\n24051\n60\nГорохов\nСергійович\nБатько - Горохов Сергій Олександрович, реєстраційний номер облікової картки платника податків/серія та номер паспорта - приховано;;мати - Горохова Ганна Йосипівна, реєстраційний номер облікової картки платника податків/серія та номер паспорта - приховано;;брат - Горохов Олександр Сергійович, реєстраційний номер облікової картки платника податків/серія та номер паспорта - приховано;;\nГорохов Ігор Сергійович\nІгор Сергійович Горохов\nІгор Горохов\nГорохов Ігор Сергійович\nІгор\nСуддя господарського суду Запорізької області\nСуддя\nЗапорізька область\nГосподарський місцевий суд\nГорохов Ігор Сергійович","estate":{"23":[{"costs":"","address":"","space_units":"","costs_rent_comment":"","space":"600","costs_comment":"","costs_rent":"","space_comment":"","region":"","location_raw":"приховано"},{"costs":"","address":"","space_units":"","costs_rent_comment":"","space":"","costs_comment":"","costs_rent":"","space_comment":"","region":"","location_raw":""},{"costs":"","address":"","space_units":"","costs_rent_comment":"","space":"","costs_comment":"","costs_rent":"","space_comment":"","region":"","location_raw":""}],"25":[{"costs":"","address":"","space_units":"","costs_rent_comment":"","space":"13","costs_comment":"","costs_rent":"","space_comment":"","region":"","location_raw":"приховано"}],"29":[{"costs_property_comment":"","address":"","space_units":"","costs_rent_comment":"","space":"1200","space_comment":"","costs_property":"","region":"","location_raw":"приховано","costs_rent":""}],"31":[{"costs_property_comment":"","address":"","space_units":"","costs_rent_comment":"","space":"39","space_comment":"","costs_property":"","region":"","location_raw":"приховано","costs_rent":""},{"costs_property_comment":"","address":"","space_units":"","costs_rent_comment":"","space":"75,33","space_comment":"","costs_property":"","region":"","location_raw":"приховано","costs_rent":""}]},"vehicle":{"40":[{"sum_comment":"","brand_info":"","sum":"","sum_rent_comment":"","year":"2003","brand":"Renault,Symbol","sum_rent":"","brand_hidden":false},{"sum_comment":"","brand_info":"","sum":"","sum_rent_comment":"","year":"2005","brand":"Volkswagen,Passat","sum_rent":"","brand_hidden":false}]},"id":"3099","income":{"5":{"family_comment":"","value":"184777","family":"63740","comment":""},"6":{"family_comment":"","value":"184705","family":"63740","comment":""},"7":{"family":"0","family_comment":"","value":"0","comment":"","source_name":"0"},"8":{"family_comment":"","value":"0","family":"0","comment":""},"9":{"family_comment":"","value":"0","family":"0","comment":""},"10":{"family_comment":"","value":"0","family":"0","comment":""},"11":{"family_comment":"","value":"0","family":"0","comment":""},"12":{"family_comment":"","value":"0","family":"0","comment":""},"13":{"family_comment":"","value":"0","family":"0","comment":""},"14":{"family_comment":"","value":"0","family":"0","comment":""},"15":{"family_comment":"","value":"0","family":"0","comment":""},"16":{"family_comment":"","value":"0","family":"0","comment":""},"17":{"family_comment":"","value":"0","family":"0","comment":""},"18":{"family_comment":"","value":"0","family":"0","comment":""},"19":{"family_comment":"","value":"0","family":"0","comment":""},"20":{"family_comment":"","value":"72","family":"0","comment":""},"21":[{"country_comment":"","uah_equal":"0","country":"0","cur":"0"},{"country_comment":"","uah_equal":"0","country":"0","cur":"0"},{"country_comment":"","uah_equal":"0","country":"0","cur":"0"},{"country_comment":"","uah_equal":"0","country":"0","cur":"0"},{"country_comment":"","uah_equal":"0","country":"0","cur":"0"}],"22":[{"country_comment":"","uah_equal":"0","country":"0","cur":"0"},{"country_comment":"","uah_equal":"0","country":"0","cur":"0"},{"country_comment":"","uah_equal":"0","country":"0","cur":"0"},{"country_comment":"","uah_equal":"0","country":"0","cur":"0"},{"country_comment":"","uah_equal":"0","country":"0","cur":"0"}]},"banks":{"45":[{"sum_units":"UAH","sum_comment":"","sum_foreign_units":"","sum":"16069","sum_foreign_comment":"","sum_foreign":""},{"sum_units":"USD","sum_comment":"","sum_foreign_units":"","sum":"","sum_foreign_comment":"","sum_foreign":""},{"sum_units":"EUR","sum_comment":"","sum_foreign_units":"","sum":"","sum_foreign_comment":"","sum_foreign":""}],"46":[{"sum_units":"UAH","sum_comment":"","sum_foreign_units":"","sum":"14898","sum_foreign_comment":"","sum_foreign":""},{"sum_units":"USD","sum_comment":"","sum_foreign_units":"","sum":"","sum_foreign_comment":"","sum_foreign":""},{"sum_units":"EUR","sum_comment":"","sum_foreign_units":"","sum":"","sum_foreign_comment":"","sum_foreign":""}],"47":[{"sum_units":"","sum_comment":"","sum_foreign_units":"","sum":"5","sum_foreign_comment":"","sum_foreign":""}],"48":[{"sum_units":"","sum_comment":"","sum_foreign_units":"","sum":"","sum_foreign_comment":"","sum_foreign":""}],"49":[{"sum_units":"","sum_comment":"","sum_foreign_units":"","sum":"","sum_foreign_comment":"","sum_foreign":""}],"50":[{"sum_units":"","sum_comment":"","sum_foreign_units":"","sum":"","sum_foreign_comment":"","sum_foreign":""}],"51":[{"sum_units":"UAH","sum_comment":"","sum_foreign_units":"","sum":"13319","sum_foreign_comment":"","sum_foreign":""},{"sum_units":"USD","sum_comment":"","sum_foreign_units":"","sum":"","sum_foreign_comment":"","sum_foreign":""},{"sum_units":"EUR","sum_comment":"","sum_foreign_units":"","sum":"","sum_foreign_comment":"","sum_foreign":""}],"52":[{"sum_units":"","sum_comment":"","sum_foreign_units":"","sum":"10","sum_foreign_comment":"","sum_foreign":""}],"53":[{"sum_units":"","sum_comment":"","sum_foreign_units":"","sum":"18676","sum_foreign_comment":"","sum_foreign":""}]},"declaration":{"notfull_lostpages":"","additional_info_text":"","additional_info":"FALSE","notfull":"FALSE","url":"http://static.declarations.com.ua/declarations/sudy/hospodarski_mistsevi_sudy/zaporizka_oblast/deklargorohov.pdf","needs_scancopy_check":false},"general":{"family_raw":"Батько - Горохов Сергій Олександрович, реєстраційний номер облікової картки платника податків/серія та номер паспорта - приховано;;мати - Горохова Ганна Йосипівна, реєстраційний номер облікової картки платника податків/серія та номер паспорта - приховано;;брат - Горохов Олександр Сергійович, реєстраційний номер облікової картки платника податків/серія та номер паспорта - приховано;;","name":"Ігор","full_name_suggest":{"input":["Горохов Ігор Сергійович","Ігор Сергійович Горохов","Ігор Горохов"],"output":"Горохов Ігор Сергійович"},"post_raw":"Суддя господарського суду Запорізької області","name_unclear":false,"patronymic":"Сергійович","patronymic_unclear":false,"last_name_hidden":false,"patronymic_hidden":false,"inn":"","addresses_raw_hidden":true,"last_name":"Горохов","full_name":"Горохов Ігор Сергійович","post":{"office":"Господарський місцевий суд","region":"Запорізька область","post":"Суддя"},"addresses_raw":"приховано","name_hidden":false,"last_name_unclear":false},"liabilities":{"54":{"sum_comment":"","sum_foreign_comment":"","sum_foreign":"","sum":"60"},"55":{"sum_units":"","sum_comment":"","sum_foreign_units":"","sum":"","sum_foreign_comment":"","sum_foreign":""},"56":{"sum_comment":"","sum_foreign_comment":"","sum_foreign":"","sum":""},"57":{"sum_comment":"","sum_foreign_comment":"","sum_foreign":"","sum":"24051"},"58":{"sum_comment":"","sum_foreign_comment":"","sum_foreign":"","sum":"1738"},"59":{"sum_comment":"","sum_foreign_comment":"","sum_foreign":"","sum":""},"60":{"sum_comment":"","sum_foreign_comment":"","sum_foreign":"","sum":""},"61":{"sum_units":"","sum_comment":"","sum_foreign_units":"","sum":"","sum_foreign_comment":"","sum_foreign":""},"62":{"sum_comment":"","sum_foreign_comment":"","sum_foreign":"","sum":""},"63":{"sum_comment":"","sum_units":"","sum_foreign":"","sum":"","sum_foreign_comment":""},"64":{"sum_comment":"","sum_units":"","sum_foreign":"","sum":"","sum_foreign_comment":""}},"intro":{"isnotdeclaration":"FALSE","declaration_year":"2013"}}