{"income":{"5":{"family_comment":"","value":"312742","family":"0","comment":""},"6":{"family_comment":"","value":"189670","family":"0","comment":""},"7":{"family_comment":"","value":"0","source_name":"0","family":"0","comment":""},"8":{"family_comment":"","value":"0","family":"0","comment":""},"9":{"family_comment":"","value":"0","family":"0","comment":""},"10":{"family_comment":"","value":"0","family":"0","comment":""},"11":{"family_comment":"","value":"0","family":"0","comment":""},"12":{"family_comment":"","value":"0","family":"0","comment":""},"13":{"family_comment":"","value":"0","family":"0","comment":""},"14":{"family_comment":"","value":"0","family":"0","comment":""},"15":{"family_comment":"","value":"0","family":"0","comment":""},"16":{"family_comment":"","value":"120000","family":"0","comment":""},"17":{"family_comment":"","value":"0","family":"0","comment":""},"18":{"family_comment":"","value":"0","family":"0","comment":""},"19":{"family_comment":"","value":"0","family":"0","comment":""},"20":{"family_comment":"","value":"3072","family":"0","comment":""},"21":[{"cur":"0","country":"0","uah_equal":"0","country_comment":""},{"cur":"0","country":"0","uah_equal":"0","country_comment":""},{"cur":"0","country":"0","uah_equal":"0","country_comment":""},{"cur":"0","country":"0","uah_equal":"0","country_comment":""},{"cur":"0","country":"0","uah_equal":"0","country_comment":""}],"22":[{"cur":"0","country":"0","uah_equal":"0","country_comment":""},{"cur":"0","country":"0","uah_equal":"0","country_comment":""},{"cur":"0","country":"0","uah_equal":"0","country_comment":""},{"cur":"0","country":"0","uah_equal":"0","country_comment":""},{"cur":"0","country":"0","uah_equal":"0","country_comment":""}]},"vehicle":{"40":[{"brand_info":"","sum":"","brand":"Honda,CR-V","sum_comment":"","year":"2012","brand_hidden":false,"sum_rent_comment":"","sum_rent":""}]},"id":"3114","banks":{"45":[{"sum_foreign_comment":"","sum":"","sum_comment":"","sum_foreign_units":"","sum_units":"UAH","sum_foreign":""},{"sum_foreign_comment":"","sum":"","sum_comment":"","sum_foreign_units":"","sum_units":"USD","sum_foreign":""},{"sum_foreign_comment":"","sum":"","sum_comment":"","sum_foreign_units":"","sum_units":"EUR","sum_foreign":""}],"46":[{"sum_foreign_comment":"","sum":"","sum_comment":"","sum_foreign_units":"","sum_units":"UAH","sum_foreign":""},{"sum_foreign_comment":"","sum":"","sum_comment":"","sum_foreign_units":"","sum_units":"USD","sum_foreign":""},{"sum_foreign_comment":"","sum":"","sum_comment":"","sum_foreign_units":"","sum_units":"EUR","sum_foreign":""}],"47":[{"sum_foreign_comment":"","sum":"","sum_comment":"","sum_foreign_units":"","sum_units":"","sum_foreign":""}],"48":[{"sum_foreign_comment":"","sum":"","sum_comment":"","sum_foreign_units":"","sum_units":"","sum_foreign":""}],"49":[{"sum_foreign_comment":"","sum":"10,49","sum_comment":"","sum_foreign_units":"","sum_units":"","sum_foreign":""}],"50":[{"sum_foreign_comment":"","sum":"","sum_comment":"","sum_foreign_units":"","sum_units":"","sum_foreign":""}],"51":[{"sum_foreign_comment":"","sum":"2076","sum_comment":"","sum_foreign_units":"","sum_units":"UAH","sum_foreign":""},{"sum_foreign_comment":"","sum":"","sum_comment":"","sum_foreign_units":"","sum_units":"USD","sum_foreign":""},{"sum_foreign_comment":"","sum":"","sum_comment":"","sum_foreign_units":"","sum_units":"EUR","sum_foreign":""}],"52":[{"sum_foreign_comment":"","sum":"","sum_comment":"","sum_foreign_units":"","sum_units":"","sum_foreign":""}],"53":[{"sum_foreign_comment":"","sum":"","sum_comment":"","sum_foreign_units":"","sum_units":"","sum_foreign":""}]},"declaration":{"needs_scancopy_check":false,"additional_info_text":"сторінка 8 - п. 49 - додатково внесено інформація про підприємство, в якому Декларант має частку у статутному фонді - ТОВ ’Миколаївська механізована колона №9\";;сторінка 8 - п. 51 - додатково внесено інформацію про назву банка, у якому члени сімї Декларанта мають суму на рахунку - ПАТ КБ Приватбанк.","notfull_lostpages":"","notfull":"FALSE","additional_info":"TRUE","url":"http://static.declarations.com.ua/declarations/sudy/mistsevi_sudy/okruzhni_administratyvni_sudy/kirovohradska/sagun.pdf"},"liabilities":{"54":{"sum_foreign_comment":"","sum":"","sum_comment":"","sum_foreign":""},"55":{"sum_foreign_comment":"","sum":"","sum_comment":"","sum_foreign_units":"","sum_units":"","sum_foreign":""},"56":{"sum_foreign_comment":"","sum":"","sum_comment":"","sum_foreign":""},"57":{"sum_foreign_comment":"","sum":"","sum_comment":"","sum_foreign":""},"58":{"sum_foreign_comment":"","sum":"","sum_comment":"","sum_foreign":""},"59":{"sum_foreign_comment":"","sum":"","sum_comment":"","sum_foreign":""},"60":{"sum_foreign_comment":"","sum":"","sum_comment":"","sum_foreign":""},"61":{"sum_foreign_comment":"","sum":"","sum_comment":"","sum_foreign_units":"","sum_units":"","sum_foreign":""},"62":{"sum_foreign_comment":"","sum":"","sum_comment":"","sum_foreign":""},"63":{"sum_foreign_comment":"","sum_units":"","sum_comment":"","sum":"","sum_foreign":""},"64":{"sum_foreign_comment":"","sum_units":"","sum_comment":"","sum":"","sum_foreign":""}},"estate":{"23":[{"costs_rent":"","location_raw":"приховано","region":"","costs":"","costs_rent_comment":"","costs_comment":"","space_comment":"","space_units":"","space":"1021","address":""},{"costs_rent":"","location_raw":"","region":"","costs":"","costs_rent_comment":"","costs_comment":"","space_comment":"","space_units":"","space":"","address":""},{"costs_rent":"","location_raw":"","region":"","costs":"","costs_rent_comment":"","costs_comment":"","space_comment":"","space_units":"","space":"","address":""}],"25":[{"costs_rent":"","location_raw":"приховано","region":"","costs":"","costs_rent_comment":"","costs_comment":"","space_comment":"","space_units":"","space":"86","address":""}],"27":[{"costs_rent":"","location_raw":"приховано","region":"","costs":"","costs_rent_comment":"","costs_comment":"","space_comment":"","space_units":"","space":"10","address":""}],"31":[{"costs_rent":"","location_raw":"приховано","region":"","costs_property":"","costs_rent_comment":"","space_comment":"","costs_property_comment":"","space_units":"","space":"86","address":""}]},"general":{"name_hidden":false,"name":"Андрій","patronymic_unclear":false,"last_name_hidden":false,"addresses_raw":"приховано","post_raw":"Суддя","patronymic":"Васильович","inn":"","family_raw":"Дружина - Сагун Н.Г. - 26.11.1980 - частково приховано.;Син - Сагун І.А. - 18.04.2001;Дочка - Сагун Т.А. - 2.07.2007","last_name":"Сагун","post":{"office":"Адміністративний місцевий суд","region":"Кіровоградська область","post":"Суддя"},"addresses_raw_hidden":true,"full_name_suggest":{"output":"Сагун Андрій Васильович","input":["Сагун Андрій Васильович","Андрій Васильович Сагун","Андрій Сагун"]},"full_name":"Сагун Андрій Васильович","patronymic_hidden":false,"last_name_unclear":false,"name_unclear":false},"ft_src":"Honda,CR-V\n2012\n1021\n10\n86\n86\n2076\n10,49\nTRUE\nсторінка 8 - п. 49 - додатково внесено інформація про підприємство, в якому Декларант має частку у статутному фонді - ТОВ ’Миколаївська механізована колона №9\";;сторінка 8 - п. 51 - додатково внесено інформацію про назву банка, у якому члени сімї Декларанта мають суму на рахунку - ПАТ КБ Приватбанк.\nFALSE\nFALSE\n2013\n189670\n312742\n120000\n3072\nHonda,CR-V\n2012\nсторінка 8 - п. 49 - додатково внесено інформація про підприємство, в якому Декларант має частку у статутному фонді - ТОВ ’Миколаївська механізована колона №9\";;сторінка 8 - п. 51 - додатково внесено інформацію про назву банка, у якому члени сімї Декларанта мають суму на рахунку - ПАТ КБ Приватбанк.\nFALSE\nTRUE\n1021\n10\n86\n86\nСуддя\nДружина - Сагун Н.Г. - 26.11.1980 - частково приховано.;Син - Сагун І.А. - 18.04.2001;Дочка - Сагун Т.А. - 2.07.2007\nСагун\nСагун Андрій Васильович\nАндрій Васильович Сагун\nАндрій Сагун\nСагун Андрій Васильович\nАндрій\nСагун Андрій Васильович\nАдміністративний місцевий суд\nСуддя\nКіровоградська область\nВасильович\n189670\n3072\n312742\n120000\n2076\n10,49\n2013\nFALSE\nСагун\nВасильович\nДружина - Сагун Н.Г. - 26.11.1980 - частково приховано.;Син - Сагун І.А. - 18.04.2001;Дочка - Сагун Т.А. - 2.07.2007\nСагун Андрій Васильович\nАндрій Васильович Сагун\nАндрій Сагун\nСагун Андрій Васильович\nАндрій\nСуддя\nСуддя\nКіровоградська область\nАдміністративний місцевий суд\nСагун Андрій Васильович","intro":{"declaration_year":"2013","isnotdeclaration":"FALSE"}}