{"income":{"5":{"family_comment":"","value":"377855","family":"113274","comment":""},"6":{"family_comment":"","value":"172430","family":"64279","comment":""},"7":{"family_comment":"","value":"0","source_name":"0","family":"0","comment":""},"8":{"family_comment":"","value":"0","family":"","comment":""},"9":{"family_comment":"","value":"0","family":"","comment":""},"10":{"family_comment":"","value":"0","family":"0","comment":""},"11":{"family_comment":"","value":"0","family":"0","comment":""},"12":{"family_comment":"","value":"0","family":"0","comment":""},"13":{"family_comment":"","value":"0","family":"0","comment":""},"14":{"family_comment":"","value":"0","family":"0","comment":""},"15":{"family_comment":"","value":"2981","family":"42076","comment":""},"16":{"family_comment":"","value":"0","family":"0","comment":""},"17":{"family_comment":"","value":"0","family":"0","comment":""},"18":{"family_comment":"","value":"0","family":"0","comment":""},"19":{"family_comment":"","value":"0","family":"0","comment":""},"20":{"family_comment":"","value":"202444","family":"0","comment":""},"21":[{"cur":"0","country":"0","uah_equal":"0","country_comment":""},{"cur":"0","country":"0","uah_equal":"0","country_comment":""},{"cur":"0","country":"0","uah_equal":"0","country_comment":""},{"cur":"0","country":"0","uah_equal":"0","country_comment":""},{"cur":"0","country":"0","uah_equal":"0","country_comment":""}],"22":[{"cur":"Є10000","country":"0","uah_equal":"108041","country_comment":""},{"cur":"0","country":"0","uah_equal":"0","country_comment":""},{"cur":"0","country":"0","uah_equal":"0","country_comment":""},{"cur":"0","country":"0","uah_equal":"0","country_comment":""},{"cur":"0","country":"0","uah_equal":"0","country_comment":""}]},"vehicle":{"35":[{"brand_info":"","sum":"","brand":"Ford,Focus","sum_comment":"","year":"2007","brand_hidden":false,"sum_rent_comment":"","sum_rent":""},{"brand_info":"","sum":"","brand":"Lada,Kalina","sum_comment":"","year":"2008","brand_hidden":false,"sum_rent_comment":"","sum_rent":""}],"40":[{"brand_info":"","sum":"","brand":"ВАЗ,2104","sum_comment":"","year":"1993","brand_hidden":false,"sum_rent_comment":"","sum_rent":""},{"brand_info":"","sum":"","brand":"Lada,Kalina","sum_comment":"","year":"2008","brand_hidden":false,"sum_rent_comment":"","sum_rent":""}]},"id":"3538","banks":{"45":[{"sum_foreign_comment":"","sum":"50","sum_comment":"","sum_foreign_units":"","sum_units":"UAH","sum_foreign":""},{"sum_foreign_comment":"","sum":"","sum_comment":"","sum_foreign_units":"","sum_units":"USD","sum_foreign":""},{"sum_foreign_comment":"","sum":"","sum_comment":"","sum_foreign_units":"","sum_units":"EUR","sum_foreign":""}],"46":[{"sum_foreign_comment":"","sum":"","sum_comment":"","sum_foreign_units":"","sum_units":"UAH","sum_foreign":""},{"sum_foreign_comment":"","sum":"","sum_comment":"","sum_foreign_units":"","sum_units":"USD","sum_foreign":""},{"sum_foreign_comment":"","sum":"","sum_comment":"","sum_foreign_units":"","sum_units":"EUR","sum_foreign":""}],"47":[{"sum_foreign_comment":"","sum":"","sum_comment":"","sum_foreign_units":"","sum_units":"","sum_foreign":""}],"48":[{"sum_foreign_comment":"","sum":"","sum_comment":"","sum_foreign_units":"","sum_units":"","sum_foreign":""}],"49":[{"sum_foreign_comment":"","sum":"","sum_comment":"","sum_foreign_units":"","sum_units":"","sum_foreign":""}],"50":[{"sum_foreign_comment":"","sum":"","sum_comment":"","sum_foreign_units":"","sum_units":"","sum_foreign":""}],"51":[{"sum_foreign_comment":"","sum":"3402","sum_comment":"","sum_foreign_units":"","sum_units":"UAH","sum_foreign":""},{"sum_foreign_comment":"","sum":"","sum_comment":"","sum_foreign_units":"","sum_units":"USD","sum_foreign":""},{"sum_foreign_comment":"","sum":"","sum_comment":"","sum_foreign_units":"","sum_units":"EUR","sum_foreign":""}],"52":[{"sum_foreign_comment":"","sum":"","sum_comment":"","sum_foreign_units":"","sum_units":"","sum_foreign":""}],"53":[{"sum_foreign_comment":"","sum":"","sum_comment":"","sum_foreign_units":"","sum_units":"","sum_foreign":""}]},"declaration":{"needs_scancopy_check":false,"additional_info_text":"Вніс все, але є уточнення в Розділі V, сума коштів декларанта та членів сім’ї до кінця не зрозумілі. ;Є ймовірність, що там щось затерто, бо не зрозуміло, чого написано такими маленькими цифрами і дуже зліва.","notfull_lostpages":"","notfull":"FALSE","additional_info":"TRUE","url":"http://static.declarations.com.ua/declarations/sudy/hospodarski_mistsevi_sudy/volynska_oblast/deklaratsiya_voronyak.pdf"},"liabilities":{"54":{"sum_foreign_comment":"","sum":"1230","sum_comment":"","sum_foreign":""},"55":{"sum_foreign_comment":"","sum":"","sum_comment":"","sum_foreign_units":"","sum_units":"","sum_foreign":""},"56":{"sum_foreign_comment":"","sum":"","sum_comment":"","sum_foreign":""},"57":{"sum_foreign_comment":"","sum":"1112","sum_comment":"","sum_foreign":""},"58":{"sum_foreign_comment":"","sum":"267","sum_comment":"","sum_foreign":""},"59":{"sum_foreign_comment":"","sum":"","sum_comment":"","sum_foreign":""},"60":{"sum_foreign_comment":"","sum":"","sum_comment":"","sum_foreign":""},"61":{"sum_foreign_comment":"","sum":"","sum_comment":"","sum_foreign_units":"","sum_units":"","sum_foreign":""},"62":{"sum_foreign_comment":"","sum":"","sum_comment":"","sum_foreign":""},"63":{"sum_foreign_comment":"","sum_units":"","sum_comment":"","sum":"","sum_foreign":""},"64":{"sum_foreign_comment":"","sum_units":"","sum_comment":"","sum":"","sum_foreign":""}},"estate":{"23":[{"costs_rent":"","location_raw":"","region":"","costs":"","costs_rent_comment":"","costs_comment":"","space_comment":"","space_units":"","space":"","address":""},{"costs_rent":"","location_raw":"","region":"","costs":"","costs_rent_comment":"","costs_comment":"","space_comment":"","space_units":"","space":"","address":""},{"costs_rent":"","location_raw":"","region":"","costs":"","costs_rent_comment":"","costs_comment":"","space_comment":"","space_units":"","space":"","address":""}],"25":[{"costs_rent":"","location_raw":"","region":"","costs":"","costs_rent_comment":"","costs_comment":"","space_comment":"","space_units":"","space":"61,7","address":""},{"costs_rent":"","location_raw":"","region":"","costs":"478800","costs_rent_comment":"","costs_comment":"","space_comment":"","space_units":"","space":"76","address":""}],"31":[{"costs_rent":"","location_raw":"","region":"","costs_property":"","costs_rent_comment":"","space_comment":"","costs_property_comment":"","space_units":"","space":"61,7","address":""}]},"general":{"name_hidden":false,"name":"Андрій","patronymic_unclear":false,"last_name_hidden":false,"addresses_raw":"приховано","post_raw":"Суддя господарського суду Волиньскої області","patronymic":"Сергійович","inn":"","family_raw":"Мати - Вороняк Б.О.;Баба - Вороняк К.Т.","last_name":"Вороняк","post":{"office":"Господарський місцевий суд","region":"Волинська область","post":"Суддя"},"addresses_raw_hidden":true,"full_name_suggest":{"output":"Вороняк Андрій Сергійович","input":["Вороняк Андрій Сергійович","Андрій Сергійович Вороняк","Андрій Вороняк"]},"full_name":"Вороняк Андрій Сергійович","patronymic_hidden":false,"last_name_unclear":false,"name_unclear":false},"ft_src":"Ford,Focus\n2007\nLada,Kalina\n2008\nВАЗ,2104\n1993\nLada,Kalina\n2008\n61,7\n61,7\n478800\n76\n3402\n50\nTRUE\nВніс все, але є уточнення в Розділі V, сума коштів декларанта та членів сім’ї до кінця не зрозумілі. ;Є ймовірність, що там щось затерто, бо не зрозуміло, чого написано такими маленькими цифрами і дуже зліва.\nFALSE\nFALSE\n2013\n64279\n172430\n42076\n2981\n113274\n377855\n202444\n108041\nЄ10000\nFord,Focus\n2007\nLada,Kalina\n2008\nВАЗ,2104\n1993\nLada,Kalina\n2008\nВніс все, але є уточнення в Розділі V, сума коштів декларанта та членів сім’ї до кінця не зрозумілі. ;Є ймовірність, що там щось затерто, бо не зрозуміло, чого написано такими маленькими цифрами і дуже зліва.\nFALSE\nTRUE\n61,7\n61,7\n478800\n76\nСуддя господарського суду Волиньскої області\nМати - Вороняк Б.О.;Баба - Вороняк К.Т.\nВороняк\nВороняк Андрій Сергійович\nАндрій Сергійович Вороняк\nАндрій Вороняк\nВороняк Андрій Сергійович\nАндрій\nВороняк Андрій Сергійович\nГосподарський місцевий суд\nСуддя\nВолинська область\nСергійович\n1112\n267\n1230\n172430\n64279\n108041\nЄ10000\n202444\n2981\n42076\n377855\n113274\n50\n3402\n2013\nFALSE\n267\n1112\n1230\nВороняк\nСергійович\nМати - Вороняк Б.О.;Баба - Вороняк К.Т.\nВороняк Андрій Сергійович\nАндрій Сергійович Вороняк\nАндрій Вороняк\nВороняк Андрій Сергійович\nАндрій\nСуддя господарського суду Волиньскої області\nСуддя\nВолинська область\nГосподарський місцевий суд\nВороняк Андрій Сергійович","intro":{"declaration_year":"2013","isnotdeclaration":"FALSE"}}