{"ft_src":"Причіп\nBMW,730\n2000\nJeep,Grand Cherokee\n1993\nAudi,A6\n2003\nAudi,A6\n2003\nУжгородський р-н\n1800\nРахівський р-н, В.Бичків урочище\n600\nУжгородський р-н\n200\n20000\nTRUE\nНа останній сторінці декларації була власноручна приписка декларанта про те, що члени його сім’ї не давали згоди на збір, зберігання та використання інформації про їх майно і доходи та зобов’язання фін. характеру.\nFALSE\nFALSE\n2013\n205498\n2800\n37100\n208298\n37100\nBMW,730\n2000\nJeep,Grand Cherokee\n1993\nAudi,A6\n2003\nAudi,A6\n2003\nПричіп\nНа останній сторінці декларації була власноручна приписка декларанта про те, що члени його сім’ї не давали згоди на збір, зберігання та використання інформації про їх майно і доходи та зобов’язання фін. характеру.\nFALSE\nTRUE\nУжгородський р-н\n1800\nРахівський р-н, В.Бичків урочище\n600\nУжгородський р-н\n200\nСуддя Господарського суду Закарпатської області\nЦ. дружина - Тарковенко В.В., р.н. 16.06.1980 р, Тарковенко Є.В. р.н. 21.01.2008 р., дочка - Йосипчук В.О., р.н. 29.11.2012 р., мати - Йосипчук Г.І. - р.н. 9.05.1938 р.\nЗакарпатська\nЙосипчук\nЙосипчук Олександр Семенович\nОлександр Семенович Йосипчук\nОлександр Йосипчук\nЙосипчук Олександр Семенович\nОлександр\nЙосипчук Олександр Семенович\nГосподарський місцевий суд\nСуддя\nЗакарпатська область\nСеменович\nУжгородський район, далі - приховано\n39782,79\n23800\n51538\n120\n205498\n37100\n2800\n208298\n37100\n20000\n2013\nFALSE\n51538\n39782,79\n23800\n120\nЙосипчук\nСеменович\nЦ. дружина - Тарковенко В.В., р.н. 16.06.1980 р, Тарковенко Є.В. р.н. 21.01.2008 р., дочка - Йосипчук В.О., р.н. 29.11.2012 р., мати - Йосипчук Г.І. - р.н. 9.05.1938 р.\nЙосипчук Олександр Семенович\nОлександр Семенович Йосипчук\nОлександр Йосипчук\nЙосипчук Олександр Семенович\nОлександр\nСуддя Господарського суду Закарпатської області\nЗакарпатська\nСуддя\nЗакарпатська область\nГосподарський місцевий суд\nЙосипчук Олександр Семенович\nУжгородський район, далі - приховано","estate":{"23":[{"costs":"","address":"","space_units":"","costs_rent_comment":"","space":"1800","costs_comment":"","costs_rent":"","space_comment":"","region":"","location_raw":"Ужгородський р-н"},{"costs":"","address":"","space_units":"","costs_rent_comment":"","space":"600","costs_comment":"","costs_rent":"","space_comment":"","region":"","location_raw":"Рахівський р-н, В.Бичків урочище"},{"costs":"","address":"","space_units":"","costs_rent_comment":"","space":"","costs_comment":"","costs_rent":"","space_comment":"","region":"","location_raw":""}],"24":[{"costs":"","address":"","space_units":"","costs_rent_comment":"","space":"200","costs_comment":"","costs_rent":"","space_comment":"","region":"","location_raw":"Ужгородський р-н"}]},"vehicle":{"35":[{"sum_comment":"","brand_info":"","sum":"","sum_rent_comment":"","year":"2000","brand":"BMW,730","sum_rent":"","brand_hidden":false},{"sum_comment":"","brand_info":"","sum":"","sum_rent_comment":"","year":"1993","brand":"Jeep,Grand Cherokee","sum_rent":"","brand_hidden":false},{"sum_comment":"","brand_info":"","sum":"","sum_rent_comment":"","year":"2003","brand":"Audi,A6","sum_rent":"","brand_hidden":false}],"39":[{"sum_comment":"","brand_info":"","sum":"","sum_rent_comment":"","year":"","brand":"Причіп","sum_rent":"","brand_hidden":false}],"40":[{"sum_comment":"","brand_info":"","sum":"","sum_rent_comment":"","year":"2003","brand":"Audi,A6","sum_rent":"","brand_hidden":false}]},"id":"3872","income":{"5":{"family_comment":"","value":"208298","family":"37100","comment":""},"6":{"family_comment":"","value":"205498","family":"0","comment":""},"7":{"family":"0","family_comment":"","value":"0","comment":"","source_name":"0"},"8":{"family_comment":"","value":"0","family":"0","comment":""},"9":{"family_comment":"","value":"0","family":"0","comment":""},"10":{"family_comment":"","value":"0","family":"0","comment":""},"11":{"family_comment":"","value":"0","family":"0","comment":""},"12":{"family_comment":"","value":"0","family":"0","comment":""},"13":{"family_comment":"","value":"0","family":"0","comment":""},"14":{"family_comment":"","value":"0","family":"0","comment":""},"15":{"family_comment":"","value":"2800","family":"0","comment":""},"16":{"family_comment":"","value":"0","family":"0","comment":""},"17":{"family_comment":"","value":"0","family":"0","comment":""},"18":{"family_comment":"","value":"0","family":"0","comment":""},"19":{"family_comment":"","value":"0","family":"0","comment":""},"20":{"family_comment":"","value":"0","family":"37100","comment":""},"21":[{"country_comment":"","uah_equal":"0","country":"0","cur":"0"},{"country_comment":"","uah_equal":"0","country":"0","cur":"0"},{"country_comment":"","uah_equal":"0","country":"0","cur":"0"},{"country_comment":"","uah_equal":"0","country":"0","cur":"0"},{"country_comment":"","uah_equal":"0","country":"0","cur":"0"}],"22":[{"country_comment":"","uah_equal":"0","country":"0","cur":"0"},{"country_comment":"","uah_equal":"0","country":"0","cur":"0"},{"country_comment":"","uah_equal":"0","country":"0","cur":"0"},{"country_comment":"","uah_equal":"0","country":"0","cur":"0"},{"country_comment":"","uah_equal":"0","country":"0","cur":"0"}]},"banks":{"45":[{"sum_units":"UAH","sum_comment":"","sum_foreign_units":"","sum":"","sum_foreign_comment":"","sum_foreign":""},{"sum_units":"USD","sum_comment":"","sum_foreign_units":"","sum":"","sum_foreign_comment":"","sum_foreign":""},{"sum_units":"EUR","sum_comment":"","sum_foreign_units":"","sum":"","sum_foreign_comment":"","sum_foreign":""}],"46":[{"sum_units":"UAH","sum_comment":"","sum_foreign_units":"","sum":"","sum_foreign_comment":"","sum_foreign":""},{"sum_units":"USD","sum_comment":"","sum_foreign_units":"","sum":"","sum_foreign_comment":"","sum_foreign":""},{"sum_units":"EUR","sum_comment":"","sum_foreign_units":"","sum":"","sum_foreign_comment":"","sum_foreign":""}],"47":[{"sum_units":"","sum_comment":"","sum_foreign_units":"","sum":"","sum_foreign_comment":"","sum_foreign":""}],"48":[{"sum_units":"","sum_comment":"","sum_foreign_units":"","sum":"","sum_foreign_comment":"","sum_foreign":""}],"49":[{"sum_units":"","sum_comment":"","sum_foreign_units":"","sum":"","sum_foreign_comment":"","sum_foreign":""}],"50":[{"sum_units":"","sum_comment":"","sum_foreign_units":"","sum":"","sum_foreign_comment":"","sum_foreign":""}],"51":[{"sum_units":"UAH","sum_comment":"","sum_foreign_units":"","sum":"20000","sum_foreign_comment":"","sum_foreign":""},{"sum_units":"USD","sum_comment":"","sum_foreign_units":"","sum":"","sum_foreign_comment":"","sum_foreign":""},{"sum_units":"EUR","sum_comment":"","sum_foreign_units":"","sum":"","sum_foreign_comment":"","sum_foreign":""}],"52":[{"sum_units":"","sum_comment":"","sum_foreign_units":"","sum":"","sum_foreign_comment":"","sum_foreign":""}],"53":[{"sum_units":"","sum_comment":"","sum_foreign_units":"","sum":"","sum_foreign_comment":"","sum_foreign":""}]},"declaration":{"notfull_lostpages":"","additional_info_text":"На останній сторінці декларації була власноручна приписка декларанта про те, що члени його сім’ї не давали згоди на збір, зберігання та використання інформації про їх майно і доходи та зобов’язання фін. характеру.","additional_info":"TRUE","notfull":"FALSE","url":"http://static.declarations.com.ua/declarations/sudy/hospodarski_mistsevi_sudy/zakarpatska_oblast/josypchuk.pdf","needs_scancopy_check":false},"general":{"family_raw":"Ц. дружина - Тарковенко В.В., р.н. 16.06.1980 р, Тарковенко Є.В. р.н. 21.01.2008 р., дочка - Йосипчук В.О., р.н. 29.11.2012 р., мати - Йосипчук Г.І. - р.н. 9.05.1938 р.","name":"Олександр","full_name_suggest":{"input":["Йосипчук Олександр Семенович","Олександр Семенович Йосипчук","Олександр Йосипчук"],"output":"Йосипчук Олександр Семенович"},"post_raw":"Суддя Господарського суду Закарпатської області","name_unclear":false,"patronymic":"Семенович","patronymic_unclear":false,"last_name_hidden":false,"patronymic_hidden":false,"inn":"","addresses_raw_hidden":true,"last_name":"Йосипчук","full_name":"Йосипчук Олександр Семенович","post":{"office":"Господарський місцевий суд","region":"Закарпатська область","post":"Суддя"},"addresses":[{"place_district":"","place_city_type":"","place_address_type":"","place":"Закарпатська","place_address":"","place_city":""}],"name_hidden":false,"last_name_unclear":false,"addresses_raw":"Ужгородський район, далі - приховано"},"liabilities":{"54":{"sum_comment":"","sum_foreign_comment":"","sum_foreign":"","sum":"120"},"55":{"sum_units":"","sum_comment":"","sum_foreign_units":"","sum":"","sum_foreign_comment":"","sum_foreign":""},"56":{"sum_comment":"","sum_foreign_comment":"","sum_foreign":"","sum":"23800"},"57":{"sum_comment":"","sum_foreign_comment":"","sum_foreign":"","sum":"39782,79"},"58":{"sum_comment":"","sum_foreign_comment":"","sum_foreign":"","sum":"51538"},"59":{"sum_comment":"","sum_foreign_comment":"","sum_foreign":"","sum":""},"60":{"sum_comment":"","sum_foreign_comment":"","sum_foreign":"","sum":""},"61":{"sum_units":"","sum_comment":"","sum_foreign_units":"","sum":"","sum_foreign_comment":"","sum_foreign":""},"62":{"sum_comment":"","sum_foreign_comment":"","sum_foreign":"","sum":""},"63":{"sum_comment":"","sum_units":"","sum_foreign":"","sum":"","sum_foreign_comment":""},"64":{"sum_comment":"","sum_units":"","sum_foreign":"","sum":"","sum_foreign_comment":""}},"intro":{"isnotdeclaration":"FALSE","declaration_year":"2013"}}