{"income":{"5":{"family_comment":"","value":"253905,49","family":"2350","comment":""},"6":{"family_comment":"","value":"241288,49","family":"0","comment":""},"7":{"family_comment":"","value":"0","source_name":"0","family":"0","comment":""},"8":{"family_comment":"","value":"0","family":"0","comment":""},"9":{"family_comment":"","value":"0","family":"0","comment":""},"10":{"family_comment":"","value":"12617","family":"0","comment":""},"11":{"family_comment":"","value":"0","family":"0","comment":""},"12":{"family_comment":"","value":"0","family":"0","comment":""},"13":{"family_comment":"","value":"0","family":"0","comment":""},"14":{"family_comment":"","value":"0","family":"0","comment":""},"15":{"family_comment":"","value":"0","family":"0","comment":""},"16":{"family_comment":"","value":"0","family":"0","comment":""},"17":{"family_comment":"","value":"0","family":"2350","comment":""},"18":{"family_comment":"","value":"0","family":"0","comment":""},"19":{"family_comment":"","value":"0","family":"0","comment":""},"20":{"family_comment":"","value":"0","family":"0","comment":""},"21":[{"cur":"0","country":"0","uah_equal":"0","country_comment":""},{"cur":"0","country":"0","uah_equal":"0","country_comment":""},{"cur":"0","country":"0","uah_equal":"0","country_comment":""},{"cur":"0","country":"0","uah_equal":"0","country_comment":""},{"cur":"0","country":"0","uah_equal":"0","country_comment":""}],"22":[{"cur":"0","country":"0","uah_equal":"0","country_comment":""},{"cur":"0","country":"0","uah_equal":"0","country_comment":""},{"cur":"0","country":"0","uah_equal":"0","country_comment":""},{"cur":"0","country":"0","uah_equal":"0","country_comment":""},{"cur":"0","country":"0","uah_equal":"0","country_comment":""}]},"vehicle":{"35":[{"brand_info":"","sum_rent_comment":"","brand":"Toyota,Camry","sum_comment":"","year":"2004","brand_hidden":false,"sum":"88300","sum_rent":""}],"39":[{"brand_info":"","sum_rent_comment":"","brand":"Причіп,ЧЗ 81021","sum_comment":"","year":"1992","brand_hidden":false,"sum":"","sum_rent":""}]},"id":"4270","banks":{"45":[{"sum_foreign_comment":"","sum_units":"UAH","sum_comment":"","sum_foreign_units":"","sum":"796,83","sum_foreign":""},{"sum_foreign_comment":"","sum_units":"USD","sum_comment":"","sum_foreign_units":"","sum":"","sum_foreign":""},{"sum_foreign_comment":"","sum_units":"EUR","sum_comment":"","sum_foreign_units":"","sum":"","sum_foreign":""}],"46":[{"sum_foreign_comment":"","sum_units":"UAH","sum_comment":"","sum_foreign_units":"","sum":"","sum_foreign":""},{"sum_foreign_comment":"","sum_units":"USD","sum_comment":"","sum_foreign_units":"","sum":"","sum_foreign":""},{"sum_foreign_comment":"","sum_units":"EUR","sum_comment":"","sum_foreign_units":"","sum":"","sum_foreign":""}],"47":[{"sum_foreign_comment":"","sum_units":"","sum_comment":"","sum_foreign_units":"","sum":"","sum_foreign":""}],"48":[{"sum_foreign_comment":"","sum_units":"","sum_comment":"","sum_foreign_units":"","sum":"","sum_foreign":""}],"49":[{"sum_foreign_comment":"","sum_units":"","sum_comment":"","sum_foreign_units":"","sum":"","sum_foreign":""}],"50":[{"sum_foreign_comment":"","sum_units":"","sum_comment":"","sum_foreign_units":"","sum":"","sum_foreign":""}],"51":[{"sum_foreign_comment":"","sum_units":"UAH","sum_comment":"","sum_foreign_units":"","sum":"","sum_foreign":""},{"sum_foreign_comment":"","sum_units":"USD","sum_comment":"","sum_foreign_units":"","sum":"","sum_foreign":""},{"sum_foreign_comment":"","sum_units":"EUR","sum_comment":"","sum_foreign_units":"","sum":"","sum_foreign":""}],"52":[{"sum_foreign_comment":"","sum_units":"","sum_comment":"","sum_foreign_units":"","sum":"","sum_foreign":""}],"53":[{"sum_foreign_comment":"","sum_units":"","sum_comment":"","sum_foreign_units":"","sum":"","sum_foreign":""}]},"declaration":{"needs_scancopy_check":false,"additional_info_text":"Копія складена 15 грудня 2014 р. (сторінка 9);;Інформація майстерно ’замазувалася’ фотошопом, тому можуть бути й інші, невідмічені, клітинки, в яких містилася інформація.;;Можна припустити, що це не та декларація, яка була здана 28 березня 2014 р.","notfull_lostpages":"","notfull":"FALSE","additional_info":"TRUE","url":"http://static.declarations.com.ua/declarations/sudy/apeliatsiini_sudy_oblastei__m.kyieva/kirovohradska/surovytska.pdf"},"liabilities":{"54":{"sum_foreign_comment":"","sum":"","sum_comment":"","sum_foreign":""},"55":{"sum_foreign_comment":"","sum_units":"","sum_comment":"","sum_foreign_units":"","sum":"","sum_foreign":""},"56":{"sum_foreign_comment":"","sum":"3962","sum_comment":"","sum_foreign":""},"57":{"sum_foreign_comment":"","sum":"","sum_comment":"","sum_foreign":""},"58":{"sum_foreign_comment":"","sum":"","sum_comment":"","sum_foreign":""},"59":{"sum_foreign_comment":"","sum":"","sum_comment":"","sum_foreign":""},"60":{"sum_foreign_comment":"","sum":"","sum_comment":"","sum_foreign":""},"61":{"sum_foreign_comment":"","sum_units":"","sum_comment":"","sum_foreign_units":"","sum":"","sum_foreign":""},"62":{"sum_foreign_comment":"","sum":"3962","sum_comment":"","sum_foreign":""},"63":{"sum_foreign_comment":"","sum_units":"","sum_comment":"","sum":"","sum_foreign":""},"64":{"sum_foreign_comment":"","sum_units":"","sum_comment":"","sum":"","sum_foreign":""}},"estate":{"23":[{"costs_rent":"","location_raw":"приховано","region":"","costs":"","costs_rent_comment":"","costs_comment":"","space_comment":"","space_units":"","space":"289,2","address":""},{"costs_rent":"","location_raw":"приховано","region":"","costs":"","costs_rent_comment":"","costs_comment":"","space_comment":"","space_units":"","space":"356","address":""},{"costs_rent":"","location_raw":"","region":"","costs":"","costs_rent_comment":"","costs_comment":"","space_comment":"","space_units":"","space":"","address":""}],"24":[{"costs_rent":"","location_raw":"приховано","region":"","costs":"","costs_rent_comment":"","costs_comment":"","space_comment":"","space_units":"","space":"124,5","address":""},{"costs_rent":"","location_raw":"приховано","region":"","costs":"","costs_rent_comment":"","costs_comment":"","space_comment":"","space_units":"","space":"50,01","address":""}],"29":[{"costs_rent":"","location_raw":"приховано","region":"","costs_property":"","costs_rent_comment":"","space_comment":"","costs_property_comment":"","space_units":"","space":"289,2","address":""}],"30":[{"costs_rent":"","location_raw":"приховано","region":"","costs_property":"","costs_rent_comment":"","space_comment":"","costs_property_comment":"","space_units":"","space":"124,5","address":""}]},"general":{"name_hidden":false,"name":"Людмила","patronymic_unclear":false,"last_name_hidden":false,"addresses_raw":"приховано","post_raw":"Суддя апеляційного суду Кіровоградської області","patronymic":"Василівна","inn":"","family_raw":"Чоловік Суровицький С.М. приховано","last_name":"Суровицька","post":{"office":"Загальний апеляційний суд","region":"Кіровоградська область","post":"Суддя"},"addresses_raw_hidden":true,"last_name_unclear":false,"full_name":"Суровицька Людмила Василівна","patronymic_hidden":false,"full_name_suggest":{"output":"Суровицька Людмила Василівна","input":["Суровицька Людмила Василівна","Людмила Василівна Суровицька","Людмила Суровицька"]},"name_unclear":false},"ft_src":"3962\n3962\nFALSE\nКопія складена 15 грудня 2014 р. (сторінка 9);;Інформація майстерно ’замазувалася’ фотошопом, тому можуть бути й інші, невідмічені, клітинки, в яких містилася інформація.;;Можна припустити, що це не та декларація, яка була здана 28 березня 2014 р.\nTRUE\n12617\n2350\n253905,49\n241288,49\n2350\nПричіп,ЧЗ 81021\n1992\nToyota,Camry\n88300\n2004\nПричіп,ЧЗ 81021\n1992\nToyota,Camry\n88300\n2004\n289,2\n356\n124,5\n289,2\n124,5\n50,01\n796,83\nTRUE\nКопія складена 15 грудня 2014 р. (сторінка 9);;Інформація майстерно ’замазувалася’ фотошопом, тому можуть бути й інші, невідмічені, клітинки, в яких містилася інформація.;;Можна припустити, що це не та декларація, яка була здана 28 березня 2014 р.\nFALSE\nFALSE\n2013\n241288,49\n12617\n2350\n253905,49\n2350\n88300\nToyota,Camry\n2004\nПричіп,ЧЗ 81021\n1992\nКопія складена 15 грудня 2014 р. (сторінка 9);;Інформація майстерно ’замазувалася’ фотошопом, тому можуть бути й інші, невідмічені, клітинки, в яких містилася інформація.;;Можна припустити, що це не та декларація, яка була здана 28 березня 2014 р.\nFALSE\nTRUE\n289,2\n356\n289,2\n124,5\n50,01\n124,5\nСуддя апеляційного суду Кіровоградської області\nЧоловік Суровицький С.М. приховано\nСуровицька\nСуровицька Людмила Василівна\nЛюдмила Василівна Суровицька\nЛюдмила Суровицька\nСуровицька Людмила Василівна\nЛюдмила\nСуровицька Людмила Василівна\nЗагальний апеляційний суд\nСуддя\nКіровоградська область\nВасилівна\n3962\n3962\n241288,49\n2350\n253905,49\n2350\n12617\n796,83\n2013\nFALSE\n3962\n3962\nСуровицька\nВасилівна\nЧоловік Суровицький С.М. приховано\nСуровицька Людмила Василівна\nЛюдмила Василівна Суровицька\nЛюдмила Суровицька\nСуровицька Людмила Василівна\nЛюдмила\nСуддя апеляційного суду Кіровоградської області\nСуддя\nКіровоградська область\nЗагальний апеляційний суд\nСуровицька Людмила Василівна\n124,5\n289,2\n356\n124,5\n50,01\n289,2\nСуддя\nКіровоградська область\nЗагальний апеляційний суд\nСуддя апеляційного суду Кіровоградської області\nЛюдмила\nВасилівна\nЧоловік Суровицький С.М. приховано\nСуровицька\nСуровицька Людмила Василівна\nСуровицька Людмила Василівна\nЛюдмила Василівна Суровицька\nЛюдмила Суровицька\nСуровицька Людмила Василівна\n796,83\nFALSE\n2013","intro":{"declaration_year":"2013","isnotdeclaration":"FALSE"}}