{"intro":{"declaration_year":"2013","isnotdeclaration":"FALSE"},"general":{"full_name":"Чишій Степан Степанович","full_name_suggest":{"output":"Чишій Степан Степанович","input":["Чишій Степан Степанович","Степан Степанович Чишій","Степан Чишій"]},"family_raw":"Дружина Чишій Н.М.;син Чишій М.С.","post_raw":"Голова Любомльського районного суду Волинської області","last_name":"Чишій","patronymic":"Степанович","name_unclear":false,"last_name_unclear":false,"last_name_hidden":false,"patronymic_unclear":false,"patronymic_hidden":false,"name":"Степан","post":{"office":"Загальний місцевий суд","post":"Голова Любомльського районного суду Волинської області","region":"Волинська область"},"inn":"","addresses_raw_hidden":true,"addresses_raw":"приховано","name_hidden":false},"vehicle":{"40":[{"brand_hidden":false,"sum_rent_comment":"","sum_comment":"","brand":"Mitsubishi,Outlander","brand_info":"","year":"2008","sum":"","sum_rent":""},{"brand_hidden":false,"sum_rent_comment":"","sum_comment":"","brand":"Kia,Rio","brand_info":"","year":"2012","sum":"","sum_rent":""}]},"income":{"5":{"family":"90361","value":"228340","family_comment":"","comment":""},"6":{"family":"90343","value":"228273","family_comment":"","comment":""},"7":{"family":"0","source_name":"0","value":"0","comment":"","family_comment":""},"8":{"family":"0","value":"0","family_comment":"","comment":""},"9":{"family":"18","value":"67","family_comment":"","comment":""},"10":{"family":"0","value":"0","family_comment":"","comment":""},"11":{"family":"0","value":"0","family_comment":"","comment":""},"12":{"family":"0","value":"0","family_comment":"","comment":""},"13":{"family":"0","value":"0","family_comment":"","comment":""},"14":{"family":"0","value":"0","family_comment":"","comment":""},"15":{"family":"0","value":"0","family_comment":"","comment":""},"16":{"family":"0","value":"0","family_comment":"","comment":""},"17":{"family":"0","value":"0","family_comment":"","comment":""},"18":{"family":"0","value":"0","family_comment":"","comment":""},"19":{"family":"0","value":"0","family_comment":"","comment":""},"20":{"family":"0","value":"0","family_comment":"","comment":""},"21":[{"cur":"0","country":"0","uah_equal":"0","country_comment":""},{"cur":"0","country":"0","uah_equal":"0","country_comment":""},{"cur":"0","country":"0","uah_equal":"0","country_comment":""},{"cur":"0","country":"0","uah_equal":"0","country_comment":""},{"cur":"0","country":"0","uah_equal":"0","country_comment":""}],"22":[{"cur":"0","country":"0","uah_equal":"0","country_comment":""},{"cur":"0","country":"0","uah_equal":"0","country_comment":""},{"cur":"0","country":"0","uah_equal":"0","country_comment":""},{"cur":"0","country":"0","uah_equal":"0","country_comment":""},{"cur":"0","country":"0","uah_equal":"0","country_comment":""}]},"estate":{"23":[{"space_comment":"","costs_rent_comment":"","region":"","costs_rent":"","space":"","location_raw":"","address":"","costs":"","costs_comment":"","space_units":""},{"space_comment":"","costs_rent_comment":"","region":"","costs_rent":"","space":"","location_raw":"","address":"","costs":"","costs_comment":"","space_units":""},{"space_comment":"","costs_rent_comment":"","region":"","costs_rent":"","space":"","location_raw":"","address":"","costs":"","costs_comment":"","space_units":""}],"25":[{"space_comment":"","costs_rent_comment":"","region":"","costs_rent":"","space":"39,7","location_raw":"приховано","address":"","costs":"","costs_comment":"","space_units":""}],"29":[{"space_comment":"","space":"1750","costs_rent_comment":"","region":"","costs_rent":"","costs_property_comment":"","address":"","space_units":"","location_raw":"приховано","costs_property":""}],"30":[{"space_comment":"","space":"212,5","costs_rent_comment":"","region":"","costs_rent":"","costs_property_comment":"","address":"","space_units":"","location_raw":"приховано","costs_property":""}]},"liabilities":{"54":{"sum_foreign_comment":"","sum_comment":"","sum_foreign":"","sum":""},"55":{"sum_foreign_comment":"","sum_comment":"","sum_foreign":"","sum":"","sum_foreign_units":"","sum_units":""},"56":{"sum_foreign_comment":"","sum_comment":"","sum_foreign":"","sum":"2420"},"57":{"sum_foreign_comment":"","sum_comment":"","sum_foreign":"","sum":"16634"},"58":{"sum_foreign_comment":"","sum_comment":"","sum_foreign":"","sum":"1110"},"59":{"sum_foreign_comment":"","sum_comment":"","sum_foreign":"","sum":""},"60":{"sum_foreign_comment":"","sum_comment":"","sum_foreign":"","sum":"528"},"61":{"sum_foreign_comment":"","sum_comment":"","sum_foreign":"","sum":"","sum_foreign_units":"","sum_units":""},"62":{"sum_foreign_comment":"","sum_comment":"","sum_foreign":"","sum":"10618"},"63":{"sum_units":"грн","sum_foreign_comment":"","sum_comment":"","sum":"106913","sum_foreign":""},"64":{"sum_units":"грн","sum_foreign_comment":"","sum_comment":"","sum":"28732","sum_foreign":""}},"id":"4909","declaration":{"needs_scancopy_check":false,"notfull":"FALSE","additional_info_text":"1) стор. 9, розділ V, п. 45, 46, 51 - декларант вказав, у якому саме банку він має вклади;;2) стор. 9, розділ VI, п. 56, 57, 58, 60, 62, 64 - декларант конкретизував, перед якими установами має фінансові зобов’язання він та члени його сім’ї;Note: стор. 8, розділ V. Сума, вказана у п. 45, менша за суму, вказану у п. 46, хоча такого не може бути.","url":"http://static.declarations.com.ua/lustration/5480185f0364a.pdf","additional_info":"TRUE","notfull_lostpages":"9.00"},"ft_src":"16634\n10618\n28732\n1110\n106913\n2420\n528\nFALSE\n1) стор. 9, розділ V, п. 45, 46, 51 - декларант вказав, у якому саме банку він має вклади;;2) стор. 9, розділ VI, п. 56, 57, 58, 60, 62, 64 - декларант конкретизував, перед якими установами має фінансові зобов’язання він та члени його сім’ї;Note: стор. 8, розділ V. Сума, вказана у п. 45, менша за суму, вказану у п. 46, хоча такого не може бути.\n9.00\nTRUE\n90361\n228340\n18\n67\n90343\n228273\nMitsubishi,Outlander\n2008\nKia,Rio\n2012\nMitsubishi,Outlander\n2008\nKia,Rio\n2012\n212,5\n1750\n39,7\n6392\n1068\n1812\nTRUE\n1) стор. 9, розділ V, п. 45, 46, 51 - декларант вказав, у якому саме банку він має вклади;;2) стор. 9, розділ VI, п. 56, 57, 58, 60, 62, 64 - декларант конкретизував, перед якими установами має фінансові зобов’язання він та члени його сім’ї;Note: стор. 8, розділ V. Сума, вказана у п. 45, менша за суму, вказану у п. 46, хоча такого не може бути.\n9.00\nFALSE\nFALSE\n2013\n90343\n228273\n90361\n228340\n18\n67\nMitsubishi,Outlander\n2008\nKia,Rio\n2012\n9.00\n1) стор. 9, розділ V, п. 45, 46, 51 - декларант вказав, у якому саме банку він має вклади;;2) стор. 9, розділ VI, п. 56, 57, 58, 60, 62, 64 - декларант конкретизував, перед якими установами має фінансові зобов’язання він та члени його сім’ї;Note: стор. 8, розділ V. Сума, вказана у п. 45, менша за суму, вказану у п. 46, хоча такого не може бути.\nFALSE\nTRUE\n1750\n212,5\n39,7\nГолова Любомльського районного суду Волинської області\nДружина Чишій Н.М.;син Чишій М.С.\nЧишій\nЧишій Степан Степанович\nСтепан Степанович Чишій\nСтепан Чишій\nЧишій Степан Степанович\nСтепан\nЧишій Степан Степанович\nЗагальний місцевий суд\nГолова Любомльського районного суду Волинської області\nВолинська область\nСтепанович\n106913\n28732\n16634\n528\n2420\n10618\n1110\n228273\n90343\n228340\n90361\n67\n18\n1812\n1068\n6392\n2013\nFALSE\n1110\n16634\n28732\n2420\n10618\n528\n106913\nЧишій\nСтепанович\nДружина Чишій Н.М.;син Чишій М.С.\nЧишій Степан Степанович\nСтепан Степанович Чишій\nСтепан Чишій\nЧишій Степан Степанович\nСтепан\nГолова Любомльського районного суду Волинської області\nГолова Любомльського районного суду Волинської області\nВолинська область\nЗагальний місцевий суд\nЧишій Степан Степанович\n212,5\n39,7\n1750\nГолова Любомльського районного суду Волинської області\nВолинська область\nЗагальний місцевий суд\nГолова Любомльського районного суду Волинської області\nСтепан\nСтепанович\nДружина Чишій Н.М.;син Чишій М.С.\nЧишій\nЧишій Степан Степанович\nЧишій Степан Степанович\nСтепан Степанович Чишій\nСтепан Чишій\nЧишій Степан Степанович\n6392\n1812\n1068\nFALSE\n2013","banks":{"45":[{"sum_foreign_comment":"","sum_comment":"","sum_foreign":"","sum":"1812","sum_foreign_units":"","sum_units":"UAH"},{"sum_foreign_comment":"","sum_comment":"","sum_foreign":"","sum":"","sum_foreign_units":"","sum_units":"USD"},{"sum_foreign_comment":"","sum_comment":"","sum_foreign":"","sum":"","sum_foreign_units":"","sum_units":"EUR"}],"46":[{"sum_foreign_comment":"","sum_comment":"","sum_foreign":"","sum":"6392","sum_foreign_units":"","sum_units":"UAH"},{"sum_foreign_comment":"","sum_comment":"","sum_foreign":"","sum":"","sum_foreign_units":"","sum_units":"USD"},{"sum_foreign_comment":"","sum_comment":"","sum_foreign":"","sum":"","sum_foreign_units":"","sum_units":"EUR"}],"47":[{"sum_foreign_comment":"","sum_comment":"","sum_foreign":"","sum":"","sum_foreign_units":"","sum_units":""}],"48":[{"sum_foreign_comment":"","sum_comment":"","sum_foreign":"","sum":"","sum_foreign_units":"","sum_units":""}],"49":[{"sum_foreign_comment":"","sum_comment":"","sum_foreign":"","sum":"","sum_foreign_units":"","sum_units":""}],"50":[{"sum_foreign_comment":"","sum_comment":"","sum_foreign":"","sum":"","sum_foreign_units":"","sum_units":""}],"51":[{"sum_foreign_comment":"","sum_comment":"","sum_foreign":"","sum":"1068","sum_foreign_units":"","sum_units":"UAH"},{"sum_foreign_comment":"","sum_comment":"","sum_foreign":"","sum":"","sum_foreign_units":"","sum_units":"USD"},{"sum_foreign_comment":"","sum_comment":"","sum_foreign":"","sum":"","sum_foreign_units":"","sum_units":"EUR"}],"52":[{"sum_foreign_comment":"","sum_comment":"","sum_foreign":"","sum":"","sum_foreign_units":"","sum_units":""}],"53":[{"sum_foreign_comment":"","sum_comment":"","sum_foreign":"","sum":"","sum_foreign_units":"","sum_units":""}]}}