{"intro":{"declaration_year":"2013","isnotdeclaration":"FALSE"},"general":{"full_name":"Боднар Оксана Василівна","full_name_suggest":{"output":"Боднар Оксана Василівна","input":["Боднар Оксана Василівна","Оксана Василівна Боднар","Оксана Боднар"]},"family_raw":"Чоловік Боднар Василь Йосипович, 24.07.1954р.","post_raw":"Суддя апеляційного суду Закарпатської області","last_name":"Боднар","patronymic":"Василівна","name_unclear":false,"last_name_unclear":false,"last_name_hidden":false,"patronymic_unclear":false,"patronymic_hidden":false,"name":"Оксана","post":{"office":"Загальний апеляційний суд","post":"Суддя","region":"Закарпатська область"},"inn":"","addresses_raw_hidden":true,"addresses_raw":"приховано","name_hidden":false},"vehicle":{"35":[{"brand_hidden":false,"sum_rent_comment":"","sum_comment":"","brand":"Mitsubishi,Lancer","brand_info":"","year":"2008","sum":"","sum_rent":""}],"40":[{"brand_hidden":false,"sum_rent_comment":"","sum_comment":"","brand":"Mitsubishi,Lancer","brand_info":"","year":"2005","sum":"","sum_rent":""}]},"income":{"5":{"family":"67498","value":"274130","family_comment":"","comment":""},"6":{"family":"59679","value":"244992","family_comment":"","comment":""},"7":{"family":"0","source_name":"0","value":"0","comment":"","family_comment":""},"8":{"family":"0","value":"0","family_comment":"","comment":""},"9":{"family":"7818","value":"16520","family_comment":"","comment":""},"10":{"family":"0","value":"12617","family_comment":"","comment":""},"11":{"family":"0","value":"0","family_comment":"","comment":""},"12":{"family":"0","value":"0","family_comment":"","comment":""},"13":{"family":"0","value":"0","family_comment":"","comment":""},"14":{"family":"0","value":"0","family_comment":"","comment":""},"15":{"family":"0","value":"0","family_comment":"","comment":""},"16":{"family":"0","value":"0","family_comment":"","comment":""},"17":{"family":"0","value":"0","family_comment":"","comment":""},"18":{"family":"0","value":"0","family_comment":"","comment":""},"19":{"family":"0","value":"0","family_comment":"","comment":""},"20":{"family":"0","value":"0","family_comment":"","comment":""},"21":[{"cur":"0","country":"0","uah_equal":"0","country_comment":""},{"cur":"0","country":"0","uah_equal":"0","country_comment":""},{"cur":"0","country":"0","uah_equal":"0","country_comment":""},{"cur":"0","country":"0","uah_equal":"0","country_comment":""},{"cur":"0","country":"0","uah_equal":"0","country_comment":""}],"22":[{"cur":"0","country":"0","uah_equal":"0","country_comment":""},{"cur":"0","country":"0","uah_equal":"0","country_comment":""},{"cur":"0","country":"0","uah_equal":"0","country_comment":""},{"cur":"0","country":"0","uah_equal":"0","country_comment":""},{"cur":"0","country":"0","uah_equal":"0","country_comment":""}]},"estate":{"23":[{"space_comment":"","costs_rent_comment":"","region":"","costs_rent":"","space":"600","location_raw":"приховано","address":"","costs":"","costs_comment":"","space_units":""},{"space_comment":"","costs_rent_comment":"","region":"","costs_rent":"","space":"600","location_raw":"приховано","address":"","costs":"","costs_comment":"","space_units":""},{"space_comment":"","costs_rent_comment":"","region":"","costs_rent":"","space":"1363","location_raw":"приховано","address":"","costs":"","costs_comment":"","space_units":""}],"24":[{"space_comment":"","costs_rent_comment":"","region":"","costs_rent":"","space":"350","location_raw":"приховано","address":"","costs":"","costs_comment":"","space_units":""}],"29":[{"space_comment":"","space":"1000","costs_rent_comment":"","region":"","costs_rent":"","costs_property_comment":"","address":"","space_units":"","location_raw":"приховано","costs_property":""},{"space_comment":"","space":"10000","costs_rent_comment":"","region":"","costs_rent":"","costs_property_comment":"","address":"","space_units":"","location_raw":"приховано","costs_property":""}],"30":[{"space_comment":"","space":"450","costs_rent_comment":"","region":"","costs_rent":"","costs_property_comment":"","address":"","space_units":"","location_raw":"приховано","costs_property":""}]},"liabilities":{"54":{"sum_foreign_comment":"","sum_comment":"","sum_foreign":"","sum":""},"55":{"sum_foreign_comment":"","sum_comment":"","sum_foreign":"","sum":"","sum_foreign_units":"","sum_units":""},"56":{"sum_foreign_comment":"","sum_comment":"","sum_foreign":"","sum":""},"57":{"sum_foreign_comment":"","sum_comment":"","sum_foreign":"","sum":""},"58":{"sum_foreign_comment":"","sum_comment":"","sum_foreign":"","sum":""},"59":{"sum_foreign_comment":"","sum_comment":"","sum_foreign":"","sum":""},"60":{"sum_foreign_comment":"","sum_comment":"","sum_foreign":"","sum":""},"61":{"sum_foreign_comment":"","sum_comment":"","sum_foreign":"","sum":"","sum_foreign_units":"","sum_units":""},"62":{"sum_foreign_comment":"","sum_comment":"","sum_foreign":"","sum":""},"63":{"sum_units":"","sum_foreign_comment":"","sum_comment":"","sum":"","sum_foreign":""},"64":{"sum_units":"","sum_foreign_comment":"","sum_comment":"","sum":"","sum_foreign":""}},"id":"5387","declaration":{"needs_scancopy_check":false,"notfull":"FALSE","additional_info_text":"1. кілька полів, а саме: і, 4 ’реєстраціний номер облікової карти платника податків, серія та номер паспорта...’, 2 ’Місце проживання’, 23, 24, 29, 30 ’Місцезнаходження об’єкта (нерухомість)’ — перекрито рівними білими прямокутниками. Я позначив це приховано;;2. поля 8 ’авторська винагорода, інші доходи від реалізації майнових прав інтелектуальної власності’ , 10 ’матеріальна допомога (членів сім’ї)’, 46 ’вкладених у звітному році’, 51 ’у тому числі за кордоном’, 55 ’недержавне пенсійне забезпечення’ порожні — без даних і без прочерка.;;3. поряд із ’Сумою коштів на рахунках у банках’ вказано банк — АТ ’Дельта Банк’. Я це проігнорував","url":"http://static.declarations.com.ua/declarations/sudy/apeliatsiini_sudy_oblastei__m.kyieva/zakarpatska/bodnar.pdf","additional_info":"FALSE","notfull_lostpages":""},"ft_src":"FALSE\n1. кілька полів, а саме: і, 4 ’реєстраціний номер облікової карти платника податків, серія та номер паспорта...’, 2 ’Місце проживання’, 23, 24, 29, 30 ’Місцезнаходження об’єкта (нерухомість)’ — перекрито рівними білими прямокутниками. Я позначив це приховано;;2. поля 8 ’авторська винагорода, інші доходи від реалізації майнових прав інтелектуальної власності’ , 10 ’матеріальна допомога (членів сім’ї)’, 46 ’вкладених у звітному році’, 51 ’у тому числі за кордоном’, 55 ’недержавне пенсійне забезпечення’ порожні — без даних і без прочерка.;;3. поряд із ’Сумою коштів на рахунках у банках’ вказано банк — АТ ’Дельта Банк’. Я це проігнорував\nFALSE\n12617\n67498\n274130\n7818\n16520\n59679\n244992\nMitsubishi,Lancer\n2008\nMitsubishi,Lancer\n2005\nMitsubishi,Lancer\n2008\nMitsubishi,Lancer\n2005\n600\n600\n1363\n450\n1000\n10000\n350\n357\n134480\n338312\nFALSE\n1. кілька полів, а саме: і, 4 ’реєстраціний номер облікової карти платника податків, серія та номер паспорта...’, 2 ’Місце проживання’, 23, 24, 29, 30 ’Місцезнаходження об’єкта (нерухомість)’ — перекрито рівними білими прямокутниками. Я позначив це приховано;;2. поля 8 ’авторська винагорода, інші доходи від реалізації майнових прав інтелектуальної власності’ , 10 ’матеріальна допомога (членів сім’ї)’, 46 ’вкладених у звітному році’, 51 ’у тому числі за кордоном’, 55 ’недержавне пенсійне забезпечення’ порожні — без даних і без прочерка.;;3. поряд із ’Сумою коштів на рахунках у банках’ вказано банк — АТ ’Дельта Банк’. Я це проігнорував\nFALSE\nFALSE\n2013\n59679\n244992\n12617\n67498\n274130\n7818\n16520\nMitsubishi,Lancer\n2008\nMitsubishi,Lancer\n2005\n1. кілька полів, а саме: і, 4 ’реєстраціний номер облікової карти платника податків, серія та номер паспорта...’, 2 ’Місце проживання’, 23, 24, 29, 30 ’Місцезнаходження об’єкта (нерухомість)’ — перекрито рівними білими прямокутниками. Я позначив це приховано;;2. поля 8 ’авторська винагорода, інші доходи від реалізації майнових прав інтелектуальної власності’ , 10 ’матеріальна допомога (членів сім’ї)’, 46 ’вкладених у звітному році’, 51 ’у тому числі за кордоном’, 55 ’недержавне пенсійне забезпечення’ порожні — без даних і без прочерка.;;3. поряд із ’Сумою коштів на рахунках у банках’ вказано банк — АТ ’Дельта Банк’. Я це проігнорував\nFALSE\nFALSE\n600\n600\n1363\n1000\n10000\n350\n450\nСуддя апеляційного суду Закарпатської області\nЧоловік Боднар Василь Йосипович, 24.07.1954р.\nБоднар\nБоднар Оксана Василівна\nОксана Василівна Боднар\nОксана Боднар\nБоднар Оксана Василівна\nОксана\nБоднар Оксана Василівна\nЗагальний апеляційний суд\nСуддя\nЗакарпатська область\nВасилівна\n244992\n59679\n274130\n67498\n12617\n16520\n7818\n338312\n134480\n357\n2013\nFALSE\nБоднар\nВасилівна\nЧоловік Боднар Василь Йосипович, 24.07.1954р.\nБоднар Оксана Василівна\nОксана Василівна Боднар\nОксана Боднар\nБоднар Оксана Василівна\nОксана\nСуддя апеляційного суду Закарпатської області\nСуддя\nЗакарпатська область\nЗагальний апеляційний суд\nБоднар Оксана Василівна\n450\n600\n600\n1363\n350\n1000\n10000\nСуддя\nЗакарпатська область\nЗагальний апеляційний суд\nСуддя апеляційного суду Закарпатської області\nОксана\nВасилівна\nЧоловік Боднар Василь Йосипович, 24.07.1954р.\nБоднар\nБоднар Оксана Василівна\nБоднар Оксана Василівна\nОксана Василівна Боднар\nОксана Боднар\nБоднар Оксана Василівна\n357\n338312\n134480\nFALSE\n2013","banks":{"45":[{"sum_foreign_comment":"","sum_comment":"","sum_foreign":"","sum":"338312","sum_foreign_units":"","sum_units":"UAH"},{"sum_foreign_comment":"","sum_comment":"","sum_foreign":"","sum":"","sum_foreign_units":"","sum_units":"USD"},{"sum_foreign_comment":"","sum_comment":"","sum_foreign":"","sum":"","sum_foreign_units":"","sum_units":"EUR"}],"46":[{"sum_foreign_comment":"","sum_comment":"","sum_foreign":"","sum":"","sum_foreign_units":"","sum_units":"UAH"},{"sum_foreign_comment":"","sum_comment":"","sum_foreign":"","sum":"","sum_foreign_units":"","sum_units":"USD"},{"sum_foreign_comment":"","sum_comment":"","sum_foreign":"","sum":"","sum_foreign_units":"","sum_units":"EUR"}],"47":[{"sum_foreign_comment":"","sum_comment":"","sum_foreign":"","sum":"357","sum_foreign_units":"","sum_units":""}],"48":[{"sum_foreign_comment":"","sum_comment":"","sum_foreign":"","sum":"","sum_foreign_units":"","sum_units":""}],"49":[{"sum_foreign_comment":"","sum_comment":"","sum_foreign":"","sum":"","sum_foreign_units":"","sum_units":""}],"50":[{"sum_foreign_comment":"","sum_comment":"","sum_foreign":"","sum":"","sum_foreign_units":"","sum_units":""}],"51":[{"sum_foreign_comment":"","sum_comment":"","sum_foreign":"","sum":"134480","sum_foreign_units":"","sum_units":"UAH"},{"sum_foreign_comment":"","sum_comment":"","sum_foreign":"","sum":"","sum_foreign_units":"","sum_units":"USD"},{"sum_foreign_comment":"","sum_comment":"","sum_foreign":"","sum":"","sum_foreign_units":"","sum_units":"EUR"}],"52":[{"sum_foreign_comment":"","sum_comment":"","sum_foreign":"","sum":"","sum_foreign_units":"","sum_units":""}],"53":[{"sum_foreign_comment":"","sum_comment":"","sum_foreign":"","sum":"","sum_foreign_units":"","sum_units":""}]}}