{"income":{"5":{"value":"377164","family_comment":"","value_unclear":false,"family_unclear":false,"family":"12240","comment":""},"6":{"family_comment":"","family_unclear":false,"value":"245164","family":"","comment":""},"7":{"family_comment":"","value":"","source_name":"","family":"","comment":""},"8":{"family_comment":"","value":"","family":"","comment":""},"9":{"family_comment":"","value":"","family":"","comment":""},"10":{"family_comment":"","value":"","family":"","comment":""},"11":{"family_comment":"","value":"","family":"","comment":""},"12":{"family_comment":"","value":"","family":"","comment":""},"13":{"family_comment":"","value":"","family":"","comment":""},"14":{"family_comment":"","value":"","family":"","comment":""},"15":{"family_comment":"","value":"132000","family":"12240","comment":""},"16":{"family_comment":"","value":"","family":"","comment":""},"17":{"family_comment":"","value":"","family":"","comment":""},"18":{"family_comment":"","value":"","family":"","comment":""},"19":{"family_comment":"","value":"","family":"","comment":""},"20":{"value":"","value_unclear":false,"family_comment":"","family_comment_unclear":false,"comment_unclear":false,"comment":"","family":""}},"id":"5608","banks":{"45":[{"sum_foreign_comment":"","sum_units":"UAH","sum_comment":"","sum_hidden":false,"sum_foreign_units":"UAH","sum_comment_hidden":false,"sum":"","sum_foreign":""}],"46":[{"sum_foreign_comment":"","sum_units":"UAH","sum_comment":"","sum_foreign_units":"UAH","sum":"","sum_foreign":""}],"47":[{"sum_foreign_comment":"","sum_units":"UAH","sum_comment":"","sum_foreign_units":"UAH","sum":"","sum_foreign":""}],"48":[{"sum_foreign_comment":"","sum_units":"UAH","sum_comment":"","sum_foreign_units":"UAH","sum":"","sum_foreign":""}],"49":[{"sum_foreign_comment":"","sum_units":"UAH","sum_comment":"","sum_foreign_units":"UAH","sum":"","sum_foreign":""}],"50":[{"sum_foreign_comment":"","sum_units":"UAH","sum_comment":"","sum_foreign_units":"UAH","sum":"","sum_foreign":""}],"51":[{"sum_foreign_comment":"","sum_units":"UAH","sum_comment":"","sum_hidden":false,"sum_foreign_units":"UAH","sum_comment_hidden":false,"sum":"","sum_foreign":""}],"52":[{"sum_foreign_comment":"","sum_units":"UAH","sum_comment":"","sum_foreign_units":"UAH","sum":"","sum_foreign":""}],"53":[{"sum_foreign_comment":"","sum_units":"UAH","sum_comment":"","sum_foreign_units":"UAH","sum":"","sum_foreign":""}]},"declaration":{"additional_info_text":"","notfull_lostpages":"","date":"2014-03-24T00:00:00","notfull":"","additional_info":"","url":"http://static.declarations.com.ua/declarations/prosecutors/batch5/149839a72a0edfe3d4e11e0dc87206e9.pdf"},"liabilities":{"54":{"sum_foreign_comment":"","sum_comment_hidden":false,"sum":"","sum_comment":"","sum_foreign":""},"55":{"sum_foreign_comment":"","sum":"","sum_comment":"","sum_foreign":""},"56":{"sum_foreign_comment":"","sum":"","sum_comment":"","sum_foreign":""},"57":{"sum_foreign_comment":"","sum":"","sum_comment":"","sum_foreign":""},"58":{"sum_foreign_comment":"","sum":"","sum_comment":"","sum_foreign":""},"59":{"sum_foreign_comment":"","sum":"","sum_comment":"","sum_foreign":""},"60":{"sum_foreign_comment":"","sum":"","sum_comment":"","sum_comment_unclear":false,"sum_foreign":""},"61":{"sum_foreign_comment":"","sum":"","sum_comment":"","sum_foreign":""},"62":{"sum_foreign_comment":"","sum":"","sum_comment":"","sum_foreign":""},"63":{"sum_foreign_comment":"","sum":"","sum_comment":"","sum_foreign":""},"64":{"sum_foreign_comment":"","sum":"","sum_comment":"","sum_foreign":""}},"ft_src":"старший прокурор відділу нагляду за додержанням законів при проведенні оперативно-розшукової діяльності слідчого управління головного управління нагляду за додержанням законів у воєнній сфері генеральної прокуратури україни\nЗагальнодержавний регіон\nГенеральна прокуратура\nОлександр\nШевченко Т. Л\nПодружжя\nВасильович\nШевченко\nШевченко Олександр Васильович\nШевченко Олександр Васильович\nОлександр Васильович Шевченко\nОлександр Шевченко\nШевченко Олександр Васильович\n12240\n132000\n377164\n12240\n245164\n58.3\n108.5\n2013\n245164\n12240\n132000\n12240\n377164\n2013\nПодружжя\nШевченко Т. Л\nШевченко Олександр Васильович\nОлександр Васильович Шевченко\nОлександр Шевченко\nШевченко Олександр Васильович\nШевченко Олександр Васильович\nОлександр\nШевченко\nГенеральна прокуратура\nЗагальнодержавний регіон\nстарший прокурор відділу нагляду за додержанням законів при проведенні оперативно-розшукової діяльності слідчого управління головного управління нагляду за додержанням законів у воєнній сфері генеральної прокуратури україни\nВасильович\n245164\n132000\n12240\n377164\n12240\n58.3\n108.5\nШевченко Т. Л\nПодружжя\nВасильович\nШевченко\nОлександр\nШевченко Олександр Васильович\nОлександр Васильович Шевченко\nОлександр Шевченко\nШевченко Олександр Васильович\nЗагальнодержавний регіон\nГенеральна прокуратура\nстарший прокурор відділу нагляду за додержанням законів при проведенні оперативно-розшукової діяльності слідчого управління головного управління нагляду за додержанням законів у воєнній сфері генеральної прокуратури україни\nШевченко Олександр Васильович\n58.3\n108.5\n2013","general":{"inn":"","name":"Олександр","patronymic_unclear":false,"last_name_hidden":false,"family":[{"inn":"","inn_hidden":true,"relations_hidden":false,"family_name":"Шевченко Т. Л","relations_other":"","relations":"Подружжя","name_hidden":true,"name_unclear":false}],"patronymic":"Васильович","inn_hidden":true,"family_raw":"","last_name":"Шевченко","post":{"post_unclear":false,"region_unclear":false,"post":"старший прокурор відділу нагляду за додержанням законів при проведенні оперативно-розшукової діяльності слідчого управління головного управління нагляду за додержанням законів у воєнній сфері генеральної прокуратури україни","candidate":"","office_hidden":false,"region":"Загальнодержавний регіон","post_hidden":false,"office":"Генеральна прокуратура","office_unclear":false,"region_hidden":false},"last_name_unclear":false,"full_name":"Шевченко Олександр Васильович","addresses":[{"place_district":"","place_city_hidden":false,"place_city":"","place_city_type_hidden":false,"place_district_hidden":false,"place_city_type":"","place_address_hidden":false,"place_address":"","place_hidden":true,"place":""}],"full_name_suggest":{"output":"Шевченко Олександр Васильович","input":["Шевченко Олександр Васильович","Олександр Васильович Шевченко","Олександр Шевченко"]},"name_unclear":false},"source":"VULYK","estate":{"23":[{"costs_rent":"","region":"","costs":"","costs_rent_comment":"","costs_comment":"","address_hidden":false,"region_hidden":false,"space_comment":"","space_units":"м²","space":"","address":""},{"costs_rent":"","region":"","costs":"","costs_rent_comment":"","costs_comment":"","address_hidden":false,"space_comment":"","space_units":"","space":"","address":""},{"costs_rent":"","region":"","costs":"","costs_rent_comment":"","costs_comment":"","space_comment":"","space_units":"","space":"","address":""}],"25":[{"space_unclear":false,"costs":"","costs_comment":"","address_hidden":false,"region_hidden":true,"space_comment":"","space_hidden":false,"space":"108.5","address":"","region":"","costs_rent_comment":"","space_units":"м²","space_units_hidden":false,"costs_rent":""}],"31":[{"space_unclear":false,"address_hidden":false,"region_hidden":true,"space_comment":"","space":"58.3","address":"","region":"","costs_property":"","costs_rent_comment":"","address_unclear":false,"space_units":"м²","costs_property_comment":"","costs_rent":""}]},"intro":{"declaration_year":"2013"}}