{"intro":{"declaration_year":"2013","isnotdeclaration":"FALSE"},"general":{"full_name":"Євпак Валентина Василівна","full_name_suggest":{"output":"Євпак Валентина Василівна","input":["Євпак Валентина Василівна","Валентина Василівна Євпак","Валентина Євпак"]},"family_raw":"Чоловік Євпак І.В.,;дочка Євпак О.І.","post_raw":"Суддя Житомирського апеляційного адміністративного суду","last_name":"Євпак","patronymic":"Василівна","name_unclear":false,"addresses":[{"place_address":"","place_district":"","place_city":"Житомир","place_address_type":"","place_city_type":"","place":"Житомирська"}],"last_name_hidden":false,"patronymic_unclear":false,"patronymic_hidden":false,"name":"Валентина","post":{"office":"Апеляційний адміністративний суд","post":"Суддя","region":"Житомирська область"},"inn":"","addresses_raw_hidden":true,"last_name_unclear":false,"addresses_raw":"Житомирська обл., м. Житомир;інша інформація - прихована","name_hidden":false},"vehicle":{"40":[{"brand_hidden":false,"sum_rent_comment":"","sum_comment":"","brand":"Nissan,Qashqai","brand_info":"","year":"2012","sum":"","sum_rent":""}]},"income":{"5":{"family":"24080","value":"347596","family_comment":"","comment":""},"6":{"family":"0","value":"269883","family_comment":"","comment":""},"7":{"family":"0","source_name":"0","value":"0","comment":"","family_comment":""},"8":{"family":"0","value":"0","family_comment":"","comment":""},"9":{"family":"0","value":"0","family_comment":"","comment":""},"10":{"family":"0","value":"12617","family_comment":"","comment":""},"11":{"family":"0","value":"0","family_comment":"","comment":""},"12":{"family":"0","value":"0","family_comment":"","comment":""},"13":{"family":"0","value":"0","family_comment":"","comment":""},"14":{"family":"0","value":"0","family_comment":"","comment":""},"15":{"family":"0","value":"0","family_comment":"","comment":""},"16":{"family":"0","value":"0","family_comment":"","comment":""},"17":{"family":"0","value":"0","family_comment":"","comment":""},"18":{"family":"0","value":"0","family_comment":"","comment":""},"19":{"family":"799","value":"6000","family_comment":"","comment":""},"20":{"family":"23281","value":"59096","family_comment":"","comment":""},"21":[{"cur":"0","country":"0","uah_equal":"0","country_comment":""},{"cur":"0","country":"0","uah_equal":"0","country_comment":""},{"cur":"0","country":"0","uah_equal":"0","country_comment":""},{"cur":"0","country":"0","uah_equal":"0","country_comment":""},{"cur":"0","country":"0","uah_equal":"0","country_comment":""}],"22":[{"cur":"0","country":"0","uah_equal":"0","country_comment":""},{"cur":"0","country":"0","uah_equal":"0","country_comment":""},{"cur":"0","country":"0","uah_equal":"0","country_comment":""},{"cur":"0","country":"0","uah_equal":"0","country_comment":""},{"cur":"0","country":"0","uah_equal":"0","country_comment":""}]},"estate":{"23":[{"space_comment":"","costs_rent_comment":"","region":"","costs_rent":"","space":"","location_raw":"","address":"","costs":"","costs_comment":"","space_units":""},{"space_comment":"","costs_rent_comment":"","region":"","costs_rent":"","space":"","location_raw":"","address":"","costs":"","costs_comment":"","space_units":""},{"space_comment":"","costs_rent_comment":"","region":"","costs_rent":"","space":"","location_raw":"","address":"","costs":"","costs_comment":"","space_units":""}],"25":[{"space_comment":"","costs_rent_comment":"","region":"","costs_rent":"","space":"26,45","location_raw":"м. Новоград-Волинський","address":"","costs":"","costs_comment":"","space_units":""},{"space_comment":"","costs_rent_comment":"","region":"","costs_rent":"","space":"36,5","location_raw":"приховано","address":"","costs":"","costs_comment":"","space_units":""},{"space_comment":"","costs_rent_comment":"","region":"","costs_rent":"","space":"60,71","location_raw":"м. Житомир","address":"","costs":"","costs_comment":"","space_units":""}],"29":[{"space_comment":"","space":"14200","costs_rent_comment":"","region":"","costs_rent":"","costs_property_comment":"","address":"","space_units":"","location_raw":"Ярунська сільська рада","costs_property":""}],"31":[{"space_comment":"","space":"35,7","costs_rent_comment":"","region":"","costs_rent":"","costs_property_comment":"","address":"","space_units":"","location_raw":"м.Новоград-Волинський, приховано","costs_property":""},{"space_comment":"","space":"26,45","costs_rent_comment":"","region":"","costs_rent":"","costs_property_comment":"","address":"","space_units":"","location_raw":"приховано","costs_property":""}],"33":[{"space_comment":"","space":"29,9","costs_rent_comment":"","region":"","costs_rent":"","costs_property_comment":"","address":"","space_units":"","location_raw":"м. Новоград-Волинський","costs_property":""},{"space_comment":"","space":"25","costs_rent_comment":"","region":"","costs_rent":"","costs_property_comment":"","address":"","space_units":"","location_raw":"м.Житомир","costs_property":""}]},"liabilities":{"54":{"sum_foreign_comment":"","sum_comment":"","sum_foreign":"","sum":""},"55":{"sum_foreign_comment":"","sum_comment":"","sum_foreign":"","sum":"","sum_foreign_units":"","sum_units":""},"56":{"sum_foreign_comment":"","sum_comment":"","sum_foreign":"","sum":"80000"},"57":{"sum_foreign_comment":"","sum_comment":"","sum_foreign":"","sum":""},"58":{"sum_foreign_comment":"","sum_comment":"","sum_foreign":"","sum":""},"59":{"sum_foreign_comment":"","sum_comment":"","sum_foreign":"","sum":""},"60":{"sum_foreign_comment":"","sum_comment":"","sum_foreign":"","sum":""},"61":{"sum_foreign_comment":"","sum_comment":"","sum_foreign":"","sum":"","sum_foreign_units":"","sum_units":""},"62":{"sum_foreign_comment":"","sum_comment":"","sum_foreign":"","sum":"80000"},"63":{"sum_units":"","sum_foreign_comment":"","sum_comment":"","sum":"","sum_foreign":""},"64":{"sum_units":"","sum_foreign_comment":"","sum_comment":"","sum":"","sum_foreign":""}},"id":"6904","declaration":{"needs_scancopy_check":false,"notfull":"FALSE","additional_info_text":"На сторінці 2 в Розділ ІI. А. Одержані з усіх джерел в Україні.;В декларації Декларантом від руки дописано доходи отримані Декларантом і членами родини поза визначеними категоріями доходів:;Декларант ’Пенсія, стипендія членів сім’ї\" - 21487 грн.;;Члени сім’ї  ’Пенсія, стипендія членів сім’ї\" - 4716","url":"http://static.declarations.com.ua/declarations/sudy/apeliatsiini_administratyvni_sudy/zhytomyrskyi/yevpak_declaration.pdf","additional_info":"TRUE","notfull_lostpages":""},"ft_src":"80000\n80000\nFALSE\nНа сторінці 2 в Розділ ІI. А. Одержані з усіх джерел в Україні.;В декларації Декларантом від руки дописано доходи отримані Декларантом і членами родини поза визначеними категоріями доходів:;Декларант ’Пенсія, стипендія членів сім’ї\" - 21487 грн.;;Члени сім’ї  ’Пенсія, стипендія членів сім’ї\" - 4716\nTRUE\n799\n6000\n12617\n23281\n59096\n24080\n347596\n269883\nNissan,Qashqai\n2012\nNissan,Qashqai\n2012\nм. Новоград-Волинський\n29,9\nм.Житомир\n25\nЯрунська сільська рада\n14200\nм.Новоград-Волинський, приховано\n35,7\n26,45\nм. Новоград-Волинський\n26,45\n36,5\nм. Житомир\n60,71\nTRUE\nНа сторінці 2 в Розділ ІI. А. Одержані з усіх джерел в Україні.;В декларації Декларантом від руки дописано доходи отримані Декларантом і членами родини поза визначеними категоріями доходів:;Декларант ’Пенсія, стипендія членів сім’ї\" - 21487 грн.;;Члени сім’ї  ’Пенсія, стипендія членів сім’ї\" - 4716\nFALSE\nFALSE\n2013\n269883\n12617\n24080\n347596\n799\n6000\n23281\n59096\nNissan,Qashqai\n2012\nНа сторінці 2 в Розділ ІI. А. Одержані з усіх джерел в Україні.;В декларації Декларантом від руки дописано доходи отримані Декларантом і членами родини поза визначеними категоріями доходів:;Декларант ’Пенсія, стипендія членів сім’ї\" - 21487 грн.;;Члени сім’ї  ’Пенсія, стипендія членів сім’ї\" - 4716\nFALSE\nTRUE\nм. Новоград-Волинський\n29,9\nм.Житомир\n25\nм.Новоград-Волинський, приховано\n35,7\n26,45\nм. Новоград-Волинський\n26,45\n36,5\nм. Житомир\n60,71\nЯрунська сільська рада\n14200\nСуддя Житомирського апеляційного адміністративного суду\nЧоловік Євпак І.В.,;дочка Євпак О.І.\nЖитомирська\nЖитомир\nЄвпак\nЄвпак Валентина Василівна\nВалентина Василівна Євпак\nВалентина Євпак\nЄвпак Валентина Василівна\nВалентина\nЄвпак Валентина Василівна\nАпеляційний адміністративний суд\nСуддя\nЖитомирська область\nВасилівна\nЖитомирська обл., м. Житомир;інша інформація - прихована\n80000\n80000\n269883\n59096\n23281\n347596\n24080\n12617\n6000\n799\n2013\nFALSE\n80000\n80000\nЄвпак\nВасилівна\nЧоловік Євпак І.В.,;дочка Євпак О.І.\nЄвпак Валентина Василівна\nВалентина Василівна Євпак\nВалентина Євпак\nЄвпак Валентина Василівна\nВалентина\nСуддя Житомирського апеляційного адміністративного суду\nЖитомирська\nЖитомир\nСуддя\nЖитомирська область\nАпеляційний адміністративний суд\nЄвпак Валентина Василівна\nЖитомирська обл., м. Житомир;інша інформація - прихована\nм.Новоград-Волинський, приховано\n35,7\n26,45\nм. Новоград-Волинський\n29,9\nм.Житомир\n25\nм. Новоград-Волинський\n26,45\n36,5\nм. Житомир\n60,71\nЯрунська сільська рада\n14200\nЖитомир\nЖитомирська\nСуддя Житомирського апеляційного адміністративного суду\nСуддя\nЖитомирська область\nАпеляційний адміністративний суд\nВалентина\nЖитомирська обл., м. Житомир;інша інформація - прихована\nВасилівна\nЧоловік Євпак І.В.,;дочка Євпак О.І.\nЄвпак\nЄвпак Валентина Василівна\nЄвпак Валентина Василівна\nВалентина Василівна Євпак\nВалентина Євпак\nЄвпак Валентина Василівна\nFALSE\n2013","banks":{"45":[{"sum_foreign_comment":"","sum_comment":"","sum_foreign":"","sum":"","sum_foreign_units":"","sum_units":"UAH"},{"sum_foreign_comment":"","sum_comment":"","sum_foreign":"","sum":"","sum_foreign_units":"","sum_units":"USD"},{"sum_foreign_comment":"","sum_comment":"","sum_foreign":"","sum":"","sum_foreign_units":"","sum_units":"EUR"}],"46":[{"sum_foreign_comment":"","sum_comment":"","sum_foreign":"","sum":"","sum_foreign_units":"","sum_units":"UAH"},{"sum_foreign_comment":"","sum_comment":"","sum_foreign":"","sum":"","sum_foreign_units":"","sum_units":"USD"},{"sum_foreign_comment":"","sum_comment":"","sum_foreign":"","sum":"","sum_foreign_units":"","sum_units":"EUR"}],"47":[{"sum_foreign_comment":"","sum_comment":"","sum_foreign":"","sum":"","sum_foreign_units":"","sum_units":""}],"48":[{"sum_foreign_comment":"","sum_comment":"","sum_foreign":"","sum":"","sum_foreign_units":"","sum_units":""}],"49":[{"sum_foreign_comment":"","sum_comment":"","sum_foreign":"","sum":"","sum_foreign_units":"","sum_units":""}],"50":[{"sum_foreign_comment":"","sum_comment":"","sum_foreign":"","sum":"","sum_foreign_units":"","sum_units":""}],"51":[{"sum_foreign_comment":"","sum_comment":"","sum_foreign":"","sum":"","sum_foreign_units":"","sum_units":"UAH"},{"sum_foreign_comment":"","sum_comment":"","sum_foreign":"","sum":"","sum_foreign_units":"","sum_units":"USD"},{"sum_foreign_comment":"","sum_comment":"","sum_foreign":"","sum":"","sum_foreign_units":"","sum_units":"EUR"}],"52":[{"sum_foreign_comment":"","sum_comment":"","sum_foreign":"","sum":"","sum_foreign_units":"","sum_units":""}],"53":[{"sum_foreign_comment":"","sum_comment":"","sum_foreign":"","sum":"","sum_foreign_units":"","sum_units":""}]}}