{"income":{"5":{"family_comment":"","value":"156377","family":"55345","comment":""},"6":{"family_comment":"","value":"143361","family":"52845","comment":""},"7":{"family_comment":"","value":"0","source_name":"0","family":"0","comment":""},"8":{"family_comment":"","value":"0","family":"0","comment":""},"9":{"family_comment":"","value":"1546","family":"10","comment":""},"10":{"family_comment":"","value":"11470","family":"2490","comment":""},"11":{"family_comment":"","value":"0","family":"0","comment":""},"12":{"family_comment":"","value":"0","family":"0","comment":""},"13":{"family_comment":"","value":"0","family":"0","comment":""},"14":{"family_comment":"","value":"0","family":"0","comment":""},"15":{"family_comment":"","value":"0","family":"0","comment":""},"16":{"family_comment":"","value":"0","family":"0","comment":""},"17":{"family_comment":"","value":"0","family":"0","comment":""},"18":{"family_comment":"","value":"0","family":"0","comment":""},"19":{"family_comment":"","value":"0","family":"0","comment":""},"20":{"family_comment":"","value":"0","family":"0","comment":""},"21":[{"cur":"0","country":"0","uah_equal":"0","country_comment":""},{"cur":"0","country":"0","uah_equal":"0","country_comment":""},{"cur":"0","country":"0","uah_equal":"0","country_comment":""},{"cur":"0","country":"0","uah_equal":"0","country_comment":""},{"cur":"0","country":"0","uah_equal":"0","country_comment":""}],"22":[{"cur":"0","country":"0","uah_equal":"0","country_comment":""},{"cur":"0","country":"0","uah_equal":"0","country_comment":""},{"cur":"0","country":"0","uah_equal":"0","country_comment":""},{"cur":"0","country":"0","uah_equal":"0","country_comment":""},{"cur":"0","country":"0","uah_equal":"0","country_comment":""}]},"vehicle":{"40":[{"brand_info":"","sum_rent_comment":"","brand":"Toyota,Highlander","sum_comment":"","year":"2008","brand_hidden":false,"sum":"","sum_rent":""}]},"id":"7608","banks":{"45":[{"sum_foreign_comment":"","sum_units":"UAH","sum_comment":"","sum_foreign_units":"","sum":"36875","sum_foreign":""},{"sum_foreign_comment":"","sum_units":"USD","sum_comment":"","sum_foreign_units":"","sum":"","sum_foreign":""},{"sum_foreign_comment":"","sum_units":"EUR","sum_comment":"","sum_foreign_units":"","sum":"","sum_foreign":""}],"46":[{"sum_foreign_comment":"","sum_units":"UAH","sum_comment":"","sum_foreign_units":"","sum":"","sum_foreign":""},{"sum_foreign_comment":"","sum_units":"USD","sum_comment":"","sum_foreign_units":"","sum":"","sum_foreign":""},{"sum_foreign_comment":"","sum_units":"EUR","sum_comment":"","sum_foreign_units":"","sum":"","sum_foreign":""}],"47":[{"sum_foreign_comment":"","sum_units":"","sum_comment":"","sum_foreign_units":"","sum":"","sum_foreign":""}],"48":[{"sum_foreign_comment":"","sum_units":"","sum_comment":"","sum_foreign_units":"","sum":"","sum_foreign":""}],"49":[{"sum_foreign_comment":"","sum_units":"","sum_comment":"","sum_foreign_units":"","sum":"","sum_foreign":""}],"50":[{"sum_foreign_comment":"","sum_units":"","sum_comment":"","sum_foreign_units":"","sum":"","sum_foreign":""}],"51":[{"sum_foreign_comment":"","sum_units":"UAH","sum_comment":"","sum_foreign_units":"","sum":"1495","sum_foreign":""},{"sum_foreign_comment":"","sum_units":"USD","sum_comment":"","sum_foreign_units":"","sum":"","sum_foreign":""},{"sum_foreign_comment":"","sum_units":"EUR","sum_comment":"","sum_foreign_units":"","sum":"","sum_foreign":""}],"52":[{"sum_foreign_comment":"","sum_units":"","sum_comment":"","sum_foreign_units":"","sum":"","sum_foreign":""}],"53":[{"sum_foreign_comment":"","sum_units":"","sum_comment":"","sum_foreign_units":"","sum":"","sum_foreign":""}]},"declaration":{"needs_scancopy_check":false,"additional_info_text":"Сторінки непронумеровані - всього їх 10, можливо щось пропущено.;Розділ V.А пункт 45 - назва банку, ПАТ ’Райффайзен банк Аваль’;Розділ V.Б пункт 51 - вклади у 2-х банках,  ПАТ ’Райффайзен банк Аваль’ та ПАТ ’Фінбанк\"","notfull_lostpages":"","notfull":"TRUE","additional_info":"TRUE","url":"http://static.declarations.com.ua/declarations/sudy/mistsevi_sudy/okruzhni_administratyvni_sudy/m._kyiv/pogrebnichenko.pdf"},"liabilities":{"54":{"sum_foreign_comment":"","sum":"","sum_comment":"","sum_foreign":""},"55":{"sum_foreign_comment":"","sum_units":"","sum_comment":"","sum_foreign_units":"","sum":"","sum_foreign":""},"56":{"sum_foreign_comment":"","sum":"","sum_comment":"","sum_foreign":""},"57":{"sum_foreign_comment":"","sum":"","sum_comment":"","sum_foreign":""},"58":{"sum_foreign_comment":"","sum":"","sum_comment":"","sum_foreign":""},"59":{"sum_foreign_comment":"","sum":"","sum_comment":"","sum_foreign":""},"60":{"sum_foreign_comment":"","sum":"","sum_comment":"","sum_foreign":""},"61":{"sum_foreign_comment":"","sum_units":"","sum_comment":"","sum_foreign_units":"","sum":"","sum_foreign":""},"62":{"sum_foreign_comment":"","sum":"","sum_comment":"","sum_foreign":""},"63":{"sum_foreign_comment":"","sum_units":"","sum_comment":"","sum":"","sum_foreign":""},"64":{"sum_foreign_comment":"","sum_units":"","sum_comment":"","sum":"","sum_foreign":""}},"estate":{"23":[{"costs_rent":"","location_raw":"","region":"","costs":"","costs_rent_comment":"","costs_comment":"","space_comment":"","space_units":"","space":"","address":""},{"costs_rent":"","location_raw":"","region":"","costs":"","costs_rent_comment":"","costs_comment":"","space_comment":"","space_units":"","space":"","address":""},{"costs_rent":"","location_raw":"","region":"","costs":"","costs_rent_comment":"","costs_comment":"","space_comment":"","space_units":"","space":"","address":""}],"25":[{"costs_rent":"","location_raw":"приховано","region":"","costs":"","costs_rent_comment":"","costs_comment":"","space_comment":"","space_units":"","space":"46,4","address":""},{"costs_rent":"","location_raw":"приховано","region":"","costs":"","costs_rent_comment":"","costs_comment":"","space_comment":"","space_units":"","space":"126,8","address":""}]},"general":{"name_hidden":false,"name":"Ігор","patronymic_unclear":false,"last_name_hidden":false,"addresses_raw":"при ховано","post_raw":"Суддя Окружного адміністративного суду м.Києві","patronymic":"Миколайович","inn":"","family_raw":"Сестра","last_name":"Погрібніченко","post":{"office":"Адміністративний місцевий суд","region":"м. Київ","post":"Суддя"},"addresses_raw_hidden":true,"last_name_unclear":false,"full_name":"Погрібніченко Ігор Миколайович","patronymic_hidden":false,"full_name_suggest":{"output":"Погрібніченко Ігор Миколайович","input":["Погрібніченко Ігор Миколайович","Ігор Миколайович Погрібніченко","Ігор Погрібніченко"]},"name_unclear":false},"ft_src":"TRUE\nСторінки непронумеровані - всього їх 10, можливо щось пропущено.;Розділ V.А пункт 45 - назва банку, ПАТ ’Райффайзен банк Аваль’;Розділ V.Б пункт 51 - вклади у 2-х банках,  ПАТ ’Райффайзен банк Аваль’ та ПАТ ’Фінбанк\"\nTRUE\n2490\n11470\n55345\n156377\n10\n1546\n52845\n143361\nToyota,Highlander\n2008\nToyota,Highlander\n2008\n46,4\n126,8\n1495\n36875\nTRUE\nСторінки непронумеровані - всього їх 10, можливо щось пропущено.;Розділ V.А пункт 45 - назва банку, ПАТ ’Райффайзен банк Аваль’;Розділ V.Б пункт 51 - вклади у 2-х банках,  ПАТ ’Райффайзен банк Аваль’ та ПАТ ’Фінбанк\"\nTRUE\nFALSE\n2013\n52845\n143361\n2490\n11470\n55345\n156377\n10\n1546\nToyota,Highlander\n2008\nСторінки непронумеровані - всього їх 10, можливо щось пропущено.;Розділ V.А пункт 45 - назва банку, ПАТ ’Райффайзен банк Аваль’;Розділ V.Б пункт 51 - вклади у 2-х банках,  ПАТ ’Райффайзен банк Аваль’ та ПАТ ’Фінбанк\"\nTRUE\nTRUE\n46,4\n126,8\nСуддя Окружного адміністративного суду м.Києві\nСестра\nПогрібніченко\nПогрібніченко Ігор Миколайович\nІгор Миколайович Погрібніченко\nІгор Погрібніченко\nПогрібніченко Ігор Миколайович\nІгор\nПогрібніченко Ігор Миколайович\nАдміністративний місцевий суд\nСуддя\nм. Київ\nМиколайович\nпри ховано\n143361\n52845\n156377\n55345\n11470\n2490\n1546\n10\n36875\n1495\n2013\nFALSE\nПогрібніченко\nМиколайович\nСестра\nПогрібніченко Ігор Миколайович\nІгор Миколайович Погрібніченко\nІгор Погрібніченко\nПогрібніченко Ігор Миколайович\nІгор\nСуддя Окружного адміністративного суду м.Києві\nСуддя\nм. Київ\nАдміністративний місцевий суд\nПогрібніченко Ігор Миколайович\nпри ховано\n46,4\n126,8\nСуддя\nм. Київ\nАдміністративний місцевий суд\nСуддя Окружного адміністративного суду м.Києві\nІгор\nпри ховано\nМиколайович\nСестра\nПогрібніченко\nПогрібніченко Ігор Миколайович\nПогрібніченко Ігор Миколайович\nІгор Миколайович Погрібніченко\nІгор Погрібніченко\nПогрібніченко Ігор Миколайович\n36875\n1495\nFALSE\n2013","intro":{"declaration_year":"2013","isnotdeclaration":"FALSE"}}