{"intro":{"declaration_year":"2013","isnotdeclaration":"FALSE"},"general":{"full_name":"Юркевич Михайло Васильович","full_name_suggest":{"output":"Юркевич Михайло Васильович","input":["Юркевич Михайло Васильович","Михайло Васильович Юркевич","Михайло Юркевич"]},"family_raw":"Дружина Юркевич О.Я.;син Юркевич О.М.","post_raw":"Голова господарського суду Львівської області","last_name":"Юркевич","patronymic":"Васильович","name_unclear":false,"addresses":[{"place_address":"","place_district":"","place_city":"Львів","place_address_type":"","place_city_type":"","place":"Львівська"}],"last_name_hidden":false,"patronymic_unclear":false,"patronymic_hidden":false,"name":"Михайло","post":{"office":"Господарський місцевий суд","post":"Голова господарського суду Львівської області","region":"Львівська область"},"inn":"","addresses_raw_hidden":true,"last_name_unclear":false,"addresses_raw":"м.Львів","name_hidden":false},"vehicle":{"35":[{"brand_hidden":false,"sum_rent_comment":"","sum_comment":"придбано у 2008 році","brand":"Toyota,Land Cruiser Prado","brand_info":"","year":"2008","sum":"","sum_rent":""}],"40":[{"brand_hidden":false,"sum_rent_comment":"","sum_comment":"","brand":"Honda,CR-V","brand_info":"","year":"2008","sum":"","sum_rent":""}]},"income":{"5":{"family":"7197","value":"260512","family_comment":"","comment":""},"6":{"family":"0","value":"259286","family_comment":"","comment":""},"7":{"family":"0","source_name":"Львівський Національний університет ім, Ів, Франка","value":"1202","comment":"","family_comment":""},"8":{"family":"0","value":"0","family_comment":"","comment":""},"9":{"family":"0","value":"0","family_comment":"","comment":""},"10":{"family":"0","value":"0","family_comment":"","comment":""},"11":{"family":"0","value":"0","family_comment":"","comment":""},"12":{"family":"0","value":"0","family_comment":"","comment":""},"13":{"family":"0","value":"0","family_comment":"","comment":""},"14":{"family":"0","value":"0","family_comment":"","comment":""},"15":{"family":"0","value":"0","family_comment":"","comment":""},"16":{"family":"0","value":"0","family_comment":"","comment":""},"17":{"family":"0","value":"0","family_comment":"","comment":""},"18":{"family":"0","value":"0","family_comment":"","comment":""},"19":{"family":"0","value":"0","family_comment":"","comment":""},"20":{"family":"7197","value":"24","family_comment":"","comment":""},"21":[{"cur":"0","country":"0","uah_equal":"0","country_comment":""},{"cur":"0","country":"0","uah_equal":"0","country_comment":""},{"cur":"0","country":"0","uah_equal":"0","country_comment":""},{"cur":"0","country":"0","uah_equal":"0","country_comment":""},{"cur":"0","country":"0","uah_equal":"0","country_comment":""}],"22":[{"cur":"0","country":"0","uah_equal":"0","country_comment":""},{"cur":"0","country":"0","uah_equal":"0","country_comment":""},{"cur":"0","country":"0","uah_equal":"0","country_comment":""},{"cur":"0","country":"0","uah_equal":"0","country_comment":""},{"cur":"0","country":"0","uah_equal":"0","country_comment":""}]},"estate":{"23":[{"space_comment":"","costs_rent_comment":"","region":"","costs_rent":"","space":"","location_raw":"","address":"","costs":"","costs_comment":"","space_units":""},{"space_comment":"","costs_rent_comment":"","region":"","costs_rent":"","space":"","location_raw":"","address":"","costs":"","costs_comment":"","space_units":""},{"space_comment":"","costs_rent_comment":"","region":"","costs_rent":"","space":"","location_raw":"","address":"","costs":"","costs_comment":"","space_units":""}],"25":[{"space_comment":"","costs_rent_comment":"","region":"","costs_rent":"","space":"70,2","location_raw":"Україна, м.Львів","address":"","costs":"","costs_comment":"","space_units":""}],"31":[{"space_comment":"","space":"28","costs_rent_comment":"","region":"","costs_rent":"","costs_property_comment":"","address":"","space_units":"","location_raw":"","costs_property":""},{"space_comment":"","space":"","costs_rent_comment":"","region":"","costs_rent":"","costs_property_comment":"","address":"","space_units":"","location_raw":"Україна, м.Івано-Франківськ","costs_property":""}]},"liabilities":{"54":{"sum_foreign_comment":"","sum_comment":"","sum_foreign":"","sum":"17858"},"55":{"sum_foreign_comment":"","sum_comment":"","sum_foreign":"","sum":"","sum_foreign_units":"","sum_units":""},"56":{"sum_foreign_comment":"","sum_comment":"","sum_foreign":"","sum":"12940"},"57":{"sum_foreign_comment":"","sum_comment":"","sum_foreign":"","sum":""},"58":{"sum_foreign_comment":"","sum_comment":"","sum_foreign":"","sum":""},"59":{"sum_foreign_comment":"","sum_comment":"","sum_foreign":"","sum":""},"60":{"sum_foreign_comment":"","sum_comment":"","sum_foreign":"","sum":"3992"},"61":{"sum_foreign_comment":"","sum_comment":"","sum_foreign":"","sum":"","sum_foreign_units":"","sum_units":""},"62":{"sum_foreign_comment":"","sum_comment":"","sum_foreign":"","sum":"5320"},"63":{"sum_units":"","sum_foreign_comment":"","sum_comment":"","sum":"","sum_foreign":""},"64":{"sum_units":"","sum_foreign_comment":"","sum_comment":"","sum":"","sum_foreign":""}},"id":"8153","declaration":{"needs_scancopy_check":false,"notfull":"FALSE","additional_info_text":"Не вносила невідповідну інформацію:;сторінка 3 розділ ІІІ пункт 25 Квартири - у графі ’Сума витрат (грн)’ вказано ’придбано у 2008 році’ - не сума;сторінка 4 розділ ІV пункт 35 Автомобілі - у графі ’Сума витрат (грн)’ вказано ’придбано у 2008 році’ - не сума","url":"http://static.declarations.com.ua/declarations/sudy/hospodarski_mistsevi_sudy/lvivska_oblast/jurkevich.pdf","additional_info":"TRUE","notfull_lostpages":""},"ft_src":"5320\n17858\n12940\n3992\nFALSE\nНе вносила невідповідну інформацію:;сторінка 3 розділ ІІІ пункт 25 Квартири - у графі ’Сума витрат (грн)’ вказано ’придбано у 2008 році’ - не сума;сторінка 4 розділ ІV пункт 35 Автомобілі - у графі ’Сума витрат (грн)’ вказано ’придбано у 2008 році’ - не сума\nTRUE\n7197\n24\nЛьвівський Національний університет ім, Ів, Франка\n1202\n7197\n260512\n259286\nпридбано у 2008 році\nToyota,Land Cruiser Prado\n2008\nHonda,CR-V\n2008\nпридбано у 2008 році\nToyota,Land Cruiser Prado\n2008\nHonda,CR-V\n2008\n28\nУкраїна, м.Івано-Франківськ\nУкраїна, м.Львів\n70,2\nTRUE\nНе вносила невідповідну інформацію:;сторінка 3 розділ ІІІ пункт 25 Квартири - у графі ’Сума витрат (грн)’ вказано ’придбано у 2008 році’ - не сума;сторінка 4 розділ ІV пункт 35 Автомобілі - у графі ’Сума витрат (грн)’ вказано ’придбано у 2008 році’ - не сума\nFALSE\nFALSE\n2013\n259286\n1202\nЛьвівський Національний університет ім, Ів, Франка\n7197\n260512\n7197\n24\nToyota,Land Cruiser Prado\n2008\nпридбано у 2008 році\nHonda,CR-V\n2008\nНе вносила невідповідну інформацію:;сторінка 3 розділ ІІІ пункт 25 Квартири - у графі ’Сума витрат (грн)’ вказано ’придбано у 2008 році’ - не сума;сторінка 4 розділ ІV пункт 35 Автомобілі - у графі ’Сума витрат (грн)’ вказано ’придбано у 2008 році’ - не сума\nFALSE\nTRUE\n28\nУкраїна, м.Івано-Франківськ\nУкраїна, м.Львів\n70,2\nГолова господарського суду Львівської області\nДружина Юркевич О.Я.;син Юркевич О.М.\nЛьвівська\nЛьвів\nЮркевич\nЮркевич Михайло Васильович\nМихайло Васильович Юркевич\nМихайло Юркевич\nЮркевич Михайло Васильович\nМихайло\nЮркевич Михайло Васильович\nГосподарський місцевий суд\nГолова господарського суду Львівської області\nЛьвівська область\nВасильович\nм.Львів\n3992\n12940\n5320\n17858\nЛьвівський Національний університет ім, Ів, Франка\n1202\n259286\n24\n7197\n260512\n7197\n2013\nFALSE\n12940\n5320\n17858\n3992\nЮркевич\nВасильович\nДружина Юркевич О.Я.;син Юркевич О.М.\nЮркевич Михайло Васильович\nМихайло Васильович Юркевич\nМихайло Юркевич\nЮркевич Михайло Васильович\nМихайло\nГолова господарського суду Львівської області\nЛьвівська\nЛьвів\nГолова господарського суду Львівської області\nЛьвівська область\nГосподарський місцевий суд\nЮркевич Михайло Васильович\nм.Львів\n28\nУкраїна, м.Івано-Франківськ\nУкраїна, м.Львів\n70,2\nЛьвів\nЛьвівська\nГолова господарського суду Львівської області\nГолова господарського суду Львівської області\nЛьвівська область\nГосподарський місцевий суд\nМихайло\nм.Львів\nВасильович\nДружина Юркевич О.Я.;син Юркевич О.М.\nЮркевич\nЮркевич Михайло Васильович\nЮркевич Михайло Васильович\nМихайло Васильович Юркевич\nМихайло Юркевич\nЮркевич Михайло Васильович\nFALSE\n2013","banks":{"45":[{"sum_foreign_comment":"","sum_comment":"","sum_foreign":"","sum":"","sum_foreign_units":"","sum_units":"UAH"},{"sum_foreign_comment":"","sum_comment":"","sum_foreign":"","sum":"","sum_foreign_units":"","sum_units":"USD"},{"sum_foreign_comment":"","sum_comment":"","sum_foreign":"","sum":"","sum_foreign_units":"","sum_units":"EUR"}],"46":[{"sum_foreign_comment":"","sum_comment":"","sum_foreign":"","sum":"","sum_foreign_units":"","sum_units":"UAH"},{"sum_foreign_comment":"","sum_comment":"","sum_foreign":"","sum":"","sum_foreign_units":"","sum_units":"USD"},{"sum_foreign_comment":"","sum_comment":"","sum_foreign":"","sum":"","sum_foreign_units":"","sum_units":"EUR"}],"47":[{"sum_foreign_comment":"","sum_comment":"","sum_foreign":"","sum":"","sum_foreign_units":"","sum_units":""}],"48":[{"sum_foreign_comment":"","sum_comment":"","sum_foreign":"","sum":"","sum_foreign_units":"","sum_units":""}],"49":[{"sum_foreign_comment":"","sum_comment":"","sum_foreign":"","sum":"","sum_foreign_units":"","sum_units":""}],"50":[{"sum_foreign_comment":"","sum_comment":"","sum_foreign":"","sum":"","sum_foreign_units":"","sum_units":""}],"51":[{"sum_foreign_comment":"","sum_comment":"","sum_foreign":"","sum":"","sum_foreign_units":"","sum_units":"UAH"},{"sum_foreign_comment":"","sum_comment":"","sum_foreign":"","sum":"","sum_foreign_units":"","sum_units":"USD"},{"sum_foreign_comment":"","sum_comment":"","sum_foreign":"","sum":"","sum_foreign_units":"","sum_units":"EUR"}],"52":[{"sum_foreign_comment":"","sum_comment":"","sum_foreign":"","sum":"","sum_foreign_units":"","sum_units":""}],"53":[{"sum_foreign_comment":"","sum_comment":"","sum_foreign":"","sum":"","sum_foreign_units":"","sum_units":""}]}}