{"intro":{"declaration_year":"2013","isnotdeclaration":"FALSE"},"general":{"full_name":"Каракашьян Сергій Костянтинович","full_name_suggest":{"output":"Каракашьян Сергій Костянтинович","input":["Каракашьян Сергій Костянтинович","Сергій Костянтинович Каракашьян","Сергій Каракашьян"]},"family_raw":"Дружина : ПІБ- приховано, дата народження - приховано; інші дані - приховано.;Мати : ПІБ- приховано, дата народження - приховано; інші дані - приховано.;Дочка : ПІБ- приховано, дата народження - приховано; інші дані - приховано.","post_raw":"Суддя Окружного адміністративного суду міста Києва","last_name":"Каракашьян","patronymic":"Костянтинович","name_unclear":false,"last_name_unclear":false,"last_name_hidden":false,"patronymic_unclear":false,"patronymic_hidden":false,"name":"Сергій","post":{"office":"Адміністративний місцевий суд","post":"Суддя","region":"м. Київ"},"inn":"","addresses_raw_hidden":true,"addresses_raw":"приховано","name_hidden":false},"vehicle":{"35":[{"brand_hidden":false,"sum_rent_comment":"","sum_comment":"","brand":"Volkswagen,Golf","brand_info":"","year":"1999","sum":"","sum_rent":""}]},"income":{"5":{"family":"70518","value":"204189","family_comment":"","comment":""},"6":{"family":"38598","value":"191147","family_comment":"","comment":""},"7":{"family":"0","source_name":"0","value":"0","comment":"","family_comment":""},"8":{"family":"0","value":"0","family_comment":"","comment":""},"9":{"family":"0","value":"0","family_comment":"","comment":""},"10":{"family":"1560","value":"0","family_comment":"","comment":""},"11":{"family":"0","value":"0","family_comment":"","comment":""},"12":{"family":"0","value":"0","family_comment":"","comment":""},"13":{"family":"0","value":"0","family_comment":"","comment":""},"14":{"family":"0","value":"0","family_comment":"","comment":""},"15":{"family":"0","value":"0","family_comment":"","comment":""},"16":{"family":"0","value":"0","family_comment":"","comment":""},"17":{"family":"0","value":"0","family_comment":"","comment":""},"18":{"family":"0","value":"0","family_comment":"","comment":""},"19":{"family":"0","value":"0","family_comment":"","comment":""},"20":{"family":"30360","value":"13042","family_comment":"","comment":""},"21":[{"cur":"0","country":"0","uah_equal":"0","country_comment":""},{"cur":"0","country":"0","uah_equal":"0","country_comment":""},{"cur":"0","country":"0","uah_equal":"0","country_comment":""},{"cur":"0","country":"0","uah_equal":"0","country_comment":""},{"cur":"0","country":"0","uah_equal":"0","country_comment":""}],"22":[{"cur":"0","country":"0","uah_equal":"0","country_comment":""},{"cur":"0","country":"0","uah_equal":"0","country_comment":""},{"cur":"0","country":"0","uah_equal":"0","country_comment":""},{"cur":"0","country":"0","uah_equal":"0","country_comment":""},{"cur":"0","country":"0","uah_equal":"0","country_comment":""}]},"estate":{"23":[{"space_comment":"","costs_rent_comment":"","region":"","costs_rent":"","space":"1500","location_raw":"приховано","address":"","costs":"","costs_comment":"","space_units":""},{"space_comment":"","costs_rent_comment":"","region":"","costs_rent":"","space":"","location_raw":"","address":"","costs":"","costs_comment":"","space_units":""},{"space_comment":"","costs_rent_comment":"","region":"","costs_rent":"","space":"","location_raw":"","address":"","costs":"","costs_comment":"","space_units":""}],"25":[{"space_comment":"","costs_rent_comment":"","region":"","costs_rent":"","space":"22,5","location_raw":"приховано","address":"","costs":"","costs_comment":"","space_units":""}],"29":[{"space_comment":"","space":"1000","costs_rent_comment":"","region":"","costs_rent":"","costs_property_comment":"","address":"","space_units":"","location_raw":"приховано","costs_property":""},{"space_comment":"","space":"2000","costs_rent_comment":"","region":"","costs_rent":"","costs_property_comment":"","address":"","space_units":"","location_raw":"приховано","costs_property":""}],"31":[{"space_comment":"","space":"22,5","costs_rent_comment":"","region":"","costs_rent":"","costs_property_comment":"","address":"","space_units":"","location_raw":"приховано","costs_property":""}]},"liabilities":{"54":{"sum_foreign_comment":"","sum_comment":"","sum_foreign":"","sum":"4145"},"55":{"sum_foreign_comment":"","sum_comment":"","sum_foreign":"","sum":"","sum_foreign_units":"","sum_units":""},"56":{"sum_foreign_comment":"","sum_comment":"","sum_foreign":"","sum":"3521"},"57":{"sum_foreign_comment":"","sum_comment":"","sum_foreign":"","sum":"24725"},"58":{"sum_foreign_comment":"","sum_comment":"","sum_foreign":"","sum":"8926"},"59":{"sum_foreign_comment":"","sum_comment":"","sum_foreign":"","sum":""},"60":{"sum_foreign_comment":"","sum_comment":"","sum_foreign":"","sum":""},"61":{"sum_foreign_comment":"","sum_comment":"","sum_foreign":"","sum":"","sum_foreign_units":"","sum_units":""},"62":{"sum_foreign_comment":"","sum_comment":"","sum_foreign":"","sum":""},"63":{"sum_units":"","sum_foreign_comment":"","sum_comment":"","sum":"","sum_foreign":""},"64":{"sum_units":"","sum_foreign_comment":"","sum_comment":"","sum":"","sum_foreign":""}},"id":"840","declaration":{"needs_scancopy_check":false,"notfull":"FALSE","additional_info_text":"","url":"http://static.declarations.com.ua/declarations/sudy/mistsevi_sudy/okruzhni_administratyvni_sudy/m._kyiv/karakashyan.pdf","additional_info":"FALSE","notfull_lostpages":""},"ft_src":"24725\n4145\n8926\n3521\nFALSE\nFALSE\n1560\n30360\n13042\n70518\n204189\n38598\n191147\nVolkswagen,Golf\n1999\nVolkswagen,Golf\n1999\n1500\n1000\n2000\n22,5\n22,5\n693\n1920\n693\n765\nFALSE\nFALSE\nFALSE\n2013\n38598\n191147\n1560\n70518\n204189\n30360\n13042\nVolkswagen,Golf\n1999\nFALSE\nFALSE\n1500\n1000\n2000\n22,5\n22,5\nСуддя Окружного адміністративного суду міста Києва\nДружина : ПІБ- приховано, дата народження - приховано; інші дані - приховано.;Мати : ПІБ- приховано, дата народження - приховано; інші дані - приховано.;Дочка : ПІБ- приховано, дата народження - приховано; інші дані - приховано.\nКаракашьян\nКаракашьян Сергій Костянтинович\nСергій Костянтинович Каракашьян\nСергій Каракашьян\nКаракашьян Сергій Костянтинович\nСергій\nКаракашьян Сергій Костянтинович\nАдміністративний місцевий суд\nСуддя\nм. Київ\nКостянтинович\n24725\n3521\n8926\n4145\n191147\n38598\n13042\n30360\n204189\n70518\n1560\n693\n1920\n765\n693\n2013\nFALSE\n8926\n24725\n3521\n4145\nКаракашьян\nКостянтинович\nДружина : ПІБ- приховано, дата народження - приховано; інші дані - приховано.;Мати : ПІБ- приховано, дата народження - приховано; інші дані - приховано.;Дочка : ПІБ- приховано, дата народження - приховано; інші дані - приховано.\nКаракашьян Сергій Костянтинович\nСергій Костянтинович Каракашьян\nСергій Каракашьян\nКаракашьян Сергій Костянтинович\nСергій\nСуддя Окружного адміністративного суду міста Києва\nСуддя\nм. Київ\nАдміністративний місцевий суд\nКаракашьян Сергій Костянтинович\n22,5\n1500\n22,5\n1000\n2000\nСуддя\nм. Київ\nАдміністративний місцевий суд\nСуддя Окружного адміністративного суду міста Києва\nСергій\nКостянтинович\nДружина : ПІБ- приховано, дата народження - приховано; інші дані - приховано.;Мати : ПІБ- приховано, дата народження - приховано; інші дані - приховано.;Дочка : ПІБ- приховано, дата народження - приховано; інші дані - приховано.\nКаракашьян\nКаракашьян Сергій Костянтинович\nКаракашьян Сергій Костянтинович\nСергій Костянтинович Каракашьян\nСергій Каракашьян\nКаракашьян Сергій Костянтинович\n693\n693\n765\n1920\nFALSE\n2013","banks":{"45":[{"sum_foreign_comment":"","sum_comment":"","sum_foreign":"","sum":"693","sum_foreign_units":"","sum_units":"UAH"},{"sum_foreign_comment":"","sum_comment":"","sum_foreign":"","sum":"","sum_foreign_units":"","sum_units":"USD"},{"sum_foreign_comment":"","sum_comment":"","sum_foreign":"","sum":"","sum_foreign_units":"","sum_units":"EUR"}],"46":[{"sum_foreign_comment":"","sum_comment":"","sum_foreign":"","sum":"693","sum_foreign_units":"","sum_units":"UAH"},{"sum_foreign_comment":"","sum_comment":"","sum_foreign":"","sum":"","sum_foreign_units":"","sum_units":"USD"},{"sum_foreign_comment":"","sum_comment":"","sum_foreign":"","sum":"","sum_foreign_units":"","sum_units":"EUR"}],"47":[{"sum_foreign_comment":"","sum_comment":"","sum_foreign":"","sum":"","sum_foreign_units":"","sum_units":""}],"48":[{"sum_foreign_comment":"","sum_comment":"","sum_foreign":"","sum":"","sum_foreign_units":"","sum_units":""}],"49":[{"sum_foreign_comment":"","sum_comment":"","sum_foreign":"","sum":"","sum_foreign_units":"","sum_units":""}],"50":[{"sum_foreign_comment":"","sum_comment":"","sum_foreign":"","sum":"","sum_foreign_units":"","sum_units":""}],"51":[{"sum_foreign_comment":"","sum_comment":"","sum_foreign":"","sum":"1920","sum_foreign_units":"","sum_units":"UAH"},{"sum_foreign_comment":"","sum_comment":"","sum_foreign":"","sum":"","sum_foreign_units":"","sum_units":"USD"},{"sum_foreign_comment":"","sum_comment":"","sum_foreign":"","sum":"","sum_foreign_units":"","sum_units":"EUR"}],"52":[{"sum_foreign_comment":"","sum_comment":"","sum_foreign":"","sum":"765","sum_foreign_units":"","sum_units":""}],"53":[{"sum_foreign_comment":"","sum_comment":"","sum_foreign":"","sum":"","sum_foreign_units":"","sum_units":""}]}}