{"ft_src":"с.Займице Бориспільського району Київської області\n1200\nм.Київ\n41,5\nFALSE\nFALSE\nFALSE\n2013\n117081\n12324\n129405\nFALSE\nFALSE\nс.Займице Бориспільського району Київської області\n1200\nм.Київ\n41,5\nНачальник відділу з пит. місцевого самоврядування та адміністративно-територіального устрою Управління констит.-го та адміністр-го закон-ва Департаменту конституц-го, адміністр.-го та соціального законодавства\nДонька- Булгакова О.П.;син-Булгаков Д.П.\nКиївська\nКиїв\nБулгакова\nБулгакова Ганна Володимирівна\nГанна Володимирівна Булгакова\nГанна Булгакова\nБулгакова Ганна Володимирівна\nГанна\nБулгакова Ганна Володимирівна\nМіністерство юстиції\nНачальник відділу з пит. місцевого самоврядування та адміністративно-територіального устрою Управління констит.-го та адміністр-го закон-ва Департаменту конституц-го, адміністр.-го та соціального законодавства\nЗагальнодержавний регіон\nВолодимирівна\nм.Київ приховано\n117081\n129405\n12324\n2013\nFALSE\nБулгакова\nВолодимирівна\nДонька- Булгакова О.П.;син-Булгаков Д.П.\nБулгакова Ганна Володимирівна\nГанна Володимирівна Булгакова\nГанна Булгакова\nБулгакова Ганна Володимирівна\nГанна\nНачальник відділу з пит. місцевого самоврядування та адміністративно-територіального устрою Управління констит.-го та адміністр-го закон-ва Департаменту конституц-го, адміністр.-го та соціального законодавства\nКиївська\nКиїв\nНачальник відділу з пит. місцевого самоврядування та адміністративно-територіального устрою Управління констит.-го та адміністр-го закон-ва Департаменту конституц-го, адміністр.-го та соціального законодавства\nЗагальнодержавний регіон\nМіністерство юстиції\nБулгакова Ганна Володимирівна\nм.Київ приховано","estate":{"23":[{"costs":"","address":"","space_units":"","costs_rent_comment":"","space":"1200","costs_comment":"","costs_rent":"","space_comment":"","region":"","location_raw":"с.Займице Бориспільського району Київської області"},{"costs":"","address":"","space_units":"","costs_rent_comment":"","space":"","costs_comment":"","costs_rent":"","space_comment":"","region":"","location_raw":""},{"costs":"","address":"","space_units":"","costs_rent_comment":"","space":"","costs_comment":"","costs_rent":"","space_comment":"","region":"","location_raw":""}],"25":[{"costs":"","address":"","space_units":"","costs_rent_comment":"","space":"41,5","costs_comment":"","costs_rent":"","space_comment":"","region":"","location_raw":"м.Київ"}]},"id":"8645","income":{"5":{"family_comment":"","value":"129405","family":"0","comment":""},"6":{"family_comment":"","value":"117081","family":"0","comment":""},"7":{"family":"0","family_comment":"","value":"0","comment":"","source_name":"0"},"8":{"family_comment":"","value":"0","family":"0","comment":""},"9":{"family_comment":"","value":"0","family":"0","comment":""},"10":{"family_comment":"","value":"12324","family":"0","comment":""},"11":{"family_comment":"","value":"0","family":"0","comment":""},"12":{"family_comment":"","value":"0","family":"0","comment":""},"13":{"family_comment":"","value":"0","family":"0","comment":""},"14":{"family_comment":"","value":"0","family":"0","comment":""},"15":{"family_comment":"","value":"0","family":"0","comment":""},"16":{"family_comment":"","value":"0","family":"0","comment":""},"17":{"family_comment":"","value":"0","family":"0","comment":""},"18":{"family_comment":"","value":"0","family":"0","comment":""},"19":{"family_comment":"","value":"0","family":"0","comment":""},"20":{"family_comment":"","value":"0","family":"0","comment":""},"21":[{"country_comment":"","uah_equal":"0","country":"0","cur":"0"},{"country_comment":"","uah_equal":"0","country":"0","cur":"0"},{"country_comment":"","uah_equal":"0","country":"0","cur":"0"},{"country_comment":"","uah_equal":"0","country":"0","cur":"0"},{"country_comment":"","uah_equal":"0","country":"0","cur":"0"}],"22":[{"country_comment":"","uah_equal":"0","country":"0","cur":"0"},{"country_comment":"","uah_equal":"0","country":"0","cur":"0"},{"country_comment":"","uah_equal":"0","country":"0","cur":"0"},{"country_comment":"","uah_equal":"0","country":"0","cur":"0"},{"country_comment":"","uah_equal":"0","country":"0","cur":"0"}]},"banks":{"45":[{"sum_units":"UAH","sum_comment":"","sum_foreign_units":"","sum":"","sum_foreign_comment":"","sum_foreign":""},{"sum_units":"USD","sum_comment":"","sum_foreign_units":"","sum":"","sum_foreign_comment":"","sum_foreign":""},{"sum_units":"EUR","sum_comment":"","sum_foreign_units":"","sum":"","sum_foreign_comment":"","sum_foreign":""}],"46":[{"sum_units":"UAH","sum_comment":"","sum_foreign_units":"","sum":"","sum_foreign_comment":"","sum_foreign":""},{"sum_units":"USD","sum_comment":"","sum_foreign_units":"","sum":"","sum_foreign_comment":"","sum_foreign":""},{"sum_units":"EUR","sum_comment":"","sum_foreign_units":"","sum":"","sum_foreign_comment":"","sum_foreign":""}],"47":[{"sum_units":"","sum_comment":"","sum_foreign_units":"","sum":"","sum_foreign_comment":"","sum_foreign":""}],"48":[{"sum_units":"","sum_comment":"","sum_foreign_units":"","sum":"","sum_foreign_comment":"","sum_foreign":""}],"49":[{"sum_units":"","sum_comment":"","sum_foreign_units":"","sum":"","sum_foreign_comment":"","sum_foreign":""}],"50":[{"sum_units":"","sum_comment":"","sum_foreign_units":"","sum":"","sum_foreign_comment":"","sum_foreign":""}],"51":[{"sum_units":"UAH","sum_comment":"","sum_foreign_units":"","sum":"","sum_foreign_comment":"","sum_foreign":""},{"sum_units":"USD","sum_comment":"","sum_foreign_units":"","sum":"","sum_foreign_comment":"","sum_foreign":""},{"sum_units":"EUR","sum_comment":"","sum_foreign_units":"","sum":"","sum_foreign_comment":"","sum_foreign":""}],"52":[{"sum_units":"","sum_comment":"","sum_foreign_units":"","sum":"","sum_foreign_comment":"","sum_foreign":""}],"53":[{"sum_units":"","sum_comment":"","sum_foreign_units":"","sum":"","sum_foreign_comment":"","sum_foreign":""}]},"declaration":{"notfull_lostpages":"","additional_info_text":"","additional_info":"FALSE","notfull":"FALSE","url":"http://static.declarations.com.ua/lustration/5475e0ba0ed44.pdf","needs_scancopy_check":false},"general":{"family_raw":"Донька- Булгакова О.П.;син-Булгаков Д.П.","name":"Ганна","full_name_suggest":{"input":["Булгакова Ганна Володимирівна","Ганна Володимирівна Булгакова","Ганна Булгакова"],"output":"Булгакова Ганна Володимирівна"},"post_raw":"Начальник відділу з пит. місцевого самоврядування та адміністративно-територіального устрою Управління констит.-го та адміністр-го закон-ва Департаменту конституц-го, адміністр.-го та соціального законодавства","name_unclear":false,"patronymic":"Володимирівна","patronymic_unclear":false,"last_name_hidden":false,"patronymic_hidden":false,"inn":"","addresses_raw_hidden":true,"last_name":"Булгакова","full_name":"Булгакова Ганна Володимирівна","post":{"office":"Міністерство юстиції","region":"Загальнодержавний регіон","post":"Начальник відділу з пит. місцевого самоврядування та адміністративно-територіального устрою Управління констит.-го та адміністр-го закон-ва Департаменту конституц-го, адміністр.-го та соціального законодавства"},"addresses":[{"place_district":"","place_city_type":"","place_address_type":"","place":"Київська","place_address":"","place_city":"Київ"}],"name_hidden":false,"last_name_unclear":false,"addresses_raw":"м.Київ приховано"},"liabilities":{"54":{"sum_comment":"","sum_foreign_comment":"","sum_foreign":"","sum":""},"55":{"sum_units":"","sum_comment":"","sum_foreign_units":"","sum":"","sum_foreign_comment":"","sum_foreign":""},"56":{"sum_comment":"","sum_foreign_comment":"","sum_foreign":"","sum":""},"57":{"sum_comment":"","sum_foreign_comment":"","sum_foreign":"","sum":""},"58":{"sum_comment":"","sum_foreign_comment":"","sum_foreign":"","sum":""},"59":{"sum_comment":"","sum_foreign_comment":"","sum_foreign":"","sum":""},"60":{"sum_comment":"","sum_foreign_comment":"","sum_foreign":"","sum":""},"61":{"sum_units":"","sum_comment":"","sum_foreign_units":"","sum":"","sum_foreign_comment":"","sum_foreign":""},"62":{"sum_comment":"","sum_foreign_comment":"","sum_foreign":"","sum":""},"63":{"sum_comment":"","sum_units":"","sum_foreign":"","sum":"","sum_foreign_comment":""},"64":{"sum_comment":"","sum_units":"","sum_foreign":"","sum":"","sum_foreign_comment":""}},"intro":{"isnotdeclaration":"FALSE","declaration_year":"2013"}}