[{"ft_src":"Mitsubishi,Lancer\n2008\nMitsubishi,Lancer\n2005\n600\n600\n1363\n450\n1000\n10000\n350\n357\n134480\n338312\nFALSE\n1. кілька полів, а саме: і, 4 ’реєстраціний номер облікової карти платника податків, серія та номер паспорта...’, 2 ’Місце проживання’, 23, 24, 29, 30 ’Місцезнаходження об’єкта (нерухомість)’ — перекрито рівними білими прямокутниками. Я позначив це приховано;;2. поля 8 ’авторська винагорода, інші доходи від реалізації майнових прав інтелектуальної власності’ , 10 ’матеріальна допомога (членів сім’ї)’, 46 ’вкладених у звітному році’, 51 ’у тому числі за кордоном’, 55 ’недержавне пенсійне забезпечення’ порожні — без даних і без прочерка.;;3. поряд із ’Сумою коштів на рахунках у банках’ вказано банк — АТ ’Дельта Банк’. Я це проігнорував\nFALSE\nFALSE\n2013\n59679\n244992\n12617\n67498\n274130\n7818\n16520\nMitsubishi,Lancer\n2008\nMitsubishi,Lancer\n2005\n1. кілька полів, а саме: і, 4 ’реєстраціний номер облікової карти платника податків, серія та номер паспорта...’, 2 ’Місце проживання’, 23, 24, 29, 30 ’Місцезнаходження об’єкта (нерухомість)’ — перекрито рівними білими прямокутниками. Я позначив це приховано;;2. поля 8 ’авторська винагорода, інші доходи від реалізації майнових прав інтелектуальної власності’ , 10 ’матеріальна допомога (членів сім’ї)’, 46 ’вкладених у звітному році’, 51 ’у тому числі за кордоном’, 55 ’недержавне пенсійне забезпечення’ порожні — без даних і без прочерка.;;3. поряд із ’Сумою коштів на рахунках у банках’ вказано банк — АТ ’Дельта Банк’. Я це проігнорував\nFALSE\nFALSE\n600\n600\n1363\n1000\n10000\n350\n450\nСуддя апеляційного суду Закарпатської області\nЧоловік Боднар Василь Йосипович, 24.07.1954р.\nБоднар\nБоднар Оксана Василівна\nОксана Василівна Боднар\nОксана Боднар\nБоднар Оксана Василівна\nОксана\nБоднар Оксана Василівна\nЗагальний апеляційний суд\nСуддя\nЗакарпатська область\nВасилівна\n244992\n59679\n274130\n67498\n12617\n16520\n7818\n338312\n134480\n357\n2013\nFALSE\nБоднар\nВасилівна\nЧоловік Боднар Василь Йосипович, 24.07.1954р.\nБоднар Оксана Василівна\nОксана Василівна Боднар\nОксана Боднар\nБоднар Оксана Василівна\nОксана\nСуддя апеляційного суду Закарпатської області\nСуддя\nЗакарпатська область\nЗагальний апеляційний суд\nБоднар Оксана Василівна","estate":{"23":[{"costs":"","address":"","space_units":"","costs_rent_comment":"","space":"600","costs_comment":"","costs_rent":"","space_comment":"","region":"","location_raw":"приховано"},{"costs":"","address":"","space_units":"","costs_rent_comment":"","space":"600","costs_comment":"","costs_rent":"","space_comment":"","region":"","location_raw":"приховано"},{"costs":"","address":"","space_units":"","costs_rent_comment":"","space":"1363","costs_comment":"","costs_rent":"","space_comment":"","region":"","location_raw":"приховано"}],"24":[{"costs":"","address":"","space_units":"","costs_rent_comment":"","space":"350","costs_comment":"","costs_rent":"","space_comment":"","region":"","location_raw":"приховано"}],"29":[{"costs_property_comment":"","address":"","space_units":"","costs_rent_comment":"","space":"1000","space_comment":"","costs_property":"","region":"","location_raw":"приховано","costs_rent":""},{"costs_property_comment":"","address":"","space_units":"","costs_rent_comment":"","space":"10000","space_comment":"","costs_property":"","region":"","location_raw":"приховано","costs_rent":""}],"30":[{"costs_property_comment":"","address":"","space_units":"","costs_rent_comment":"","space":"450","space_comment":"","costs_property":"","region":"","location_raw":"приховано","costs_rent":""}]},"vehicle":{"35":[{"sum_comment":"","brand_info":"","sum":"","sum_rent_comment":"","year":"2008","brand":"Mitsubishi,Lancer","sum_rent":"","brand_hidden":false}],"40":[{"sum_comment":"","brand_info":"","sum":"","sum_rent_comment":"","year":"2005","brand":"Mitsubishi,Lancer","sum_rent":"","brand_hidden":false}]},"id":"5387","income":{"5":{"family_comment":"","value":"274130","family":"67498","comment":""},"6":{"family_comment":"","value":"244992","family":"59679","comment":""},"7":{"family":"0","family_comment":"","value":"0","comment":"","source_name":"0"},"8":{"family_comment":"","value":"0","family":"0","comment":""},"9":{"family_comment":"","value":"16520","family":"7818","comment":""},"10":{"family_comment":"","value":"12617","family":"0","comment":""},"11":{"family_comment":"","value":"0","family":"0","comment":""},"12":{"family_comment":"","value":"0","family":"0","comment":""},"13":{"family_comment":"","value":"0","family":"0","comment":""},"14":{"family_comment":"","value":"0","family":"0","comment":""},"15":{"family_comment":"","value":"0","family":"0","comment":""},"16":{"family_comment":"","value":"0","family":"0","comment":""},"17":{"family_comment":"","value":"0","family":"0","comment":""},"18":{"family_comment":"","value":"0","family":"0","comment":""},"19":{"family_comment":"","value":"0","family":"0","comment":""},"20":{"family_comment":"","value":"0","family":"0","comment":""},"21":[{"country_comment":"","uah_equal":"0","country":"0","cur":"0"},{"country_comment":"","uah_equal":"0","country":"0","cur":"0"},{"country_comment":"","uah_equal":"0","country":"0","cur":"0"},{"country_comment":"","uah_equal":"0","country":"0","cur":"0"},{"country_comment":"","uah_equal":"0","country":"0","cur":"0"}],"22":[{"country_comment":"","uah_equal":"0","country":"0","cur":"0"},{"country_comment":"","uah_equal":"0","country":"0","cur":"0"},{"country_comment":"","uah_equal":"0","country":"0","cur":"0"},{"country_comment":"","uah_equal":"0","country":"0","cur":"0"},{"country_comment":"","uah_equal":"0","country":"0","cur":"0"}]},"banks":{"45":[{"sum_units":"UAH","sum_comment":"","sum_foreign_units":"","sum":"338312","sum_foreign_comment":"","sum_foreign":""},{"sum_units":"USD","sum_comment":"","sum_foreign_units":"","sum":"","sum_foreign_comment":"","sum_foreign":""},{"sum_units":"EUR","sum_comment":"","sum_foreign_units":"","sum":"","sum_foreign_comment":"","sum_foreign":""}],"46":[{"sum_units":"UAH","sum_comment":"","sum_foreign_units":"","sum":"","sum_foreign_comment":"","sum_foreign":""},{"sum_units":"USD","sum_comment":"","sum_foreign_units":"","sum":"","sum_foreign_comment":"","sum_foreign":""},{"sum_units":"EUR","sum_comment":"","sum_foreign_units":"","sum":"","sum_foreign_comment":"","sum_foreign":""}],"47":[{"sum_units":"","sum_comment":"","sum_foreign_units":"","sum":"357","sum_foreign_comment":"","sum_foreign":""}],"48":[{"sum_units":"","sum_comment":"","sum_foreign_units":"","sum":"","sum_foreign_comment":"","sum_foreign":""}],"49":[{"sum_units":"","sum_comment":"","sum_foreign_units":"","sum":"","sum_foreign_comment":"","sum_foreign":""}],"50":[{"sum_units":"","sum_comment":"","sum_foreign_units":"","sum":"","sum_foreign_comment":"","sum_foreign":""}],"51":[{"sum_units":"UAH","sum_comment":"","sum_foreign_units":"","sum":"134480","sum_foreign_comment":"","sum_foreign":""},{"sum_units":"USD","sum_comment":"","sum_foreign_units":"","sum":"","sum_foreign_comment":"","sum_foreign":""},{"sum_units":"EUR","sum_comment":"","sum_foreign_units":"","sum":"","sum_foreign_comment":"","sum_foreign":""}],"52":[{"sum_units":"","sum_comment":"","sum_foreign_units":"","sum":"","sum_foreign_comment":"","sum_foreign":""}],"53":[{"sum_units":"","sum_comment":"","sum_foreign_units":"","sum":"","sum_foreign_comment":"","sum_foreign":""}]},"declaration":{"notfull_lostpages":"","additional_info_text":"1. кілька полів, а саме: і, 4 ’реєстраціний номер облікової карти платника податків, серія та номер паспорта...’, 2 ’Місце проживання’, 23, 24, 29, 30 ’Місцезнаходження об’єкта (нерухомість)’ — перекрито рівними білими прямокутниками. Я позначив це приховано;;2. поля 8 ’авторська винагорода, інші доходи від реалізації майнових прав інтелектуальної власності’ , 10 ’матеріальна допомога (членів сім’ї)’, 46 ’вкладених у звітному році’, 51 ’у тому числі за кордоном’, 55 ’недержавне пенсійне забезпечення’ порожні — без даних і без прочерка.;;3. поряд із ’Сумою коштів на рахунках у банках’ вказано банк — АТ ’Дельта Банк’. Я це проігнорував","additional_info":"FALSE","notfull":"FALSE","url":"http://static.declarations.com.ua/declarations/sudy/apeliatsiini_sudy_oblastei__m.kyieva/zakarpatska/bodnar.pdf","needs_scancopy_check":false},"general":{"family_raw":"Чоловік Боднар Василь Йосипович, 24.07.1954р.","name":"Оксана","full_name_suggest":{"input":["Боднар Оксана Василівна","Оксана Василівна Боднар","Оксана Боднар"],"output":"Боднар Оксана Василівна"},"post_raw":"Суддя апеляційного суду Закарпатської області","name_unclear":false,"patronymic":"Василівна","patronymic_unclear":false,"last_name_hidden":false,"patronymic_hidden":false,"inn":"","addresses_raw_hidden":true,"last_name":"Боднар","full_name":"Боднар Оксана Василівна","post":{"office":"Загальний апеляційний суд","region":"Закарпатська область","post":"Суддя"},"addresses_raw":"приховано","name_hidden":false,"last_name_unclear":false},"liabilities":{"54":{"sum_comment":"","sum_foreign_comment":"","sum_foreign":"","sum":""},"55":{"sum_units":"","sum_comment":"","sum_foreign_units":"","sum":"","sum_foreign_comment":"","sum_foreign":""},"56":{"sum_comment":"","sum_foreign_comment":"","sum_foreign":"","sum":""},"57":{"sum_comment":"","sum_foreign_comment":"","sum_foreign":"","sum":""},"58":{"sum_comment":"","sum_foreign_comment":"","sum_foreign":"","sum":""},"59":{"sum_comment":"","sum_foreign_comment":"","sum_foreign":"","sum":""},"60":{"sum_comment":"","sum_foreign_comment":"","sum_foreign":"","sum":""},"61":{"sum_units":"","sum_comment":"","sum_foreign_units":"","sum":"","sum_foreign_comment":"","sum_foreign":""},"62":{"sum_comment":"","sum_foreign_comment":"","sum_foreign":"","sum":""},"63":{"sum_comment":"","sum_units":"","sum_foreign":"","sum":"","sum_foreign_comment":""},"64":{"sum_comment":"","sum_units":"","sum_foreign":"","sum":"","sum_foreign_comment":""}},"intro":{"isnotdeclaration":"FALSE","declaration_year":"2013"}}]