[{"id":"vulyk_75_141","declaration":{"notfull_lostpages":"","additional_info_text":"Пункт 54. Добровільне страхування 30142 грн., з них: 28384 грн. Аска, 1758грн. Оранта. Пункт 57. Погашення основної суми позики (кредиту) : 170535 грн., з них: 80102грн. ПУМБ, 53620 грн. БРР, 36813 грн. ПУМБ","additional_info":"1","date":"2014-03-28T00:00:00","notfull":"","url":"http://static.declarations.com.ua/declarations/chosen_ones/judges_batch/1794_melnychuk_volodymyr_petrovych.pdf"},"estate":{"25":[{"address":"","space_units":"м²","space_hidden":true,"space_unclear":false,"region_hidden":true,"costs_comment":"","space_comment":"","address_hidden":false,"space":"","costs_rent_comment":"","costs":"","region":"","costs_rent":""}],"29":[{"costs_property_comment":"","costs_property":"","address":"","space_units":"м²","space_comment":"","region_hidden":true,"space_units_unclear":false,"region":"","address_hidden":false,"costs_rent_comment":"","space":"1900","costs_rent":""}],"30":[{"costs_property_comment":"","address":"","space_units":"м²","costs_rent_comment":"","space":"26","region":"","region_hidden":true,"costs_property":"","space_comment":"1/4","costs_rent":""}],"31":[{"costs_property_comment":"","address":"","space_units":"м²","space_unclear":false,"region_hidden":true,"costs_property":"","space_comment":"","address_hidden":false,"costs_rent_comment":"","space":"281.9","region":"","costs_rent":""}]},"vehicle":{"35":[{"sum_comment":"","brand_unclear":false,"sum_rent":"","sum":"","sum_rent_comment":"","brand_hidden":false,"brand":"Toyota Highlander","brand_info":"3456 куб. см.","brand_info_unclear":false,"year":"2012","sum_unclear":false}]},"source":"VULYK","income":{"5":{"family_comment":"","value":"260961","family":"12301","comment":""},"6":{"family_comment":"","family_hidden":false,"value":"244287","family":"","comment":""},"7":{"family":"","family_comment":"","value":"","comment":"","source_name":""},"8":{"family_comment":"","value":"","family":"","comment":""},"9":{"family_comment":"","family":"","comment":"","value_unclear":false,"family_hidden":false,"value":""},"10":{"family":"","family_comment":"","comment":"","value_hidden":false,"value":"12617","family_hidden":false,"family_unclear":false},"11":{"family_comment":"","value":"","family":"","comment":""},"12":{"family_comment":"","value":"","family":"","comment":""},"13":{"family_comment":"","value":"","family":"","comment":""},"14":{"family_comment":"","value":"","family":"","comment":""},"15":{"family_comment":"","value":"4057","family":"","comment":""},"16":{"family_comment":"","value":"","family":"","comment":""},"17":{"family_comment":"","value":"","family":"","comment":""},"18":{"family_comment":"","value":"","family":"","comment":""},"19":{"family_comment":"","value":"","family":"","comment":""},"20":{"family_comment":"пенсія","comment":"","family":"12301","comment_unclear":false,"value":"","family_comment_unclear":false}},"banks":{"51":[{"sum_units":"UAH","sum_comment":"","sum_foreign_units":"UAH","sum":"120","sum_foreign_comment":"","sum_foreign":""},{"sum_comment":"","sum_units":"UAH","sum_foreign":"","sum":"3700","sum_foreign_comment":""}]},"ft_src":"Toyota Highlander\n3456 куб. см.\n2012\n120\n3700\n1\nПункт 54. Добровільне страхування 30142 грн., з них: 28384 грн. Аска, 1758грн. Оранта. Пункт 57. Погашення основної суми позики (кредиту) : 170535 грн., з них: 80102грн. ПУМБ, 53620 грн. БРР, 36813 грн. ПУМБ\n2013\n3456 куб. см.\n2012\nToyota Highlander\nПункт 54. Добровільне страхування 30142 грн., з них: 28384 грн. Аска, 1758грн. Оранта. Пункт 57. Погашення основної суми позики (кредиту) : 170535 грн., з них: 80102грн. ПУМБ, 53620 грн. БРР, 36813 грн. ПУМБ\n1\n120\n3700\n2013\nМельничук\nПетрович\nПодружжя\nМельничук М. І\nМельничук Володимир Петрович\nВолодимир Петрович Мельничук\nВолодимир Мельничук\nМельничук Володимир Петрович\nВолодимир\nМельничук Володимир Петрович\nАпеляційний адміністративний суд\nсуддя київського апеляційного адміністративного суду\nм. Київ\n36813\n30142\n133722\n244287\nпенсія\n12301\n4057\n260961\n12301\n12617\n1900\n26\n1/4\n281.9\n36813\n133722\n30142\n281.9\n1/4\n26\n1900\nМельничук М. І\nПодружжя\nМельничук\nПетрович\nсуддя київського апеляційного адміністративного суду\nм. Київ\nАпеляційний адміністративний суд\nМельничук Володимир Петрович\nМельничук Володимир Петрович\nВолодимир Петрович Мельничук\nВолодимир Мельничук\nМельничук Володимир Петрович\nВолодимир\n244287\n4057\n12617\n12301\n260961\nпенсія\n12301","general":{"inn":"","addresses":[{"place_city_type_hidden":false,"place_city_type":"","place_city_hidden":false,"place_hidden":true,"place_district":"","place_district_hidden":false,"place":"","place_city":"","place_address_hidden":false,"place_address":""}],"last_name":"Мельничук","full_name":"Мельничук Володимир Петрович","family":[{"inn":"","family_name":"Мельничук М. І","relations_other":"","relations_hidden":false,"name_unclear":false,"inn_hidden":false,"name_hidden":false,"relations":"Подружжя"}],"patronymic":"Петрович","inn_hidden":true,"name":"Володимир","post":{"office":"Апеляційний адміністративний суд","region":"м. Київ","post":"суддя київського апеляційного адміністративного суду"},"family_raw":"","full_name_suggest":{"input":["Мельничук Володимир Петрович","Володимир Петрович Мельничук","Володимир Мельничук"],"output":"Мельничук Володимир Петрович"}},"liabilities":{"54":{"sum_comment":"","sum_foreign_comment":"","sum_foreign":"","sum":"30142"},"55":{"sum_comment":"","sum_foreign_comment":"","sum_foreign":"","sum":""},"56":{"sum_comment":"","sum_foreign_comment":"","sum_foreign":"","sum":""},"57":{"sum_comment":"","sum_foreign_comment":"","sum_foreign":"","sum":"133722"},"58":{"sum_comment":"","sum_foreign_comment":"","sum_foreign":"","sum":"36813"},"59":{"sum_comment_unclear":false,"sum_comment":"","sum":"","sum_foreign_comment":"","sum_foreign":"","sum_unclear":false},"60":{"sum_comment":"","sum_foreign_comment":"","sum_foreign":"","sum":""},"61":{"sum_comment":"","sum_foreign_comment":"","sum_foreign":"","sum":""},"62":{"sum_comment":"","sum_foreign_comment":"","sum_foreign":"","sum_unclear":false,"sum":""},"63":{"sum_comment":"","sum_foreign_comment":"","sum_foreign":"","sum":""},"64":{"sum_comment":"","sum_foreign_comment":"","sum_foreign":"","sum":""}},"intro":{"isnotdeclaration":"","declaration_year":"2013"}}]