[{"id":"vulyk_51_132","declaration":{"notfull_lostpages":"","additional_info_text":"","additional_info":"","date":"2015-03-30T00:00:00","notfull":"","url":"http://static.declarations.com.ua/declarations/chosen_ones/mega_batch/rybak_mykyta_anatoliiovych.pdf"},"estate":{"23":[{"address":"","space_units":"м²","costs_hidden":false,"costs_rent_hidden":false,"space_comment":"","region_hidden":false,"costs_comment":"","address_hidden":false,"costs":"","address_unclear":false,"costs_rent_comment":"","space":"","region":"","costs_rent":""},{"address":"","space_units":"","costs_hidden":false,"costs_rent_hidden":false,"space_comment":"","region_hidden":false,"costs_comment":"","space":"","costs_rent_comment":"","costs":"","region":"","costs_rent":""},{"costs":"","address_unclear":false,"address":"","space_units":"","costs_rent_comment":"","space":"","costs_comment":"","space_comment":"","region":"","costs_rent":""},{"costs":"","address":"","space_units":"","costs_rent_comment":"","space":"","space_comment":"","costs_comment":"","region":"","costs_rent":""}],"25":[{"address":"м. Київ","space_units":"м²","costs_hidden":false,"space_hidden":false,"space_unclear":false,"region_hidden":false,"costs_rent_comment":"","space_comment":"частка","address_hidden":false,"costs":"","address_unclear":false,"costs_comment":"","space":"16.92","region":"м. Київ","costs_rent":""}]},"vehicle":{"35":[{"sum_comment":"","sum_rent_hidden":false,"brand_info_hidden":false,"sum_hidden":false,"sum":"","sum_rent_comment":"","year":"2007","brand":"Toyota Camry","brand_info":"3456 куб. см, 204 кВт, 481 см","brand_info_unclear":false,"sum_rent":""},{"sum_comment":"","brand_info":"1799 куб. см, 103 кВт, 454 см","sum":"","sum_rent_comment":"","year":"2007","brand":"Honda Civic","sum_rent":""}]},"source":"VULYK","income":{"5":{"family":"17419","family_comment":"","comment":"","value_hidden":false,"value":"182768","family_hidden":false,"family_unclear":false},"6":{"family_comment":"","comment":"","family":"3585","comment_unclear":false,"value":"170072","family_comment_unclear":false},"7":{"family":"","family_comment":"","value":"","comment":"","source_name":"Керченський міський суд АР Крим,Управління праці і соціального захисту населення в Солом'янському районі м. Києва, Шевченківський районний суд міста Києва, ДТГО 'Південно-Західна залізниця', ПАТ КБ 'Приватбанк'"},"8":{"family_comment":"","value":"","family":"","comment":""},"9":{"family_comment":"","value":"","family":"","comment":""},"10":{"family_comment":"","value":"12150","family":"","comment":"по догляду за дитиною до досягн.3 років"},"11":{"family_comment":"","value":"","family":"","comment":"","family_comment_unclear":false},"12":{"family_comment":"","value":"","family":"","comment":""},"13":{"family_comment":"","value":"","family":"","comment":""},"14":{"family_comment":"","value":"","family":"","comment":""},"15":{"family_comment":"","value":"","family":"","comment":""},"16":{"family_comment":"","value":"","family":"","comment":""},"17":{"family_comment":"","value":"","family":"","comment":""},"18":{"family_comment":"","value":"","family":"","comment":""},"19":{"family":"","family_comment":"","value":"","comment":"","value_hidden":false},"20":{"family_comment":"","comment_unclear":false,"value":"546","family":"13834","comment":""}},"banks":{"45":[{"sum_comment_unclear":false,"sum_units":"UAH","sum_foreign_units":"UAH","sum_hidden":false,"sum":"","sum_foreign_comment":"","sum_comment":"","sum_foreign":"","sum_comment_hidden":false},{"sum_units":"","sum_comment":"","sum_foreign_units":"","sum":"","sum_foreign_comment":"","sum_foreign":""},{"sum_units":"","sum_comment":"","sum_foreign_units":"","sum":"","sum_foreign_comment":"","sum_foreign":""},{"sum_units":"","sum_comment":"","sum_foreign_units":"","sum":"","sum_foreign_comment":"","sum_foreign":""},{"sum_units":"","sum_comment":"","sum_foreign_units":"","sum":"","sum_foreign_comment":"","sum_foreign":"","sum_unclear":false}],"46":[{"sum_units":"UAH","sum_comment":"","sum_foreign_units":"UAH","sum":"","sum_foreign_comment":"","sum_foreign":""}],"47":[{"sum_units":"UAH","sum_comment":"","sum_foreign_units":"UAH","sum":"","sum_foreign_comment":"","sum_foreign":""}],"48":[{"sum_units":"UAH","sum_comment":"","sum_foreign_units":"UAH","sum":"","sum_foreign_comment":"","sum_foreign":""}],"49":[{"sum_units":"UAH","sum_comment":"","sum_foreign_units":"UAH","sum":"","sum_foreign_comment":"","sum_foreign":""}],"50":[{"sum_units":"UAH","sum_comment":"","sum_foreign_units":"UAH","sum":"","sum_foreign_comment":"","sum_foreign":""}],"51":[{"sum_units":"UAH","sum_comment":"","sum_foreign_units":"UAH","sum":"","sum_foreign_comment":"","sum_foreign":"","sum_comment_hidden":false},{"sum_units":"","sum_comment":"","sum_foreign_units":"","sum":"","sum_foreign_comment":"","sum_foreign":""},{"sum_units":"","sum_comment":"","sum_foreign_units":"","sum":"","sum_foreign_comment":"","sum_foreign":""}],"52":[{"sum_units":"UAH","sum_comment":"","sum_foreign_units":"UAH","sum":"","sum_foreign_comment":"","sum_foreign":"","sum_comment_hidden":false}],"53":[{"sum_units":"UAH","sum_comment":"","sum_foreign_units":"UAH","sum":"","sum_foreign_comment":"","sum_foreign":""}]},"ft_src":"Toyota Camry\n3456 куб. см, 204 кВт, 481 см\n2007\n1799 куб. см, 103 кВт, 454 см\n2007\nHonda Civic\n2014\n3456 куб. см, 204 кВт, 481 см\n2007\nToyota Camry\n1799 куб. см, 103 кВт, 454 см\nHonda Civic\n2007\n16.92\nчастка\nм. Київ\nм. Київ\nРибак\nРибак Микита Анатолійович\nМикита Анатолійович Рибак\nМикита Рибак\nРибак Микита Анатолійович\nМикита\nАнатолійович\n07443\nКиївська область\nРибак Микита Анатолійович\nЗагальний місцевий суд\nсуддя шевченківського районного суду міста києва\nм. Київ\nПодружжя\nРибак Л. А\nДитина\nРибак А. М\nДитина\nРибак Д. М\nКерченський міський суд АР Крим,Управління праці і соціального захисту населення в Солом'янському районі м. Києва, Шевченківський районний суд міста Києва, ДТГО 'Південно-Західна залізниця', ПАТ КБ 'Приватбанк'\n170072\n3585\n546\n13834\n17419\n182768\nпо догляду за дитиною до досягн.3 років\n12150\n2014\nчастка\nм. Київ\n16.92\nм. Київ\nРибак Л. А\nПодружжя\nРибак А. М\nДитина\nРибак Д. М\nДитина\nАнатолійович\nКиївська область\n07443\nРибак\nм. Київ\nЗагальний місцевий суд\nсуддя шевченківського районного суду міста києва\nРибак Микита Анатолійович\nРибак Микита Анатолійович\nМикита Анатолійович Рибак\nМикита Рибак\nРибак Микита Анатолійович\nМикита\n3585\n170072\nпо догляду за дитиною до досягн.3 років\n12150\nКерченський міський суд АР Крим,Управління праці і соціального захисту населення в Солом'янському районі м. Києва, Шевченківський районний суд міста Києва, ДТГО 'Південно-Західна залізниця', ПАТ КБ 'Приватбанк'\n17419\n182768\n13834\n546","general":{"inn":"","addresses":[{"place_city_type_hidden":false,"place_city_type":"","place_city_hidden":false,"place_hidden":true,"place_district":"","place_district_hidden":false,"place":"Київська область","place_address":"07443","place_address_hidden":true,"place_city":""}],"last_name":"Рибак","full_name":"Рибак Микита Анатолійович","family":[{"inn":"","family_name":"Рибак Л. А","relations_other":"","name_unclear":false,"inn_hidden":false,"name_hidden":false,"relations":"Подружжя"},{"inn":"","family_name":"Рибак А. М","relations_other":"","relations_hidden":false,"name_unclear":false,"inn_hidden":false,"name_hidden":false,"relations":"Дитина"},{"inn":"","family_name":"Рибак Д. М","relations_other":"","name_unclear":false,"inn_hidden":false,"name_hidden":false,"relations":"Дитина"}],"patronymic":"Анатолійович","inn_hidden":true,"name":"Микита","post":{"office":"Загальний місцевий суд","post":"суддя шевченківського районного суду міста києва","office_unclear":false,"region_hidden":false,"region":"м. Київ","office_hidden":false},"family_raw":"","full_name_suggest":{"input":["Рибак Микита Анатолійович","Микита Анатолійович Рибак","Микита Рибак"],"output":"Рибак Микита Анатолійович"}},"liabilities":{"54":{"sum_comment":"","sum_foreign_comment":"","sum_foreign":"","sum":"","sum_comment_hidden":false},"55":{"sum_comment":"","sum_foreign_comment":"","sum_foreign":"","sum":""},"56":{"sum_comment":"","sum_foreign_comment":"","sum_foreign":"","sum":""},"57":{"sum_comment":"","sum_hidden":false,"sum":"","sum_foreign_comment":"","sum_foreign":"","sum_comment_hidden":false},"58":{"sum_comment":"","sum_foreign_comment":"","sum_foreign":"","sum":"","sum_comment_hidden":false},"59":{"sum_comment":"","sum_foreign_comment":"","sum_foreign":"","sum":""},"60":{"sum_comment":"","sum_foreign_comment":"","sum_foreign":"","sum":""},"61":{"sum_comment":"","sum_foreign_comment":"","sum_foreign":"","sum":""},"62":{"sum_comment":"","sum_foreign_comment":"","sum_foreign":"","sum":""},"63":{"sum_comment":"","sum_foreign_comment":"","sum_foreign":"","sum":"","sum_comment_hidden":false},"64":{"sum_comment":"","sum_foreign_comment":"","sum_foreign":"","sum":""}},"intro":{"isnotdeclaration":"","declaration_year":"2014"}}]