[{"id":"vulyk_66_33","ft_src":"1/2\n66.6\n1/2\n66.6\n1\nНижче п. 22 дописано: У ПАТ КБ Приват Банк у м. Южноукраїнську використано кошти кредитного ліміту у сумі 12700 грн. Нижче п. 64 дописано: АТ Райфайнзен Банк 'Аваль' у м. Южноукраїнську, ПАТ КБ Приват Банк у м. Южноукраїнську\n2014\n228839\nОдеське регіональне відділення Національної школи суддів України\n2204\n236066\n5023\nНижче п. 22 дописано: У ПАТ КБ Приват Банк у м. Южноукраїнську використано кошти кредитного ліміту у сумі 12700 грн. Нижче п. 64 дописано: АТ Райфайнзен Банк 'Аваль' у м. Южноукраїнську, ПАТ КБ Приват Банк у м. Южноукраїнську\n1\n66.6\n1/2\n66.6\n1/2\nЗагальний місцевий суд\nсуддя южноукраїнського міського суду миколаївської області\nМиколаївська область\nДитина\nГлушко А. В\nВолкова Олена Іванівна\nОлена Іванівна Волкова\nОлена Волкова\nВолкова Олена Іванівна\nВолкова Олена Іванівна\nОлена\nВолкова\nІванівна\n31493\n11352\n2204\nОдеське регіональне відділення Національної школи суддів України\n228839\n5023\n236066\n2014\n11352\n31493\nГлушко А. В\nДитина\nІванівна\nВолкова\nОлена\nВолкова Олена Іванівна\nОлена Іванівна Волкова\nОлена Волкова\nВолкова Олена Іванівна\nМиколаївська область\nсуддя южноукраїнського міського суду миколаївської області\nЗагальний місцевий суд\nВолкова Олена Іванівна","estate":{"25":[{"address":"","space_units":"м²","costs_hidden":false,"space_hidden":false,"space_unclear":false,"region_hidden":true,"costs_rent_comment":"","space_comment":"1/2","space_comment_unclear":false,"costs":"","address_unclear":false,"address_hidden":true,"costs_comment":"","space":"66.6","region_unclear":false,"region":"","space_units_hidden":false,"costs_rent":""}],"31":[{"costs_property_comment":"","address":"","space_units":"м²","space_hidden":false,"space_unclear":false,"region_hidden":true,"costs_property":"","space_comment":"1/2","address_hidden":true,"space_comment_hidden":false,"space_comment_unclear":false,"costs_rent_comment":"","space":"66.6","region":"","costs_rent":""}]},"source":"VULYK","income":{"5":{"family_comment":"","family":"","value_hidden":false,"comment":"","value":"236066","comment_unclear":false,"value_unclear":false,"family_unclear":false,"family_hidden":false},"6":{"family":"","family_comment":"","comment":"","value_hidden":false,"value_unclear":false,"value":"228839","comment_unclear":false,"family_unclear":false,"family_hidden":false},"7":{"family_comment":"","comment":"","family":"","source_name_unclear":false,"value":"2204","source_name":"Одеське регіональне відділення Національної школи суддів України"},"8":{"family_comment":"","value":"","family":"","comment":""},"9":{"family_comment":"","comment":"","family":"","value_unclear":false,"comment_hidden":false,"comment_unclear":false,"value":""},"10":{"family_comment":"","family":"","value_hidden":false,"comment":"","comment_unclear":false,"value":""},"11":{"family_comment":"","value":"","family":"","comment":""},"12":{"family_comment":"","value":"","family":"","comment":""},"13":{"family_comment":"","value":"","family":"","comment":""},"14":{"family_comment":"","value":"","family":"","comment":""},"15":{"family_comment":"","value":"","family":"","comment":""},"16":{"family_comment":"","value":"","family":"","comment":""},"17":{"family_comment":"","value":"","family":"","comment":""},"18":{"family":"","family_comment":"","comment":"","value_hidden":false,"family_hidden":false,"value":""},"19":{"family_comment":"","value":"","family":"","comment":""},"20":{"family":"","family_comment":"","comment":"","value_hidden":false,"value_unclear":false,"value":"5023","family_hidden":false,"family_unclear":false}},"general":{"family":[{"inn":"","family_name":"Глушко А. В","relations_other":"","relations_hidden":false,"name_unclear":false,"inn_hidden":false,"name_hidden":true,"relations":"Дитина"}],"family_raw":"","name":"Олена","full_name_suggest":{"input":["Волкова Олена Іванівна","Олена Іванівна Волкова","Олена Волкова"],"output":"Волкова Олена Іванівна"},"patronymic":"Іванівна","inn_hidden":false,"addresses":[{"place_city_type_hidden":true,"place_district_hidden":true,"place_address_unclear":false,"place":"","place_city":"","place_unclear":false,"place_city_type_unclear":false,"place_city_type":"","place_city_hidden":true,"place_city_unclear":false,"place_district":"","place_district_unclear":false,"place_address":"","place_address_hidden":true,"place_hidden":true}],"last_name_hidden":false,"inn":"","inn_unclear":false,"last_name":"Волкова","full_name":"Волкова Олена Іванівна","post":{"office":"Загальний місцевий суд","post":"суддя южноукраїнського міського суду миколаївської області","candidate":"","office_hidden":false,"region":"Миколаївська область","post_unclear":false,"office_unclear":false},"last_name_unclear":false},"liabilities":{"54":{"sum_comment_unclear":false,"sum_comment":"","sum":"","sum_foreign_comment":"","sum_foreign":"","sum_unclear":false,"sum_comment_hidden":false},"55":{"sum_comment":"","sum_foreign_comment":"","sum_foreign":"","sum":""},"56":{"sum_comment":"","sum_hidden":false,"sum":"","sum_foreign_comment":"","sum_foreign":"","sum_foreign_hidden":false,"sum_comment_hidden":false},"57":{"sum_comment_unclear":false,"sum_comment":"","sum_hidden":false,"sum":"31493","sum_foreign_comment":"","sum_foreign":"","sum_unclear":false,"sum_comment_hidden":false},"58":{"sum_comment_unclear":true,"sum_comment":"","sum":"11352","sum_foreign_comment":"","sum_foreign":"","sum_unclear":false},"59":{"sum_comment_unclear":false,"sum_comment":"","sum_hidden":false,"sum":"","sum_foreign_comment":"","sum_foreign":"","sum_foreign_hidden":false},"60":{"sum_comment":"","sum_comment_unclear":false,"sum_foreign_comment":"","sum":"","sum_foreign":""},"61":{"sum_comment":"","sum_foreign_comment":"","sum_foreign":"","sum":""},"62":{"sum_comment":"","sum_hidden":false,"sum":"","sum_foreign_comment":"","sum_foreign":"","sum_unclear":false,"sum_foreign_hidden":false},"63":{"sum_comment_unclear":false,"sum_comment":"","sum":"","sum_foreign_comment":"","sum_foreign":"","sum_unclear":false,"sum_comment_hidden":false},"64":{"sum_comment":"","sum_comment_unclear":false,"sum_foreign_comment":"","sum":"","sum_foreign":""}},"declaration":{"notfull_lostpages":"","additional_info_text":"Нижче п. 22 дописано: У ПАТ КБ Приват Банк у м. Южноукраїнську використано кошти кредитного ліміту у сумі 12700 грн. Нижче п. 64 дописано: АТ Райфайнзен Банк 'Аваль' у м. Южноукраїнську, ПАТ КБ Приват Банк у м. Южноукраїнську","additional_info":"1","date":"2015-03-31T00:00:00","notfull":"","url":"http://static.declarations.com.ua/declarations/chosen_ones/mega_batch/volkova_olena_ivanivna.pdf"},"intro":{"isnotdeclaration":"","declaration_year_unclear":false,"declaration_year":"2014"}}]