{"income":{"5":{"value":"336815","value_unclear":false,"family_comment":"","family":"85012","comment":"","family_comment_unclear":false},"6":{"family_comment":"","value":"336815","family":"","comment":""},"7":{"source_name_unclear":false,"value":"","family_comment":"","source_name":"","family":"","comment":""},"8":{"family_comment":"","value":"","family":"","comment":""},"9":{"family_comment":"","value":"","family":"12","comment":""},"10":{"family_comment":"","value":"","family":"","comment":""},"11":{"family_comment":"","value":"","family":"","comment":""},"12":{"family_comment":"","value":"","family":"","comment":""},"13":{"family_comment":"","value":"","family":"","comment":""},"14":{"family_comment":"","value":"","family":"","comment":""},"15":{"family_comment":"","value":"","family":"","comment":""},"16":{"family_comment":"","value":"","family":"35000","comment":""},"17":{"family_comment":"","value":"","family":"","comment":""},"18":{"family_comment":"","value":"","value_unclear":false,"family":"","comment":""},"19":{"family_comment":"","value":"","comment_unclear":false,"family":"11000","comment":""},"20":{"family_comment":"","family_unclear":false,"value":"","family":"39000","comment":""}},"vehicle":{"35":[{"brand_info":"3500 куб. см., 249 к. с","sum":"","brand":"Nissan Murano","sum_comment":"","year":"2013","brand_hidden":false,"brand_info_hidden":false,"brand_info_unclear":false,"sum_rent_comment":"","sum_rent":""},{"brand_info":"2998 куб. см., 220 к. с","sum":"","brand":"Mitsubishi Outlander","sum_comment":"","year":"2007","brand_hidden":false,"sum_rent_comment":"","sum_rent":""},{"brand_info":"1498 куб. см., 85 к. с","sum":"","brand":"ЗАЗ Lanos","sum_comment":"","brand_unclear":false,"year":"2005","sum_rent_comment":"","sum_rent":""}],"37":[{"brand_info":"5 м3, довжина 4,5 м","sum_rent_comment":"","brand":"Казанка 5М3","sum_comment":"","brand_unclear":true,"year":"1990","brand_hidden":false,"sum":"","sum_rent":""}],"40":[{"brand_info":"75 к. с","sum":"","brand":"ИЖ 21251","sum_comment":"","year":"1987","brand_hidden":false,"brand_info_hidden":false,"brand_info_unclear":false,"sum_rent_comment":"","sum_rent":""}]},"id":"vulyk_9_71","banks":{"45":[{"sum_foreign_comment":"","sum_units":"UAH","sum_comment":"","sum_hidden":false,"sum_foreign_units":"UAH","sum_comment_hidden":false,"sum_unclear":false,"sum":"","sum_foreign":""},{"sum_foreign_comment":"","sum_units":"","sum_comment":"","sum_hidden":false,"sum_foreign_units":"","sum_comment_hidden":false,"sum":"","sum_foreign":""}],"46":[{"sum_foreign_comment":"","sum_unclear":false,"sum_units":"UAH","sum_comment":"","sum_hidden":false,"sum_foreign_units":"UAH","sum":"","sum_foreign":""},{"sum_foreign_comment":"","sum":"","sum_comment":"","sum_foreign_units":"","sum_units":"","sum_foreign":""},{"sum_foreign_comment":"","sum":"","sum_comment":"","sum_foreign_units":"","sum_units":"","sum_foreign":""},{"sum_foreign_comment":"","sum":"","sum_comment":"","sum_foreign_units":"","sum_units":"","sum_foreign":""}],"47":[{"sum_foreign_comment":"","sum":"","sum_comment":"","sum_foreign_units":"UAH","sum_units":"UAH","sum_foreign":""}],"48":[{"sum_foreign_comment":"","sum_units":"UAH","sum_comment":"","sum_hidden":false,"sum_foreign_units":"UAH","sum":"","sum_foreign":""}],"49":[{"sum_foreign_comment":"","sum_units":"UAH","sum_comment":"","sum_hidden":false,"sum_foreign_units":"UAH","sum_comment_hidden":false,"sum":"","sum_foreign":""},{"sum_foreign_comment":"","sum":"","sum_comment":"","sum_foreign_units":"","sum_comment_hidden":false,"sum_units":"","sum_foreign":""},{"sum_foreign_comment":"","sum":"","sum_comment":"","sum_foreign_units":"","sum_units":"","sum_foreign":""},{"sum_foreign_comment":"","sum":"","sum_comment":"","sum_foreign_units":"","sum_units":"","sum_foreign":""},{"sum_foreign_comment":"","sum":"","sum_comment":"","sum_foreign_units":"","sum_units":"","sum_foreign":""}],"50":[{"sum_foreign_comment":"","sum":"","sum_comment":"","sum_foreign_units":"UAH","sum_units":"UAH","sum_foreign":""}],"51":[{"sum_foreign_comment":"","sum_units":"UAH","sum_comment":"","sum_comment_unclear":false,"sum_hidden":false,"sum_foreign_units":"UAH","sum_comment_hidden":false,"sum_unclear":false,"sum":"330","sum_foreign":""},{"sum_foreign_comment":"","sum_units":"","sum_comment":"","sum_hidden":false,"sum_foreign_units":"","sum":"","sum_foreign":""}],"52":[{"sum_foreign_comment":"","sum":"","sum_comment":"","sum_foreign_units":"UAH","sum_units":"UAH","sum_foreign":""}],"53":[{"sum_foreign_comment":"","sum_units":"UAH","sum_comment":"","sum_hidden":false,"sum_foreign_units":"UAH","sum_comment_hidden":false,"sum":"","sum_foreign":""},{"sum_foreign_comment":"","sum":"","sum_comment":"","sum_foreign_units":"","sum_units":"","sum_foreign":""},{"sum_foreign_comment":"","sum":"","sum_comment":"","sum_comment_unclear":false,"sum_foreign_units":"","sum_units":"","sum_foreign":""},{"sum_foreign_comment":"","sum":"","sum_comment":"","sum_comment_unclear":false,"sum_foreign_units":"","sum_units":"","sum_foreign":""},{"sum_foreign_comment":"","sum":"","sum_comment":"","sum_foreign_units":"","sum_units":"","sum_foreign":""},{"sum_foreign_comment":"","sum":"","sum_comment":"","sum_foreign_units":"","sum_units":"","sum_foreign":""},{"sum_foreign_comment":"","sum":"","sum_comment":"","sum_foreign_units":"","sum_units":"","sum_foreign":""}]},"declaration":{"date":"2015-03-30T00:00:00","additional_info_text":"1. Батьки за станом здоров'я не можуть точно підрахувати розмір отриманих пенсій та розмір орендної плати за землю. 2. Батько дружини - Черевченко М. І. у 2014 році продав належні йому: а) будинко з господарськими будівлями за 34754 грн. б) земельну ділянку площею 0,508 га за 45517 грн. в) земельну ділянку площею 0,13 га за 24483 грн. Вартість земельних ділянок станом на 01. 01. 2015 року покупцем не сплачена. Строк сплати відповідно до угод встановлено 25. 10. 2016 р","additional_info":"1","url":"http://static.declarations.com.ua/declarations/chosen_ones/batch_10/makarchukma.pdf"},"liabilities":{"54":{"sum_foreign_comment":"","sum":"","sum_comment":"","sum_comment_unclear":false,"sum_comment_hidden":false,"sum_foreign":""},"55":{"sum_foreign_comment":"","sum":"","sum_comment":"","sum_foreign":""},"56":{"sum_foreign_comment":"","sum":"","sum_comment":"","sum_foreign":""},"57":{"sum_foreign_comment":"","sum_comment":"","sum":"205000","sum_comment_hidden":false,"sum_foreign":""},"58":{"sum_foreign_comment":"","sum_comment":"","sum":"","sum_comment_hidden":false,"sum_foreign":""},"59":{"sum_foreign_comment":"","sum":"","sum_comment":"","sum_foreign":""},"60":{"sum_foreign_comment":"","sum":"","sum_comment":"","sum_hidden":false,"sum_comment_hidden":false,"sum_foreign":""},"61":{"sum_foreign_comment":"","sum":"","sum_comment":"","sum_foreign":""},"62":{"sum_foreign_comment":"","sum":"","sum_comment":"","sum_foreign":""},"63":{"sum_foreign_comment":"","sum":"","sum_comment":"","sum_hidden":false,"sum_comment_hidden":false,"sum_foreign":""},"64":{"sum_foreign_comment":"","sum":"","sum_comment":"","sum_hidden":false,"sum_comment_hidden":false,"sum_foreign":""}},"ft_src":"3500 куб. см., 249 к. с\nNissan Murano\n2013\nMitsubishi Outlander\n2007\n2998 куб. см., 220 к. с\n2005\n1498 куб. см., 85 к. с\nЗАЗ Lanos\nКазанка 5М3\n5 м3, довжина 4,5 м\n1990\n75 к. с\nИЖ 21251\n1987\n330\n1\n1. Батьки за станом здоров'я не можуть точно підрахувати розмір отриманих пенсій та розмір орендної плати за землю. 2. Батько дружини - Черевченко М. І. у 2014 році продав належні йому: а) будинко з господарськими будівлями за 34754 грн. б) земельну ділянку площею 0,508 га за 45517 грн. в) земельну ділянку площею 0,13 га за 24483 грн. Вартість земельних ділянок станом на 01. 01. 2015 року покупцем не сплачена. Строк сплати відповідно до угод встановлено 25. 10. 2016 р\n2014\n5 м3, довжина 4,5 м\n1990\nКазанка 5М3\n75 к. с\n1987\nИЖ 21251\n3500 куб. см., 249 к. с\n2013\nNissan Murano\n2998 куб. см., 220 к. с\nMitsubishi Outlander\n2007\n1498 куб. см., 85 к. с\nЗАЗ Lanos\n2005\n1\n1. Батьки за станом здоров'я не можуть точно підрахувати розмір отриманих пенсій та розмір орендної плати за землю. 2. Батько дружини - Черевченко М. І. у 2014 році продав належні йому: а) будинко з господарськими будівлями за 34754 грн. б) земельну ділянку площею 0,508 га за 45517 грн. в) земельну ділянку площею 0,13 га за 24483 грн. Вартість земельних ділянок станом на 01. 01. 2015 року покупцем не сплачена. Строк сплати відповідно до угод встановлено 25. 10. 2016 р\n330\n20.8\n7450\n51.8\n28\n64300\n66500\n49.9\nМакарчук Михайло Андрійович\nМихайло Андрійович Макарчук\nМихайло Макарчук\nМакарчук Михайло Андрійович\nМакарчук Михайло Андрійович\nПодружжя\nМакарчук Н. М\nБатьки\nМакарчук К. В\nІнше\nбатько дружини\nЧеревченко М. І\nЧеревченко М. І\nІнше\nмати дружини\nМихайло\nАндрійович\nВищий спеціалізований суд з розгляду цивільних і кримінальних справ\nЗагальнодержавний регіон\nсуддя вищого спеціалізованого суду україни з розгляду цивільних і кримінальних справ, член вищої кваліфікаційної комісії суддів україни\nМакарчук\n205000\n336815\n39000\n336815\n85012\n35000\n12\n11000\n2014\n205000\n20.8\n64300\n66500\n49.9\n7450\n28\n51.8\nМакарчук Н. М\nПодружжя\nМакарчук К. В\nБатьки\nбатько дружини\nЧеревченко М. І\nІнше\nІнше\nмати дружини\nЧеревченко М. І\nМихайло\nАндрійович\nМакарчук\nМакарчук Михайло Андрійович\nМихайло Андрійович Макарчук\nМихайло Макарчук\nМакарчук Михайло Андрійович\nЗагальнодержавний регіон\nВищий спеціалізований суд з розгляду цивільних і кримінальних справ\nсуддя вищого спеціалізованого суду україни з розгляду цивільних і кримінальних справ, член вищої кваліфікаційної комісії суддів україни\nМакарчук Михайло Андрійович\n336815\n85012\n336815\n35000\n11000\n12\n39000","general":{"inn":"","name":"Михайло","family":[{"inn":"","inn_hidden":true,"inn_unclear":false,"relations_hidden":false,"family_name":"Макарчук Н. М","relations":"Подружжя","name_hidden":true,"name_unclear":false},{"inn":"","inn_hidden":false,"inn_unclear":false,"name_hidden":false,"family_name":"Макарчук К. В","relations":"Батьки","name_unclear":false},{"inn":"","inn_hidden":false,"family_name":"Черевченко М. І","relations_other":"батько дружини","relations":"Інше","name_hidden":false,"name_unclear":true},{"inn":"","relations_other":"мати дружини","relations":"Інше","inn_hidden":false,"family_name":"Черевченко М. І"}],"patronymic":"Андрійович","inn_hidden":true,"family_raw":"","last_name":"Макарчук","post":{"post_unclear":false,"region_unclear":false,"post":"суддя вищого спеціалізованого суду україни з розгляду цивільних і кримінальних справ, член вищої кваліфікаційної комісії суддів україни","candidate":"","office_hidden":false,"region":"Загальнодержавний регіон","region_hidden":false,"office":"Вищий спеціалізований суд з розгляду цивільних і кримінальних справ","office_unclear":false},"full_name_suggest":{"output":"Макарчук Михайло Андрійович","input":["Макарчук Михайло Андрійович","Михайло Андрійович Макарчук","Михайло Макарчук"]},"full_name":"Макарчук Михайло Андрійович","addresses":[{"place_district":"","place_address_hidden":false,"place_city":"","place_address":"","place_district_hidden":false,"place_city_type":"","place_city_hidden":false,"place_city_type_hidden":false,"place_hidden":true,"place":""}],"last_name_unclear":false},"source":"VULYK","estate":{"23":[{"costs":"","costs_comment":"","address_hidden":false,"region_hidden":true,"space_comment":"","space":"28","address":"","region":"","costs_rent_comment":"","space_comment_unclear":false,"space_units":"м²","costs_rent":""},{"costs":"","costs_comment":"","address_hidden":false,"region_hidden":false,"space_comment":"","space":"","address":"","region":"","costs_rent_comment":"","space_comment_unclear":false,"space_units":"","costs_rent":""},{"costs_rent":"","address_hidden":false,"region":"","costs":"","costs_rent_comment":"","costs_comment":"","space_comment_unclear":false,"space_comment":"","space_units":"","space":"","address":""},{"costs_rent":"","region":"","costs":"","costs_rent_comment":"","costs_comment":"","address_hidden":false,"space_comment":"","space_units":"","space":"","address":""},{"costs_rent":"","region":"","costs":"","costs_rent_comment":"","costs_comment":"","address_hidden":false,"space_comment":"","space_units":"","space":"","address":""},{"costs_rent":"","region":"","costs":"","costs_rent_comment":"","costs_comment":"","address_hidden":false,"space_comment":"","space_units":"","space":"","address":""},{"costs_rent":"","region":"","costs":"","costs_rent_comment":"","costs_comment":"","address_hidden":false,"space_comment":"","space_units":"","space":"","address":""},{"costs_rent":"","region":"","costs":"","costs_rent_comment":"","costs_comment":"","address_hidden":false,"space_comment":"","space_units":"","space":"","address":""},{"costs_rent":"","region":"","costs":"","costs_rent_comment":"","costs_comment":"","address_hidden":false,"space_comment":"","space_units":"","space":"","address":""},{"costs_rent":"","region":"","costs":"","costs_rent_comment":"","costs_comment":"","address_hidden":false,"space_comment":"","space_units":"","space":"","address":""},{"costs_rent":"","region":"","costs":"","costs_rent_comment":"","costs_comment":"","space_comment":"","space_units":"","space":"","address":""},{"costs_rent":"","region":"","costs":"","costs_rent_comment":"","costs_comment":"","space_comment":"","space_units":"","space":"","address":""},{"costs_rent":"","region":"","costs":"","costs_rent_comment":"","costs_comment":"","space_comment":"","space_units":"","space":"","address":""},{"costs_rent":"","region":"","costs":"","costs_rent_comment":"","costs_comment":"","space_comment":"","space_units":"","space":"","address":""},{"costs_rent":"","region":"","costs":"","costs_rent_comment":"","costs_comment":"","space_comment":"","space_units":"","space":"","address":""},{"costs_rent":"","region":"","costs":"","costs_rent_comment":"","costs_comment":"","space_comment":"","space_units":"","space":"","address":""},{"costs_rent":"","region":"","costs":"","costs_rent_comment":"","costs_comment":"","space_comment":"","space_units":"","space":"","address":""},{"costs_rent":"","region":"","costs":"","costs_rent_comment":"","costs_comment":"","space_comment":"","space_units":"","space":"","address":""},{"costs_rent":"","region":"","costs":"","costs_rent_comment":"","costs_comment":"","space_comment":"","space_units":"","space":"","address":""},{"costs_rent":"","region":"","costs":"","costs_rent_comment":"","costs_comment":"","space_comment":"","space_units":"","space":"","address":""}],"24":[{"costs_rent":"","region":"","costs":"","costs_rent_comment":"","costs_comment":"","address_hidden":false,"region_hidden":true,"space_comment":"","space_units":"м²","space":"49.9","address":""}],"25":[{"space_unclear":false,"costs":"","costs_comment":"","address_hidden":false,"region_hidden":true,"space_comment":"","space_hidden":false,"space":"51.8","address":"","region":"","costs_rent_comment":"","space_units":"м²","costs_rent":""}],"27":[{"costs_rent":"","region":"","costs":"","costs_rent_comment":"","costs_comment":"","address_hidden":false,"region_hidden":true,"space_comment":"","space_units":"м²","space":"20.8","address":""}],"28":[{"space_hidden":true,"costs":"","costs_comment":"","address_hidden":false,"region_hidden":true,"space_comment":"","space":"","address":"","region":"","costs_rent_comment":"","space_units":"м²","costs_rent":"7450"}],"29":[{"costs_rent":"","region":"","costs_property":"","costs_rent_comment":"","address_hidden":false,"region_hidden":true,"space_comment":"","costs_property_comment":"","space_units":"м²","space":"64300","address":""},{"costs_rent":"","region":"","costs_property":"","costs_rent_comment":"","address_hidden":false,"space_comment":"","costs_property_comment":"","space_units":"м²","space":"66500","address":""}]},"intro":{"declaration_year":"2014","isnotdeclaration":""}}