{"income":{"5":{"value":"236066","family_comment":"","value_unclear":false,"family_hidden":false,"value_hidden":false,"family_unclear":false,"comment_unclear":false,"comment":"","family":""},"6":{"value":"228839","family_comment":"","comment_unclear":false,"family_hidden":false,"value_hidden":false,"family_unclear":false,"value_unclear":false,"comment":"","family":""},"7":{"source_name_unclear":false,"value":"2204","family_comment":"","source_name":"Одеське регіональне відділення Національної школи суддів України","family":"","comment":""},"8":{"family_comment":"","value":"","family":"","comment":""},"9":{"value":"","value_unclear":false,"comment_hidden":false,"family_comment":"","comment_unclear":false,"comment":"","family":""},"10":{"value":"","comment_unclear":false,"value_hidden":false,"family_comment":"","family":"","comment":""},"11":{"family_comment":"","value":"","family":"","comment":""},"12":{"family_comment":"","value":"","family":"","comment":""},"13":{"family_comment":"","value":"","family":"","comment":""},"14":{"family_comment":"","value":"","family":"","comment":""},"15":{"family_comment":"","value":"","family":"","comment":""},"16":{"family_comment":"","value":"","family":"","comment":""},"17":{"family_comment":"","value":"","family":"","comment":""},"18":{"value":"","family_hidden":false,"value_hidden":false,"family_comment":"","family":"","comment":""},"19":{"family_comment":"","value":"","family":"","comment":""},"20":{"value":"5023","family_comment":"","value_unclear":false,"family_hidden":false,"value_hidden":false,"family_unclear":false,"family":"","comment":""}},"id":"vulyk_66_33","declaration":{"additional_info_text":"Нижче п. 22 дописано: У ПАТ КБ Приват Банк у м. Южноукраїнську використано кошти кредитного ліміту у сумі 12700 грн. Нижче п. 64 дописано: АТ Райфайнзен Банк 'Аваль' у м. Южноукраїнську, ПАТ КБ Приват Банк у м. Южноукраїнську","notfull_lostpages":"","date":"2015-03-31T00:00:00","notfull":"","additional_info":"1","url":"http://static.declarations.com.ua/declarations/chosen_ones/mega_batch/volkova_olena_ivanivna.pdf"},"liabilities":{"54":{"sum_foreign_comment":"","sum":"","sum_comment":"","sum_comment_unclear":false,"sum_comment_hidden":false,"sum_unclear":false,"sum_foreign":""},"55":{"sum_foreign_comment":"","sum":"","sum_comment":"","sum_foreign":""},"56":{"sum_foreign_comment":"","sum":"","sum_comment":"","sum_hidden":false,"sum_comment_hidden":false,"sum_foreign_hidden":false,"sum_foreign":""},"57":{"sum_foreign_comment":"","sum":"31493","sum_comment":"","sum_comment_unclear":false,"sum_hidden":false,"sum_comment_hidden":false,"sum_unclear":false,"sum_foreign":""},"58":{"sum_foreign_comment":"","sum":"11352","sum_comment":"","sum_comment_unclear":true,"sum_unclear":false,"sum_foreign":""},"59":{"sum_foreign_comment":"","sum":"","sum_comment":"","sum_comment_unclear":false,"sum_hidden":false,"sum_foreign_hidden":false,"sum_foreign":""},"60":{"sum_foreign_comment":"","sum":"","sum_comment":"","sum_comment_unclear":false,"sum_foreign":""},"61":{"sum_foreign_comment":"","sum":"","sum_comment":"","sum_foreign":""},"62":{"sum_foreign_comment":"","sum_unclear":false,"sum":"","sum_comment":"","sum_hidden":false,"sum_foreign_hidden":false,"sum_foreign":""},"63":{"sum_foreign_comment":"","sum":"","sum_comment":"","sum_comment_unclear":false,"sum_comment_hidden":false,"sum_unclear":false,"sum_foreign":""},"64":{"sum_foreign_comment":"","sum":"","sum_comment":"","sum_comment_unclear":false,"sum_foreign":""}},"ft_src":"1/2\n66.6\n1/2\n66.6\n1\nНижче п. 22 дописано: У ПАТ КБ Приват Банк у м. Южноукраїнську використано кошти кредитного ліміту у сумі 12700 грн. Нижче п. 64 дописано: АТ Райфайнзен Банк 'Аваль' у м. Южноукраїнську, ПАТ КБ Приват Банк у м. Южноукраїнську\n2014\n228839\nОдеське регіональне відділення Національної школи суддів України\n2204\n236066\n5023\nНижче п. 22 дописано: У ПАТ КБ Приват Банк у м. Южноукраїнську використано кошти кредитного ліміту у сумі 12700 грн. Нижче п. 64 дописано: АТ Райфайнзен Банк 'Аваль' у м. Южноукраїнську, ПАТ КБ Приват Банк у м. Южноукраїнську\n1\n66.6\n1/2\n66.6\n1/2\nЗагальний місцевий суд\nсуддя южноукраїнського міського суду миколаївської області\nМиколаївська область\nДитина\nГлушко А. В\nВолкова Олена Іванівна\nОлена Іванівна Волкова\nОлена Волкова\nВолкова Олена Іванівна\nВолкова Олена Іванівна\nОлена\nВолкова\nІванівна\n31493\n11352\n2204\nОдеське регіональне відділення Національної школи суддів України\n228839\n5023\n236066\n2014\n11352\n31493\nГлушко А. В\nДитина\nІванівна\nВолкова\nОлена\nВолкова Олена Іванівна\nОлена Іванівна Волкова\nОлена Волкова\nВолкова Олена Іванівна\nМиколаївська область\nсуддя южноукраїнського міського суду миколаївської області\nЗагальний місцевий суд\nВолкова Олена Іванівна","general":{"inn":"","name":"Олена","last_name_hidden":false,"last_name":"Волкова","family":[{"inn":"","inn_hidden":false,"relations_hidden":false,"family_name":"Глушко А. В","relations_other":"","relations":"Дитина","name_hidden":true,"name_unclear":false}],"inn_hidden":false,"family_raw":"","inn_unclear":false,"post":{"post_unclear":false,"post":"суддя южноукраїнського міського суду миколаївської області","candidate":"","office_hidden":false,"region":"Миколаївська область","office":"Загальний місцевий суд","office_unclear":false},"full_name_suggest":{"output":"Волкова Олена Іванівна","input":["Волкова Олена Іванівна","Олена Іванівна Волкова","Олена Волкова"]},"full_name":"Волкова Олена Іванівна","addresses":[{"place_city_type_unclear":false,"place_city_type_hidden":true,"place_district_hidden":true,"place_city_type":"","place_address_hidden":true,"place_address_unclear":false,"place_address":"","place":"","place_district":"","place_unclear":false,"place_hidden":true,"place_city_unclear":false,"place_city_hidden":true,"place_city":"","place_district_unclear":false}],"patronymic":"Іванівна","last_name_unclear":false},"source":"VULYK","estate":{"25":[{"region_unclear":false,"space_hidden":false,"costs":"","costs_comment":"","costs_hidden":false,"address_hidden":true,"region_hidden":true,"space_comment":"1/2","space_unclear":false,"space":"66.6","address":"","region":"","address_unclear":false,"costs_rent_comment":"","space_comment_unclear":false,"space_units":"м²","space_units_hidden":false,"costs_rent":""}],"31":[{"space_unclear":false,"address_hidden":true,"region_hidden":true,"space_comment":"1/2","space_hidden":false,"space":"66.6","address":"","region":"","costs_property":"","costs_rent_comment":"","space_comment_unclear":false,"space_comment_hidden":false,"space_units":"м²","costs_property_comment":"","costs_rent":""}]},"intro":{"declaration_year":"2014","isnotdeclaration":"","declaration_year_unclear":false}}