{"income":{"5":{"family_comment":"","value":"302203","family":"","comment":""},"6":{"family_comment":"","value":"227198","family":"","comment":""},"7":{"value":"","comment_hidden":false,"family_comment":"","source_name":"","family":"","comment":"","source_name_hidden":false},"8":{"family_comment":"","value":"","family":"","comment":"","family_hidden":false},"9":{"value":"5","family_comment":"","value_unclear":false,"family_unclear":false,"family":"","comment":""},"10":{"family_comment":"","value":"","family":"","comment":""},"11":{"family_comment":"","value":"","family":"","comment":""},"12":{"family_comment":"","value":"","family":"","comment":""},"13":{"family_comment":"","value":"","family":"","comment":""},"14":{"family_comment":"","value":"","family":"","comment":""},"15":{"family_comment":"","value":"","family":"","comment":""},"16":{"family_comment":"","value":"75000","family":"","comment":""},"17":{"family_comment":"","value":"","family":"","comment":""},"18":{"family_comment":"","value":"","family":"","comment":""},"19":{"family_comment":"","value":"","family":"","comment":""},"20":{"value":"","value_unclear":false,"family_hidden":false,"family_comment":"","family":"","comment":""}},"id":"vulyk_109_47","declaration":{"additional_info_text":"Пояснення: мною не заповнені розділи декларації ІІ, Ш, ІУ, У, УІ відносно мого чоловіка Рязанцева С. В. оскілки останній виїхав за межі України в 2014 році і з цього часу я не володію інформацією щодо його доходів та майна. Чоловік в Україну не повертався","notfull_lostpages":"","date":"2016-03-25T00:00:00","notfull":"","additional_info":"1","url":"http://static.declarations.com.ua/declarations/chosen_ones/judges_batch/2504_kesia_nataliia_borysivna_2015.pdf"},"liabilities":{"54":{"sum_foreign_comment":"","sum":"","sum_comment":"","sum_hidden":false,"sum_comment_hidden":false,"sum_unclear":false,"sum_foreign":""},"55":{"sum_foreign_comment":"","sum":"","sum_comment":"","sum_comment_unclear":false,"sum_foreign":""},"56":{"sum_foreign_comment":"","sum":"","sum_comment":"","sum_foreign":""},"57":{"sum_foreign_comment":"","sum_comment":"","sum":"","sum_comment_hidden":false,"sum_foreign":""},"58":{"sum_foreign_comment":"","sum_comment":"","sum":"","sum_comment_hidden":false,"sum_foreign":""},"59":{"sum_foreign_comment":"","sum":"","sum_comment":"","sum_foreign":""},"60":{"sum_foreign_comment":"","sum":"","sum_comment":"","sum_foreign":""},"61":{"sum_foreign_comment":"","sum":"","sum_comment":"","sum_foreign":""},"62":{"sum_foreign_comment":"","sum":"","sum_comment":"","sum_foreign":""},"63":{"sum_foreign_comment":"","sum":"","sum_comment":"","sum_foreign":""},"64":{"sum_foreign_comment":"","sum":"","sum_comment":"","sum_foreign":""}},"ft_src":"44.8\n1\nПояснення: мною не заповнені розділи декларації ІІ, Ш, ІУ, У, УІ відносно мого чоловіка Рязанцева С. В. оскілки останній виїхав за межі України в 2014 році і з цього часу я не володію інформацією щодо його доходів та майна. Чоловік в Україну не повертався\n2015\n227198\n302203\n75000\n5\nПояснення: мною не заповнені розділи декларації ІІ, Ш, ІУ, У, УІ відносно мого чоловіка Рязанцева С. В. оскілки останній виїхав за межі України в 2014 році і з цього часу я не володію інформацією щодо його доходів та майна. Чоловік в Україну не повертався\n1\n227198\n302203\n75000\n5\nКеся Наталія Борисівна\nНаталія Борисівна Кеся\nНаталія Кеся\nКеся Наталія Борисівна\nНаталія\nПодружжя\nРязанцев С. В\nДитина\nРязанцева З. С\nКеся Наталія Борисівна\nБорисівна\nГосподарський місцевий суд\nДніпропетровська область\nсуддя господарського суду дніпропетровської області\nКеся\n44.8\n2015\nПодружжя\nРязанцев С. В\nДитина\nРязанцева З. С\nБорисівна\nКеся\nНаталія\nКеся Наталія Борисівна\nНаталія Борисівна Кеся\nНаталія Кеся\nКеся Наталія Борисівна\nДніпропетровська область\nГосподарський місцевий суд\nсуддя господарського суду дніпропетровської області\nКеся Наталія Борисівна","general":{"name_hidden":false,"name":"Наталія","inn":"","last_name":"Кеся","family":[{"inn":"","relations":"Подружжя","relations_hidden":true,"inn_hidden":true,"family_name":"Рязанцев С. В","relations_other":"","name_hidden":false,"name_unclear":false},{"inn":"","relations":"Дитина","relations_other":"","inn_hidden":true,"family_name":"Рязанцева З. С","name_hidden":false,"name_unclear":false}],"inn_hidden":true,"family_raw":"","inn_unclear":false,"post":{"region_unclear":false,"region":"Дніпропетровська область","post":"суддя господарського суду дніпропетровської області","region_hidden":false,"office":"Господарський місцевий суд","office_hidden":false,"office_unclear":false},"full_name":"Кеся Наталія Борисівна","addresses":[{"place_district":"","place_address_hidden":true,"place_city":"","place_address":"","place_district_hidden":true,"place_city_type":"","place_city_hidden":true,"place_city_type_hidden":true,"place_hidden":true,"place":""}],"patronymic":"Борисівна","full_name_suggest":{"output":"Кеся Наталія Борисівна","input":["Кеся Наталія Борисівна","Наталія Борисівна Кеся","Наталія Кеся"]}},"source":"VULYK","estate":{"25":[{"space_unclear":false,"costs":"","costs_comment":"","address_hidden":true,"region_hidden":true,"space_comment":"","space_hidden":false,"space":"44.8","space_units_hidden":false,"region":"","costs_rent_comment":"","space_units":"м²","address":"","costs_rent":""}]},"intro":{"declaration_year":"2015","isnotdeclaration":""}}