{"income":{"5":{"value":"183664.05","family_comment":"","value_unclear":false,"family_hidden":false,"value_hidden":false,"family_unclear":false,"family":"73657.86","comment":"","family_comment_unclear":false},"6":{"value":"171484.05","family_comment":"","value_unclear":false,"comment_hidden":false,"family_hidden":false,"value_hidden":false,"family_unclear":false,"family":"19320.7","comment":""},"7":{"value":"","value_hidden":false,"family_comment":"","source_name":"","family":"","comment":"","source_name_hidden":false},"8":{"family_comment":"","value":"","family":"","comment":""},"9":{"value":"","comment_hidden":false,"value_hidden":false,"family_comment":"","family":"","comment":""},"10":{"value":"12180","value_unclear":false,"value_hidden":false,"family_comment":"","family":"","comment":""},"11":{"family_comment":"","value":"","family":"","comment":""},"12":{"family_comment":"","value":"","family":"","comment":""},"13":{"family_comment":"","value":"","family":"","comment":"","family_hidden":false},"14":{"family_comment":"","value":"","family":"","comment":""},"15":{"family_comment":"","family_unclear":false,"value":"","family":"","comment":""},"16":{"family_comment":"","value":"","value_unclear":false,"family":"","comment":""},"17":{"family_comment":"","value":"","family":"","comment":""},"18":{"family_comment":"","value":"","family":"","comment":""},"19":{"family_comment":"","value":"","comment_unclear":false,"family":"","comment":""},"20":{"value":"","comment_unclear":false,"family_hidden":false,"value_hidden":false,"family_comment":"Згідно з ч. 6 ст. 46 ЗУ 'Про запобігання корупції' від 14. 10. 2014 №1700 у п. 20 Декларації 'сума одержаного (нарахованого) доходу членів сім'ї ' сума вказана без зазначення доходу платника (ід.№ 2021315983) за 4 кв. 2014р. року. ' - Момонт Г. М","family":"54337.16","comment":""}},"vehicle":{"40":[{"year_hidden":false,"brand_info":"1197 куб. см., 29.4 кВт","sum_rent_comment":"","year":"1987","brand_info_hidden":false,"brand_info_unclear":false,"sum_rent":"","sum":"","brand":"ЛуАЗ 969 М","sum_comment":"","brand_unclear":false,"brand_hidden":false}],"41":[{"brand_info":"554 М, 4750 куб. см., 59 кВт","sum":"","brand":"ЗИЛ ММЗ","sum_comment":"","year":"1990","sum_rent_comment":"","sum_rent":""}],"44":[{"brand_info":"Трактор, 6333 куб. см., 662 кВт","sum":"","brand":"Т-74","sum_comment":"","brand_unclear":false,"year":"1970","sum_rent_comment":"","sum_rent":""},{"brand_info":"Трактор, 4940 куб. см., 45.6 кВт","sum":"","brand":"ЮМЗ","sum_comment":"","year":"1987","sum_rent_comment":"","sum_rent":""}]},"id":"vulyk_64_146","declaration":{"additional_info_text":"","notfull_lostpages":"","date":"2015-03-31T00:00:00","notfull":"","additional_info":"","url":"http://static.declarations.com.ua/declarations/chosen_ones/mega_batch/momont_halyna_mytrofanivna.pdf"},"liabilities":{"54":{"sum_foreign_comment":"","sum":"3427","sum_comment":"","sum_foreign_comment_hidden":false,"sum_hidden":false,"sum_comment_hidden":false,"sum_unclear":false,"sum_foreign":""},"55":{"sum_foreign_comment":"","sum":"","sum_comment":"","sum_comment_unclear":false,"sum_foreign":""},"56":{"sum_foreign_comment":"","sum":"","sum_comment":"","sum_unclear":false,"sum_foreign":""},"57":{"sum_foreign_comment":"","sum":"3715.13","sum_comment":"","sum_hidden":false,"sum_unclear":false,"sum_foreign":""},"58":{"sum_foreign_comment":"","sum":"5084.87","sum_comment":"","sum_unclear":false,"sum_foreign":""},"59":{"sum_foreign_comment":"","sum":"","sum_comment":"","sum_comment_unclear":false,"sum_comment_hidden":false,"sum_unclear":false,"sum_foreign":""},"60":{"sum_foreign_comment":"","sum":"","sum_comment":"","sum_foreign":""},"61":{"sum_foreign_comment":"","sum":"","sum_comment":"","sum_foreign":""},"62":{"sum_foreign_comment":"","sum":"","sum_comment":"","sum_unclear":false,"sum_foreign":""},"63":{"sum_foreign_comment":"","sum":"","sum_comment":"","sum_unclear":false,"sum_foreign":""},"64":{"sum_foreign_comment":"","sum":"","sum_comment":"","sum_comment_unclear":false,"sum_unclear":false,"sum_foreign":""}},"ft_src":"554 М, 4750 куб. см., 59 кВт\n1990\nЗИЛ ММЗ\n1197 куб. см., 29.4 кВт\nЛуАЗ 969 М\n1987\n1970\nТрактор, 6333 куб. см., 662 кВт\nТ-74\nТрактор, 4940 куб. см., 45.6 кВт\n1987\nЮМЗ\n20000\n79.2\n110000\n79.2\n46.85\n289805.1\n2014\n19320.7\n171484.05\n12180\n73657.86\n183664.05\nЗгідно з ч. 6 ст. 46 ЗУ 'Про запобігання корупції' від 14. 10. 2014 №1700 у п. 20 Декларації 'сума одержаного (нарахованого) доходу членів сім'ї ' сума вказана без зазначення доходу платника (ід.№ 2021315983) за 4 кв. 2014р. року. ' - Момонт Г. М\n54337.16\n1197 куб. см., 29.4 кВт\nЛуАЗ 969 М\n1987\nТрактор, 6333 куб. см., 662 кВт\nТ-74\n1970\nТрактор, 4940 куб. см., 45.6 кВт\nЮМЗ\n1987\n554 М, 4750 куб. см., 59 кВт\nЗИЛ ММЗ\n1990\n20000\n110000\n79.2\n79.2\n289805.1\n46.85\nАдміністративний місцевий суд\nКіровоградська область\nсуддя кіровоградського окружного адміністративного суду\nБатьки\nМомонт Митрофан Сергійович\nБатьки\nМомонт Лідія Іванівна\nБрат/Сестра\nМомонт Сергій Митрофанович\nМомонт Галина Митрофанівна\nГалина Митрофанівна Момонт\nГалина Момонт\nМомонт Галина Митрофанівна\nМомонт Галина Митрофанівна\nГалина\nМомонт\nМитрофанівна\n3715.13\n5084.87\n3427\n19320.7\n171484.05\nЗгідно з ч. 6 ст. 46 ЗУ 'Про запобігання корупції' від 14. 10. 2014 №1700 у п. 20 Декларації 'сума одержаного (нарахованого) доходу членів сім'ї ' сума вказана без зазначення доходу платника (ід.№ 2021315983) за 4 кв. 2014р. року. ' - Момонт Г. М\n54337.16\n183664.05\n73657.86\n12180\n2014\n5084.87\n3715.13\n3427\nБатьки\nМомонт Митрофан Сергійович\nБатьки\nМомонт Лідія Іванівна\nМомонт Сергій Митрофанович\nБрат/Сестра\nМитрофанівна\nМомонт\nГалина\nМомонт Галина Митрофанівна\nГалина Митрофанівна Момонт\nГалина Момонт\nМомонт Галина Митрофанівна\nКіровоградська область\nАдміністративний місцевий суд\nсуддя кіровоградського окружного адміністративного суду\nМомонт Галина Митрофанівна","general":{"inn":"","name":"Галина","last_name_hidden":false,"last_name":"Момонт","family":[{"inn":"","inn_hidden":true,"relations_unclear":false,"relations_hidden":false,"relations_other":"","relations":"Батьки","name_hidden":false,"inn_unclear":false,"family_name":"Момонт Митрофан Сергійович","name_unclear":false},{"inn":"","inn_hidden":false,"relations_unclear":false,"relations_hidden":false,"relations_other":"","relations":"Батьки","name_hidden":false,"family_name":"Момонт Лідія Іванівна","name_unclear":false},{"inn":"","inn_hidden":false,"family_name":"Момонт Сергій Митрофанович","relations_other":"","relations":"Брат/Сестра","name_hidden":false,"name_unclear":false}],"inn_hidden":true,"family_raw":"","inn_unclear":false,"post":{"post_unclear":false,"post":"суддя кіровоградського окружного адміністративного суду","candidate":"","post_hidden":false,"region":"Кіровоградська область","office":"Адміністративний місцевий суд","office_hidden":false,"office_unclear":false,"region_hidden":false},"full_name_suggest":{"output":"Момонт Галина Митрофанівна","input":["Момонт Галина Митрофанівна","Галина Митрофанівна Момонт","Галина Момонт"]},"full_name":"Момонт Галина Митрофанівна","addresses":[{"place_city_type_unclear":false,"place_address":"","place_district_hidden":false,"place_city_type":"","place_unclear":false,"place_city_type_hidden":false,"place_city":"","place":"","place_district":"","place_address_hidden":false,"place_hidden":true,"place_city_unclear":false,"place_city_hidden":false}],"patronymic":"Митрофанівна","patronymic_hidden":false,"last_name_unclear":false,"name_unclear":false},"source":"VULYK","estate":{"23":[{"space_unclear":false,"costs":"","costs_rent_unclear":false,"costs_comment":"","costs_hidden":false,"space_comment_unclear":false,"space_hidden":false,"space_units_unclear":false,"space_units_hidden":false,"costs_rent_comment_unclear":false,"region":"","costs_unclear":false,"space_comment_hidden":false,"costs_rent":"","region_unclear":false,"address_hidden":false,"region_hidden":true,"space_comment":"","space":"20000","address":"","address_unclear":false,"costs_rent_comment":"","costs_rent_hidden":false,"space_units":"м²"}],"24":[{"space_hidden":false,"costs":"","costs_comment":"","costs_hidden":false,"address_hidden":false,"region_hidden":true,"space_comment":"","space":"79.2","address":"","region":"","address_unclear":false,"costs_rent_comment":"","costs_rent_hidden":false,"space_units":"м²","costs_rent":""}],"25":[{"region_unclear":false,"space_unclear":false,"costs":"289805.1","costs_rent_unclear":false,"costs_comment":"","costs_hidden":false,"address_hidden":false,"region_hidden":true,"space_comment":"","space_hidden":false,"space":"46.85","address":"","costs_rent_comment_unclear":false,"region":"","costs_rent_comment":"","costs_rent_hidden":false,"space_comment_unclear":false,"space_units":"м²","space_units_hidden":false,"costs_rent":"","costs_unclear":false}],"29":[{"region_unclear":false,"space_unclear":false,"costs_rent_unclear":false,"costs_property_hidden":false,"address_hidden":false,"region_hidden":true,"space_comment":"","space_hidden":false,"space":"110000","address":"","region":"","costs_property":"","costs_rent_comment":"","costs_rent_hidden":false,"address_unclear":false,"space_units":"м²","costs_property_comment":"","costs_rent":""}],"30":[{"region_unclear":false,"space_hidden":false,"costs_property_hidden":false,"address_hidden":false,"region_hidden":true,"space_comment":"","space_unclear":false,"space":"79.2","address":"","region":"","costs_property":"","costs_rent_comment":"","costs_rent_hidden":false,"space_comment_unclear":false,"address_unclear":false,"space_units":"м²","costs_property_comment":"","costs_rent":""}]},"intro":{"declaration_year":"2014","isnotdeclaration":"","declaration_year_unclear":false,"declaration_year_hidden":false}}