{"intro":{"declaration_year":"2014","declaration_year_hidden":false,"isnotdeclaration":""},"source":"VULYK","vehicle":{"35":[{"brand_hidden":false,"sum_rent_comment":"","sum_comment":"","brand_unclear":false,"brand":"BMW 525 TDS","brand_info":"2.5л., 143 к. с., 105 кВт","sum":"","brand_info_unclear":false,"sum_rent_comment_hidden":false,"sum_rent":"","year":"1995","brand_info_hidden":false}]},"income":{"5":{"family_unclear":false,"family":"12241","value":"264676","comment":"","value_unclear":false,"family_comment":"","family_hidden":false},"6":{"family_unclear":false,"family":"12241","value":"258101","comment":"","value_unclear":false,"family_comment":"","family_hidden":false},"7":{"source_name_hidden":false,"family":"","source_name":"","value":"","comment":"","family_comment":""},"8":{"family":"","value":"","family_comment":"","comment":""},"9":{"family":"","value":"","family_comment":"","comment":""},"10":{"family_unclear":false,"family":"","value":"","comment":"","family_comment":"","value_unclear":false},"11":{"family":"","value":"","family_comment":"","comment":""},"12":{"family":"","value":"","family_comment":"","comment":""},"13":{"family":"","value":"","family_comment":"","comment":""},"14":{"family":"","value":"","family_comment":"","comment":""},"15":{"family":"","value":"1350","comment":"","value_hidden":false,"family_comment":"","value_unclear":false},"16":{"family":"","value":"","family_comment":"","comment":""},"17":{"family_comment_hidden":false,"family":"","value":"","family_comment":"","comment":""},"18":{"family":"","value":"","family_comment":"","comment":""},"19":{"family":"","value":"","family_comment":"","comment":""},"20":{"family_unclear":false,"family_comment_hidden":false,"family_comment_unclear":false,"value":"5225","comment":"5208 - санітарно-курортне лікування, 17 грн. - Дельта-Банк додаткове благо","comment_unclear":false,"family_comment":"","family":""}},"estate":{"23":[{"costs_unclear":false,"costs_rent_comment":"","costs_rent":"","region":"","space":"0.0933","address_hidden":true,"space_hidden":false,"address":"","space_comment":"993 кв. м","costs_rent_hidden":false,"space_unclear":false,"region_hidden":true,"address_unclear":false,"costs_hidden":false,"costs":"","costs_comment":"","space_units":"га"},{"costs_hidden":false,"costs_rent_comment":"","costs_rent":"","region":"","space":"","space_unclear":false,"address":"","space_comment":"","costs_rent_hidden":false,"space_comment_unclear":false,"region_hidden":false,"costs_comment_unclear":false,"costs":"","costs_comment":"","space_units":""},{"space_comment":"","costs_rent_comment":"","costs_rent":"","region":"","space":"","space_units":"","costs":"","address":"","costs_comment":""}],"25":[{"costs_rent_comment":"","region":"","costs_rent":"","space":"66.7","address_hidden":true,"space_comment_hidden":false,"address":"","space_comment":"1/4 частина","space_hidden":false,"region_hidden":true,"space_unclear":false,"costs":"","costs_comment":"","space_units":"м²"}],"26":[{"space_comment":"","costs_rent_comment":"","region_hidden":true,"costs_rent":"","region":"","space":"","address_hidden":false,"space_units":"м²","costs":"","address":"","costs_comment":""}],"29":[{"costs_rent_comment":"","costs_rent":"","region":"","space":"0.0693","address_hidden":true,"costs_property":"","space_comment":"693 кв. м) (для садівництва №978","costs_property_comment":"","space_unclear":false,"region_hidden":true,"address_unclear":false,"address":"","space_units":"га"},{"costs_rent_comment":"","region":"","costs_rent":"","space":"0.0961","address_hidden":false,"costs_property":"","space_comment":"961 кв. м) (для будівництва будинку","costs_property_comment":"","space_unclear":false,"region_hidden":false,"address":"","space_units":"га"}],"31":[{"costs_rent_comment":"","region":"","costs_rent":"","space":"66.7","address_hidden":true,"space_comment_unclear":false,"costs_property":"","space_comment":"1/4 частина","costs_property_comment":"","space_hidden":false,"region_hidden":true,"space_comment_hidden":false,"space_unclear":false,"address":"","space_units":"м²"}],"32":[{"space_comment":"","costs_rent_comment":"","region_hidden":true,"region":"","costs_rent":"","costs_property_comment":"","address_hidden":true,"space":"67.5","costs_property":"","address":"","space_units":"м²"}]},"liabilities":{"54":{"sum_foreign_comment":"","sum_comment":"","sum_foreign":"","sum":"","sum_unclear":false,"sum_comment_unclear":false,"sum_comment_hidden":false,"sum_hidden":false},"55":{"sum_foreign_comment":"","sum_comment":"","sum_foreign":"","sum":""},"56":{"sum_foreign_comment":"","sum_comment":"","sum_foreign":"","sum":"","sum_unclear":false},"57":{"sum_foreign_comment":"","sum_comment":"","sum_foreign":"","sum":"87890","sum_unclear":false,"sum_comment_hidden":false,"sum_hidden":false},"58":{"sum_foreign_comment":"","sum_comment":"","sum_foreign":"","sum":"24520","sum_comment_hidden":false},"59":{"sum_foreign_comment":"","sum_comment":"","sum_foreign":"","sum":"","sum_unclear":false,"sum_comment_unclear":false},"60":{"sum_foreign_comment":"","sum_comment":"","sum_foreign":"","sum":"","sum_unclear":false,"sum_comment_unclear":false,"sum_comment_hidden":false,"sum_hidden":false},"61":{"sum_foreign_comment":"","sum_hidden":false,"sum_foreign":"","sum":"","sum_comment":""},"62":{"sum_foreign_comment":"","sum_comment":"","sum_foreign":"","sum":"","sum_unclear":false},"63":{"sum_foreign_comment":"","sum_hidden":false,"sum_foreign":"","sum":"","sum_comment":"","sum_comment_hidden":false},"64":{"sum_foreign_comment":"","sum_hidden":false,"sum_foreign":"","sum":"","sum_comment":"","sum_comment_hidden":false}},"general":{"full_name":"Остапчук Лариса Вячеславівна","full_name_suggest":{"output":"Остапчук Лариса Вячеславівна","input":["Остапчук Лариса Вячеславівна","Лариса Вячеславівна Остапчук","Лариса Остапчук"]},"family_raw":"","last_name":"Остапчук","patronymic":"Вячеславівна","last_name_unclear":false,"family":[{"inn":"","relations_other":"","inn_hidden":true,"relations":"Подружжя","inn_unclear":false,"name_unclear":false,"name_hidden":false,"family_name":"Остапчук П. М., 02. 03. 1958","relations_hidden":false}],"name":"Лариса","post":{"post":"суддя рівненського районного суду рівненської області","office_unclear":false,"region":"Рівненська область","post_hidden":false,"office":"Загальний місцевий суд","post_unclear":false,"office_hidden":false},"inn":"","inn_hidden":true,"addresses":[{"place_address":"","place_district":"","place_city":"","place_address_hidden":true,"place_city_type_hidden":true,"place":"","place_district_hidden":true,"place_city_type":"","place_city_hidden":true,"place_hidden":true}]},"id":"vulyk_28_31","declaration":{"date":"2015-03-31T00:00:00","notfull":"","additional_info_text":"п. 20, другий рядок: сума - 17 коментар - Дельтабанк - Додаткове благо п. 57: Укрексімбанк - 8959 Дельта Банк - 16301 ОТП Банк - 14600 Креді Агрікаль Банк - 26292 Приватбанк - 14119 Альфа-Банк - 7619 п. 58: Укрексімбанк - 2050 Дельта Банк - 9278 ОТП Банк - 1031 Креді Агрікаль Банк - 9570 Приватбанк - 1513 Альфа-Банк - 1078","url":"http://static.declarations.com.ua/declarations/chosen_ones/mega_batch/ostapchuk_larysa_viacheslavivna.pdf","additional_info":"1","notfull_lostpages":""},"ft_src":"87890\n24520\nп. 20, другий рядок: сума - 17 коментар - Дельтабанк - Додаткове благо п. 57: Укрексімбанк - 8959 Дельта Банк - 16301 ОТП Банк - 14600 Креді Агрікаль Банк - 26292 Приватбанк - 14119 Альфа-Банк - 7619 п. 58: Укрексімбанк - 2050 Дельта Банк - 9278 ОТП Банк - 1031 Креді Агрікаль Банк - 9570 Приватбанк - 1513 Альфа-Банк - 1078\n1\nсуддя рівненського районного суду рівненської області\nРівненська область\nЗагальний місцевий суд\nЛариса\nОстапчук П. М., 02. 03. 1958\nПодружжя\nВячеславівна\nОстапчук\nОстапчук Лариса Вячеславівна\nОстапчук Лариса Вячеславівна\nЛариса Вячеславівна Остапчук\nЛариса Остапчук\nОстапчук Лариса Вячеславівна\n2.5л., 143 к. с., 105 кВт\nBMW 525 TDS\n1995\n3169\n4746\n1\nп. 20, другий рядок: сума - 17 коментар - Дельтабанк - Додаткове благо п. 57: Укрексімбанк - 8959 Дельта Банк - 16301 ОТП Банк - 14600 Креді Агрікаль Банк - 26292 Приватбанк - 14119 Альфа-Банк - 7619 п. 58: Укрексімбанк - 2050 Дельта Банк - 9278 ОТП Банк - 1031 Креді Агрікаль Банк - 9570 Приватбанк - 1513 Альфа-Банк - 1078\n2014\n2.5л., 143 к. с., 105 кВт\nBMW 525 TDS\n1995\nп. 20, другий рядок: сума - 17 коментар - Дельтабанк - Додаткове благо п. 57: Укрексімбанк - 8959 Дельта Банк - 16301 ОТП Банк - 14600 Креді Агрікаль Банк - 26292 Приватбанк - 14119 Альфа-Банк - 7619 п. 58: Укрексімбанк - 2050 Дельта Банк - 9278 ОТП Банк - 1031 Креді Агрікаль Банк - 9570 Приватбанк - 1513 Альфа-Банк - 1078\n1\n4746\n3169\n66.7\n1/4 частина\n0.0933\n993 кв. м\n0.0693\n693 кв. м) (для садівництва №978\n0.0961\n961 кв. м) (для будівництва будинку\n1/4 частина\n66.7\n67.5\nОстапчук Лариса Вячеславівна\nЛариса Вячеславівна Остапчук\nЛариса Остапчук\nОстапчук Лариса Вячеславівна\nОстапчук Лариса Вячеславівна\nПодружжя\nОстапчук П. М., 02. 03. 1958\nЛариса\nВячеславівна\nЗагальний місцевий суд\nсуддя рівненського районного суду рівненської області\nРівненська область\nОстапчук\n87890\n24520\n12241\n258101\n5225\n5208 - санітарно-курортне лікування, 17 грн. - Дельта-Банк додаткове благо\n1350\n12241\n264676\n2014\n24520\n87890\n693 кв. м) (для садівництва №978\n0.0693\n961 кв. м) (для будівництва будинку\n0.0961\n67.5\n993 кв. м\n0.0933\n1/4 частина\n66.7\n1/4 частина\n66.7\nОстапчук П. М., 02. 03. 1958\nПодружжя\nЛариса\nВячеславівна\nОстапчук\nОстапчук Лариса Вячеславівна\nЛариса Вячеславівна Остапчук\nЛариса Остапчук\nОстапчук Лариса Вячеславівна\nРівненська область\nсуддя рівненського районного суду рівненської області\nЗагальний місцевий суд\nОстапчук Лариса Вячеславівна\n12241\n258101\n1350\n12241\n264676\n5208 - санітарно-курортне лікування, 17 грн. - Дельта-Банк додаткове благо\n5225\nBMW 525 TDS\n2.5л., 143 к. с., 105 кВт\n1995\n1350\n5225\n5208 - санітарно-курортне лікування, 17 грн. - Дельта-Банк додаткове благо\n264676\n12241\n258101\n12241\n1/4 частина\n66.7\n993 кв. м\n0.0933\n67.5\n1/4 частина\n66.7\n693 кв. м) (для садівництва №978\n0.0693\n961 кв. м) (для будівництва будинку\n0.0961\n4746\n3169\n2014","banks":{"45":[{"sum_units_hidden":false,"sum_hidden":false,"sum_comment":"","sum_units":"UAH","sum_units_unclear":false,"sum_comment_hidden":false,"sum_foreign_comment":"","sum_foreign":"","sum":"4746","sum_unclear":false,"sum_foreign_units":"UAH","sum_comment_unclear":false},{"sum_foreign_comment":"","sum_comment":"","sum_foreign":"","sum":"","sum_unclear":false,"sum_foreign_units":"","sum_units_unclear":false,"sum_comment_hidden":false,"sum_units":""},{"sum_foreign_comment":"","sum_comment":"","sum_foreign":"","sum":"","sum_foreign_units":"","sum_units":""}],"46":[{"sum_foreign_comment":"","sum_comment":"","sum_foreign":"","sum":"","sum_unclear":false,"sum_foreign_units":"UAH","sum_units_unclear":false,"sum_comment_hidden":false,"sum_units":"UAH","sum_hidden":false},{"sum_foreign_comment":"","sum_comment":"","sum_foreign":"","sum":"","sum_comment_hidden":false,"sum_units":""}],"47":[{"sum_hidden":false,"sum_comment":"","sum_units":"UAH","sum_units_unclear":false,"sum_comment_hidden":false,"sum_foreign_comment_hidden":false,"sum_foreign_comment":"","sum_foreign":"","sum":"","sum_unclear":false,"sum_foreign_units":"UAH","sum_comment_unclear":false},{"sum_units":"","sum_foreign_comment":"","sum_comment":"","sum":"","sum_foreign":""}],"48":[{"sum_foreign_comment":"","sum_comment":"","sum_foreign":"","sum":"","sum_foreign_units":"UAH","sum_units":"UAH"},{"sum_foreign_comment":"","sum_comment":"","sum_foreign":"","sum":"","sum_foreign_units":"","sum_units":""}],"49":[{"sum_foreign_comment":"","sum_comment":"","sum_foreign":"","sum":"","sum_foreign_units":"UAH","sum_units":"UAH"}],"50":[{"sum_foreign_comment":"","sum_comment":"","sum_foreign":"","sum":"","sum_foreign_units":"UAH","sum_units":"UAH"}],"51":[{"sum_units_hidden":false,"sum_hidden":false,"sum_comment":"","sum_units":"UAH","sum_units_unclear":false,"sum_comment_hidden":false,"sum_foreign_unclear":false,"sum_foreign_comment":"","sum_foreign":"","sum":"3169","sum_unclear":false,"sum_foreign_units":"UAH","sum_foreign_units_unclear":false},{"sum_foreign_comment":"","sum_comment":"","sum_foreign":"","sum":"","sum_comment_hidden":false,"sum_foreign_units":"","sum_units":""}],"52":[{"sum_foreign_comment":"","sum_comment":"","sum_foreign":"","sum":"","sum_unclear":false,"sum_foreign_units":"UAH","sum_comment_unclear":false,"sum_units_unclear":false,"sum_comment_hidden":false,"sum_units":"UAH"}],"53":[{"sum_foreign_comment":"","sum_comment":"","sum_foreign":"","sum":"","sum_foreign_units":"UAH","sum_units":"UAH"}]}}