{"intro":{"declaration_year":"2014","declaration_year_unclear":false,"isnotdeclaration":""},"source":"VULYK","vehicle":{"35":[{"brand":"Volkswagen Touareg","sum_rent_comment":"","sum_comment":"отримано у спадщину","sum":"","brand_unclear":false,"brand_info":"2987 куб. см., 225 к. с","year":"2010","sum_rent":"","brand_info_unclear":false}],"40":[{"brand":"Subaru Tribeca","sum_rent_comment":"користування","sum_comment":"","sum":"","brand_unclear":false,"brand_info":"3630 куб. см., 258 к. с","year":"2008","sum_rent":"","year_unclear":false,"brand_info_unclear":false}]},"income":{"5":{"family_unclear":false,"family_comment":"","comment_hidden":false,"value":"331875.75","comment":"","value_hidden":false,"value_unclear":false,"family":"1487.02","family_hidden":false},"6":{"family_unclear":false,"family_comment":"","value":"251799.2","comment":"","value_unclear":false,"comment_unclear":false,"family":"","family_hidden":false},"7":{"family":"","source_name":"Національна академія правових наук України, НДІ приватного права і підприємництва НАПрН, Одеський національний медичний університет. НУ 'Одеська юридична академія', Національна школа суддів України, ДВНЗ 'Одеський коледж економіки, права та готельно-ресторанного бізнесу'","value":"80076.55","comment":"","source_name_unclear":false,"value_hidden":false,"family_comment":"","source_name_hidden":false},"8":{"family":"","value":"","comment":"","value_hidden":false,"family_comment":"","family_hidden":false},"9":{"family_unclear":false,"family_comment":"","value":"","comment":"","value_hidden":false,"value_unclear":false,"family":"109.02","family_hidden":false},"10":{"family":"","value":"","family_comment":"","comment":""},"11":{"family":"","value":"","family_comment":"","comment":""},"12":{"family":"","value":"","family_comment":"","comment":""},"13":{"family":"","value":"","family_comment":"","comment":""},"14":{"family":"","value":"","family_comment":"","comment":""},"15":{"family":"","value":"","family_comment":"","comment":""},"16":{"family_unclear":false,"family":"","value":"","comment":"","family_comment":"","value_unclear":false},"17":{"family":"","value":"","family_comment":"","comment":""},"18":{"family":"","value":"","family_comment":"","comment":""},"19":{"family":"","comment_unclear":false,"value":"","comment":"","family_comment":""},"20":{"family_unclear":false,"family":"1378","comment_hidden":false,"value":"","comment":"","family_comment_unclear":false,"value_unclear":false,"value_hidden":false,"comment_unclear":false,"family_comment":"","family_hidden":false}},"estate":{"23":[{"costs_hidden":false,"costs_rent_comment":"","region":"","space_units_hidden":false,"costs_rent_hidden":false,"address_hidden":true,"space_units_unclear":false,"space_unclear":true,"address":"","space_comment":"за договором дарування","space":"241","space_hidden":false,"region_hidden":true,"costs_rent":"","costs":"","costs_comment":"","space_units":"м²"},{"costs_rent_comment":"","region":"","costs_rent":"","space":"314","address_hidden":true,"space_units_unclear":false,"address":"","space_comment":"в порядку приватизації","space_unclear":false,"region_hidden":true,"costs":"","costs_comment":"","space_units":"м²"},{"space_comment":"отримано в порядку спадкування за законом","costs_rent_comment":"","costs_rent":"","region":"","space":"800","space_units":"м²","costs":"","address":"","costs_comment":""},{"space_comment":"отримано в порядку спадкування за законом","costs_rent_comment":"","costs_rent":"","region":"","space":"907","space_units":"м²","costs":"","address":"","costs_comment":""}],"25":[{"costs_hidden":false,"costs_rent_comment":"","space_units_hidden":false,"costs_rent":"","space":"102.5","address_hidden":true,"region":"","space_comment_unclear":false,"costs_rent_comment_hidden":false,"space_comment":"житловий фонд місцевої Ради","costs_rent_hidden":false,"space_hidden":false,"region_hidden":true,"costs_comment_hidden":false,"address_unclear":false,"space_unclear":false,"region_unclear":false,"address":"","costs":"","costs_comment":"","space_units":"м²"},{"space_comment":"в порядку спадкування","costs_rent_comment":"","region_hidden":true,"costs_rent":"","region":"","space":"136.1","address_hidden":false,"space_units":"м²","costs":"","address":"","costs_comment":""}],"26":[{"costs_hidden":false,"costs_rent_comment":"","region":"","costs_rent":"","costs_rent_hidden":false,"address_hidden":true,"costs_rent_comment_hidden":false,"space_comment":"за договором дарування","space":"107.4","region_hidden":true,"costs_comment_hidden":false,"address":"","costs":"","costs_comment":"","space_units":"м²"},{"space_comment":"як новостворене майно","costs_rent_comment":"","region_hidden":true,"costs_rent":"","region":"","space":"97.9","space_units":"м²","costs":"","address":"","costs_comment":""}],"29":[{"costs_rent_comment":"","costs_rent":"","region":"","space":"17700","address_hidden":true,"space_units_unclear":false,"space_hidden":false,"costs_property":"","space_comment":"","costs_property_comment":"","space_unclear":false,"region_hidden":true,"address_unclear":false,"address":"","space_units":"м²"}],"31":[{"costs_property_comment":"","costs_rent_comment":"","costs_rent":"","region":"","costs_rent_hidden":false,"address_hidden":true,"space_units_unclear":false,"space_unclear":false,"costs_property":"","space_comment":"248/1000 частин квартири","costs_property_hidden":false,"space_hidden":false,"region_hidden":true,"space":"24.65","space_comment_unclear":false,"costs_rent_comment_hidden":false,"address":"","costs_property_comment_hidden":false,"space_units":"м²"}]},"liabilities":{"54":{"sum_foreign_comment":"","sum_comment":"","sum_foreign":"","sum":"767","sum_unclear":false},"55":{"sum_foreign_comment":"","sum_comment":"","sum_foreign":"","sum":""},"56":{"sum_foreign_comment":"","sum_comment":"","sum_foreign":"","sum":"","sum_unclear":false},"57":{"sum_foreign_comment":"","sum_comment":"","sum_foreign":"","sum":"","sum_unclear":false,"sum_comment_hidden":false},"58":{"sum_foreign_comment":"","sum_comment":"","sum_foreign":"","sum":"","sum_comment_hidden":false},"59":{"sum_foreign_comment":"","sum_comment":"","sum_foreign":"","sum":""},"60":{"sum_foreign_comment":"","sum_comment":"","sum_foreign":"","sum":"","sum_comment_unclear":false},"61":{"sum_foreign_comment":"","sum_comment":"","sum_foreign":"","sum":"","sum_unclear":false},"62":{"sum_foreign_comment":"","sum_comment":"","sum_foreign":"","sum":"","sum_unclear":false},"63":{"sum_foreign_comment":"","sum_comment":"","sum_foreign":"","sum":"","sum_unclear":false,"sum_comment_hidden":false,"sum_hidden":false},"64":{"sum_foreign_comment":"","sum_comment":"","sum_foreign":"","sum":"","sum_comment_hidden":false}},"general":{"full_name":"Погрібний Сергій Олексійович","full_name_suggest":{"output":"Погрібний Сергій Олексійович","input":["Погрібний Сергій Олексійович","Сергій Олексійович Погрібний","Сергій Погрібний"]},"family_raw":"","last_name":"Погрібний","patronymic":"Олексійович","name_unclear":false,"addresses":[{"place_district":"","place_city":"","place_city_type_unclear":false,"place_address_unclear":false,"place_address_hidden":true,"place_district_hidden":true,"place_city_type":"","place_city_hidden":true,"place_hidden":true,"place_address":"","place_unclear":false,"place_district_unclear":false,"place_city_type_hidden":true,"place_city_unclear":false,"place":""}],"last_name_hidden":false,"patronymic_unclear":false,"inn":"","name":"Сергій","post":{"office_unclear":false,"post":"суддя, заступник голови приморського районного суду м. одеси","region_hidden":false,"region":"Одеська область","region_unclear":false,"post_unclear":false,"office":"Загальний місцевий суд","office_hidden":false},"family":[{"inn_hidden":true,"inn":"","relations_other":"","inn_unclear":false,"relations":"Подружжя","relations_unclear":false,"name_unclear":false,"name_hidden":true,"family_name":"Погрібна О. В","relations_hidden":false},{"inn":"","relations_other":"","inn_hidden":false,"relations":"Дитина","inn_unclear":false,"name_unclear":false,"name_hidden":true,"family_name":"Погрібний М. С","relations_unclear":false}],"inn_hidden":true,"inn_unclear":false,"last_name_unclear":false,"name_hidden":false},"id":"vulyk_63_130","declaration":{"date":"2015-03-25T00:00:00","notfull":"","additional_info_text":"","url":"http://static.declarations.com.ua/declarations/chosen_ones/mega_batch/pohribnyi_serhii_oleksiiovych.pdf","additional_info":"","notfull_lostpages":""},"ft_src":"767\nсуддя, заступник голови приморського районного суду м. одеси\nОдеська область\nЗагальний місцевий суд\nСергій\nПогрібна О. В\nПодружжя\nПогрібний М. С\nДитина\nОлексійович\nПогрібний\nПогрібний Сергій Олексійович\nПогрібний Сергій Олексійович\nСергій Олексійович Погрібний\nСергій Погрібний\nПогрібний Сергій Олексійович\nотримано у спадщину\n2010\nVolkswagen Touareg\n2987 куб. см., 225 к. с\nкористування\n3630 куб. см., 258 к. с\nSubaru Tribeca\n2008\n15620.21\n2014\n2987 куб. см., 225 к. с\nотримано у спадщину\n2010\nVolkswagen Touareg\n3630 куб. см., 258 к. с\nкористування\n2008\nSubaru Tribeca\n15620.21\n241\nза договором дарування\n314\nв порядку приватизації\n800\nотримано в порядку спадкування за законом\n907\nотримано в порядку спадкування за законом\n17700\n107.4\nза договором дарування\n97.9\nяк новостворене майно\n24.65\n248/1000 частин квартири\n102.5\nжитловий фонд місцевої Ради\n136.1\nв порядку спадкування\nОлексійович\nПогрібний Сергій Олексійович\nСергій Олексійович Погрібний\nСергій Погрібний\nПогрібний Сергій Олексійович\nСергій\nПодружжя\nПогрібна О. В\nДитина\nПогрібний М. С\nПогрібний Сергій Олексійович\nЗагальний місцевий суд\nОдеська область\nсуддя, заступник голови приморського районного суду м. одеси\nПогрібний\n767\n80076.55\nНаціональна академія правових наук України, НДІ приватного права і підприємництва НАПрН, Одеський національний медичний університет. НУ 'Одеська юридична академія', Національна школа суддів України, ДВНЗ 'Одеський коледж економіки, права та готельно-ресторанного бізнесу'\n251799.2\n1378\n331875.75\n1487.02\n109.02\n2014\n767\n248/1000 частин квартири\n24.65\n17700\nза договором дарування\n107.4\nяк новостворене майно\n97.9\nза договором дарування\n241\nв порядку приватизації\n314\nотримано в порядку спадкування за законом\n800\nотримано в порядку спадкування за законом\n907\nжитловий фонд місцевої Ради\n102.5\nв порядку спадкування\n136.1\nПодружжя\nПогрібна О. В\nДитина\nПогрібний М. С\nОлексійович\nПогрібний\nПогрібний Сергій Олексійович\nСергій Олексійович Погрібний\nСергій Погрібний\nПогрібний Сергій Олексійович\nСергій\nОдеська область\nсуддя, заступник голови приморського районного суду м. одеси\nЗагальний місцевий суд\nПогрібний Сергій Олексійович\n251799.2\nНаціональна академія правових наук України, НДІ приватного права і підприємництва НАПрН, Одеський національний медичний університет. НУ 'Одеська юридична академія', Національна школа суддів України, ДВНЗ 'Одеський коледж економіки, права та готельно-ресторанного бізнесу'\n80076.55\n1487.02\n331875.75\n109.02\n1378\nотримано у спадщину\n2010\n2987 куб. см., 225 к. с\nVolkswagen Touareg\nкористування\n2008\n3630 куб. см., 258 к. с\nSubaru Tribeca\n1378\n331875.75\n1487.02\n80076.55\nНаціональна академія правових наук України, НДІ приватного права і підприємництва НАПрН, Одеський національний медичний університет. НУ 'Одеська юридична академія', Національна школа суддів України, ДВНЗ 'Одеський коледж економіки, права та готельно-ресторанного бізнесу'\n109.02\n251799.2\n248/1000 частин квартири\n24.65\nза договором дарування\n241\nв порядку приватизації\n314\nотримано в порядку спадкування за законом\n800\nотримано в порядку спадкування за законом\n907\nза договором дарування\n107.4\nяк новостворене майно\n97.9\n102.5\nжитловий фонд місцевої Ради\nв порядку спадкування\n136.1\n17700\n15620.21\n2014","banks":{"51":[{"sum_foreign_comment":"","sum_comment":"","sum_foreign":"","sum":"15620.21","sum_comment_hidden":false,"sum_foreign_units":"UAH","sum_foreign_unclear":false,"sum_foreign_hidden":false,"sum_units":"UAH","sum_hidden":false,"sum_unclear":false}]}}