{"intro":{"declaration_year":"2014","isnotdeclaration":""},"source":"VULYK","vehicle":{"35":[{"brand_hidden":false,"sum_rent_comment":"","sum_comment":"","brand_unclear":false,"year_hidden":false,"brand":"Kia Mohave","brand_info":"3800 куб. см.","sum":"","brand_info_unclear":false,"sum_rent":"","year":"2012","brand_info_hidden":false}],"40":[{"brand":"Honda CR-V","sum_rent_comment":"","sum_comment":"","sum":"","brand_info_unclear":false,"brand_info":"2400 куб. см., 165 кВт","year":"2011","sum_rent":""}]},"income":{"5":{"family_unclear":false,"family_comment":"","value":"360837","comment":"","value_hidden":false,"value_unclear":false,"family":"1589869","family_hidden":false},"6":{"family_unclear":false,"family":"","value":"229528","comment":"","family_comment":"","value_unclear":false},"7":{"source_name_hidden":false,"family":"","comment_hidden":false,"value":"128204","comment":"","source_name_unclear":false,"source_name":"Львівський національний університет Франка, Національний університет 'Львівська політехніка', Львівський державний університет внутрішніх справ, ПВНЗ 'Львівський університет бізнесу та права', Національна школа суддів України","family_comment":""},"8":{"family":"","value":"3000","family_comment":"","comment":""},"9":{"family_unclear":false,"family":"","value":"105","comment":"","value_unclear":false,"family_comment":"","family_comment_unclear":false,"family_hidden":false},"10":{"family":"","value":"","family_comment":"","comment":""},"11":{"family":"","value":"","family_comment":"","comment":""},"12":{"family":"","value":"","family_comment":"","comment":""},"13":{"family":"","value":"","family_comment":"","comment":""},"14":{"family":"","value":"","family_comment":"","comment":""},"15":{"family":"","value":"","family_comment":"","comment":""},"16":{"family":"","value":"","family_comment":"","comment":""},"17":{"family":"1589869","value":"","family_comment":"","comment":""},"18":{"family":"","value":"","family_comment":"","comment":""},"19":{"family":"","value":"","family_comment":"","comment":""},"20":{"family_unclear":false,"family_comment_hidden":false,"family_comment_unclear":false,"value":"","comment":"","value_unclear":false,"comment_unclear":false,"family_comment":"","family":""}},"estate":{"23":[{"costs_rent_comment":"","region":"","costs_rent":"","space":"499","address_hidden":false,"space_comment_unclear":false,"address":"","space_comment":"","space_unclear":false,"region_hidden":true,"costs":"","costs_comment":"","space_units":"м²"},{"space_comment":"","costs_rent_comment":"","region_hidden":false,"costs_rent":"","region":"","space":"1.884","space_units":"га","costs":"","address":"","costs_comment":""},{"space_comment":"","costs_rent_comment":"","costs_rent":"","region":"","space":"2500","space_units":"м²","costs":"","address":"","costs_comment":""}],"24":[{"costs_rent_comment":"","region":"","costs_rent":"","space":"254.9","address_hidden":false,"space_comment_unclear":false,"address":"","space_comment":"","space_unclear":false,"region_hidden":true,"costs":"","costs_comment":"","space_units":"м²"}],"25":[{"space_comment":"","costs_rent_comment":"","region":"","costs_rent":"","space":"30.6","address_hidden":false,"space_hidden":false,"address":"","costs_rent_comment_unclear":false,"space_unclear":false,"region_hidden":true,"costs":"","costs_comment":"","space_units":"м²"},{"costs_rent_comment":"","region":"","costs_rent":"","space":"35.3","address_hidden":false,"address":"","space_comment":"","space_unclear":false,"region_hidden":false,"costs_comment_hidden":false,"costs":"","costs_comment":"","space_units":""}],"27":[{"space_comment":"","costs_rent_comment":"","region_hidden":true,"costs_rent":"","region":"","space":"48.8","address_hidden":false,"space_units":"м²","costs":"","address":"","costs_comment":""}],"29":[{"costs_rent_comment":"","region":"","costs_rent":"","space":"1.435","address_hidden":true,"space_unclear":false,"costs_property":"","space_comment":"","costs_property_comment":"","space_comment_unclear":false,"region_hidden":true,"address":"","space_units":"га"}],"31":[{"costs_rent_comment":"","region":"","costs_rent":"","space":"70.1","address_hidden":true,"space_hidden":false,"costs_property":"","space_comment":"","costs_property_comment":"","space_comment_unclear":false,"region_hidden":true,"address":"","space_units":"м²"},{"space_comment":"","costs_rent_comment":"","region_hidden":false,"costs_rent":"","region":"","costs_property_comment":"","space":"91.4","space_units":"м²","address":"","costs_property":""},{"space_comment":"","costs_rent_comment":"","region_hidden":false,"costs_rent":"","costs_property_comment":"","space":"63.5","space_units":"м²","address":"","costs_property":""}]},"liabilities":{"54":{"sum_foreign_comment":"","sum_hidden":false,"sum_foreign":"","sum":"","sum_comment":""},"55":{"sum_foreign_comment":"","sum_comment":"","sum_foreign":"","sum":""},"56":{"sum_foreign_comment":"","sum_comment":"","sum_foreign":"","sum":"50000"},"57":{"sum_foreign_comment":"","sum_comment":"","sum_foreign":"","sum":"65469","sum_unclear":false,"sum_comment_hidden":false,"sum_hidden":false},"58":{"sum_foreign_comment":"","sum_comment":"","sum_foreign":"","sum":"70603","sum_unclear":false,"sum_comment_unclear":false,"sum_hidden":false},"59":{"sum_foreign_comment":"","sum_comment":"","sum_foreign":"","sum":""},"60":{"sum_foreign_comment":"","sum_hidden":false,"sum_foreign":"","sum":"","sum_comment":""},"61":{"sum_foreign_comment":"","sum_comment":"","sum_foreign":"","sum":""},"62":{"sum_foreign_comment":"","sum_comment":"","sum_foreign":"","sum":"45000"},"63":{"sum_foreign_comment":"","sum_comment":"","sum_foreign":"","sum":"145758"},"64":{"sum_foreign_comment":"","sum_comment":"","sum_foreign":"","sum":"178189"}},"general":{"full_name":"Кравчук Володимир Миколайович","post":{"post":"суддя львівського окружного адміністративного суду","candidate":"","office_unclear":false,"region":"Львівська область","region_unclear":false,"post_unclear":false,"office":"Адміністративний місцевий суд"},"inn":"","last_name":"Кравчук","family_raw":"","patronymic":"Миколайович","inn_hidden":true,"full_name_suggest":{"output":"Кравчук Володимир Миколайович","input":["Кравчук Володимир Миколайович","Володимир Миколайович Кравчук","Володимир Кравчук"]},"addresses":[{"place_address":"","place_district":"","place_city":"","place_address_hidden":true,"place_city_type_hidden":true,"place":"","place_district_hidden":true,"place_city_type":"","place_city_hidden":true,"place_hidden":true}],"family":[{"inn":"","relations_other":"","name_unclear":false,"relations":"Подружжя","inn_hidden":true,"name_hidden":false,"family_name":"Красовська А. В","relations_hidden":false},{"inn":"","relations_other":"","name_unclear":false,"relations":"Дитина","inn_hidden":false,"name_hidden":false,"family_name":"Кравчук Д. В"}],"name":"Володимир"},"id":"vulyk_93_45","declaration":{"date":"2015-03-31T00:00:00","notfull":"","additional_info_text":"","url":"http://static.declarations.com.ua/declarations/chosen_ones/judges_batch/3491_kravchuk_volodymyr_mykolaiovych.pdf","additional_info":"","notfull_lostpages":""},"ft_src":"65469\n45000\n70603\n145758\n50000\n178189\nКравчук Володимир Миколайович\nсуддя львівського окружного адміністративного суду\nЛьвівська область\nАдміністративний місцевий суд\nВолодимир\nКрасовська А. В\nПодружжя\nКравчук Д. В\nДитина\nКравчук Володимир Миколайович\nВолодимир Миколайович Кравчук\nВолодимир Кравчук\nКравчук Володимир Миколайович\nКравчук\nМиколайович\n3800 куб. см.\nKia Mohave\n2012\n2400 куб. см., 165 кВт\n2011\nHonda CR-V\n48.8\n1.435\n254.9\n70.1\n91.4\n63.5\n499\n1.884\n2500\n30.6\n35.3\n59000\n2014\n3800 куб. см.\nKia Mohave\n2012\n2400 куб. см., 165 кВт\nHonda CR-V\n2011\n48.8\n30.6\n35.3\n499\n1.884\n2500\n1.435\n254.9\n70.1\n91.4\n63.5\nКравчук\nПодружжя\nКрасовська А. В\nДитина\nКравчук Д. В\nКравчук Володимир Миколайович\nВолодимир Миколайович Кравчук\nВолодимир Кравчук\nКравчук Володимир Миколайович\nКравчук Володимир Миколайович\nВолодимир\nМиколайович\nЛьвівська область\nАдміністративний місцевий суд\nсуддя львівського окружного адміністративного суду\n70603\n65469\n50000\n45000\n145758\n178189\n128204\nЛьвівський національний університет Франка, Національний університет 'Львівська політехніка', Львівський державний університет внутрішніх справ, ПВНЗ 'Львівський університет бізнесу та права', Національна школа суддів України\n229528\n1589869\n360837\n1589869\n105\n3000\n59000\n2014\n70603\n65469\n50000\n45000\n145758\n178189\n229528\n105\n3000\nЛьвівський національний університет Франка, Національний університет 'Львівська політехніка', Львівський державний університет внутрішніх справ, ПВНЗ 'Львівський університет бізнесу та права', Національна школа суддів України\n128204\n1589869\n360837\n1589869\nПодружжя\nКрасовська А. В\nДитина\nКравчук Д. В\nКравчук\nМиколайович\nЛьвівська область\nАдміністративний місцевий суд\nсуддя львівського окружного адміністративного суду\nКравчук Володимир Миколайович\nКравчук Володимир Миколайович\nВолодимир Миколайович Кравчук\nВолодимир Кравчук\nКравчук Володимир Миколайович\nВолодимир\nKia Mohave\n3800 куб. см.\n2012\n2011\n2400 куб. см., 165 кВт\nHonda CR-V\n105\n360837\n1589869\n3000\n128204\nЛьвівський національний університет Франка, Національний університет 'Львівська політехніка', Львівський державний університет внутрішніх справ, ПВНЗ 'Львівський університет бізнесу та права', Національна школа суддів України\n1589869\n229528\n70.1\n91.4\n63.5\n499\n1.884\n2500\n254.9\n48.8\n30.6\n35.3\n1.435\n59000\n2014","banks":{"47":[{"sum_foreign_comment":"","sum_comment":"","sum_foreign":"","sum":"59000","sum_foreign_units":"UAH","sum_units":"UAH"}]}}