{"intro":{"declaration_year":"2013","isnotdeclaration":""},"source":"VULYK","vehicle":{"35":[{"sum_rent_comment":"","sum_hidden":false,"sum_comment":"","brand_unclear":false,"sum_unclear":false,"brand_info_hidden":false,"brand":"Chevrolet Aveo","brand_info":"TC58 U, 1568 куб. см., 106 л. с","sum":"","brand_info_unclear":false,"sum_rent":"","year":"2008","sum_rent_hidden":false,"year_unclear":false}]},"income":{"5":{"family_unclear":false,"family_comment":"","value":"259989","comment":"","value_hidden":false,"value_unclear":false,"family":"","family_hidden":false},"6":{"family_unclear":false,"family_comment":"","value":"243496","comment":"","value_hidden":false,"value_unclear":false,"family":"","family_hidden":false},"7":{"family":"","source_name":"","value":"","family_hidden":false,"value_hidden":false,"family_comment":"","source_name_hidden":false,"comment":""},"8":{"family":"","value":"","comment":"","value_hidden":false,"family_comment":"","family_hidden":false},"9":{"family":"","value":"13","comment":"","value_unclear":false,"family_comment":"","family_hidden":false},"10":{"family":"","family_comment":"","value":"12617","comment":"","value_unclear":false},"11":{"family":"","value":"24","family_comment":"","comment":"дарунок"},"12":{"family":"","value":"","family_comment":"","comment":""},"13":{"family":"","value":"","family_comment":"","comment":""},"14":{"family":"","value":"","family_comment":"","comment":""},"15":{"family":"","value":"","family_comment":"","comment":""},"16":{"family":"","value":"","family_comment":"","comment":""},"17":{"family":"","value":"","family_comment":"","comment":""},"18":{"family":"","value":"","family_comment":"","comment":""},"19":{"family":"","family_comment":"","value":"","comment":"","value_unclear":false},"20":{"family":"","value":"3839","comment":"","family_comment_unclear":false,"comment_unclear":false,"family_comment":"","value_unclear":false}},"estate":{"23":[{"costs_hidden":false,"costs_rent_comment":"","costs_rent":"","space_units_hidden":false,"costs_rent_hidden":false,"address_hidden":false,"region":"","space_comment_hidden":false,"costs_comment":"","space_comment":"","space":"","space_unclear":false,"region_hidden":false,"address_unclear":false,"space_units_unclear":false,"costs":"","address":"","space_units":"м²"},{"costs_comment":"","costs_rent_comment":"","costs_rent":"","region":"","space":"","address_hidden":false,"space_comment_hidden":false,"costs_rent_comment_hidden":false,"space_comment":"","space_unclear":false,"region_hidden":false,"costs_comment_hidden":false,"address_unclear":false,"costs":"","address":"","space_units":""},{"space_comment":"","costs_rent_comment":"","region_hidden":false,"costs_rent":"","region":"","space":"","space_units":"","costs":"","address":"","costs_comment":""},{"space_comment":"","costs_rent_comment":"","region_hidden":false,"costs_rent":"","region":"","space":"","space_units":"","costs":"","address":"","costs_comment":""},{"space_comment":"","costs_rent_comment":"","costs_rent":"","space":"","space_units":"","costs":"","address":"","costs_comment":""}],"25":[{"costs_hidden":false,"costs_rent_comment":"","costs_rent":"","region":"","costs_rent_hidden":false,"address_hidden":false,"space_unclear":false,"address":"","space_comment":"","space":"59.4","space_hidden":false,"region_hidden":true,"space_comment_hidden":false,"address_unclear":false,"space_comment_unclear":false,"region_unclear":false,"costs":"","costs_comment":"","space_units":"м²"}]},"liabilities":{"54":{"sum_foreign_comment":"","sum_comment":"","sum_foreign":"","sum":"","sum_foreign_hidden":false,"sum_unclear":false,"sum_comment_hidden":false,"sum_hidden":false},"55":{"sum_foreign_comment":"","sum_comment":"","sum_foreign":"","sum":""},"56":{"sum_foreign_comment":"","sum_comment":"","sum_foreign":"","sum":"","sum_unclear":false},"57":{"sum_foreign_comment":"","sum_comment":"","sum_foreign":"","sum":"27576","sum_unclear":false,"sum_comment_unclear":false,"sum_comment_hidden":false,"sum_hidden":false},"58":{"sum_foreign_comment":"","sum_comment":"","sum_foreign":"","sum":"1049","sum_unclear":false,"sum_comment_hidden":false,"sum_hidden":false},"59":{"sum_foreign_comment":"","sum_comment":"","sum_foreign":"","sum":""},"60":{"sum_foreign_comment":"","sum_comment":"","sum_foreign":"","sum":"","sum_unclear":false,"sum_comment_hidden":false,"sum_hidden":false},"61":{"sum_foreign_comment":"","sum_comment":"","sum_foreign":"","sum":""},"62":{"sum_foreign_comment":"","sum_comment":"","sum_foreign":"","sum":""},"63":{"sum_foreign_comment":"","sum_comment":"","sum_foreign":"","sum":"","sum_comment_hidden":false},"64":{"sum_foreign_comment":"","sum_comment":"","sum_foreign":"","sum":"","sum_unclear":false,"sum_comment_hidden":false}},"general":{"full_name":"Фаріонова Олена Миколаївна","full_name_suggest":{"output":"Фаріонова Олена Миколаївна","input":["Фаріонова Олена Миколаївна","Олена Миколаївна Фаріонова","Олена Фаріонова"]},"family_raw":"","last_name":"Фаріонова","patronymic":"Миколаївна","name_unclear":false,"addresses":[{"place_district":"","place_city":"","place_address_unclear":false,"place_address_hidden":false,"place_district_hidden":false,"place_city_type":"","place_city_hidden":false,"place_hidden":true,"place_address":"","place_unclear":false,"place_city_type_hidden":true,"place":""}],"last_name_hidden":false,"patronymic_unclear":false,"inn":"","patronymic_hidden":false,"name":"Олена","post":{"post":"суддя апеляційного суду миколаївської області","candidate":"","office_unclear":false,"region":"Миколаївська область","post_hidden":false,"office":"Загальний апеляційний суд","post_unclear":false,"region_hidden":false,"office_hidden":false,"region_unclear":false},"family":[{"inn":"","relations_other":"","name_unclear":false,"relations":"Дитина","inn_hidden":false,"name_hidden":false,"family_name":"Фаріонова С. В. 18. 08. 2007 р. н","relations_hidden":false}],"inn_hidden":true,"inn_unclear":false,"last_name_unclear":false,"name_hidden":false},"id":"vulyk_1_534","declaration":{"date":"2014-03-31T00:00:00","notfull":"","additional_info_text":"57. Погашення основної суми позики (кредиту) - 13376 грн. (Адміральське відділення ПАТ КБ 'ПриватБанк' у м. Миколаєві) 58. Погашення суми процентів за позикою (кредитом) - 7 грн. (Адміральське відділення ПАТ КБ 'ПриватБанк' у м. Миколаєві","url":"http://static.declarations.com.ua/declarations/sudy/apeliatsiini_sudy_oblastei__m.kyieva/mykolaivska/farionova.pdf","additional_info":"1","notfull_lostpages":""},"ft_src":"27576\n1049\n57. Погашення основної суми позики (кредиту) - 13376 грн. (Адміральське відділення ПАТ КБ 'ПриватБанк' у м. Миколаєві) 58. Погашення суми процентів за позикою (кредитом) - 7 грн. (Адміральське відділення ПАТ КБ 'ПриватБанк' у м. Миколаєві\n1\nсуддя апеляційного суду миколаївської області\nМиколаївська область\nЗагальний апеляційний суд\nОлена\nФаріонова С. В. 18. 08. 2007 р. н\nДитина\nМиколаївна\nФаріонова\nФаріонова Олена Миколаївна\nФаріонова Олена Миколаївна\nОлена Миколаївна Фаріонова\nОлена Фаріонова\nФаріонова Олена Миколаївна\nChevrolet Aveo\nTC58 U, 1568 куб. см., 106 л. с\n2008\n1674\n1\n57. Погашення основної суми позики (кредиту) - 13376 грн. (Адміральське відділення ПАТ КБ 'ПриватБанк' у м. Миколаєві) 58. Погашення суми процентів за позикою (кредитом) - 7 грн. (Адміральське відділення ПАТ КБ 'ПриватБанк' у м. Миколаєві\n2013\nTC58 U, 1568 куб. см., 106 л. с\nChevrolet Aveo\n2008\n57. Погашення основної суми позики (кредиту) - 13376 грн. (Адміральське відділення ПАТ КБ 'ПриватБанк' у м. Миколаєві) 58. Погашення суми процентів за позикою (кредитом) - 7 грн. (Адміральське відділення ПАТ КБ 'ПриватБанк' у м. Миколаєві\n1\n1674\n59.4\nМиколаївна\nФаріонова Олена Миколаївна\nОлена Миколаївна Фаріонова\nОлена Фаріонова\nФаріонова Олена Миколаївна\nОлена\nДитина\nФаріонова С. В. 18. 08. 2007 р. н\nФаріонова Олена Миколаївна\nЗагальний апеляційний суд\nМиколаївська область\nсуддя апеляційного суду миколаївської області\nФаріонова\n27576\n1049\n243496\n3839\n259989\nдарунок\n24\n12617\n13\n2013\n1049\n27576\n59.4\nФаріонова С. В. 18. 08. 2007 р. н\nДитина\nМиколаївна\nФаріонова\nФаріонова Олена Миколаївна\nОлена Миколаївна Фаріонова\nОлена Фаріонова\nФаріонова Олена Миколаївна\nОлена\nМиколаївська область\nЗагальний апеляційний суд\nсуддя апеляційного суду миколаївської області\nФаріонова Олена Миколаївна\n243496\nдарунок\n24\n12617\n259989\n13\n3839\n2008\nChevrolet Aveo\nTC58 U, 1568 куб. см., 106 л. с\nдарунок\n24\n12617\n3839\n259989\n13\n243496\n59.4\n1674\n2013","banks":{"45":[{"sum_units_hidden":false,"sum_comment":"","sum_foreign":"","sum":"1674","sum_foreign_comment":"","sum_foreign_units":"UAH","sum_comment_unclear":false,"sum_unclear":false,"sum_comment_hidden":false,"sum_hidden":false,"sum_units":"UAH"},{"sum_foreign_comment":"","sum_comment":"","sum_foreign":"","sum":"","sum_unclear":false,"sum_foreign_units":"","sum_comment_hidden":false,"sum_units":""},{"sum_foreign_comment":"","sum_comment":"","sum_foreign":"","sum":"","sum_unclear":false,"sum_foreign_units":"","sum_units":""}],"46":[{"sum_foreign_comment":"","sum_comment":"","sum_foreign":"","sum":"","sum_unclear":false,"sum_foreign_units":"UAH","sum_comment_hidden":false,"sum_units":"UAH","sum_hidden":false}],"47":[{"sum_foreign_comment":"","sum_comment":"","sum_foreign":"","sum":"","sum_comment_hidden":false,"sum_foreign_units":"UAH","sum_units":"UAH"}],"48":[{"sum_foreign":"","sum_foreign_comment":"","sum_comment":"","sum":"","sum_foreign_hidden":false,"sum_foreign_units":"UAH","sum_units":"UAH"}],"49":[{"sum_foreign_comment":"","sum_comment":"","sum_foreign":"","sum":"","sum_foreign_units":"UAH","sum_units":"UAH"}],"50":[{"sum_foreign_comment":"","sum_comment":"","sum_foreign":"","sum":"","sum_foreign_units":"UAH","sum_units":"UAH"}],"51":[{"sum_foreign_comment":"","sum_comment":"","sum_foreign":"","sum":"","sum_unclear":false,"sum_foreign_units":"UAH","sum_comment_hidden":false,"sum_units":"UAH","sum_hidden":false},{"sum_foreign_comment":"","sum_comment":"","sum_foreign":"","sum":"","sum_foreign_units":"","sum_units":"","sum_foreign_units_unclear":false},{"sum_foreign_comment":"","sum_comment":"","sum_foreign":"","sum":"","sum_foreign_units":"","sum_units":""}],"52":[{"sum_foreign_comment":"","sum_comment":"","sum_foreign":"","sum":"","sum_comment_hidden":false,"sum_foreign_units":"UAH","sum_units":"UAH"}],"53":[{"sum_foreign_comment":"","sum_comment":"","sum_foreign":"","sum":"","sum_comment_hidden":false,"sum_foreign_units":"UAH","sum_units":"UAH","sum_hidden":false}]}}