{"income":{"5":{"value":"182768","family_comment":"","family_hidden":false,"value_hidden":false,"family_unclear":false,"family":"17419","comment":""},"6":{"value":"170072","comment_unclear":false,"family_comment":"","family":"3585","comment":"","family_comment_unclear":false},"7":{"family_comment":"","value":"","source_name":"Керченський міський суд АР Крим,Управління праці і соціального захисту населення в Солом'янському районі м. Києва, Шевченківський районний суд міста Києва, ДТГО 'Південно-Західна залізниця', ПАТ КБ 'Приватбанк'","family":"","comment":""},"8":{"family_comment":"","value":"","family":"","comment":""},"9":{"family_comment":"","value":"","family":"","comment":""},"10":{"family_comment":"","value":"12150","family":"","comment":"по догляду за дитиною до досягн.3 років"},"11":{"family_comment":"","value":"","family":"","comment":"","family_comment_unclear":false},"12":{"family_comment":"","value":"","family":"","comment":""},"13":{"family_comment":"","value":"","family":"","comment":""},"14":{"family_comment":"","value":"","family":"","comment":""},"15":{"family_comment":"","value":"","family":"","comment":""},"16":{"family_comment":"","value":"","family":"","comment":""},"17":{"family_comment":"","value":"","family":"","comment":""},"18":{"family_comment":"","value":"","family":"","comment":""},"19":{"family_comment":"","value":"","family":"","comment":"","value_hidden":false},"20":{"family_comment":"","value":"546","comment_unclear":false,"family":"13834","comment":""}},"vehicle":{"35":[{"brand_info":"3456 куб. см, 204 кВт, 481 см","sum_rent_comment":"","brand":"Toyota Camry","sum_comment":"","sum_rent_hidden":false,"year":"2007","sum_hidden":false,"brand_info_hidden":false,"brand_info_unclear":false,"sum":"","sum_rent":""},{"brand_info":"1799 куб. см, 103 кВт, 454 см","sum_rent_comment":"","brand":"Honda Civic","sum_comment":"","year":"2007","sum":"","sum_rent":""}]},"id":"vulyk_51_132","banks":{"45":[{"sum_foreign_comment":"","sum_units":"UAH","sum_comment":"","sum_comment_unclear":false,"sum_hidden":false,"sum_foreign_units":"UAH","sum_comment_hidden":false,"sum":"","sum_foreign":""},{"sum_foreign_comment":"","sum_units":"","sum_comment":"","sum_foreign_units":"","sum":"","sum_foreign":""},{"sum_foreign_comment":"","sum_units":"","sum_comment":"","sum_foreign_units":"","sum":"","sum_foreign":""},{"sum_foreign_comment":"","sum_units":"","sum_comment":"","sum_foreign_units":"","sum":"","sum_foreign":""},{"sum_foreign_comment":"","sum_units":"","sum_comment":"","sum_foreign_units":"","sum":"","sum_unclear":false,"sum_foreign":""}],"46":[{"sum_foreign_comment":"","sum_units":"UAH","sum_comment":"","sum_foreign_units":"UAH","sum":"","sum_foreign":""}],"47":[{"sum_foreign_comment":"","sum_units":"UAH","sum_comment":"","sum_foreign_units":"UAH","sum":"","sum_foreign":""}],"48":[{"sum_foreign_comment":"","sum_units":"UAH","sum_comment":"","sum_foreign_units":"UAH","sum":"","sum_foreign":""}],"49":[{"sum_foreign_comment":"","sum_units":"UAH","sum_comment":"","sum_foreign_units":"UAH","sum":"","sum_foreign":""}],"50":[{"sum_foreign_comment":"","sum_units":"UAH","sum_comment":"","sum_foreign_units":"UAH","sum":"","sum_foreign":""}],"51":[{"sum_foreign_comment":"","sum_units":"UAH","sum_comment":"","sum_foreign_units":"UAH","sum_comment_hidden":false,"sum":"","sum_foreign":""},{"sum_foreign_comment":"","sum_units":"","sum_comment":"","sum_foreign_units":"","sum":"","sum_foreign":""},{"sum_foreign_comment":"","sum_units":"","sum_comment":"","sum_foreign_units":"","sum":"","sum_foreign":""}],"52":[{"sum_foreign_comment":"","sum_units":"UAH","sum_comment":"","sum_foreign_units":"UAH","sum_comment_hidden":false,"sum":"","sum_foreign":""}],"53":[{"sum_foreign_comment":"","sum_units":"UAH","sum_comment":"","sum_foreign_units":"UAH","sum":"","sum_foreign":""}]},"declaration":{"additional_info_text":"","notfull_lostpages":"","date":"2015-03-30T00:00:00","notfull":"","additional_info":"","url":"http://static.declarations.com.ua/declarations/chosen_ones/mega_batch/rybak_mykyta_anatoliiovych.pdf"},"liabilities":{"54":{"sum_foreign_comment":"","sum_comment_hidden":false,"sum":"","sum_comment":"","sum_foreign":""},"55":{"sum_foreign_comment":"","sum":"","sum_comment":"","sum_foreign":""},"56":{"sum_foreign_comment":"","sum":"","sum_comment":"","sum_foreign":""},"57":{"sum_foreign_comment":"","sum":"","sum_comment":"","sum_hidden":false,"sum_comment_hidden":false,"sum_foreign":""},"58":{"sum_foreign_comment":"","sum_comment_hidden":false,"sum":"","sum_comment":"","sum_foreign":""},"59":{"sum_foreign_comment":"","sum":"","sum_comment":"","sum_foreign":""},"60":{"sum_foreign_comment":"","sum":"","sum_comment":"","sum_foreign":""},"61":{"sum_foreign_comment":"","sum":"","sum_comment":"","sum_foreign":""},"62":{"sum_foreign_comment":"","sum":"","sum_comment":"","sum_foreign":""},"63":{"sum_foreign_comment":"","sum_comment_hidden":false,"sum":"","sum_comment":"","sum_foreign":""},"64":{"sum_foreign_comment":"","sum":"","sum_comment":"","sum_foreign":""}},"ft_src":"07443\nКиївська область\nРибак Микита Анатолійович\nсуддя шевченківського районного суду міста києва\nм. Київ\nЗагальний місцевий суд\nМикита\nРибак Л. А\nПодружжя\nРибак А. М\nДитина\nРибак Д. М\nДитина\nРибак Микита Анатолійович\nМикита Анатолійович Рибак\nМикита Рибак\nРибак Микита Анатолійович\nРибак\nАнатолійович\nToyota Camry\n3456 куб. см, 204 кВт, 481 см\n2007\n1799 куб. см, 103 кВт, 454 см\n2007\nHonda Civic\n2014\n3456 куб. см, 204 кВт, 481 см\n2007\nToyota Camry\n1799 куб. см, 103 кВт, 454 см\nHonda Civic\n2007\n16.92\nчастка\nм. Київ\nм. Київ\nРибак\nРибак Микита Анатолійович\nМикита Анатолійович Рибак\nМикита Рибак\nРибак Микита Анатолійович\nМикита\nАнатолійович\n07443\nКиївська область\nРибак Микита Анатолійович\nЗагальний місцевий суд\nсуддя шевченківського районного суду міста києва\nм. Київ\nПодружжя\nРибак Л. А\nДитина\nРибак А. М\nДитина\nРибак Д. М\nКерченський міський суд АР Крим,Управління праці і соціального захисту населення в Солом'янському районі м. Києва, Шевченківський районний суд міста Києва, ДТГО 'Південно-Західна залізниця', ПАТ КБ 'Приватбанк'\n170072\n3585\n546\n13834\n17419\n182768\nпо догляду за дитиною до досягн.3 років\n12150\n2014\nчастка\nм. Київ\n16.92\nм. Київ\nРибак Л. А\nПодружжя\nРибак А. М\nДитина\nРибак Д. М\nДитина\nАнатолійович\nКиївська область\n07443\nРибак\nм. Київ\nЗагальний місцевий суд\nсуддя шевченківського районного суду міста києва\nРибак Микита Анатолійович\nРибак Микита Анатолійович\nМикита Анатолійович Рибак\nМикита Рибак\nРибак Микита Анатолійович\nМикита\n3585\n170072\nпо догляду за дитиною до досягн.3 років\n12150\nКерченський міський суд АР Крим,Управління праці і соціального захисту населення в Солом'янському районі м. Києва, Шевченківський районний суд міста Києва, ДТГО 'Південно-Західна залізниця', ПАТ КБ 'Приватбанк'\n17419\n182768\n13834\n546\n2007\nToyota Camry\n3456 куб. см, 204 кВт, 481 см\nHonda Civic\n1799 куб. см, 103 кВт, 454 см\n2007\nпо догляду за дитиною до досягн.3 років\n12150\n13834\n546\n182768\n17419\nКерченський міський суд АР Крим,Управління праці і соціального захисту населення в Солом'янському районі м. Києва, Шевченківський районний суд міста Києва, ДТГО 'Південно-Західна залізниця', ПАТ КБ 'Приватбанк'\n170072\n3585\nчастка\nм. Київ\nм. Київ\n16.92\n2014","general":{"inn":"","inn_hidden":true,"last_name":"Рибак","post":{"post":"суддя шевченківського районного суду міста києва","region":"м. Київ","office_hidden":false,"office":"Загальний місцевий суд","office_unclear":false,"region_hidden":false},"name":"Микита","full_name":"Рибак Микита Анатолійович","family_raw":"","addresses":[{"place_district":"","place_city_hidden":false,"place_city":"","place_city_type_hidden":false,"place_district_hidden":false,"place_city_type":"","place_address_hidden":true,"place_address":"07443","place_hidden":true,"place":"Київська область"}],"family":[{"inn":"","relations":"Подружжя","relations_other":"","inn_hidden":false,"family_name":"Рибак Л. А","name_hidden":false,"name_unclear":false},{"inn":"","inn_hidden":false,"relations_hidden":false,"family_name":"Рибак А. М","relations_other":"","relations":"Дитина","name_hidden":false,"name_unclear":false},{"inn":"","relations":"Дитина","relations_other":"","inn_hidden":false,"family_name":"Рибак Д. М","name_hidden":false,"name_unclear":false}],"full_name_suggest":{"output":"Рибак Микита Анатолійович","input":["Рибак Микита Анатолійович","Микита Анатолійович Рибак","Микита Рибак"]},"patronymic":"Анатолійович"},"source":"VULYK","estate":{"23":[{"costs":"","costs_comment":"","costs_hidden":false,"address_hidden":false,"region_hidden":false,"space_comment":"","space":"","address":"","region":"","address_unclear":false,"costs_rent_comment":"","costs_rent_hidden":false,"space_units":"м²","costs_rent":""},{"costs":"","costs_comment":"","costs_hidden":false,"region_hidden":false,"space_comment":"","space":"","address":"","region":"","costs_rent_comment":"","costs_rent_hidden":false,"space_units":"","costs_rent":""},{"space":"","region":"","costs":"","costs_rent_comment":"","costs_comment":"","address_unclear":false,"space_comment":"","space_units":"","costs_rent":"","address":""},{"costs_rent":"","region":"","costs":"","costs_rent_comment":"","costs_comment":"","space_comment":"","space_units":"","space":"","address":""}],"25":[{"space_unclear":false,"costs":"","costs_comment":"","costs_hidden":false,"address_hidden":false,"region_hidden":false,"space_comment":"частка","space_hidden":false,"space":"16.92","address":"м. Київ","region":"м. Київ","address_unclear":false,"costs_rent_comment":"","space_units":"м²","costs_rent":""}]},"intro":{"declaration_year":"2014","isnotdeclaration":""}}