{"id":"vulyk_65_114","declaration":{"notfull_lostpages":"","additional_info_text":"","additional_info":"","date":"2015-03-27T00:00:00","notfull":"","url":"http://static.declarations.com.ua/declarations/chosen_ones/mega_batch/fortuna_tetiana_iuriivna.pdf"},"estate":{"23":[{"address":"Новоодеський р-н, с/р Констянтинівська, СТ вул. Вишнева","space_units":"м²","space_hidden":false,"space_unclear":false,"region_hidden":false,"costs_comment":"","space_comment":"","address_hidden":true,"costs":"","address_unclear":true,"costs_rent_comment":"","space":"400","region":"Миколаївська область","costs_rent":""}],"25":[{"costs_rent_comment_unclear":false,"address":"м. Миколаїв, вул. Архітектора Старова","space_units":"м²","space_hidden":false,"space_unclear":false,"region_hidden":false,"costs_comment":"","space_comment":"","space_comment_unclear":false,"costs":"","address_unclear":true,"address_hidden":true,"costs_rent_comment":"","space":"81","region":"Миколаївська область","space_units_hidden":false,"costs_rent":""}],"26":[{"address":"Новоодеський р-н, с. Костянтиніквка, вул. Вишнева","space_units":"м²","costs_comment":"","space_comment":"","region_hidden":false,"region":"Миколаївська область","address_hidden":true,"space":"82.2","address_unclear":true,"costs_rent_comment":"","costs":"","space_units_hidden":false,"costs_rent":""}],"29":[{"costs_property_comment":"","address":"Миколаївський р-н, с. Олексіївка","space_units":"га","space_unclear":false,"region_hidden":false,"costs_property":"","space_comment":"","address_hidden":true,"address_unclear":true,"costs_rent_comment":"","space":"8.26","region":"Одеська область","space_units_hidden":false,"costs_rent":""}],"33":[{"costs_property_comment":"","address":"м. Миколаїв, вул. Архітектора Старова","space_units":"м²","space_comment":"","region_hidden":false,"costs_property":"","region":"Миколаївська область","address_hidden":true,"address_unclear":true,"costs_rent_comment":"","space":"20.88","costs_rent":""}]},"vehicle":{"35":[{"brand_info":"1794 куб. см., 95 кВт","sum_rent_comment":"","brand_unclear":false,"year":"2008","brand_hidden":true,"sum_comment":"","brand_info_hidden":false,"sum_rent":"","brand":"","year_unclear":false,"brand_info_unclear":false,"sum":""}]},"source":"VULYK","income":{"5":{"family":"143740","family_comment":"","comment":"","value_hidden":false,"value_unclear":false,"value":"211222","family_hidden":false,"family_unclear":false},"6":{"family_comment":"","family":"","value_hidden":false,"comment":"","comment_unclear":false,"value_unclear":false,"value":"171562","family_hidden":false},"7":{"source_name_hidden":true,"family_comment":"","family":"","value_hidden":false,"comment":"","value":"","source_name":""},"8":{"family_comment":"","value":"","family":"","comment":""},"9":{"family_comment":"","comment_unclear":false,"value":"","family":"","comment":""},"10":{"family_comment":"","value":"12180","family":"","comment":"","value_unclear":false},"11":{"family_comment":"","value":"","family":"","comment":""},"12":{"family_comment":"","value":"","family":"","comment":""},"13":{"family_comment":"","value":"","family":"","comment":""},"14":{"family_comment":"","value":"","family":"129382","comment":""},"15":{"family_comment":"","value":"","family":"","comment":""},"16":{"family_comment":"","value":"","family":"","comment":""},"17":{"family_comment":"","value":"","family":"","comment":""},"18":{"family_comment":"","value":"","family":"","comment":""},"19":{"family":"3882","family_comment":"","comment":"","value_hidden":false,"value_unclear":false,"comment_hidden":false,"family_hidden":false,"value":"","family_comment_hidden":false},"20":{"family_comment":"Кредит ПАТ 'Альфа-Банк'","family":"10476","value_hidden":false,"comment":"Кредит ПАТ 'Альфа банк' - 10174 Кредит ПАТ 'ВТБ банк' - 10013 Кредит ПАТ КБ 'Приватбанк' - 3778 Бонус ПАТ КБ 'Приватбанк' - 62 Акція ПАТ 'ВТБ банк' - 50 Пільга на комунальні послуги як багатодітна сім'я - 3440","value":"","comment_unclear":true,"value_unclear":true,"family_unclear":false,"family_hidden":false}},"banks":{"45":[{"sum_comment_unclear":false,"sum_comment":"","sum_foreign_units":"UAH","sum_hidden":false,"sum":"736","sum_foreign_comment":"","sum_units_unclear":false,"sum_unclear":false,"sum_foreign":"","sum_units":"UAH"}]},"ft_src":"1794 куб. см., 95 кВт\n2008\n736\n2014\n1794 куб. см., 95 кВт\n2008\n736\n400\nМиколаївська область\nНовоодеський р-н, с/р Констянтинівська, СТ вул. Вишнева\n8.26\nОдеська область\nМиколаївський р-н, с. Олексіївка\n82.2\nМиколаївська область\nНовоодеський р-н, с. Костянтиніквка, вул. Вишнева\n81\nМиколаївська область\nм. Миколаїв, вул. Архітектора Старова\n20.88\nМиколаївська область\nм. Миколаїв, вул. Архітектора Старова\nЗагальний місцевий суд\nМиколаївська область\nсуддя первомайського міськрайонного суду миколаївської області\nФортуна Тетяна Юріївна\nТетяна Юріївна Фортуна\nТетяна Фортуна\nФортуна Тетяна Юріївна\nТетяна\nПодружжя\n29. 06. 1975\nДитина\n07. 08. 1998\nДитина\n21. 08. 2000\nДитина\n19. 01. 2010\nФортуна Тетяна Юріївна\nФортуна\nЮріївна\n54046, вул. Архітектора Старова\nМиколаївська область\nМиколаїв\n2598\n2346\n812\n8811\n171562\nКредит ПАТ 'Альфа банк' - 10174 Кредит ПАТ 'ВТБ банк' - 10013 Кредит ПАТ КБ 'Приватбанк' - 3778 Бонус ПАТ КБ 'Приватбанк' - 62 Акція ПАТ 'ВТБ банк' - 50 Пільга на комунальні послуги як багатодітна сім'я - 3440\nКредит ПАТ 'Альфа-Банк'\n10476\n129382\n211222\n143740\n12180\n3882\n2014\n2346\n8811\n812\n2598\nм. Миколаїв, вул. Архітектора Старова\nМиколаївська область\n20.88\nНовоодеський р-н, с/р Констянтинівська, СТ вул. Вишнева\n400\nМиколаївська область\nОдеська область\nМиколаївський р-н, с. Олексіївка\n8.26\nМиколаївська область\nНовоодеський р-н, с. Костянтиніквка, вул. Вишнева\n82.2\nМиколаївська область\nм. Миколаїв, вул. Архітектора Старова\n81\n29. 06. 1975\nПодружжя\nДитина\n07. 08. 1998\n21. 08. 2000\nДитина\n19. 01. 2010\nДитина\nЮріївна\nФортуна\nТетяна\nФортуна Тетяна Юріївна\nТетяна Юріївна Фортуна\nТетяна Фортуна\nФортуна Тетяна Юріївна\n54046, вул. Архітектора Старова\nМиколаїв\nМиколаївська область\nМиколаївська область\nЗагальний місцевий суд\nсуддя первомайського міськрайонного суду миколаївської області\nФортуна Тетяна Юріївна\n171562\n129382\n12180\n143740\n211222\n3882\nКредит ПАТ 'Альфа-Банк'\nКредит ПАТ 'Альфа банк' - 10174 Кредит ПАТ 'ВТБ банк' - 10013 Кредит ПАТ КБ 'Приватбанк' - 3778 Бонус ПАТ КБ 'Приватбанк' - 62 Акція ПАТ 'ВТБ банк' - 50 Пільга на комунальні послуги як багатодітна сім'я - 3440\n10476","general":{"family":[{"inn":"","inn_unclear":false,"family_name":"29. 06. 1975","relations_other":"","relations_hidden":false,"name_unclear":false,"inn_hidden":true,"name_hidden":true,"relations":"Подружжя"},{"inn":"","inn_unclear":false,"family_name":"07. 08. 1998","relations_hidden":false,"relations_unclear":false,"name_unclear":false,"relations":"Дитина","inn_hidden":false,"name_hidden":false,"relations_other":""},{"inn":"","inn_unclear":false,"family_name":"21. 08. 2000","relations_other":"","relations_hidden":false,"name_unclear":false,"inn_hidden":false,"name_hidden":false,"relations":"Дитина"},{"inn":"","family_name":"19. 01. 2010","relations_other":"","name_unclear":false,"inn_hidden":false,"relations":"Дитина"}],"family_raw":"","name":"Тетяна","full_name_suggest":{"input":["Фортуна Тетяна Юріївна","Тетяна Юріївна Фортуна","Тетяна Фортуна"],"output":"Фортуна Тетяна Юріївна"},"name_unclear":false,"patronymic":"Юріївна","inn_hidden":true,"addresses":[{"place_city_type":"Місто","place_address_unclear":false,"place_city_type_hidden":false,"place_hidden":false,"place_city_hidden":false,"place_district":"","place_district_hidden":true,"place":"Миколаївська область","place_city":"Миколаїв","place_address_hidden":true,"place_address":"54046, вул. Архітектора Старова"}],"last_name_hidden":false,"patronymic_hidden":false,"inn":"","inn_unclear":false,"last_name":"Фортуна","full_name":"Фортуна Тетяна Юріївна","post":{"post_hidden":false,"office":"Загальний місцевий суд","post":"суддя первомайського міськрайонного суду миколаївської області","region":"Миколаївська область","region_hidden":false,"office_unclear":false,"office_hidden":false,"post_unclear":true,"region_unclear":false},"name_hidden":false,"last_name_unclear":false},"liabilities":{"54":{"sum_comment_unclear":true,"sum_comment":"","sum_hidden":false,"sum":"8811","sum_foreign_comment":"","sum_foreign":"","sum_comment_hidden":false},"55":{"sum_comment":"","sum_foreign_comment":"","sum_foreign":"","sum":""},"56":{"sum_comment":"","sum_foreign_comment":"","sum_foreign":"","sum_unclear":false,"sum":""},"57":{"sum_comment_unclear":true,"sum_comment":"","sum":"","sum_foreign_comment":"","sum_foreign":"","sum_unclear":true},"58":{"sum_comment_unclear":true,"sum_comment":"","sum":"","sum_foreign_comment":"","sum_foreign":"","sum_unclear":true},"59":{"sum_comment":"","sum_foreign_comment":"","sum_foreign":"","sum":""},"60":{"sum_comment":"","sum_comment_unclear":false,"sum_foreign_comment":"","sum":"812","sum_foreign":""},"61":{"sum_comment":"","sum_foreign_comment":"","sum_foreign":"","sum":""},"62":{"sum_comment":"","sum_foreign_comment":"","sum_foreign":"","sum":""},"63":{"sum_comment":"","sum_foreign_comment":"","sum_foreign":"","sum":"2598"},"64":{"sum_comment":"","sum_foreign_comment":"","sum_foreign":"","sum_unclear":true,"sum":"2346"}},"intro":{"declaration_year_hidden":false,"isnotdeclaration":"","declaration_year":"2014"}}