{"id":"vulyk_97_153","ft_src":"Toyota Rav 4\n1998 куб. см., 110 кВт\n2003\n3498 куб. см., 206 кВт\n2007\nInfiniti M35\n30.3\n70\n86.6\n1\nВідомості про доходи (розділ ІІ), вклади у банках, цінні папери та інші активи (розділ V), фінансові зобов'язання моєї дружини Волкової О. М. мною не внесено до декларації, оскільки таку інформацію нею мені не було надано\n2014\n188630.1\n188630.1\n1998 куб. см., 110 кВт\nToyota Rav 4\n2003\n3498 куб. см., 206 кВт\n2007\nInfiniti M35\nВідомості про доходи (розділ ІІ), вклади у банках, цінні папери та інші активи (розділ V), фінансові зобов'язання моєї дружини Волкової О. М. мною не внесено до декларації, оскільки таку інформацію нею мені не було надано\n1\n2014\nВолков Андрій Станіславович\nАндрій Станіславович Волков\nАндрій Волков\nВолков Андрій Станіславович\nАндрій\nПодружжя\nВолкова С. М\nДитина\nВолкова В. А\nВолков Андрій Станіславович\nВолков\nАдміністративний місцевий суд\nКиївська область\nсуддя київського окружного адміністративного суду\nСтаніславович\n188630.1\n188630.1\n30.3\n70\n86.6\nПодружжя\nВолкова С. М\nВолкова В. А\nДитина\nСтаніславович\nВолков\nАндрій\nВолков Андрій Станіславович\nАндрій Станіславович Волков\nАндрій Волков\nВолков Андрій Станіславович\nКиївська область\nАдміністративний місцевий суд\nсуддя київського окружного адміністративного суду\nВолков Андрій Станіславович","estate":{"25":[{"address":"","space_units":"м²","space_hidden":false,"space_unclear":false,"region_hidden":true,"costs_rent_comment":"","space_comment":"","address_hidden":false,"space_comment_hidden":false,"costs":"","space_comment_unclear":false,"costs_comment":"","space":"86.6","region_unclear":false,"region":"","costs_rent":""}],"30":[{"costs_property_comment":"","address":"","space_units":"м²","space_comment":"","region_hidden":true,"costs_property":"","region":"","address_hidden":false,"address_unclear":false,"costs_rent_comment":"","space":"30.3","costs_rent":""},{"costs_property_comment":"","address":"","space_units":"м²","costs_rent_comment":"","space":"70","region":"","costs_property":"","space_comment":"","costs_rent":""}]},"vehicle":{"40":[{"sum_comment":"","brand_info":"1998 куб. см., 110 кВт","brand_unclear":false,"sum_rent_comment":"","year":"2003","brand":"Toyota Rav 4","sum_rent":"","brand_info_unclear":false,"year_unclear":false,"sum":""},{"sum_comment":"","brand_info":"3498 куб. см., 206 кВт","sum":"","sum_rent_comment":"","year":"2007","brand":"Infiniti M35","sum_rent":""}]},"source":"VULYK","income":{"5":{"family_comment":"","value":"188630.1","family":"","comment":""},"6":{"family_comment":"","family":"","comment":"","value_unclear":false,"family_unclear":false,"comment_hidden":false,"value":"188630.1"},"7":{"family":"","family_comment":"","value":"","comment":"","source_name":""},"8":{"family_comment":"","value":"","family":"","comment":""},"9":{"family_comment":"","value":"","family_unclear":false,"family":"","comment":""},"10":{"family_comment":"","value":"","family":"","comment":"","value_unclear":false},"11":{"family_comment":"","value":"","family":"","comment":""},"12":{"family_comment":"","value":"","family":"","comment":""},"13":{"family_comment":"","value":"","family":"","comment":""},"14":{"family_comment":"","value":"","family":"","comment":""},"15":{"family_comment":"","value":"","family":"","comment":""},"16":{"family_comment":"","value":"","family":"","comment":""},"17":{"family_comment":"","value":"","family":"","comment":""},"18":{"family_comment":"","value":"","family":"","comment":""},"19":{"family_comment":"","value":"","family":"","comment":""},"20":{"family_comment":"","comment":"","family":"","value_unclear":false,"comment_unclear":false,"value":"","family_hidden":false,"family_comment_unclear":false}},"general":{"family":[{"inn":"","family_name":"Волкова С. М","relations_other":"","name_unclear":false,"inn_hidden":true,"name_hidden":true,"relations":"Подружжя"},{"inn":"","family_name":"Волкова В. А","name_unclear":false,"inn_hidden":false,"name_hidden":false,"relations":"Дитина"}],"family_raw":"","name":"Андрій","full_name_suggest":{"input":["Волков Андрій Станіславович","Андрій Станіславович Волков","Андрій Волков"],"output":"Волков Андрій Станіславович"},"patronymic":"Станіславович","inn_hidden":true,"addresses":[{"place_city_type":"","place_city_type_hidden":true,"place_hidden":true,"place_city_hidden":true,"place_district_hidden":true,"place_district":"","place_city_unclear":false,"place":"","place_city":"","place_address_hidden":true,"place_address":""}],"last_name_hidden":false,"patronymic_hidden":false,"inn":"","inn_unclear":false,"last_name":"Волков","full_name":"Волков Андрій Станіславович","post":{"post_hidden":false,"office":"Адміністративний місцевий суд","post":"суддя київського окружного адміністративного суду","office_unclear":false,"region_unclear":false,"region":"Київська область"},"name_hidden":false},"liabilities":{"54":{"sum_comment_unclear":false,"sum_comment":"","sum_hidden":false,"sum":"","sum_foreign_comment":"","sum_foreign":"","sum_unclear":false,"sum_comment_hidden":false},"55":{"sum_comment":"","sum_foreign_comment":"","sum_foreign":"","sum":""},"56":{"sum_comment":"","sum_foreign_comment":"","sum_foreign":"","sum":""},"57":{"sum_comment_unclear":false,"sum_comment":"","sum_hidden":false,"sum":"","sum_foreign_comment":"","sum_foreign":"","sum_unclear":false,"sum_comment_hidden":false},"58":{"sum_comment_unclear":false,"sum_comment":"","sum_hidden":false,"sum":"","sum_foreign_comment":"","sum_foreign":"","sum_unclear":false,"sum_comment_hidden":false},"59":{"sum_comment":"","sum_foreign_comment":"","sum_foreign":"","sum":""},"60":{"sum_comment_unclear":false,"sum_comment":"","sum_hidden":false,"sum":"","sum_foreign_comment":"","sum_foreign":"","sum_comment_hidden":false},"61":{"sum_comment":"","sum_foreign_comment":"","sum_foreign":"","sum":""},"62":{"sum_comment":"","sum_foreign_comment":"","sum_foreign":"","sum_unclear":false,"sum":""},"63":{"sum_comment":"","sum_foreign_comment":"","sum_foreign":"","sum_hidden":false,"sum":""},"64":{"sum_comment":"","sum_foreign_comment":"","sum_foreign":"","sum":""}},"declaration":{"notfull_lostpages":"","additional_info_text":"Відомості про доходи (розділ ІІ), вклади у банках, цінні папери та інші активи (розділ V), фінансові зобов'язання моєї дружини Волкової О. М. мною не внесено до декларації, оскільки таку інформацію нею мені не було надано","additional_info":"1","date":"2015-03-26T00:00:00","notfull":"","url":"http://static.declarations.com.ua/declarations/chosen_ones/judges_batch/4055_volkov_andrii_stanislavovych.pdf"},"intro":{"isnotdeclaration":"","declaration_year":"2014"}}