{"income":{"5":{"family_comment":"","value":"392681","value_unclear":false,"family":"13236","comment":""},"6":{"family_comment":"","value":"333629","value_unclear":false,"family":"","comment":""},"7":{"source_name_unclear":false,"value":"","family_hidden":false,"value_hidden":false,"family_comment":"","source_name":"","family":"","comment":"","source_name_hidden":false},"8":{"value":"","family_hidden":false,"value_hidden":false,"family_comment":"","family":"","comment":""},"9":{"value":"","value_unclear":false,"value_hidden":false,"family_comment":"","comment_unclear":false,"comment":"","family":""},"10":{"value":"13764","family_hidden":false,"value_hidden":false,"family_comment":"","family":"","comment":""},"11":{"value":"","family_hidden":false,"value_hidden":false,"family_comment":"","family":"","comment":""},"12":{"value":"","family_hidden":false,"value_hidden":false,"family_comment":"","family":"","comment":""},"13":{"value":"","family_hidden":false,"value_hidden":false,"family_comment":"","family":"","comment":""},"14":{"value":"","family_hidden":false,"value_hidden":false,"family_comment":"","family":"","comment":""},"15":{"value":"","family_hidden":false,"value_hidden":false,"family_comment":"","family":"","comment":""},"16":{"value":"","family_hidden":false,"value_hidden":false,"family_comment":"","family":"","comment":""},"17":{"value":"","family_hidden":false,"value_hidden":false,"family_comment":"","family":"","comment":""},"18":{"value":"","comment_unclear":false,"family_hidden":false,"value_hidden":false,"family_comment":"","family":"","comment":""},"19":{"value":"","family_hidden":false,"value_hidden":false,"family_comment":"","family":"","comment":""},"20":{"value":"45288","value_unclear":false,"family_hidden":false,"value_hidden":false,"family_comment":"пенсія","comment_unclear":false,"comment":"пенсія","family":"13236"}},"id":"vulyk_70_167","banks":{"45":[{"sum_units":"UAH","sum_foreign":"","sum_hidden":false,"sum":"17","sum_units_hidden":false,"sum_foreign_comment":"","sum_foreign_hidden":false,"sum_comment":"","sum_foreign_units":"UAH","sum_units_unclear":false,"sum_comment_hidden":false,"sum_unclear":false}]},"declaration":{"additional_info_text":"","notfull":"1","additional_info":"","notfull_lostpages":"Декларація не повна. на 2-х сторінках вибірково наведені дані по декількох пунктах, що містять певну інформацію. пункти (2) (7-9) (11-19) (21-22) (24-29) (32-44) (46-64) відсутні. немає відомостей щодо року декларування і дати складання декларації","url":"http://static.declarations.com.ua/declarations/chosen_ones/judges_batch/167_kostenko_tetiana_fedorivna.pdf"},"liabilities":{"54":{"sum_foreign_comment":"","sum_foreign_hidden":false,"sum_comment":"","sum_hidden":false,"sum_foreign_comment_unclear":false,"sum_comment_hidden":false,"sum":"","sum_foreign":""},"55":{"sum_foreign_comment":"","sum":"","sum_hidden":false,"sum_comment":"","sum_foreign":""},"56":{"sum_foreign_comment":"","sum":"","sum_comment":"","sum_foreign":""},"57":{"sum_foreign_comment":"","sum_foreign_hidden":false,"sum_comment":"","sum_hidden":false,"sum_comment_hidden":false,"sum":"","sum_foreign":""},"58":{"sum_foreign_comment":"","sum":"","sum_comment":"","sum_hidden":false,"sum_comment_hidden":false,"sum_foreign":""},"59":{"sum_foreign_comment":"","sum_foreign_hidden":false,"sum_comment":"","sum_hidden":false,"sum":"","sum_foreign":""},"60":{"sum_foreign_comment":"","sum":"","sum_comment":"","sum_comment_unclear":false,"sum_hidden":false,"sum_comment_hidden":false,"sum_foreign":""},"61":{"sum_foreign_comment":"","sum":"","sum_hidden":false,"sum_comment":"","sum_foreign":""},"62":{"sum_foreign_comment":"","sum_foreign_hidden":false,"sum_comment":"","sum_comment_hidden":false,"sum_unclear":false,"sum":"","sum_foreign":""},"63":{"sum_foreign_comment":"","sum_foreign_hidden":false,"sum_comment":"","sum_hidden":false,"sum_comment_hidden":false,"sum":"","sum_foreign":""},"64":{"sum_foreign_comment":"","sum":"","sum_comment":"","sum_hidden":false,"sum_comment_hidden":false,"sum_foreign":""}},"ft_src":"1\nДекларація не повна. на 2-х сторінках вибірково наведені дані по декількох пунктах, що містять певну інформацію. пункти (2) (7-9) (11-19) (21-22) (24-29) (32-44) (46-64) відсутні. немає відомостей щодо року декларування і дати складання декларації\nсуддя вищого господарського суду україни\nЗагальнодержавний регіон\nВищий господарський суд\nТетяна\nДзюба Ольга Тихонівна\nБатьки\nФедорівна\nКостенко\nКостенко Тетяна Федорівна\nКостенко Тетяна Федорівна\nТетяна Федорівна Костенко\nТетяна Костенко\nКостенко Тетяна Федорівна\n1613\n40\n7500\n79\n17\nДекларація не повна. на 2-х сторінках вибірково наведені дані по декількох пунктах, що містять певну інформацію. пункти (2) (7-9) (11-19) (21-22) (24-29) (32-44) (46-64) відсутні. немає відомостей щодо року декларування і дати складання декларації\n1\n2013\n1\nДекларація не повна. на 2-х сторінках вибірково наведені дані по декількох пунктах, що містять певну інформацію. пункти (2) (7-9) (11-19) (21-22) (24-29) (32-44) (46-64) відсутні. немає відомостей щодо року декларування і дати складання декларації\n2013\nБатьки\nДзюба Ольга Тихонівна\nКостенко Тетяна Федорівна\nТетяна Федорівна Костенко\nТетяна Костенко\nКостенко Тетяна Федорівна\nТетяна\nКостенко Тетяна Федорівна\nФедорівна\nсуддя вищого господарського суду україни\nВищий господарський суд\nЗагальнодержавний регіон\nКостенко\n333629\n45288\nпенсія\nпенсія\n13236\n392681\n13236\n13764\n1613\n7500\n40\n79\n17\n333629\n13764\n13236\n392681\nпенсія\nпенсія\n13236\n45288\nБатьки\nДзюба Ольга Тихонівна\nТетяна\nФедорівна\nКостенко\nКостенко Тетяна Федорівна\nТетяна Федорівна Костенко\nТетяна Костенко\nКостенко Тетяна Федорівна\nЗагальнодержавний регіон\nВищий господарський суд\nсуддя вищого господарського суду україни\nКостенко Тетяна Федорівна\n13764\nпенсія\n45288\n13236\nпенсія\n13236\n392681\n333629\n79\n40\n7500\n1613\n17\n2013","general":{"inn":"","name":"Тетяна","inn_unclear":false,"family":[{"inn":"","relations":"Батьки","inn_unclear":false,"relations_hidden":false,"inn_hidden":true,"relations_other":"","name_hidden":false,"family_name":"Дзюба Ольга Тихонівна","name_unclear":false}],"inn_hidden":true,"family_raw":"","last_name":"Костенко","post":{"post":"суддя вищого господарського суду україни","region":"Загальнодержавний регіон","candidate":"","office_hidden":false,"post_hidden":false,"office":"Вищий господарський суд","region_hidden":false},"last_name_unclear":false,"full_name":"Костенко Тетяна Федорівна","addresses":[{"place_city_type_unclear":false,"place_address":"","place_district_hidden":false,"place_city_type":"","place_address_hidden":false,"place_address_unclear":false,"place_city_type_hidden":false,"place":"","place_district":"","place_unclear":false,"place_city":"","place_city_unclear":false,"place_hidden":true,"place_city_hidden":false,"place_district_unclear":false}],"patronymic":"Федорівна","full_name_suggest":{"output":"Костенко Тетяна Федорівна","input":["Костенко Тетяна Федорівна","Тетяна Федорівна Костенко","Тетяна Костенко"]},"name_unclear":false},"source":"VULYK","estate":{"23":[{"region_unclear":false,"space_unclear":false,"costs":"","costs_comment":"","costs_hidden":false,"address_hidden":false,"region_hidden":true,"space_comment":"","space_hidden":false,"space_units_unclear":false,"address":"","costs_comment_unclear":false,"region":"","address_unclear":false,"space":"1613","costs_rent_hidden":false,"costs_rent_comment_hidden":false,"space_units":"м²","costs_comment_hidden":false,"costs_rent":"","costs_rent_comment":""}],"29":[{"space_unclear":false,"costs_property_hidden":false,"address_hidden":false,"region_hidden":true,"space_comment":"","space_hidden":false,"space":"7500","address":"","region":"","costs_property":"","costs_rent_comment":"","costs_rent_hidden":false,"space_comment_hidden":false,"space_units":"м²","costs_property_comment":"","costs_rent":""}],"30":[{"space_hidden":false,"costs_property_hidden":false,"address_hidden":false,"region_hidden":true,"space_comment":"","space_units_hidden":false,"space_unclear":false,"space":"40","address":"","region":"","costs_property":"","costs_rent_comment":"","costs_rent_hidden":false,"space_comment_unclear":false,"space_units":"м²","costs_property_comment":"","costs_rent":""}],"31":[{"region_unclear":false,"space_unclear":false,"costs_property_hidden":false,"address_hidden":false,"region_hidden":true,"space_comment":"","space_units_hidden":false,"space_hidden":false,"space":"79","address":"","region":"","costs_property":"","costs_rent_comment":"","space_comment_unclear":false,"space_units":"м²","costs_property_comment":"","costs_rent":""}]},"intro":{"declaration_year":"2013","isnotdeclaration":"","declaration_year_unclear":false,"declaration_year_hidden":false}}